"本文以双波包双原点粒子模型和四元数全时间 、四元数全动量 和四元数全速度 等新概念为基础，对电子进行了分析研究，通过推断粒子存在波–粒二象性的原因，对自由电子形象有了新的理解，因此得出全新的结论：一是不确定范围 是粒子具有波动性质的根本原因；二是象电子存在静止能量 ,它也还存在 参数；三是海森堡不确定性原理存在的原因是 的不确定量 和 的不确定量 。还对电子为什么带电作了定性的猜想。 关键词 :双波包双原点模型，玻尔半径a 0 ，电子静止质量m 0 ，不确定性原理"
"经典物理和相对论都认为电子是具有一定速度 运动的质点，而量子物理学认为，电子在三维 空间具有波–粒二象性，它有时表现得像经典的运动质点，有时又表现为德布罗意物质波的特性。虽然理论和实验都证明了它们的正确性，但经典电子形象和波–粒二象性之间的关联，除去尺度方面的因素外，必定还有更深刻的原因。本文以双波包双原点(双弦双原点)微观粒子模型、全时间 、全动量 和微观粒子运动全速度 等一系列新概念[ 1 ] 为基础，通过对电子分别在位形 空间和能量 空间中的两个波函数 和 的研究分析，运用逻辑推理和理论推导的方法以期展现电子性质新的方面，从而使其物理形象更加完整且易于理解。"
"电子具有波–粒二象性已被实验证实，但理论的现状是大多数人们头脑中很难建立起电子波–粒二象性的统一形象。下面依据双波包双原点微观粒子模型，从一个新的角度对电子审视分析，以期对微观粒子波–粒二象性形象有进一步的认识。  德布罗意揭示了自然界有明显的对称性，认为既然光具有波–粒二象性，则实物粒子也应具有波–粒二象性，并建立了德布罗意关系，进而给出在三维 空间自由粒子平面波表达式： (1) 实际上按量子力学现有解释，上面1式所表达的粒子有确定的能量 和动量 ，但在三维 空间没有确定位置。依据双波包双原点微观粒子模型可以理解为：上面1式所表示的粒子一个波包在三维 空间不确定性 为无穷大，另一波包在三维 空间为一点不确定性 为零。现在有个问题须要搞清楚，那就是微观粒子不确定性的原因是什么，也就是说 和 是什么因素造成的？现有量子力学理论没有清楚回答这一问题。本文认为：微观粒子不确定量 和 和粒子运动速度 变化与否没有因果关系， 来自 进而来自参数 的不确定量； 来自粒子的质量参数 的不确定量 。 还有一个问题始终不能很明白，那就是为什么首先展现在人类面前的光子是波的形象，而实物粒子诸如电子是经典微粒形象，一般人们相信造成这一历史顺序的原因是因为精细结构常数 很小的缘故[ 2 ] ，也就是说运动速度 数值很小状态的微观粒子表现象微粒，速度越大其波动性质越明显，实际上这个说法不确切其概念也是模糊的。因此，本文认为：微观粒子在三维 空间一般状态具有四维结构 ，其可能的出现点在时间 维度的不确定范围 是粒子具有波动性质的根本原因。也就是说，微观粒子不确定量 近于零状态某一确定时刻 在三维 空间出现的电子一定是具有确定速度 的缩成一点的点粒子，非被测量状态确定速度 的单个电子不确定范围 越大、在时间维度弥散的越开其 空间波动性越明显。单个电子的 参数的差异仅仅表现为其运动速度 的不同。 在确定的参照系内,组成单个粒子的所有本征值波函数相互叠加形成互为因果的两个波函数 和 ，因为单个粒子的所有本征值都有相同的运动速度，所以自体本征值之间彼此不能发生相互作用。相互作用只能存在于不同粒子之间，例如两粒子相互作用的必要条件是：其一，两粒子运动速度不同有差异，其二，两粒子波函数存在重叠部分有叠加并且在三维 空间同时同一点碰撞出现、或者在三维 空间同能量同动量同一点碰撞出现。  依据双波包双原点微观粒子模型，非相互作用状态电子在三维 空间是一波函数 ，在三维 空间也是一波函数 ，两个波函数互为因果。这里要特别强调，本文不完全同意现有量子力学关于自由电子的定义，并认为其只是电子一特殊运动状态或是一普通本征值波函数。并进一步认为，与经典物理学中一样，自由电子若不在参与相互作用过程中其波函数运动速度不变化。自由电子波函数应该具有如下特点：其一，单个自由电子波函数在其不参与相互作用的状态，电子能量子在三维 空间可能出现的最大几率点和其它可能几率点一样保持匀速 不变。其二，单个自由电子具有互为因果的双波包 和 形象，在三维 空间叠加成波包 的所有德布罗意本征值波函数，其波前传播速率都为 相等。在三维 空间某一确定点 不可能同时存在两个电子的最大几率点，同样地，在三维 空间某一确定点 也不能同能量同动量出现两个电子的最大几率点。也就是说，在三维 空间确定的参照系里不可能找到具有相同 、 参数的全同电子，这或就是泡利不相容原理。象在三维 空间一样，在三维 空间确定的参照系里两个速度不同电子的(期望点)无限接近地出现也会碰撞，所以，在三维 空间确定的参照系里其最大几率点出现点距离很远的两电子是可以相互作用的，因为它有可能在三维 空间正在碰撞相互作用过程中。 2.3. 玻尔半径a 0 的意义 经典物理学认为氢原子玻尔半径 是绕原子核以一定速度 运动电子的轨道半径，氢原子基态能量 为玻尔半径 上以速度 运动电子的动能，它等于无穷远处静止电子运动到 处场 所做的功。下面从双波包双原点微观粒子模型出发，以期分析发现玻尔半径 和基态能量 物理意义的新侧面。 自由电子参与相互作用或被测量时，电子波包塌缩其四元数参数能量 、全动量 出现在三维 空间波函数 内一点，在某一点出现的几率与该点波函数复振幅的平方成比例；同样地，电子四元数位置参数 、全时间 出现在三维 空间波函数 内一点，在某一点出现的几率与该点复振幅的平方成比例。本文认为：单个电子本征值能量 、全动量 在其波函数 内存在一出现期望点，该点波函数复振幅有最大值电子能量子 出现的几率最大，进一步认为该点就是经典物理学认为的质点电子出现存在点。另一方面，与具有了能量子的 点出现在波函数 内同步，电子四元数位置参数 、全时间 也做为本征值可能出现在三维 空间波函数 内复振幅有最大值的期望点，我们认为该期望点 就是能同步出现在三维 空间的宏观粒子氢原子的圆心。显然，氢原子玻尔半径 就是基态电子双原点 与 在三维 空间的距离；基态能量 就是电子双原点 与 在三维 空间的能量距离。 在三维 空间确定参照系内，运动速度为 的自由电子波函数本征值出现参与相互作用过程完成后，其期望点速度 发生变化，同时电子出现时刻双原点 与 在三维 空间和三维 空间的距离都发生相应变化。因此，两个变化了的波函数重新形成，自由电子从一个运动状态又进入了一新的运动状态。显然，经典物理学和狭义相对论在氢原子内对经典电子的研究，就是对粒子波函数出现期望点——电子质点的研究。"
"3. 三维E空间电子“静止”x 0 参数存在  为下面讨论的方便，有必要回顾一下我在《微观粒子形象模型假说》一文中提出的全时间、全动量、和全速度概念。 全时间 的定义：微观粒子四元数距离 被光速常数 整除等于全时间 。它的四元数结构由实部标量 和虚部矢量 组成，用公式表示如下： (2) 全动量 的定义：微观粒子四元数能量 被光速常数 整除等于全动量 。它的四元数结构由实部标量 和虚部矢量 组成，用公式表示如下： (3) 四元数全时间 和全动量 是新概念，由经典物理学动量 计算公式 得到启示，大胆推断全时间 和全动量 各分量关系如下： (4) (5) (6) (7) 对于单个微观粒子 与 绝对值恒相等； 与 绝对值恒相等。 试想，假如人类不是仅仅能够看到三维 空间世界，而能直接观察四维空间微观粒子的全貌。那么，当波包塌缩粒子出现瞬时，观察者应该能够观察看到 对全时间 的全微分 而不仅仅是偏导数 。我们称全微分 为微观粒子在三维 空间运动全速度。粒子全速度 的“模”为光速常量 。且如下公式： (8) 成立，若将上式中 则关系式， (9) 成立。当粒子为光子时， 可见，粒子质量 、全动量 和全速度 的关系为： 不难看出，通常在三维 空间观察到的“静止状态”粒子仅是其全速度矢量部分 为零的状态，为了叙述的方便后面将 状态粒子称作“经典静止”粒子。 同理，单个微观粒子在在三维 空间的运动全速度 的“模”也为光速常量 ，将全速度 用字母 表示如下公式。 ， (10) 成立，若将上式中， 则关系式 (11) 存在。 同样的，粒子参数 、全时间 和在三维 空间全速度 的关系为： . 3.2. 电子x 0 参数存在的推断 假若，三维 空间氢原子玻尔半径 上 点出现在电子期望点成为其能量子 ，该状态电子能量子运动速度为 ，由爱因斯坦狭义相对论[ 3 ] 知道，电子能量 可表示为： (12) 且 成立，其中 为电子静止质量常数。由12式可以看出，氢原子中电子期望点运动速度 为零时其 为电子静止能量；电子期望点运动速度 为光速常数 时电子能量 ，也就是说一般电子期望点运动速度 不能达到光速常数 。 因为电子两个波函数 和 存在因果对称关系，因此本文认为：在三维 空间电子期望点出现 且具有的参数 也应存在如下关系。 (13) 上式中 与电子静止质量常数 对称对应，速度 其绝对值与三维 空间 相等。 当电子位置参数 等于氢原子玻尔半径 时，参数 可用下式求得： (14) 考虑能量空间电子运动满足关系式 。由三角函数关系 ，所以有 。因此14式变为： 又由于，同一电子 与 绝对值恒相等，所以14式又可变为： 我们知道精细结构常数 的表达式为： 所以电子 参数其值为电子约化康普顿波长 (15) 由关系式 可以看出，三维 空间氢原子中电子出现期望点速度 为零时，静止电子的位置参数 最可能是无穷大，其速度 为光速常数 时参数 最可能为 。 综上所述，可以得出如下结论：在三维 空间电子波函数 期望点(经典位置)出现的 期望点 (经典质量)其运动如下关系式 成立，在三维 空间电子 期望点出现的 期望点 的运动如下关系式 成立。显然，电子两个波函数原点 和 在三维 空间的距离为 ，它应该出现在电子运动速度 状态；两原点在三维 空间的距离为 ，其应出现在电子速度 运动状态。而一般情况或在氢原子内电子的这两运动状态都仅能够发现电子的特殊本征值，因为。在三维 空间速度 状态要求出现的电子本征值静止质量必须为零其动量、能量才可以是有限值，否则电子质量就是无穷大；在三维 空间 状态要求出现的电子本征值 参数必须为零其参数 和参数 才是有限值。有和无其‘误差’可看做无穷大。"
"海森堡不确定性原理是量子力学的基础结论之一。该原理陈述了精确确定一个粒子比如氢原子内电子的位置和动量是有限制的。并且认为其不确定性来自两个因素，首先，测量的行为将会不可避免地扰乱被测粒子而改变它的状态；其次，因为量子世界具有波动性，基于概率精确确定一个粒子的状态存在更深刻更根本的限制[ 4 ] 。本文认为：不确定性原理是微观粒子的固有特性，单个电子波函数 是由许多速度相同的本征值波函数叠加而成的群波，一般单个电子在三维 空间没有确切位置，它表现出的经典宏观看起来的位置点其实是对几率函数 的期望点，也可说是电子被测量出现几率最大的点。例如在不测量时单个电子能量子出现在 中哪一点有很多可能，一旦测量(相互作用)单个电子的一本征值必须出现在它的一可能位置。在测量动作前单个电子的整个波函数 的运动群速度确定，但它在时间、空间里是散漫的，一般状态电子波函数 不是一个点，所以电子具有不确定性。而被测量就是电子一个本征值在某一点出现与测量者相互作用，参与相互作用的结果是电子从一种运动状态变为另一种运动状态，运动速度发生变化进而电子能量 和动量 也相应变化。 如果承认经典电子 和 两个参数是电子分别在两个空间里出现在期望点的本征值才能有的参数，也即电子出现在概率最大点的本征值才能具有的参数。那么，当电子处在速度 状态一个本征值在某一点出现时，他的四个本征值参数 、 、 和 就都有了确定值，若该次出现不在期望点，那么，相对于假如出现在期望点情况该次出现的“测不准误差”如下： 考虑到 的绝对值恒等于 ； 的数值恒等于 。上面四式可写成 进一步有 将上式代入海森堡不确定性关系 推导后可发现 和 所得结果完全一样，进而得到电子变形的不确定性关系式 (16) 分析16式可以看出，单个电子运动速度 状态时，电子的不确定性范围 有最小值，随着电子速度 的增大电子的不确定性范围越大，电子速度 逐渐接近光速常数 时其不确定性范围趋向无穷大。"
"假如，一电子在三维 空间出现，其能量 和动量 表现有固定值，则德布罗意波函数可表示为： 本文认为：若上式所代表的是某一自由电子的一特殊状态，电子静止质量为经典电子 且其运动速度有确定值 ，那么，上式波函数中能量 和动量 必须为 如若上面德布罗意波函数表达式它仅仅代表该电子的一本征值波函数，则波函数中能量和动量就为 上式中 不一定与经典电子静止质量 相等，因为有不同几率的出现点上出现的电子本征值参数能量 、动量 、位置 和时间 都可能有不同的数值，也就是说单个电子不同本征值波函数各参数值一般有差异，而具体一个本征值点的能量 和动量 与出现几率最大期望点的本征值能量 和动量 之间的差值可表示为 可以看出在电子运动速度 保持不变情况下，上式表示的差值 和 都来自于 。想象一下假设能够条件不变无限次测量一个单电子，实验已经告诉我们每一次测量都可能得到该电子一个不同的本征值能量 、动量 ，显然，非相互作用状态运动速度 固定对于变化了的电子能量和动量其静止质量是唯一的可变量。因此，可以推断非相互作用状态自由电子静止质量 具有不确定性。经典电子静止质量 是电子波函数 中本征值出现几率最大点也即期望点所具有的电子静止质量值。 显然，经典物理和狭义相对论都是在假定粒子静止质量 不确定量 为零基础上进行讨论的理论，可以想像当速度 固定若量 为零则能量 、动量 有固定值， 峰值期望点 就不能存在。因此，物质粒子在 空间的运动出现范围就可以是平滑的整个空间而没有 点的限制，因此，可以认为狭义相对论理论已假定自由粒子平面波表达式 是成立的。也只有满足上式的自由粒子在不同惯性系中才有可能满足关系式 然而，若不确定性原理是微观粒子更真实的客观存在，那么狭义相对论理论在该意义上也是一近似理论。实际上，正是微观粒子静止质量 的不确定性产生了三维 空间期望点 ；而参数 的不确定性又反过来产生三维 空间期望点 互为因果。所以双波包 和 微观粒子模型才更全面地反映了真实的物质世界。"
"我们知道经典电子是带负电荷 的物质粒子，我们所接受的电荷的所有基本概念和基本理论，全来自于库仑的物理实验和库仑定律，而什么是电荷及电荷的本质是什么，为什么电子会带电，电与什么物理量有关，是至今我们也没有弄明白的一个基本概念。本文认为：电子电荷本质来自电子的不确定性质，通过上面的讨论我们能够想象一自由电子在三维 空间的形象。假如，空间某一点 出现电子能量子 的几率最大，以点 为圆心圆球对称地每一射线上距离园心点 越远电子能量子 出现的几率越小，而每一个能量子 可能的出现点都是该电子出现与其它带电粒子相互作用交换光子的点。我们说：经典物理学将出现电子能量子 几率最大的点 约化看做成了电子质点，而将以质点 为圆心球射线上距离越远电子出现几率越小的整个空间看做与电子质量点 共存的电场。"
"在承认海森堡不确定性原理的前提下，本文讨论的关键是对微观粒子波–粒二象性及不确定性原理的理解给出了新的解释。我们知道动量 位置 ，但现有理论没有回答动量不确定量 是来自质量还是来自速度；位置不确定量 来自 的不确定量 ，而 是来自 还是来自速度 。本文认定电子波–粒二象性及不确定性原理的根本是其质量 有不确定量和参数 有不确定量的缘故，不确定性与被测量电子测量前后运动速度 变化改变其运动状态是两回事，测不测量自由电子的不确定性都客观存在。当然这些假定和推断的正确与否还须实验的验证，但沿着这一思路深入思考展现出的电子的一些新侧面，或许对量子物理科学的发展有推动或借鉴意义。"
