"在听觉大脑中，一些神经元表现出对一个重复刺激的特异性适应(stimulus-specific adaptation, SSA)。SSA从中脑到初级听皮层(primary auditory cortex, AI)都存在。研究发现SSA强烈表达在听觉丘脑的主要核团，即内侧膝状体(medial geniculate body, MGB)的非丘系区域内。本文我们将重点介绍听觉丘脑MGB神经元的SSA研究和听觉中枢(即丘脑)在检测声音方面的重要性。 关键词 :听觉丘脑，刺激–特异性适应，失匹配负电位"
"听觉所及范围内声音的突然变化，可能意味着这是一个重要的、关乎生存的行为事件。因此，大脑会形成特定的机制来分辨新声音和熟悉(或重复)的声音事件。以往的研究表明，某些听觉系统的神经元会减少对一个频繁发放的声音的反应，但当它们听见一个新异的声音时，会迅速地恢复发放 [ 1 ] [ 2 ] 。这些神经元能够通过特定时间窗口来追踪这些不同的声音，同时相应地调整它们自身的反应，这一属性被称为刺激–特异性适应(stimulus-specific adaptation SSA)。 SSA的机制尚不清楚，未来的研究需要明确：SSA是简单反映了神经元对一个频繁的“标准”声音刺激的特殊抑制反应(例如，通过突触抑制产生)，还是对与正常音调序列的规律性相违背的“非标准”声音刺激很敏感(即，偏差检测)。目前，我们暂时把SSA定义为神经元对一个标准刺激的适应。要注意区别SSA与神经疲劳，SSA神经元一旦适应于一个标准的刺激后，仍然会对“非标准”的其他刺激发放；神经疲劳可能发生在神经元接受输入的水平上，因此SSA在环路的某些水平上可能仍然基于神经疲劳(或功能类似的现象)。Ulanovsky等 [ 3 ] 首先在听觉皮层证明了SSA，但SSA也同样发生在听觉的皮层下通路。许多学者认为，对皮层下水平进行研究有利于我们明确SSA的作用和产生机制。 鉴于SSA与听觉皮层的关系，听觉丘脑一直是许多关于SSA研究的焦点。已有研究证明，SSA在内侧膝状体(medial geniculate body, MGB)中被强烈表达。对大鼠MGB的研究发现，SSA并不是均匀地表达在整个大鼠的MGB，它在MGB的非丘系表现突出，而在丘系不存在或只有极低水平 [ 4 ] [ 5 ] 。大鼠丘系MGB神经元SSA低灵敏性的发现与猫 [ 3 ] 和沙鼠 [ 6 ] 的研究结果是一致的。由于AI是SSA强烈表达的主要区域，Antunes等 [ 5 ] 运用冷却技术使AC可逆性的失活，从而进一步研究MGB的SSA，结果表明AC不是丘脑SSA产生所必须的。 为更好的描述MGB三个主要亚区SSA的特征，并且说明在丘脑核团SSA不依赖于AC，本文首先对MGB、AC和皮层通路做一个简单介绍。"
"丘脑是所有感觉(除嗅觉外)上传的重要接替核团。在结构上，它一方面接受下级核团的上传纤维投射，另一方面还接受大量的离皮层下行纤维投射。因此，在各种感觉的信息处理和传递过程中，具有特殊的功能。越来越多的证据显示，在听觉、视觉和体感系统，丘脑可调节和调制感觉信号，并作为皮层输入信号的重要来源。MGB是主要的听觉丘脑，与听皮质一起形成了一个可以对上行声音信息提取和编码所必需的回路 [ 7 ] 。MGB神经元同时接收来自IC的兴奋性和抑制性输入、来自皮层的兴奋性输入和来自丘脑网状核的抑制性输入，通过三者之间动态的相互作用实现其调制作用的。 根据结构和功能的不同，MGB可分成三个区：腹侧区MGv、背侧区MGd和中间部MGm。其中，MGv属丘系，而MGd和MGm属非丘系。在大鼠中，MGv和MGd这两个分区中的所有神经元几乎都形成丘脑皮质束投射到听皮层。而MGm还可以将许多输入信息投射至非听觉中枢。此外，MGm和MGd还涉及多感觉的相互作用、学习诱导的可塑性以及听觉刺激的情感内容和交互信号的处理等等。 MGv包含成簇的、丘脑皮质“中继”神经元，这些神经元通常接收来自同侧具有音频定位特性的IC中央核的信号输入，并且能够及时灵敏地对对侧耳的纯音刺激做出反应 [ 8 ] 。MGv神经元只投射到初级听皮层，主要到皮层的第Ⅲ和第Ⅳ层。MGv簇状神经元具有高度定向的树枝状乔木平行排列结构，与来自IC上臂的传入纤维一起，形成一个层状结构，此结构也是MGv的音频定位的基础。 MGd包含两种类型的神经元：一类是具有与MGv神经元相似结构但又不完全相同的簇状神经元，此类神经元没有定向的树突树结构也没有音频定位的特性；另一类是由放射状延伸树突发散形成的星形结构的星状神经元(仅发现于MGd)。在大鼠，MGd主要投射到不连续的两个AC的非主要区域：初级听觉区域尾端的背缘即背后区和鼻侧端的腹缘即腹侧区；这两个区域都将来自MGd的信息传递至更高的皮质区域(即后顶叶皮层和岛叶) [ 9 ] 。 MGm是一个扁平的豆状神经核，从头至尾延伸至整个MGB，是MGB中最小的一个分区。与MGv和MGd相比，MGm神经元胞体大小不均匀，通常有长而稀疏的分支状树突，并且它们的轴突可产生分支去支配同一或附近的核团内的神经元 [ 10 ] 。MGm的输入是多来源的，不仅来自IC的侧部、喙部和背部皮层，也来自于体感、视觉中心，以及其他听觉区域；MGm能对这些多来源输入信号的其中一个或多个有反应，并且它们能够迅速地适应重复的声音刺激。MGm神经元轴突可投射至几乎所有听皮层区域，终止于第Ⅰ、Ⅲ、Ⅳ、Ⅴ层，此外还可投射至其它皮质区域参与多感觉整合 [ 11 ] 。"
"AC是颞叶的一部分，来自MGB的上行纤维大多止于AC。AC具有种属差异，基于丘脑皮质束、皮质丘脑束以及胼胝体输入模式，目前已确定了大鼠的皮层分区。大鼠的AC可分为：初级听觉皮层(A1)和一个包括次级听觉皮层的周边区域。MGB最显著的特征之一是其接受大量来自离皮层的投射，此投射主要起源于皮层第五层的锥体细胞。在大鼠，离皮层投射都是兴奋性作用，数量是上行投射的10倍。MGB的三个亚区都接收离皮层投射，且大多终止于MGB的主要神经元 [ 12 ] 。虽然皮质–丘脑–皮质投射允许非丘系和丘系区域之间相互作用，但是丘系AC区域的投射标靶依然是MGB丘系区域，而非丘系AC区域大部分投射至非丘系丘脑核 [ 13 ] 。但MGm，接收来自所有AC区域或非听觉皮层的输入 [ 8 ] 。"
"人类大脑的异常可通过诱发电位来检测，诱发电位又被称为失匹配负电位(mismatch negativity potential, MMN)，是一个通过脑电图记录下的电反应。MMN的产生是由于引起MMN的声音与一个刺激序列的规律性特征不同，这些规律性特征包括：频率、强度、持续时间和更复杂的不规则声音刺激形式如音乐。MMN传统的测量方法是将一个罕见的声音(即偏差)随机的嵌入在普通的声音序列中，检测偏差刺激对抗标准刺激诱发的事件相关电位之间的差异；MMN也可发生在注意力或行为缺失的人类身上，比如：昏迷病人、睡着的新生儿和胎儿 [ 14 ] [ 15 ] 。 目前对MMN存在的神经机制尚不清楚，最普遍的解释是“感觉记忆”，它认为MMN不仅反应了神经核团对重复的标准刺激的适应或者不应性，也反应了真实的差异检测 [ 16 ] 。根据这一观点，大脑可有效地贮存一个标准刺激的“记忆痕迹”，新输入的刺激与此对比，则不匹配的差异刺激会引起明显增强的反应，此增强的反应可作为差异的指标。但是，MMN是真实的差异检测，还是由于神经核团对标准刺激的编码的适应或不应引起的，这一问题仍待解决。一些学者认为MMN的“感觉记忆”模型仍然有许多基本问题没有没被解答的。例如感觉记忆痕迹的生理表现是怎样的？ 最近的研究证实MMN通常在刺激后150~200 ms范围内达到峰值不是听觉大脑差异检测最早的电生理表现 [ 17 ] 。听觉差异可以在刺激变化开始的20 ms检测出来，说明由于皮质下区域的参与，早期差异变化发生先于MMN的产生，这对分层的系统组织在各自不同的复杂层面上可对听觉差异产生作用这一观点是强有力的支持 [ 16 ] 。除人类外，MMN样活动已经在猴、猫、兔、豚鼠、大鼠、和小鼠中发现并被证实。对于MMN样活动的研究，大部分的工作专注于对AC的研究上，MGB及海马中也有部分报道。"
"SSA的研究通常运用一个与诱发MMN相似的刺激序列。在关于它的大部分经典文献中，就像Ulanovsky等 [ 18 ] 的最初描述那样，在确定的重复率下，随机地给予两个不同频率(f 1 和f 2 )的声音刺激，这两个频率的声音出现的概率不同，其中的一个频率作为标准刺激频率(具90%的出现概率)，而另一个频率作为偏差刺激频率(10%的概率)，然后用两个频率出现概率颠倒的序列重复相同的实验。结果发现听皮层 [ 3 ] [ 19 ] 、MGB [ 1 ] [ 2 ] [ 4 ] [ 5 ] 、丘脑网状核 [ 20 ] 和下丘脑 [ 1 ] 的神经元都减少了它们对标准声音刺激的反应，但仍保留它们对差异声音刺激的回应，即出现了SSA。然而在耳蜗核的神经元没有发现这一性质。目前，IC已被证明是显示SSA最低级的听觉中枢，但是在耳蜗核和IC之间的脑干是否具有同样的性质还未被研究。IC是中脑信号输入整合的主要中枢，并且还是区分丘系和非丘系通路起源的结构所在，因为皮质下SSA的产生与非丘系通路相关，因此它非常重要。虽然，SSA的研究麻醉动物中进行 [ 1 ] [ 6 ] [ 21 ] ，但SSA在清醒动物中也会出现 [ 19 ] ，说明SSA并不是由麻醉引起的。 SSA对刺激的反应快速且高度敏感，它取决于两个刺激之间的对比、标准刺激与差异刺激出现的相关概率，以及给予刺激的方式 [ 2 ] - [ 4 ] 。SSA通常用Ulanovsky等 [ 3 ] 制定的指标量化：1) 频率特异的SSA指标(SI)，SI(f i ) (i = 1或2)，计算SI(f i ) = [d(f i ) − s(f i )]/[d(f i ) + s(f i )]，其中d(f i )(峰电位发放数)和s(f i ) (刺激)是对频率f(i)在差异刺激或标准刺激情况下各自的反应；2) 两个频率下SSA的总量(共同SSA指数，CSI)，计算公式为CSI = [d(f 1 ) + d(f 2 ) − s(f 1 ) − s(f 2 )]/[d(f 1 ) + d(f 2 ) + s(f 1 ) + s(f 2 )] [ 3 ] 。这些指数反应了对一个声音反应的范围。在标准情况下，对相同声音的回应范围小于偏差情况下。指数范围在−1和+1之间，如果在偏差情况下，对一个声音的回应是正数，说明这比在标准情况下对相同声音的回应更大。自从这些指数被量化为一个比率，在对标准和偏差声音刺激的反应中，如果反应的绝对数值是小的，可能导致一个大的比率；当回应的绝对数值是大的，可能产生一个小的比率。这是我们在分析数据时需要注意的。因此，我们相信CSI指数并不是一个测量的假象，而是具有生物学意义。测量标准和偏差刺激之间的对比指数，当反应的绝对数值低时，这个比值大，SSA增强 [ 3 ] 。"
"前期研究发现，以相同的刺激参数在AI中可被强烈激发的SSA，在猫的MGB(可能是MGv)中的水平非常低 [ 3 ] 。随后，在小鼠 [ 22 ] 、大鼠 [ 4 ] 和蒙古沙鼠 [ 6 ] 中也证明了MGv中的低水平SSA。Yu等 [ 20 ] 研究了在大鼠MGB和TRN中的SSA，发现TRN中SSA强而MGB中较弱。Anderson等 [ 22 ] 研究了小鼠MGB不同亚区的SSA，结果显示其适应水平比AC或IC神经元中的SSA要弱。这些研究表明某些SSA出现在MGm和丘系的MGv中，而不在非丘系MGd中。然而对大鼠的研究发现，SSA强烈表达在大鼠MGB中，其MGm和MGd神经元显示强烈的SSA [ 2 ] [ 5 ] ；这些发现将丘脑SSA与非丘系通路相连，其结果与先前在大鼠中脑 [ 20 ] [ 23 ] 和斑胸草雀听觉前脑 [ 24 ] 的研究一致。目前对小鼠MGB和IC神经元SSA缺失 [ 22 ] 的原因尚不清楚，可能的原因包括：种类、方法(例如，麻醉剂的使用、分区的定义)和抽样的差异(小鼠研究中MGd记录是以一个小的样本量n = 13为基础，包括多单位和单个单位记录)等。 通常，用与猫诱发AC的SSA一样的刺激参数，可在大鼠MGB中同样诱发SSA [ 2 ] ，在MGB中能诱发最强SSA的刺激的频率比率为0.141~0.526，刺激时间间距(ISI)为250~500 ms。甚至在0.14音阶比率，和2000 ms的ISI测试条件下，MGm和MGd神经元也可显示的强烈的SSA。一个有意思的发现是，在某些非丘系的MGB神经元，频率间隔小至0.057音阶，SSA仍可被观察到。说明，若两个频率都位于其频率响应区域内，某些非丘系MGB神经元可以区别两个非常相近的频率；这表明了MGB神经元对频率变化的敏感度，这与先前在猫的AC [ 3 ] 和大鼠IC [ 23 ] 上发现的结果一样。值得一提的是，这个发现，即一个神经元可以分离两个频谱非常接近的频率并输出它的反应，可能是不同输入对具有严格调频特性和适应性的神经元激活的结果这可能涉及SSA的相关机制，尚有待研究。 已有研究发现，少数MGB神经元显示与TRN一样高水平的SSA，甚至当ISIs是TRN的两倍长 [ 20 ] 。给最大的ISI (=2000 ms)时，一些MGB神经元显示比AI神经元更高的SSA值(但仅仅在MGv以外) [ 2 ] 。MGv接收来自IC的中央核团的输入，同时又是上行输入到AI的主要来源。在MGv [ 2 ] 和IC的中央神经核 [ 23 ] 中发现的SSA与短ISIs (120~250 ms，onset-to-onset，75 ms持续刺激)有很大相关性。在丘系通路中，猫 [ 3 ] 和大鼠 [ 25 ] 的AI的SSA水平远远超出了在大鼠 [ 5 ] 、豚鼠 [ 6 ] 和小鼠 [ 22 ] 的MGv中的发现的数值，在所有这些研究中，MGv中SSA的发现值几乎为0。"
"为了检验AC是否是MGB神经元中SSA的表达所必须的，Antunes等 [ 5 ] 通过冷却技术可逆的灭活AC，观察麻醉大鼠MGB神经元在皮层灭活前，中和后的SSA，发现在AC灭活期间，MGB神经元的反应发生显著改变，但是，SSA的水平和动态时间未受影响。这些发现说明，MGB中的SSA并不继承于AC，恰恰相反，它可能承接于更低一级中枢的IC，或者产生于MGB神经元的重新合成。随后，他们关于IC的研究也有相似的发现 [ 26 ] 。SSA很可能是被自下而上的传递，产生于更低中枢，并且可以在听觉通路的的各级中枢内被调制。SSA这种自下而上的传递可以使听觉系统的各级中枢形成对上一级中枢的反应 [ 5 ] ，因此，MGv中发现相当弱的SSA的量可能是AI中神经元SSA表达所导致的。 在AC灭活期间，MGB神经元SSA对AC灭活的不灵敏性影响了MGB神经元许多其他特质，比如，它们的频率反应区域、自发放活动、放电率以及发放延时等 [ 5 ] 。这些发现证实了先前利用冷却技术 [ 27 ] 和电刺激 [ 12 ] 关于离皮层投射的研究，并证实了在MGB中强烈的离皮层调制。离皮层调制并不能解释MGB中的SSA的产生机制，然而，离皮层调制了MGB神经元的放电率，影响了它们对标准刺激和偏差刺激的反应，说明了离皮层的增益控制作用 [ 5 ] 。因此，SSA的程度被量化为一个驱动率的比率,在很大程度上不被皮层冷却失活影响。这个推论与先前的研究相一致，说明离皮层系统参与一个加强的控制过程，从而导致刺激编码的显著改变提高 [ 28 ] 。这与离皮层通路通过控制增益缩放MGB对它的驱动输入的敏感性的作用 [ 5 ] 结果是相一致的。 有趣的发现是虽然皮质灭活对MGB中的SSA影响很弱，但是SSA与皮质冷却诱发的改变之间却有显著的联系。离皮层对MGB神经元放电率的调制随SSA水平的不同而表现出明显的改变，例如由AC引起的MGB神经元的易化作用会随SSA的增强而减弱，而且这种调制关系取决于MGB神经元的SSA程度，与其所属的解剖位置无关每月 [ 5 ] 。皮质丘脑间相互作用的观点在很多方面有大的变化。因此，皮质调制的程度与SSA的强弱有关这一事实是皮质调制神经元特性的强有力的证据，证明了低SSA与强的皮质增益有关 [ 5 ] 。这些发现引人注目，并将在未来的研究中进一步的阐明，包括使用不同的方法量化SSA来避免目前使用的指标的限制。 最近的研究表明GABAa介导的抑制作用在MGB的SSA形成过程在扮演了一个角色，通过强化对比标准刺激和偏差刺激来加强SSA [ 29 ] 。一些高SSA水平的非丘系MGB神经元受到来自离皮质通路的抑制性影响 [ 5 ] ，并且在这种作用下抑制是可能的机制。对MGB抑制的主要来源是通过AC-TRN的GABA能输入。然而，当皮层灭活期间，SSA的水平维持不变，来自离皮质通路的抑制作用并不能驱动或调制MGB的SSA [ 5 ] 。因此，在MGB的SSA形成中起作用的GABA能抑制性输入，很可能涉及到其它来源，比如来自IC的上行输入和MGB-TRN-MGB之间的联系。"
"在听觉丘脑非丘系核团存在的高水平SSA说明了SSA对此处的信息处理非常重要。例如，在MGm中被发现的非常强的SSA与MGm作为主要的听觉输入源到杏仁核引起的恐惧反应回路作用相一致 [ 2 ] [ 25 ] 。MGm-杏仁核通路主动参与恐惧学习机制，被认为对抑制由中性或安全声音刺激所引起的恐惧是至关重要的 [ 30 ] ，与SSA在抑制被假设为不相关和安全的重复声音反应的作用一样。AC和离皮层通路并没有驱动或转换MGB中的SSA，可能只是作为门控或增益控制来调制MGB神经元的回应 [ 28 ] 。其它一些关于SSA功能的假设，包括神经元编码的优化、信息传递的最大化、对即将到来的刺激分辨力的优化处理以及峰值的有效利用等作用都可归因于一般的适应。 当前对SSA的研究结果支持了关于SSA机制的假设，至少在频率偏差假设中，SSA在听觉通路自下而上被传递，通过限制与行为相关的听觉信息流的门控机制来发挥作用。其可能推测SSA在不同的听觉传导通路水平上有不同的模型，沿着传导通路，某些特征增强，可在更高的水平参与更复杂的任务。SSA通常运用简单的声音特性和范例被研究，例如，将纯音嵌入一个随机序列，刺激远离复杂的自然声音和真实的声音环境。可能由于这个原因，SSA的表达在不同听觉通路的出现相似。听觉传导通路各个水平的局限和性能是什么？SSA是异常检测所必须的过程吗？如果是，真实的神经异常检测在哪里？它是从哪个水平开始汇聚？为了进一步了解SSA的机制和功能作用，未来的研究需要使用更复杂的实验条件，比如Yaron等 [ 25 ] 对大鼠AC中神经元反应敏感性统计规律的研究，他们对比了神经元对随机序列和周期性序列的反应，证明AC中的神经元对复杂结构的声音序列敏感。Aguillon等 [ 31 ] 研究检验了IC神经元对模式不同反刺激的敏感性，初步的结果显示，不管它们的概率，对预期和非预期的声音IC神经元都显示不同的反应。这些数据说明，IC神经元可越过对重复抑制的适应(用最简单的声音序列测量)，同时可能编码预期抑制。未来的研究在于阐明在复杂实验模式中神经元对不同声音的敏感性是否确实是可反映异常检测，或者还是与由基础的生理机制引起的相互作用。"
