"目的：探讨脑小血管病患者脑血流动力学改变与认知功能损害的相关性。方法：连续纳入2015年6月至2016年3月就诊于兰州军区乌鲁木齐总医院干三科的经MRI诊断的脑小血管病患者，经CTA、MRA排除大动脉狭窄后，对其进行经颅多普勒(Trans cranial Doppler, TCD)监测和事件相关电位(Event-related potential, ERP)检查，结合神经心理学量表(Montreal Cognitive Assessment, MOCA和Mini-Mental State Examination, MMSE)检测评价其脑血流动力学参数与认知动能相关性。结果：47例患者中，男性80.9%，年龄65.17 ± 10.68岁，MOCA评分：23.70 ± 5.46分，MMSE评分：26.38 ± 3.37分。Cz位置P3潜伏期：346.87 ± 34.12 ms；Pz位置P3潜伏期：346.66 ± 35.14 ms。通过多元逐步回归分析，TCD指标中左侧大脑中动脉RI与ERP中Cz位置P3潜伏期及Pz位置P3潜伏期均有明显相关性(P < 0.05)。结论：脑血流动力学的改变对脑小血管病患者的认知功能有明显影响，脑血流动力学TCD检测结果可能成为评判脑小血管病患者认知功能下降早期、无创、简便的筛查方法。 关键词 :脑小血管病，经颅多普勒，事件相关电位，认知功能"
"脑小血管病(cerebral small vessel diseases, CSVD)是多种原因致颅内小血管病变引起的一系列临床、影像、病理综合征 [ 1 ] 。CSVD是认知障碍和痴呆最常见的原因 [ 2 ] ，但是由于起病隐袭，在患病早期认知功能障碍通常不易引起人们的重视。经颅多普勒(TCD)监测可根据频谱形态和参数指标了解脑血流动力学 [ 3 ] ，被认为可作为识别阿尔茨海默氏病患者认知功能障碍的潜在方法 [ 4 ] 。然而对于CSVD患者脑血流动力学与认知功能之间的关系，国内外鲜见深入的报道。因此，综合分析CSVD患者的脑血流动力学及认知功能改变的相关性，可能为脑小血管病患者认知功能早期改变提供无创、简便的筛查方法。"
"选择2015年6月至2016年4月就诊于XX医院干三科的CSVD患者47例。详细记录患者一般情况及临床信息，所有受试者均进行MOCA和MMSE、ERP及TCD检查。 纳入标准：1) CSVD患者：头颅磁共振成像(magnetic resonance imaging, MRI) T2加权成像及液体衰减反转恢复序列(fluid attenuated inversion recovery, FLAIR)上脑白质多灶高信号，Fazekas评分 [ 5 ] ≥ 2级和至少一个腔隙性梗死灶；2) 双耳听力正常，可以配合完成检查。3) 患者血压控制在收缩压120~140 mmHg，舒张压70~90 mmHg。4) 同意参加研究并签署知情同意书。排除标准：1) 有不能纠正的听力障碍或其他原因，不能配合检查者；2) 可能的心源性栓塞和大动脉硬化性脑梗死；3) 其他原因的脑白质高信号，如多发性硬化、代谢或中毒性脑病、感染等；4) 可疑存在其他神经系统疾病；5) 有严重的骨关节疾病，影响活动者；6) 经CTA、MRA检查颈动脉及颅内大动脉狭窄者。   使用德国DWL公司生产的Dopplar-Box型超声经颅多普勒分析仪，软件版本2.7。经颞窗探查血管分别选择大脑中动脉(MCA)、大脑前动脉(ACA)、大脑后动脉(PCA)。经枕窗检测血管依次选择椎动脉(VA)、基底动脉(BA)。记录脑血流峰值流速(peak velocity, Vp)、平均流速(mean velocity, Vm)、血管搏动指数(pulsitility index, PI)及血管阻力指数(resistance index, RI)。以MCA的TCD参数作为与ERP进行相关统计的数据源，同时观测各动脉血流频谱形态及声频特征。  采用美国尼高力公司生产的Vikinguest4肌电诱发电位系统测试听觉事件相关电位。针电极置于Cz、Pz位置，非靶刺激以大概率呈现(80%)，靶刺激以小概率呈现(20%)。分析时间为75 ms，平均叠加次数400次，声音刺激采用2000 Hz和750 Hz的纯音 [ 6 ] 。ERP采集靶刺激引出的N1、P2、N2及P3波为分析成分，测量各成分潜伏期(PL，由刺激起始点至N1、P2、N2及P3等波顶点的时间)，同时观察波形情况。  对所有脑小血管病患者进行认知功能测定(包括蒙特利尔认知评估量表和简易智能量表)，均由二名医师在安静的室内进行指导及测验。 蒙特利尔认知评估量表(Montreal Cognitive Assessment, MOCA)测定，包括注意与集中，执行功能，记忆，语言，视结构技能，抽象思维，计算和定向力。满分30分。如果受试者受教育年限≤12年则加１分。≥26分属于正常，<26分提示患者已有认知功能损害。 简易智力量表(Mini-Mental State Examination, MMSE)测定，包括以下7个方面：时间定向力，地点定向力，即刻记忆，注意力及计算力，延迟记忆，语言，视空间。量表总分范围为0~30分。正常界值划分标准为：文盲>17分，小学>20分，初中及以上>24分。  数据分别由2人录入EXCEL文件，进行比对核实准确性，应用SPSS19.0软件进行统计分析。计量数据以均数±标准差，组间比较用t检验。相关分析使用Pearson相关分析和逐步多元回归分析方法。P<0.05为具有统计学意义。"
"纳入研究共47例，其中男38例(80.9%)，女9例(19.1%)，年龄50岁~87岁，平均年龄65.17 ± 10.68岁。受教育程度小学3例(6.4%)，中学23例(48.9%)，大学21例(44.7%)。其详细资料见表1。  各血管血流动力学数据分析如表2所示。  所有患者MOCA分数为6~30，平均23.70 ± 5.46分。≥26分者27例(57.4%)，<26分者20例(42.6%)；MMSE分数为13~30，平均26.38 ± 3.37分。≥24分者40例(85.1%)，小于24分者7例(14.9%)。ERP结果见表3，Cz位置P300值295~513 ms，平均值346.87 ± 34.12 ms；Pz位置P300值284~515 ms，平均值346.66 ± 35.14 ms。   双侧大脑中动脉TCD检查结果与事件相关电位及神经心理学量表作单因素相关分析，结果如表3。左侧大脑中动脉血流PI与Pz位置的P3潜伏期正相关(P < 0.05)，左侧大脑中动脉血流PI及RI均与Cz位置的P3潜伏期正相关(P < 0.05)。 Table 1 临床资料 例数(%) 年龄 65.17 ± 10.68 男性 38(80.9) 受教育程度 小学 3(6.4) 中学 23(48.9) 大学 21(44.7) 高血压 34(72.3) 糖尿病 18(38.3) 高胆固醇血症 15(31.9) 表1. 患者一般临床资料 Table 2 血管位置 Vp(m/s) Vm(m/s) PI RI 左侧ACA 74.33 ± 18.58 47.50 ± 11.52 0.86 ± 0.26 0.54 ± 0.09 右侧ACA 77.13 ± 21.61 49.23 ± 14.03 0.89 ± 0.36 0.54 ± 0.10 左侧MCA 92.85 ± 21.83 58.43 ± 13.75 0.85 ± 0.21 0.55 ± 0.08 右侧MCA 101.32 ± 38.70 64.02 ± 27.20 0.86 ± 0.14 0.54 ± 0.06 左侧PCA 52.05 ± 25.88 30.61 ± 8.82 0.91 ± 0.11 0.54 ± 0.15 右侧PCA 49.29 ± 13.22 30.22 ± 8.74 0.84 ± 0.13 0.54 ± 0.09 左侧VCA 44.49 ± 12.84 29.17 ± 8.62 0.78 ± 0.13 0.51 ± 0.06 右侧VCA 44.77 ± 11.25 29.60 ± 7.38 0.76 ± 0.16 0.50 ± 0.07 BA 54.22 ± 17.41 35.98 ± 11.06 0.77 ± 0.13 0.50 ± 0.06 表2. TCD各指标值  以大脑中动脉的TCD各指标为自变量，分别以MOCA分数、MMSE分数、Cz与Pz位置的P3潜伏期为因变量建立多元逐步回归方程，筛选相关因素。结果发现(表4、表5)，与Cz位置P3潜伏期相关的因素为：左侧大脑中动脉RI；与PzP3潜伏期相关的因素为：左侧大脑中动脉RI。 Table 3 Pz P3 Cz P3 MMSE MOCA MCA-L-Vp Pearson相关指数 0.115 0.124 0.132 0.119 P 0.442 0.405 0.376 0.425 MCA-L-Vm Pearson相关指数 0.075 0.075 0.221 0.192 P 0.617 0.614 0.135 0.196 MCA-L-PI Pearson相关指数 0.286 0.335 * 0.039 0.073 P 0.052 0.021 0.792 0.624 MCA-L-RI Pearson相关指数 0.327 * 0.381 ** −0.105 0.030 P 0.025 0.008 0.480 0.839 MCA-R-Vp Pearson相关指数 0.183 0.148 0.059 −0.114 P 0.218 0.320 0.694 0.445 MCA-R-Vm Pearson相关指数 0.172 0.133 0.107 −0.063 P 0.248 0.371 0.473 0.672 MCA-R-PI Pearson相关指数 −0.109 −0.031 −0.147 −0.106 P 0.468 0.838 0.323 0.480 MCA-R-RI Pearson相关指数 −0.067 0.002 −0.159 −0.143 P 0.657 0.991 0.285 0.336 表3. MCA各TCD指标与认知功能相关性 Table 4 模型 非标准化回归系数 标准偏回归系数 t P B 标准误差 1 (常量) 267.321 34.531 7.741 0.000 MCA-L-RI 144.807 62.389 0.327 2.321 0.025 表4. 大脑中动脉TCD参数与PzP3相关的多元逐步回归模型 a因变量：PzP3，R 2 = 0.107。 Table 5 模型 非标准化回归系数 标准偏回归系数 t P B 标准误差 1 (常量) 257.073 32.809 7.835 .000 MCA-L-RI 163.899 59.278 .381 2.765 .008 表5. 大脑中动脉TCD参数与CzP3相关的多元逐步回归模型 a因变量：CzP3，R 2 = 0.145。"
"CSVD主要表现为腔隙性脑梗死、皮质下白质病变、脑微出血和微梗死 [ 1 ] 。在我国，CSVD病变所引起的腔隙性梗死占缺血性脑卒中的25%~50%，而脑出血占所有类型脑卒中的25%，显著高于西方国家 [ 7 ] 。多项研究结果显示CSVD已成为血管性痴呆最常见的病因，是混合性痴呆的主要病因之一 [ 8 ] 。CSVD不仅可导致思维异常及运动障碍，更重要的是对认知功能造成损害 [ 9 ] ，其严重性不亚于大动脉粥样硬化性血栓栓塞，因此早期诊断及治疗CSVD相关的认知功能下降具有重要意义。 本研究结果显示，CSVD患者MOCA平均分数小于26分，Cz和Pz位置的P3潜伏期也较平均水平延长，提示存在轻度认知功能损害，与国内CSVD人群的同类研究结果一致 [ 10 ] 。大脑中动脉PI与RI指标与ERP的P3潜伏期有显著性相关，提示CSVD患者认知损害与TCD指标之间存在相关性。国外meta分析显示，阿尔兹海默症和血管性痴呆患者脑血流动力学变化为血流最大速度减小和PI增大 [ 11 ] 。我国学者研究发现，轻度认知功能障碍患者表现为TCD的RI指数与ERP的P3潜伏期有弱相关，PI指数与ERP潜伏期和波幅均无相关 [ 12 ] 。本研究结果提示，脑部小血管尤其是前循环的大脑中动脉血液微循环与认知功能之间相关。可能是CSVD患者脑动脉硬化造成了血管壁的顺应性和弹性下降，引起脑血流动力学紊乱，体现在PI指数和RI指数升高，使远端血管供血区域形成局灶性缺血缺氧，造成脑功能不同程度紊乱，从而表现出认知功能损害，与Stefani [ 13 ] 等提出的认知功能障碍患者血管损害的研究结果类似。研究中相关分析显示左侧大脑中动脉PI、RI与P3潜伏期相关，可能与大多数患者右利手，左侧大脑供血更多影响整体认知功能有关系。 目前对CSVD的认知功能损害还没有可操作的国际普遍接受的诊断标准。本研究中CSVD患者MOCA评分较其他研究高 [ 14 ] ，ERP结果P3潜伏期虽然有所延长，但还处于正常范围，因此CSVD的认知功能损害早期临床表现可仅有轻度下降，在认知电位检测结果及神经心理量表评分表现不明显。但脑血流动力学的改变，可以早于症状出现之前就已经存在。因此脑血流动力学的改变，可用于早期评估CSVD患者认知状态。通过早期发现、早期干预，可以预防其病情发展，避免加重家庭和社会的照护和经济负担。 本研究局限性在于样本量较小，只是初步分析了TCD和认知功能的相关性，可能有影响的更多其他因素在有限的样本量得到的数据分析中还未能够显示出其阳性结果。需要在后期研究中进一步扩大样本量，深入分析CSVD脑部病变的数量和程度，得出更加准确的结果。"
"脑血流动力学的改变对脑小血管病患者的认知功能有明显影响，脑血流动力学TCD检测结果可能成为评判脑小血管病患者认知功能下降早期、无创、简便的筛查方法。"
