"中晚期肝癌及术后复发转移性肝癌目前仍然缺乏有效治疗手段。原人参二醇(protopanoxadiol, PPD)及人参皂苷Compound K是二醇型人参皂苷在体内的代谢产物。近年来多项研究发现这两种天然产物可通过诱导细胞凋亡、抑制细胞增殖、抑制血管生成、抑制转移等机制对多种肿瘤发挥抑瘤效应。其中对肝细胞肝癌的作用研究较多，抑癌效果尤为突出。本文就近年来PPD及Compound K抗肝细胞肝癌的作用和相关机制研究进行系统综述，以期有助于开发出有效治疗肝癌的天然药物。 关键词 :肝细胞肝癌，原人参二醇，Compound K Copyright © 2017 by authors and Hans Publishers Inc. This work is licensed under the Creative Commons Attribution International License (CC BY). http://creativecommons.org/licenses/by/4.0/"
"肝癌是最常见的恶性肿瘤之一，全球每年近 80万人死于肝癌，位居癌症死因的第三位。在我国由于肝炎和肝炎转肝硬化的病人众多，每年肝癌发病率及病死率均占全球一半以上，肝癌居癌症死因的第2位。其中，90%以上肝癌是肝细胞肝癌(hepatocellular carcinoma, HCC)。恶性程度高、手术切除或肝移植后复发转移率高、缺乏有效化疗和靶向药物，使HCC迄今仍然预后很差 [ 1 ] [ 2 ] [ 3 ] [ 4 ] [ 5 ] 。 中医药治疗肿瘤尤其对于中晚期肿瘤，采用“去邪扶正”的治则，近年来临床实践和研究表明这种中医疗法可联合局部手术、放化疗应用起到增效减毒和改善患者生活质量的功效，也可单独使用发挥抑瘤作用。但传统中药复方成分复杂，药效和质控不稳定，药效物质及机制不明确，难以被国际同行接受。从中合理有效地筛检出有效组分或成分研究是突破中药开发应用瓶颈的研究思路。 人参是常用的中医去邪扶正药物，长期实验结果表明，人参有显著抗癌作用 [ 6 ] 。人参主要生物活性成分为人参皂苷，是四环三萜类化合物，包括原人参二醇型、原人参三醇型和齐墩果酸型，其中原人参二醇型皂苷具有较强抗肿瘤作用 [ 7 ] 。药物代谢结果表明，原人参二醇型皂苷在体内经肠道菌群代谢降解为：次苷-20-O-β-D-吡喃葡萄糖苷-20(S)-原人参二醇(20-O-beta-d-glucopyranosyl-20(S)-protopanaxadiol, GPD)，又被研究者称为Compound K，或苷元—原人参二醇(protopanoxadiol, PPD)入血，是其体内主要代谢物和药效实体 [ 8 ] [ 9 ] 。PPD也可由人参属的三七、西洋参皂苷或者绞股蓝属植物提取物反应获得。近年来的多项体内体外实验显示，PPD和Compound K具有较强的抗多种肿瘤活性，包括胃癌、乳腺癌、肝癌、卵巢癌、结肠癌、黑色素瘤等 [ 8 ] [ 9 ] ，对肿瘤细胞有很强细胞毒性，并有抑制细胞增殖、诱导细胞分化和凋亡、调节免疫等作用 [ 10 ] - [ 15 ] 。二者对肝细胞肝癌的效果尤为显著，能有效抑制肝癌细胞增殖、诱导凋亡，并可提高抗肝癌药物的肿瘤抑制作用，增效减毒。明确药理机制有利于药物的开发应用，近年来科研人员同时对PPD和Compound K的抗癌作用相关分子机制也进行了深入研究。本文概述二者在HCC中的生物药理作用及机制，以期促进其在HCC治疗中的开发应用。"
"PPD/Compound K可诱导肝癌细胞的凋亡，其作用主要通过三种基本途径：由细胞表面的死亡受体如Fas和肿瘤坏死因子受体家族引发的膜受体途径；由多种应激条件、化学试剂或药物所起始的线粒体途径；内质网应激活化半胱天冬蛋白酶Caspase-12进而导致凋亡的内质网应激途径。 研究表明，PPD可抑制SMMC-7721细胞裸鼠异种移植瘤生长，发挥抗肿瘤作用 [ 16 ] [ 17 ] 。体外实验发现PPD呈剂量依赖性地抑制SMMC-7721细胞的增殖并诱导细胞凋亡，进一步发现其上调Caspase-3活性，诱导凋亡小体出现 [ 16 ] [ 17 ] 。Compound K能够上调人肝癌细胞MHCC97-H的Fas、Fas配体(FasL)表达及Bax/Bcl-2比例，抑制Akt的磷酸化，通过调节Fas死亡受体和线粒体介导的通路诱导MHCC97-H细胞凋亡 [ 18 ] 。但也有研究发现，在人肝癌细胞HepG2中，Compound K虽可抑制Fas/FasL表达，上调可溶性Fas配体(sFasL)的表达，但阻断Fas受体并没有影响Compound K诱导的细胞凋亡，提示Fas/FasL途径只是Compound K诱导细胞凋亡的途径之一 [ 19 ] 。 Liu等研究证实，Compound K可以破坏线粒体膜电位(Δψm)，导致细胞色素C的释放，诱导细胞凋亡 [ 20 ] 。用Compound K干预人肝癌细胞株MHCC97-H，细胞染色显示亚二倍体凋亡率增加。进一步研究发现Compound K致线粒体膜电位降低，诱导DNA剪切损伤。明艳林等用Compound K干预人肝癌细胞株 SMMC-7721、HepG2、MHCC97-H，同样发现Compound K增加细胞周期中亚二倍体峰，促进DNA 降解梯形条带的形成，线粒体跨膜电位崩溃，增加Caspase-9/Caspase-3的表达，表明Compound K可促进肝癌细胞凋亡，从而发挥其抗HCC活性 [ 21 ] 。Song等研究发现，Compound K通过上调抑癌基因P53表达，诱导细胞核内的Bid剪切并转移至线粒体，促使细胞色素C从线粒体释放，从而介导线粒体凋亡途径促使肝癌细胞凋亡 [ 22 ] [ 23 ] 。Cho等也报道Compound K促进凋亡作用通过激活caspases-3、caspases-8和caspases-9，破坏线粒体膜电位，释放细胞色素C和Smac/DIABLO，Bid和Bax易位到线粒体表面，并下调Bcl-2和Bcl-xL的表达实现 [ 24 ] 。 近来研究发现过度内质网应激可启动细胞凋亡，前者可特异性激活Caspase-12，进一步活化Caspase-3等下游效应蛋白酶,最终导致细胞凋亡。在人肝癌细胞HepG2中，PPD通过内外源性途径诱导细胞凋亡，激活死亡受体5以及Caspase-3、Caspase-8和Caspase-9的活性，并上调与内质网应激相关分子的表达。Guo等研究发现PPD可通过上调与内质网应激相关的蛋白和基因，使PPD治疗的细胞出现巨大的细胞质空泡化以及内质网的形态变化，从而抑制HepG2 细胞的生长，并诱导其凋亡 [ 25 ] 。"
"PPD阻滞肝癌细胞周期于G0/G1期，抑制肝癌细胞增殖。Mochizuki 等研究证实PPD使细胞产生明显的G1期阻滞现象，可能给抑癌基因提供了作用的靶点，如p53蛋白即是通过将细胞周期阻滞于G1期，对损伤DNA进行修复，当修复失败时诱导细胞凋亡 [ 26 ] 。Compound K可将肝癌细胞SMMC-7721阻滞在G0/G1期，从而抑制SMMC-7721增殖发挥其抗肝癌作用 [ 27 ] 。Ming等研究发现，Compound K以时间和剂量依赖方式能明显抑制肝癌细胞BEL-7402增殖，流式检测发现Compound K可将细胞周期阻滞在G0/G1期，进一步诱导细胞收缩、膜泡化、染色质降解等细胞凋亡特征 [ 28 ] 。在人肝癌细胞MHCC97-H中，Compound K同样将细胞周期阻滞在G1期，从而抑制细胞增殖 [ 18 ] 。"
"论肿瘤细胞转移是造成绝大多数癌症患者死亡的原因，而肿瘤诱导的新生血管生成是肿瘤生长与转移最重要的原因之一 [ 29 ] 。其中，内皮细胞增殖在血管新生中起着非常重要的作用，而PPD可以剂量依赖的方式抑制人脐静脉内皮细胞增殖 [ 30 ] 。此外，肝癌血管生成受诸多血管生成因子如血管内皮生长因子(vascular endothelial growth factor, VEGF)、碱性成纤维细胞生长因子(basic fibroblast growth factor, bFGF)等的影响，这些细胞因子的表达可被PPD所抑制，进而抑制肿瘤血管的生成 [ 31 ] [ 32 ] 。秦俊杰等研究也发现PPD通过抑制肝癌间质血管密度，抑制肿瘤血管的形成，使肿瘤细胞的增殖活性下降，从而抑制了肿瘤生长 [ 33 ] 。 Ming等通过体内外实验发现Compound K可以抑制NF-κB通路的激活，使体外肝癌细胞的集落形成、黏附和侵袭能力减弱，同时也使得体内自发肝癌的转移性生长得到抑制。并且Compound K也能够通过抑制VEGF、bFGF的分泌来抑制肝癌细胞的侵袭转移 [ 34 ] 。"
"P-糖蛋白(P-glycoprotein, P-gp)表达增加是肿瘤耐药的一个重要原因。PPD可通过阻断P-gp的活性，从而显著提高化疗药物的肿瘤抑制作用，显示与化疗药物抗癌活性具有协同效应 [ 35 ] 。明艳林等将Compound K与常用抗肝癌药物环磷酰胺(Cytoxan, CTX)、5-氟尿嘧啶(5-FU)、顺铂(cDDP)联合处理肝癌细胞Bel-7402、SMMC-7721，发现Compound K与CTX联合用药后对肝癌细胞Bel-7402、SMMC-7721的增殖抑制作用明显增强，具有化疗协同、增敏作用；与5-FU联合用药后对两种细胞的抑制作用仅有相加效果，与cDDP联合对SMMC-7721具有轻微协同效果 [ 36 ] 。"
"原人参二醇型皂苷代谢物PPD及Compound K具有广泛的生物学作用，对包括HCC在内的多种肿瘤的药效作用已经被多项研究证实，药理机制研究也取得一定进展。其抗肝癌作用主要通过诱导细胞凋亡、抑制细胞增殖、抑制血管生成从而抑制转移等来实现，另外可提高其它化疗药物的抗肿瘤活性、改善肿瘤耐药，在其它肿瘤研究中还发现PPD有激活体内免疫系统、促进活性氧的产生活化AMPK/JNK诱导自噬等对抗肿瘤的作用 [ 37 ] [ 38 ] 。PPD及Compound K有望开发成治疗HCC的新型药物，但迄今多数研究仍然局限于体外实验或小鼠皮下成瘤实验，二者对于其它多种HCC细胞、动物肝脏原位肿瘤的作用以及临床实验研究有待后续开展。另外由于HCC发生发展的分子生物学机制的复杂性及天然药物的多靶点性，PPD及Compound K抗肝癌的机制也尚需更多更深入的探讨。"
