"低孔、低渗储层物性差，孔隙结构复杂，不同的流体性质具有相似的物性、电性特征，增加了油气水层判别难度，以往的解释图版和解释方法已经不能完全满足测井解释的需求。测录井技术综合运用，通过由三种算法组成的交会图技术来识别流体性质及流体类型，解决了常规测井对低孔、低渗储层油气层识别的技术难题，提高了复杂储层烃类、非烃类流体的优快识别准确率和效果。最后，通过30个层段的识别结果与测压取样、试油结果对比，验证了该方法具有较好的应用效果。该技术的运用为低品位油气层勘探开发纵深发展提供技术保障。 关键词 :低孔低渗储层，流体性质，录井资料，测井资料 Copyright © 2017 by authors, Yangtze University and Hans Publishers Inc. This work is licensed under the Creative Commons Attribution International License (CC BY). http://creativecommons.org/licenses/by/4.0/"
"随着南海西部海域构造圈闭、岩性圈闭勘探开发的不断深入，其目标区逐渐转移至由岩性因素起主导作用的低孔渗砂岩油气藏。但目前尚未形成一套快速识别低孔渗砂岩油气藏的有效的方法及理论依据，尤其在低孔渗透砂岩油气藏的流体识别技术还十分欠缺。鉴于低孔渗砂岩油气藏形成的地质条件和分布规律具有复杂性和隐蔽性两个显著特点，其规律性认识难、勘探开发难度大 [ 1 ] [ 2 ] 。为适应新形势需要，须及时对已发现的低孔渗油气藏进行仔细分析和总结，掌握低孔渗油气藏的分布规律，确定适合于南海西部海域低孔渗砂岩油气藏识别方法和技术，优选勘探开发目标，为低孔渗油气圈闭的勘探开发提供理论依据、技术和方法，建立适合南海西部海域低渗透油气藏流体的测录井识别和评价技术。"
"致密砂岩油气藏储层利用常规测井方法难以对孔隙结构进行有效评价；岩石骨架的测井响应特征远远大于流体的贡献，电阻值的高低受储层岩性及物性的双重影响，给油气水层评价带来了难度；相似的物性、电性特征，储层内的流体有很大差异，一定程度上制约了对致密砂岩储层的勘探开发 [ 3 ] [ 4 ] 。因此寻求新的油气层识别技术成为急需解决的问题。 目前为止南海西部海域已发现了众多的低渗砂岩油气藏，近年来最为典型的是在YZ区XY组和XZ区SG组。这些低孔、低渗透砂岩油气藏的流体识别问题一直是勘探开发中的难题。油气层识别与评价是测井解释过程中最难把握的技术之一，同时也是测井解释的核心 [ 5 ] 。  测井资料交会图是常用的直观显示地层含油性的交会图版，该图版综合应用电性和物性特征来反映地层含油性信息。通常在纯砂岩条件下，能够很好地反映含油性和物性的变化规律 [ 6 ] [ 7 ] (图1)。利用现有的测井资料，结合相关的DST测试和电缆地层测试分析结果以及相关的地质资料分地区分层位研究了相关的流体识别图版。 图1. 测井资料识别流体性质识别图版 注：(a) XY组一段密度与电阻率交会图；(b)XY组一段声波时差与电阻率交会图；(c) XY组一段孔隙度与电阻率交会图；(d) XY组二段孔隙度与电阻率交会图；(e) XY组二段密度与电阻率交会图；(f) XY组二段声波时差与电阻率交会图。 图1(a)~(f)为XY组一段和XY组二段储层流体性质识别图版。可以看出，目的层段不同流体性质的分区很明显；由图1(e)和图1(f)可见，密度、声波时差测井值与电阻率交会图对气层的敏感性不高，这是由于低孔渗地层中，测井响应值主要受岩石骨架的影响，而储层的流体性质的响应特征较弱，油气层与水层之间存在很大一个模糊区域，因此，仅利用测井资料不能够快速准确地识别地层流体性质。  录井气测反映地下钻井破碎岩石中烃类的体积分数，气测值得高低在一定条件下反映了地层的含烃丰度。但在低孔渗储层中，由于储层可动孔隙度低，有效储集空间中的烃类组分相对较低，单一利用录井气测技术难以像常规储层那样快速识别出流体性质。 图2(a)为油、气和水层的全烃体积分数与烃湿度交会图，从图中可以看出，油气层与水层在全烃体积分数的坐标轴上有一明显的分界线，而气层的烃湿度值则明显小于油层，可以把这三种流体的类型识别出来。图2(a)和图2(b)中的三种流体类型的样本点来自XZ与YZ地区(YZ区主要为气层、而XZ区则缺乏气层样本点)。 图2(b)为全烃体积分数与C 1 /C 2+ 体积分数比值交会图，从图中可以发现油、气层的C 1 /C 2+ 体积分数比值具有明显的分界线，可以较好地区分这两种流体类型。 但是，从图2(a)和图2(b)可见，含气水层的气测特征值与气层的相当，没有清晰的界限。 图2. 录井资料识别流体性质识别图版 注：(a) 全烃体积分数与烃湿度交会图；(b) 全烃体积分数与C 1 /C 2+ 体积分数比值交会图。  低孔低渗储层受泥浆的侵入、岩性、地层水矿化度、孔隙结构特征等因素的影响 [ 8 ] ，使油水差异减小，部分高电阻率水层和低电阻率油层在该交会图中难以识别。因此，将反映地下烃类丰度的气测组分与反映地下岩石储集特性岩石物理参数结合起来将是解决低孔渗储层快速识别技术的关键。 研究区进行了大量的气测录井，取得了丰富的气测资料。在交会图版中利用气测资料与测井资料，不同流体类型的分区更明显，即图版对储层流体性质判别更敏感。把孔隙度∅与电阻率ρ t 综合考虑，整合成一个参数后，可以发现水层的[1/(∅ × ρ t )]值明显高于油气层的值，并且知道油气层的[1/(∅ × ρ t )]值是小于1的，对储层流体性质的识别效果最好，图3(a)和图3(b)为结合了气测资料得到的YZ区XY组流体性质识别图版。图3(c)和图3(d)为SG组常规测井资料结合气测资料得到的流体类型识别图版，可以看出，图版中利用气测资料后对流体性质的识别更有效了，分区重合样本点变少了。 图3. 录井与测井资料结合识别流体性质识别图版 注1：∅为孔隙度，1；φ(TG)为气测全烃体积分数，%；ρ t 为地层电阻率，Ω∙m。注2：(a)为XY组(∅ × φ(TG))与电阻率交会图；(b)为XY组(∅ × φ(TG))与[1/(∅ × ρ t )]交会图；(c)为SG组(∅×φ(TG))与电阻率交会图；(d)为SG组(∅ × φ(TG))与[1/(∅ × ρ t )]交会图。"
"交会图版算法由聚类算法、点与线位置关系算法和点与折线位置关系算法组成。软件通过该算法实现将用户绘制的分界线转换为Line或Broken数据结构，以实现识别算法的及时更新。以下将对这三种算法详细介绍。  聚类分析法是根据模式之间的相似性对模式进行分类，对一批没有标出类别的模式样本集，将相似的归为一类，不相似的归为另一类。在流体性质交会图版中，当遇到没有明显的流体性质分界标准的图版时，可以通过模式识别中的聚类分析法算法达到识别流体性质的目的。模式类别之间的相似性或差异性可以聚类准则函数来表示，是通过计算未知流体性质的储层与已知流体性质试油数据的距离，并比较未知流体性质的储层与各流体性质试油点均值，将均值最小的流体性质作为结果输出。  交会图版中经常使用画直线的方法实现对流体性质分布的划分。在双线性坐标中，点与线位置关系算法的实现通过Lines数据结构起点坐标和终点坐标拟合直线方程y = kx + b (当k > 20时，该线为垂线)，通过代入自变量值来对比因变量值进而判断点与直线位置关系。当坐标系内有一轴或两轴是对数坐标时，需要纠正使用直线方程y = kx + b带来的视觉误差。其实现方法是采用了计算相对距离的方法间接的实现了坐标轴的转换。该坐标中y轴为对数刻度的坐标，定义y轴的总长度为1；同理如果x轴为对数刻度，亦可以通过此公式进行转换。  当流体性质分界线为折线时，需要应用到点与折线位置关系算法。点与折线的位置关系只有两种，点在折线内(折线小于π的角)和点在折线外，其通过计算“角度和”的方法实现。该算法的原理如下，如果点在折线内，则点与折线两边的角度和必等于折角和。为了减少计算量，软件采用坐标轴原点平移的方法，将坐标轴的原点平移到折线的拐点，然后利用Math.Atan2(y，x)方法计算角度。Math.Atan2方法返回值是θ，以弧度为单位，满足−π ≤ θ ≤ π，且tan(θ) = y /x，其中x、y是坐标轴值。"
"表1为层位取自ZH2的识别结果与测压取样、试油结果对比数据表，由表可见符合率为90%。该方法能快速、直观和准确地判断低孔低渗储层流体性质。 Table 1 井号 起始深度/m 终止深度/m 识别结论 测试方式 符合情况 U 3520.6 3526.2 水层 电缆地层测试取样 符合 V 3392.9 3397.9 气层 电缆地层测试取样 符合 3452.1 3455.9 水层 电缆地层测试取样 符合 W 3385.4 3393.4 气层 DST取样 符合 3460.0 3470.2 气层 符合 3489.9 3497.4 气层 符合 3748.7 3756.6 油层 电缆地层测试取样 符合 X 2025.5 2032.0 油层 DST取样 符合 Y 2032.6 2038.7 油层 符合 Z 3625.3 3632.1 气层 电缆地层测试取样 不符合 表1. 流体性质快速识别结果与测压取样、试油结果对比"
"1) 储层物性好时，测井或录井资料交会图可以直观准确地反映地层流体性质。 2) 利用录井资料并结合常规测井资料交会图可以对低孔、低渗透砂岩油气藏流体性质进行有效的识别。 3) 交会图通过聚类算法、点与线位置关系算法和点与折线位置关系算法来实现。 4) 通过30个测试层段结果与交会图解释结果对比，验证了地质录井资料与测井资料相结合的方法识别低孔低渗储层流体性质的方法具有较好的应用效果。"
