"针对开发井组监测资料不足、分层动态分析难度大等多层系合采油田，提出以井组内注采平衡为依据，利用岩心驱替实验所得PV倍数与含水率关系曲线、无因次指数进行井组产层动用情况的研究方法。该方法视井组为一个统一整体，充分考虑了注水井与受效油井的影响因素(包括油层厚度、渗透率、原油黏度、地应力方向、注采井距、生产压差、改造措施等)，通过平面和垂向系数合理劈分注水井分层注水量，计算油井各小层分层产量。运用该方法计算了X油田近300口水井分层吸水量和油井分层产夜量，与现场实测剖面结果相符，表明该方法可靠。 关键词 :注采平衡，PV倍数与含水率关系曲线，无因次指数，注水量，产液量，劈分 Copyright © 2017 by authors, Yangtze University and Hans Publishers Inc. This work is licensed under the Creative Commons Attribution International License (CC BY). http://creativecommons.org/licenses/by/4.0/"
"油田进入高含水中后期开发阶段后，注水井的层间矛盾和平面矛盾日益严重，地下情况更加复杂，只有充分认清油、水井分层动用情况，才能采取切实可行的分层调整及挖潜措施，从而提高油田的开发水平。因此，提出了油、水井分层注水量和产液量研究。传统方法主要采用产吸剖面劈分法、KH值劈分法、井组注采平衡劈分法 [ 1 ] - [ 6 ] 及数模等。产吸剖面劈分法最为准确，但是测试成本高；KH值劈分法仅在建产初期较为合适；井组注采平衡劈分法仅可对分层产液进行劈分，无法计算分层含水，即计算的分层产液比和产水比相等，分层含水等于单井含水。为此，笔者提出了一种综合考虑油层条件和开发条件的油、水井分层动用状况研究方法。"
"笔者针对剖面测试资料较少井的油水井分层注水量和产液量劈分提出了以下方法： 1) 以水井为中心，以见水、见效台帐及地应力方向为条件，水井周围距离最近的2口油井和水井组成的三角形进行区域划分，计算区域面积；以上述3口井油层厚度的加权平均厚度作为容积的高度，计算容积体积。 2) 充分考虑井组开发条件(包括注采井距、产吸剖面、生产压差、改造措施等)，对水井平面方向的注水量系数进行确定，把注水井注水量劈分到各个小层对应的油井平面： ① 利用实验测试的PV倍数与含水率的关系，计算油井该方向的含水率； ② 相渗数据归一化的无因次指数结合含水率，计算油井各个分层方向上的液量及油量； ③ 统计油井所有层位的总液量和总油量，根据分层液量和油量计算油井分层产液系数及产油系数，利用该系数计算油井的分层液量及油量，利用井口含水率通过多元回归法对分层产液量和产油量进行校正。"
"采用渗流理论 [ 7 ] 对水井分层措施进行劈分来确定注水井分层注水系数，主要考虑相关层的各种改造措施及地质静态因素，其中以吸水剖面和一般性改造措施为主，一般性改造措施后的小层劈分系数C j 拟合公式 [ 8 ] 为： C j = Y j ∑ j = 1 n Y j (1) Y j = K j H j Z j G j K sh , j N j ln ( D j ) (2) 式中：Y j 为小层劈分条件值；K j 为渗透率；H j 为有效厚度；Z j 为连通系数；G j 为层间干扰系数；K sh,j 为沉积微相影响因数；N j 为水井对应的油井数；D j 为油水井距；下标j为小层序号。 当储层经过措施改造以后，引入措施系数R，措施后的劈分系数 Y ′ j 变为： Y ′ j = Y j × R (3)  对有吸水剖面资料的注水井，充分考虑静态因素以后，直接利用吸水剖面资料计算注水井各小层的注水量： W j = Q w × R j (4) 式中：W j 为注水井第j小层的日注水量，m 3 ；Q w 为注水井全井日注水量，m 3 ；R j 为注水井全井第j小层吸水比例(吸水剖面资料)，1。 没有吸水剖面资料的注水井，在综合考虑水井的各小层静态因素(包括油层厚度、渗透率、原油黏度)及开发条件(包括注采井距、生产压差、改造措施)的基础上，将注水井井口注水量劈分到注水井的各个小层： W j = Q w × Y ′ j (5)"
"以水井为中心，以见水见效台帐及地应力方向为条件，水井周围距离最近的2口油井和水井组成三角形，按照逆时针或者顺时针方向进行区域划分，计算区域面积；以2口油井的油层厚度的加权平均厚度作为容积的高度，计算容积的体积；以油井和水井的加权孔隙度进行孔隙度计算；利用加权孔隙度和加权体积进行PV (孔隙体积)的确定。其具体的计算过程如下。 (6) 式中：l为A、B、C这3口井距离之和的一半，m；L 1 为油井B和油井C的距离，m；L 2 为水井A、油井B的距离，m；L 3 为水井A、油井C的距离，m。 S = l ( l − L 1 ) ( l − L 2 ) ( l − L 3 ) (7) 式中：S为A、B、C这3口井构成的单元的面积，m 2 。 PV = S h ϕ (8) 式中：PV为A、B、C这3口井构成的单元孔隙体积，m 3 ；h为容积高度(2口油井的油层厚度的加权平均厚度)，m； ϕ 为孔隙度(2口油井和水井的加权孔隙度)，1。 根据分层的注水量及分层PV进行PV倍数的计算： m = W j PV (9) 式中：m为注水量与孔隙体积的倍数，1。 在反五点法注采井网中，水井A、油井B和油井C如图1所示。 图1. 注采单元示意图  根据达西定律，当油、水两相同时流过油藏内某一地层的横截面时，水相占整个产液量的百分数为水的分流量或者含水率，计算公式 [ 9 ] 为： f w = 1 1 + K ro μ w K rw μ o (10) K ro K rw = a e - b S w (11) 式中：f w 为含水率，1；K ro 、K rw 分别为油相、水相相对渗透率，1；μ o 、μ w 分别为油、水相黏度，mPa∙s；a、b为无因次指数系数，1；S w 为含水饱和度，1。 根据式(10)和式(11)可得： f w = 1 1 + ( a e - b S w ) μ w μ o (12) 无因次采油指数计算公式为： a o ( f w ) = K w K ro ( S w ) K K ro , max (13) 式中：a o 为无因次采油指数；K为渗透率，μm 2 ；K w 为水相渗透率，μm 2 ；K ro,max 为油相相对渗透率最大值，1。 若不考虑注水开发过程中绝对渗透率的变化，则K = K w ，即： a o ( f w ) = K ro ( S w ) K ro,max (14) 其无因次采液指数a l 的计算公式为： a l ( f w ) = a o ( f w ) 1 − f w (15) 通过相渗数据，利用二元回归法，通过上述公式对a o 和a l 进行公式回归。  在分层注水量计算的基础上，计算出注水井各小层在周围每口井方向上的注水量；利用岩心驱替实验测得PV倍数与f w 的关系曲线，结合分层m计算分层f w ；根据a o 和a l 计算油井产油量和产水量；然后以油井为中心，将根据a o 和a l 计算的产油量和产液量叠加，即得到油井分层的产油量和产液量；再根据井组累积产油量和产液量计算分层的采油指数系数和采液指数系数： J o = J o , i K i h i n i ln d i ∑ J o , i K i h i n i ln d i (16) J l = J l , i K i h i n i ln d i ∑ J l , i K i h i n i ln d i (17) 式中：J o 为无因次采油指数系数；J l 为无因次采液指数系数；J o,i 为第i层无因次采油指数系数；J l,i 为第i层无因次采液指数系数；K i 为第i的渗透率；h i 为第i层的有效厚度；d i 为油水井井距；n i 为第i层的总油井数。  根据井口的产油量和产液量，利用分层系数对产油量和产液量进行劈分，利用井口的含水率通过多元回归求解的方式对分层产液量和产油量进行校正。"
"利用上述方法对X油田近300口油、水井进行分层注水量、产液量和产油量的计算，对比计算结果和测试结果(见表1、表2)表明，每口井各小层的分层注水量和分层产液量趋势基本一致。 上述分析表明，本文方法计算结果与实际情况符合程度比较高，表明静态因素资料结合吸水剖面，充分考虑地应力方向对平面劈分的影响，利用PV倍数与含水率的关系，采用无因次指数进行井组产层研究，能够很好地解决小层数据劈分问题。"
"笔者把油、水井作为一个统一的油水运动系统，动静结合，综合考虑注水井和其影响到的采油井的各种开采条件(包括油层厚度、渗透率、原油黏度、地应力方向、注采井距、生产压差、改造措施)等因素，克服了过去常用方法计算劈分油、水井的分层注水量和产液量不准确的缺陷。通过现场实际资料验证，本文方法符合率比较高。该方法可有效分析缺少监测资料井点的动用状况，对分析小层剩余油潜力及制定分层改造措施方案有一定指导作用。"
