"缺血性脑卒中(Ischemic stroke IS)是临床常见病，具有高发病率、高死亡率、高致残率的特点，占脑卒中的70%~80%，给家庭及社会带来沉重的负担。面对其预防及治疗效果不满意、发病机制复杂的现状，利用中医体质识别及目前现有的辅助检查相结合的手段，可以为临床中预防及治疗缺血性脑卒中提供新方向。本文通过对近年来缺血性脑卒中、中医体质和经颅多普勒超声(transcranial Doppler, TCD)改变以及其三者之间的相关研究进展进行分析和总结，探讨缺血性脑卒中患者中医体质和TCD所示颅内血管改变的相关性。 关键词 :中医体质，缺血性脑卒中，TCD改变 Copyright © 2018 by authors and Hans Publishers Inc. This work is licensed under the Creative Commons Attribution International License (CC BY). http://creativecommons.org/licenses/by/4.0/"
"缺血性脑卒中又称脑梗死，是指各种原因所致脑部血流供应障碍，导致局部脑组织缺血、缺氧性坏死，而出现相应神经功能缺损的一类临床综合征。随着我国人口的老龄化，脑卒中发病率逐年升高，严重威胁着人类的健康。2010年全球疾病负担、伤害及危险因素研究(GBD2010)中，我国数据分析发现，脑卒中是2010年国人死亡的主要原因之一 [ 1 ] 。缺血性脑卒中的发病及预后与脑内血管形态密切相关，颅内动脉狭窄闭塞性病变尤其大血管的狭窄与闭塞病变是导致缺血性卒中的主要原因。TCD主要针对缺血性卒中的血管源性病变进行初步筛查，是检测缺血性脑卒中的重要手段，其在缺血性脑卒中的诊断、治疗中的作用及前期预防疾病的作用突出；且因其实时、便携、无创、可反复检查，甚至可长程检测的优点，临床应用价值不断增加。中医体质学认为，不同的体质有其不同的易感疾病，脑卒中存在着好发体质。随着对依据TCD检查所示的脑血管的改变及中医体质的不断研究深入，探讨将客观现代检查手段与中医体质辩证相结合，互为参照，可以为缺血性脑卒中的预防和治疗带来了新的希望。"
"中医体质学认为，体质是人体生命过程中，在先天禀赋和后天获得的基础上形成的形态结构、生理功能和心理状态方面综合的、相对稳定的固有特质 [ 2 ] 。许多相关疾病发生的“共同土壤”在于其体质基础，体质状态决定发病与否以及发病的倾向性 [ 3 ] 。缺血性脑卒中又名中风，其病机包括气、血、风、火、痰、虚六种，此六种单独或合而为病。脑卒中病因病机颇为复杂，虽同感受邪气，但每个人发病与否、发病的表现及预后情况，则与患者的体质有密切的关系。 脑卒中是我国高发病率、高死亡率和高致残率疾病，其中缺血性脑卒中占脑卒中的80%。在我国，农村脑卒中死亡率为150.17/10万人，城市脑卒中的死亡率为125.56/10万人 [ 4 ] ，并且70%~80%的存活者因为残疾而不能独立生活，这给社会及家庭都带来沉重负担 [ 5 ] 。如何做到早预防，从根本上减少发病及致死、致残率是未来的目标与方向，因此不断有研究探讨中风病的发病与中医体质的相关性，研究涉及中风病的各不同阶段及发病状态。如马卫琴等 [ 6 ] 观察了173例中风先兆患者的中医体质，结果显示以痰湿质、气虚质、血瘀质、阴虚质多见，其中痰湿质占28.32%，气虚质占21.39%，提示痰湿质、气虚质是中风好发体质；李柱等 [ 7 ] 对200例急性缺血性中风(中经络)患者进行中医体质辨识，结果显示痰湿质、湿热质和血瘀质是其主要体质。贾爱明等 [ 8 ] 分析缺血性中风恢复期(2~24周)患者的体质，缺血性中风恢复期患者体质主要为血瘀质(20.97%)、痰湿质(18.71%)、气虚质(16.29%)。复发性脑卒中患者的中医体质类型以阴虚质、血瘀质和气虚质为多 [ 9 ] ；孔燕莹等 [ 10 ] 通过对202例脑血管病后遗症患者中医体质类型分析认为气虚质是脑血管病后遗症最常见的体质。近年来体质学说的研究较多，虽各研究得出的中风体质之间存在着差异，但也不断印证了，中风病的发病概率、发病后临床表现以及预后及复发都与体质存在着密切的关系。"
"TCD改变即通过经颅多普勒(transcranial Doppler, TCD)超声检测出颅内血管的改变。TCD通过参考检查的血流速度、血流频谱分布、声频改变和流速比值等来诊断颅内血管的狭窄，其实时、便携、无创、可反复检查，甚至可长程检测，是初步筛查缺血性脑卒中血管源性病变的重要手段。多项国内外研究，将TCD对血管闭塞及狭窄的诊断准确性与数字血管减影造影术及磁共振血管造影 [ 11 ] [ 12 ] 等进行对比，研究结果表明TCD对诊断 ≥ 50%的颅内动脉狭窄存在优势。TCD对MCAM1段血管狭窄的特异度和敏感度最高，其次为颈内动脉末端、PCA P1和P2段 [ 13 ] 。我国急性缺血性脑卒中患者颅内动脉狭窄以MCA段最常见，部分或完全性MCA梗死患者占幕上缺血性卒中的10%左右 [ 14 ] ，是导致高致残率和致死率的主要原因，恶性MCA梗死患者常在最初的24~48 h出现病情的恶化，80%患者预后不良；TCD可以通过检测MCA远端或近端闭塞，判断患者远期预后。 临床上TCD可用于指导缺血性脑卒中急性期诊断、治疗，判断预后。对于具有卒中可能性的患者尽快完善颅内外大血管检查，可明确脑缺血发病机制，血管狭窄/闭塞部位以及侧支循环的建立情况；对于急性脑梗死患者，溶栓前进行TCD残留血流的检测，根据溶栓的脑缺血(hurombolys is in brain ischemia, TIBI)分级，可以预测卒中严重程度、静脉溶栓病死率以及临床转归 [ 15 ] [ 16 ] 同时，通过TCD检测动脉闭塞部位，为静脉溶栓、动脉内溶栓或机械取栓提供一定的依据。据Kumako等 [ 17 ] 研究报道发现，对于急性期脑梗死患者r-t PA溶栓中进行持续的TCD检测，其血管再通率得到了明显的提高。随着生活水平的不断提高，人们对健康问题的重视，身体的定期检查得到更多人的青睐，尤其对于中风病危险因素的筛查，而TCD在此领域发挥了重要作用。通过定期检查颅内外血管狭窄的程度、部位并结合其他卒中危险因素，可指导患者干预及治疗。李康等 [ 18 ] 对可疑颅内血管狭窄的200例患者的研究结果表明TCD较DSA和CTA特异度差异小，可用于疑似患者初检查和筛查。Karandashova等 [ 19 ] 研究及国内杨利杰等 [ 20 ] 研究均表示TCD在脑梗死静脉溶栓时能及时了解血管再通情况，根据血流情况可以了解患者预后，同时认为TCD还能对脑梗死或无症状颈内动脉重度狭窄患者进行栓子监测以探查、定位及量化脑血流中微栓塞。以上都提示TCD对缺血性卒中的预防、干预具有重要作用和优势。"
"随着人们生活习惯的改变，动脉硬化导致的心脑血管疾病逐渐成为危害人类健康的主要疾病；体质作为先天和后天相互作用形成的相对稳定的身体状态，影响着个体动脉硬化的形成和进展。尹莲花等人 [ 21 ] 通过收集和研究300例高血压前期患者的中医体质和动脉硬化程度，表明在提示有早期动脉硬度改变的高血压病早期，其动脉硬化程度与阴虚质、痰湿质及瘀血质相关。周华等 [ 22 ] 人经过对201例临床原发性高血压患者中医体质辨识后进行颈动脉超声检测发现：原发性高血压患者中，中医体质以“郁”和“热”为主，发生颈动脉粥样硬化的人群中郁滞质以斑块形成为主，内热质以血管阻力指数的增高和内膜中层厚度的增厚为主。范莹等 [ 23 ] 对243例闭塞性动脉硬化症患者进行体质调查显示其存在体质差异，主要体质类型为阳虚质、气虚质、痰湿质。以上都表明中医体质与动脉硬化之间存在着必然的联系，脑动脉硬化作为缺血性脑卒中的主要致病原因，可以通过TCD检测得到，因此可以通过借助TCD客观直接的研究分析缺血性脑卒中患者脑动脉硬化与中医体质之间的关系。"
"通过上文可知动脉硬化与中医体质之间存在着联系，而TCD作为便捷、可靠的辅助手段，可以客观的反映颅内动脉硬化改变，因此可以通过研究患者TCD血管改变以及其中医体质来探讨两者之间的关系。近年来越来越多的临床医生及研究者注意到中医体质在疾病预防及治疗中的作用，以及针对疾病患病者的中医体质结合实验室或其他辅助检查的客观指标来进行研究。如孟晓嵘等 [ 24 ] 对2型糖尿病合并肿瘤患者中医体质类型及与糖类抗原CA199的相关性研究中，认为CA199在不同体质患者间比较差异有统计学意义，主要以痰湿质、血瘀质、气郁质为主。丁春丽等 [ 25 ] 探讨多囊卵巢综合征患者中医体质与性激素、脂代谢的相关性分析的结果也表明中医体质与性激素各指标间存在相关性。这些研究都表明中医体质这种人群及人群中的个体在遗传的基础上，在环境的影响下，在其生长发育和衰老过程中形成的与自然、社会环境相适应的人体个性特征，功能结构与代谢上相对稳定的特殊状态 [ 26 ] ，与相关的客观指标之间具有相关性，两者可以相互结合，研究疾病的预防、治疗和预后。 邱笑琼等 [ 27 ] 对缺血性脑血管病患者体质和脑血管造影分析认为，缺血性脑血管病患者中医体质与脑动脉狭窄密切相关，在其研究的297例患者中痰湿质、血瘀质是脑动脉狭窄的危险因素，血瘀质患者脑动脉狭窄程度更严重。赖少兰等 [ 28 ] 研究验证了中医体质对于脑卒中患者的脑血流动力学具有一定的影响，痰湿质、阴虚质、血瘀质偏颇体质积分越高，血流动力学积分越低，偏颇体质症状积分能够在一定程度上反应脑血流动力的异常。脑血管的狭窄程度以及脑血流动力学都可以通过TCD检测，同时TCD的便捷、实时使得其可以动态的探究患者情况。近年来的研究也表明中医体质的偏颇与多种疾病的发生存在相关性，体质是卒中发生的重要参考，TCD改变在缺血性脑卒中的诊断和治疗中也发挥着重要的作用，综上笔者认为中医体质与TCD改变之间具有一定的相关性，虽然目前关于两者之间的相关性研究的报告不多，但相信通过研究二者之间的关系可以更好的为缺血性脑卒中的干预提供依据，尤其对于无症状而有血管事件的高危人群及社区患者。"
"体质现象作为人类生命活动的一种重要表现形式，与健康和疾病有着密不可分的关系。中医理论认为，体质是疾病发生和转归的内在决定因素。现代医学对疾病的生理病理的研究也在逐步印证中医的这种观点。综上所述：近几年从中医体质角度研究缺血性脑卒中的防治取得了较大的进展，虽然各家研究不尽相同，但缺血性脑卒中的主要体质为：痰湿质、气虚质、血瘀质；脑血管的狭窄及血流度的改变与体质相关性的研究都取得了一定的收获。虽然目前直接探讨TCD改变与中医体质相关性的研究报道鲜有，但随着对TCD改变及中医体质关系的不断研究探讨下，将客观现代检查手段与中医体质辩证相结合可以为我们临床治疗探寻新的方向。以客观的TCD检查结果结合中医体质测评为参考，并以调整体质、改变体质的方向为着手点，开展临床脑卒中的一级、二级预防，可以减少中风病的发生，以期达到治未病的目的。"
