"目的：评估经皮冠状动脉介入(percutaneous coronary intervention, PCI)及冠状动脉旁路移植术(coronary artery bypass grafting, CABG)治疗急性ST段抬高心肌梗死(ST segment elevated myocardial infarction, STEMI)的有效性及安全性。方法：入选我院2009.1~2015.1 ST段抬高型心肌梗死(STEMI)后接受PCI或CABG治疗的120例患者，分为PCI干预组(A组)、CABG干预组(B组)，比较两组患者的一般临床资料、冠状动脉造影血管病变情况及心源性病死率、心律失常、再发心绞痛以及再入院率和再次血运重建术率，术后随访24个月。结果：CABG组三支和左主干冠状动脉病变例数明显高于PCI组(70.91% vs. 13.85%, 16.36% vs. 1.54%, P < 0.05)，随访24个月两组患者在心源性病死率、合并心律失常、再次住院率及再次血管重建术发生率(P > 0.05)差异无统计学意义。PCI和CABG两组在心绞痛复发和IABP应用上有差异，具有统计学意义(16.92% vs. 3.64%, 4.62% vs. 18.18%, P < 0.05)。结论：PCI与CABG是治疗STEMI患者重要的血运重建方式，CABG较PCI在完全血运重建、减少心绞痛复发方面更有优势，根据患者的一般状况和冠脉病变情况采用合理的血运重建方式，以达到最佳重建冠状动脉血流的结果，改善患者的预后。 关键词 :急性ST段抬高心肌梗死，冠状动脉旁路移植术，多支病变 Copyright © 2018 by authors and Hans Publishers Inc. This work is licensed under the Creative Commons Attribution International License (CC BY). http://creativecommons.org/licenses/by/4.0/"
"ST段抬高急性心肌梗死(ST segment elevation myocardial infarction, STEMI)属于急性冠状动脉综合征(acute coronary syndromes, ACS)的一种，大约1/3合并多支病变且病变重，较非ST段抬高型心肌梗塞患者病情重，既往实验，动物实验表明，对于发病6小时内的患者及时开通梗死相关动脉，恢复冠脉血流，更能有效挽救患者心肌，改善患者的预后，而大多数患者心梗发生后6小时内不能得到有效救治；无疑PCI是治疗心肌梗塞一种重要的血运重建方式，具有及时、快速及并发症少等优点，但对于多支合并左主干病变、病变冠脉解剖不适合PCI及合并机械并发症的患者，CABG是一种重要选择策略，新指南推荐直接PCI策略较2010年指南更加完善，也对行CABG治疗策略进行了完善 [ 1 ] 。现对就诊于我院接受PCI或CABG治疗的120例STEMI患者做回顾性分析，探讨不同冠状动脉重建术治疗STEMI的影响，为后续STEMI的临床治疗提供更多的参考依据。"
"选取2009年1月~2015年1月住院收治的STEMI患者120例，其中男81例，女39例；年龄42~81 (68.6 ± 8.2)岁。其中65例行经皮冠状动脉成形术(percutaneous coronary intervention, PCI)治疗，55例患者行冠状动脉旁路移植术(coronary artery bypass grafting, CABG)治疗。病例入选标准：1) 诊断均符合ACC/AHA2007《ST段抬高心肌梗死治疗指南》制定的诊断标准；2) 符合ACC/AHA 2004年冠脉移植术指南及2007年ACC/AHA经皮冠状动脉介入治疗指南；3) 对于血流动力学不稳定患者积极予以药物及IABP辅助。4) 接受PCI和CABG患者各均有同一医疗组进行管理。排除标准：1) STEMI并发机械性并发症(室问隔穿孔、乳头肌功能失、室壁瘤行层)需要同期行瓣膜置换，室间隔修补及室壁瘤切除术患者；2) 需同期行其他脏器手术。收集所有患者的临床一般资料，包括年龄、性别、体质量、既往史、并发症、病变血管、术后死亡及并发症、IABP应用，检测心肌血清生化标志物及超声心动图检查指标。  所有患者均常规应用药物行扩冠、抗凝、降脂等治疗；经冠状动脉造影证实病变适宜PCI治疗者，PCI 皆采用药物洗脱支架(DES)，其手术遵从冠状动脉介入的常规用药及操作步骤，血管造影成功主要是指病变处经充分扩张并置入支架后，术后冠脉造影提示残余狭窄 < 20%，操作成功是指在达到造影成功的标准后，达到TIMl3级血流；对于多支弥漫性病变或合并左主干以及靶变血管解剖位置不适合PCI，转入心脏外科完善术前常规检查拟行CABG，根据患者发病时间及状况确定手术时机，据患者心功能及全身状况选择体外循环或非体外循环冠状动脉旁路移植术，术中均采用静脉加吸入复合麻醉，胸骨正中切口，取左乳内动脉备用，其余血管桥用自体大隐静脉尽可能行完全血运重建。  对于顺利出院后1月、3月、6月、12月及24月采用电话或门诊随访进行评估，做随访人员均具有良好的沟通能力，对随访内容详细记录，随访其术后主要心脏事件，包括心源性死亡、再发心绞痛、再次血运重建、脑卒中、再次住院的主要MACCE事件。  计量资料以均数±标准差(χ ± s)表示，统计学方法采用t检验，计数资料采用χ2检验，采用SPSS 17.0统计软件进行统计处理。P < 0.05为差异有统计学意义。"
"共有120例患者被纳入研究，其中人院后65例患者行PCI治疗，55例行CABG治疗。患者在一般临床资料差别无统计学意义。  A组单支病变例数明显高于B组且统计学有差异(P < 0.05)，而B组三支和合并左主干病变冠状动脉病变例数明显高于A组(P < 0.05)。A组冠状动脉病变114处，成功处理98 (85.96%)处。共植人支架112枚药物覆膜支架。B组病变冠状动脉149支，桥血管数支数165支，其中动脉桥血管51支，静脉桥血管114支，实现血管完全重建。B组使用IABP例数明显高于A组(P < 0.05)，术前A组予以应用2例IABP，术后2天内均顺利撤除；B组术前置入7例，3例应用于术后因血流动力学不稳定的患者。  STEMI后接受CABG围手术期死亡4例，2例死于术后30天内多器官功能衰竭，1例死于低心排， Table 1 指标 A组(n = 65) B组(n = 55) x 2 /t值 P值 男性/例(%) 44 (67.69) 37 (67.27) 0.02 0.961 年龄/岁 68.5 ± 8.09 68.6 ± 8.39 −0.105 0.916 体重/Kg 68.02 ± 3.92 69.22 ± 3.63 −1.999 0.048 糖尿病/例(%) 13 (20.00) 15 (27.27) 0.881 0.348 高血压/例(%) 21 (32.31) 23 (41.82) 1.16 0.281 高血脂/例(%) 30 (46.15) 28 (50.91) 0.27 0.603 慢阻肺/例(%) 2 (3.07) 3 (5.45) 0.036 0.849 脑卒中病史/例(%) 2 (3.07) 3 (5.45) 0.036 0.849 左主干病变/例(%) 1 (1.54) 9 (16.36) 6.741 0.009 单支/例(%) 32 (49.23) 1 (1.82) 31.25 0 双支/例(%) 24 (36.92) 15 (27.27) 1.265 0.261 三支/例(%) 9 (13.85) 39 (70.91) 40.42 0 LVEF(%) 46.74 ± 4.79 44.42 ± 4.11 2.856 0.005 表1. 术前两组临床资料比较 Table 2 指标 A组(PCI) B组(CABG) x 2 值 P值 术后低心排/例(%) 1 (1.54) 3 (5.45) 0.463 0.496 术后死亡/例(%) 2 (3.08) 5 (9.09) 1.020 0.313 院内/例(%) 1 (1.54) 4 (7.27) 1.227 0.268 随访期/例(%) 1 (1.54) 1 (1.82) 0 1.0 心绞痛复发/例(%) 11 (16.92) 2 (3.64) 4.156 0.041 再次入院/例(%) 7 (10.77) 2 (3.64) 1.278 0.258 血管重建/例(%) 5 (7.69) 1 (1.82) 1.104 0.293 心律失常/例(%) 3 (4.62) 4 (7.27) 0.052 0.820 IABP例数/例(%) 3 (4.62) 10 (18.18) 4.359 0.037 表2. 术后两组临床资料比较 1例死于室性心率失常，术后随访18月时死于脑血管意外1例，接受PCI组围手术期死于恶性心律失常1例，术后随访1例死于交通意外。PCI组较CABG组再发心绞痛明显高于CABG (P < 0.05)，这可能与PCI组不能完全血运重建有关，两组比较术后低心排、心源性病死率、合并心律失常和再次血管重建术发生率差异无统计学意义(P > 0.05)。"
"ST段抬高急性心肌梗死是急性心肌缺血性坏死，大多是在冠状动脉病变基础上发生冠状动脉血供急剧减少或中断，使相应的心肌严重而持久地急性缺血所致，原因通常是冠状动脉粥样硬化不稳定斑块病变基础上继发血栓形成导致冠状动脉血管持续、完全阻塞。cTnI是诊断心肌梗死的“金标准”，通常在心肌缺血坏死后1 h就在血中出现，12~48 h达到高峰，可以作为心肌损伤诊断、预后判断及治疗效果的评价指标，对改善高危心肌梗死患者的预后和降低其死亡率也有一定的临床意义。PCI和CABG已经成为再灌注治疗的重要手段，及时开通梗死相关动脉(IRA)，有效地挽救存活心肌，减少梗死面积及改善左室功能，从而明显降低AMI病死率 [ 2 ] 。对于冠状动脉多支病变、左主干严重病变及解剖位置不适合PCI，CABG是挽救患者生命重要有效策略，但对于急性心肌梗死后CABG治疗的时间及手术时机上仍有争议，2013年ACCF/AHA指南 [ 3 ] 中认为，建议对于血流动力学相对稳定的STEMI患者推迟手术，但是未明确具体等待时间，Lee等 [ 4 ] 和Weiss等 [ 5 ] 研究均提示，排除STEMI后有严重并发症或进行性缺血需急诊CABG，血流动力学相对稳定STEMI患者选择在心肌梗死后至少3天手术是相对安全；我们前期对急性心梗后行冠状动脉旁路移植术时机的研究提示对于血流动力学稳定的患者，cTnI转归正常后积极予以干预，可改善患者心肌功能，对提高患者的近期和远期治疗效果有着积极的作用 [ 6 ] 。我们对于错过最佳血运重建时间且血流动力学相对稳定的患者均等待cTnI转归正常后后接受CABG或PCI，而对于在药物或IABP辅助下仍持续性心肌缺血或血流动力学不稳定的患者，选择急诊干预挽救患者生命。从表1可以观察到A组冠状动脉单支病变例数多于B组(P < 0.05)，而B组冠状动脉血管三支病变及左主干病变例数明显大于A组(P < 0.05)，两组术前左心室射血分数差异有统计学意义，因此CABG组患者冠状动脉病变程度及心室功能重于PCI组，显然行CABG手术创伤大，术后并发症较PCI高，但研究结果提示CABG与PCI组相比较并未增加心源性死亡的危险，其次与PIC治疗相比能够相对完全血运重建，术后再发心绞痛、再人院次数及再次血管重建明显减少。不论PCI或CABG都是STEMI后重要两种冠脉血运重建重要有效方法，临床上我们应根据患者具体病情采取合理血运重建方案。 美国国立心肺血液研究所在对PCI后非靶病变血管的进展情况提示：随着时间的推移，那些行PCI的广泛严重冠状动脉效果不好，其次先前无需干预的病变血管大约有6%病变支数需要PCI [ 7 ] ；另外，目前PCI本身也存在支架内再狭窄现象，所以多支病变行PCI的患者，因病变进展行再次血运重建的比率较高 [ 8 ] ；同时我们回顾性研究提示PCI组再术后24个月随访期间患者的再次血运重建率、再发心绞痛及再次住院率高于CABG组，分析原因可能如下；1) STEMI后接受PCI组患者未能完全血运重建，如表2提示PCI组患者冠脉血运重建率85.96%，而接受CABG组患者冠脉完全血运重建。2) STEMI患者处于应激状态，冠脉血管处于一种痉挛的状态，使IRA不能充分扩张，会相应影响对血管狭窄程度的判断，从而会导致支架选择不当。3) 直接支架植入术后将近30%的患者IRA血流下降，出现TIMI血流分级无复流/慢血流现象，血栓高负荷风险的患者，无复流/慢血流的发生率可能更高 [ 9 ] [ 10 ] [ 11 ] 。4) PCI后早期有血栓的形成及支架内再狭窄的可能，我们观察到PCI组有2例发生冠状动脉血栓事件。 对于IABP的应用建议认为血运重建治疗前置入IABP有助于稳定血流动力学状态，但对于远期死亡率的作用尚有争议 [ 12 ] ，对于合并心源性休克患者需要CABG或PCI手术时，术前均应积极置入IABP辅助，急症或相对稳定后紧迫手术是唯一的选择 [ 13 ] 。对于STEMI做主干严重病变的患者，我们的经验是积极的应用IABP，可增加冠脉的灌注且降低心脏的后负荷，降低心肌的耗氧量，心梗后合并心功能不全或心源性休克，小剂量的血管活性药物治疗下血流动力学仍不稳定，IABP的应用具有重要的价值。不可否认长期IABP应用会相应增加临床一些严重的并发症，国外对于AMI合并CS患随机分为IABP和非IABP组一项研究中表明，两组在1个月、6个月、12个月病死率方面差异无统计学意义，所以IABP在急性心肌梗死高危因素患者中的使用效果需要在前瞻性、随机化双盲对照研究中进一步进行评估，但无疑早期IABP应用前提下尽早进行CABG术成为高危AMI患者的主要手段。"
"综上，初步探讨了STEMI后患者接受PCI或CABG治疗的有效性及安全性，CABG较PCI在处理复杂冠脉病变上更具有完全血运重建的优势且并未增加手术死亡率，对错过最佳手术时机的血流动力学相对稳定的患者，cTnI恢复正常之后再行冠脉重建是安全可行的；当然在临床上我们不能一成不变，针对具体情况实施不同的措施，根据患者一般情况及病变血管选择合理恰当的方式，这些对改善患者预后有重要意义 [ 14 ] 。本研究为单中心小样本回顾性分析研究，病例数目有限，术后随访时间较短，对两组心肌梗死梗死部位不尽相同，都会影响研究结果。后续会继续对大量数据的统计及长期的随访。"
