"利用1960~2014年的西南地区93个站的逐月降水资料，统计分析了西南地区(95˚E~111˚E, 20˚N~35˚N)全年和春、夏、秋、冬季降水的时空分布特征。取得主要结论如下：1) 降水时间分布上，西南地区夏季降水最多；而冬季降水最少。同时西南地区全年和夏季降水量在1968年最多，而在2011年最少；春季降水量在1990年最多，而在1979年最少；秋季降水量在1982年最多，而在2009年最少；冬季降水量在1969年最多，而在2009年最少。2) 降水空间分布上总体存在三个特点：一是西南地区降水有从东到西递减的趋势；二是川西高原为少雨区并且在四川中部有一多雨区；三是西南地区夏季是多雨季，而冬季是少雨季。3) 对西南地区降水的EOF分析而言，我国西南地区全年、春季、夏季、秋季和冬季降水第一模态在空间上都表现为全区一致性，具有下降的年际变化特征。 关键词 :西南地区，时空分布，降水 Copyright © 2018 by author and Hans Publishers Inc. This work is licensed under the Creative Commons Attribution International License (CC BY). http://creativecommons.org/licenses/by/4.0/"
"近年来，全球气温持续上升，全球极端降水事件也显著增加 [ 1 ] [ 2 ] [ 3 ] 。干旱和洪涝等极端降水事件发生的也越来越频繁，极端降水事件频繁的发生对社会经济的发展和人民的生产生活造成了巨大的影响 [ 4 ] 。同时西南地区集合了高原、盆地、丘陵和山地这四种复杂的地形，因为人类的开发和极端降水事件的发生，使西南地区成为我国地质灾害发生频率最高的地区 [ 5 ] 。崔云等 [ 6 ] 的研究表明，降水事件的发生加速了山地灾害的发生过程并且扩大了灾害范围。张天宇等 [ 7 ] 的研究表明，重庆地区汛期极端降水事件发生的频次出现南部多北部少的特征。叶香等 [ 8 ] 的研究表明，重庆地区汛期极端降水事件中东北和东南部降水量大，而中部和西部降水量小。刘丽等 [ 9 ] 的研究表明，近年来云南汛期极端强降水事件增加趋势减弱。张顺谦等 [ 10 ] 的研究表明，近年来四川盆地东北部和川西高原南部极端降水事件出现增多增强趋势，而四川盆地南部和川西高原北部极端降水事件出现增多减弱趋势。王学锋等 [ 11 ] 的研究表明，近年来云贵高原地区极端降水事件呈现上升趋势。此外，张焕等 [ 12 ] 的研究发现，春季时西南地区平均雨强减小，而极端雨强增大；夏季时西南大部分地区平均雨强和极端雨强都减小，而四川盆地西部平均雨强和极端雨强增大；秋季时西南地区平均雨强和极端雨强都减小；冬季时西南地区平均雨强增大，而极端雨强减小。综上所述，近年来我国极端降水事件出现的越来越频繁，尤其是西南地区极端降水对当地的生产生活以及经济造成了重大的影响。西南地区极端降水已成为社会高度关注的热点问题，因而，研究我国西南地区降水的影响非常重要，统计降水过程并了解极端降水事件的共性，是掌握此类事件规律、进行准确预报、预测和防灾、减灾的重要基础。"
"资料来源于中国气象局国家气象中心提供的756站观测资料，选取1960~2014年共55a西南地区93个站的逐月降水资料。同时本文采用统计分析方法和经验正交函数法。"
"图1分别给出了西南地区不同时间段降水和降水异常随时间分布。从图1(a)中可以看出西南地区冬季降水最少，在0~1 (mm/d)；而夏季降水最多，在4~8 (mm/d)；全年降水、春季降水和秋季降水类似，都在1.5~3.5 (mm/d)。西南地区全年降水在2011年降水量最小，仅有2.41 (mm/d)，而在1968年降水量 图1. 1960~2014年我国西南地区降水时间分布(mm/d)。((a) 全年和四季降水分布，(b) 年降水距平分布，(c) 春季降水距平分布，(d) 夏季降水距平分布，(e) 秋季降水距平分布，(f) 冬季降水距平分布) 最大，达到3.33 (mm/d)；春季降水在1979年降水量最小，仅有1.64 (mm/d)，而在1990年降水量最大，达到2.96 (mm/d)；夏季降水在2011年降水量最小，仅有4.5 (mm/d)，而在1968年降水量最大，达到7.35 (mm/d)；秋季降水在2009年降水量最小，仅有1.72 (mm/d)，而在1982年降水量最大，达到3.3 (mm/d)；西南地区冬季降水在2009年降水量最小，仅有0.25 (mm/d)，而在1969年降水量最大，达到0.81 (mm/d)。同时随着时间变化，西南地区夏季降水波动最大，而冬季降水波动最小。 从图1(b)中可以看出西南地区全年降水距平随时间变化呈下降趋势，西南地区全年降水负距平在2011年最大，说明西南地区2011年全年降水相较于1960~2014年降水减少达到最大，少0.5 (mm/d)，而在1968年西南地区全年降水正距平最大，说明西南地区1968年全年降水相较于1960~2014年降水增加达到最大，多0.42 (mm/d)。 从图1(c)中可以看出西南地区春季降水距平随时间几乎没有变化，西南地区春季降水负距平在1979年最大，说明西南地区1979年春季降水相较于1960~2014年降水减少达到最大，少0.73 (mm/d)，而在1990年西南地区春季降水正距平最大，说明西南地区1990年春季降水相较于1960~2014年降水增加达到最大，多0.59 (mm/d)。 从图1(d)中可以看出西南地区夏季降水距平随时间变化呈下降趋势，但趋势较小，西南地区夏季降水负距平在2011年最大，说明西南地区2011年夏季降水相较于1960~2014年降水减少达到最大，少1.56 (mm/d)，而在1968年西南地区夏季降水正距平最大，说明西南地区1968年夏季降水相较于1960~2014年在1968年降水增加达到最大，多1.29 (mm/d)。 从图1(e)中可以看出西南地区秋季降水距平随时间变化呈下降趋势，西南地区秋季降水负距平在2009年最大，说明西南地区2009年秋季降水相较于1960~2014年降水减少达到最大，少0.94 (mm/d)，而在1982年西南地区秋季降水正距平最大，说明西南地区1982年秋季降水相较于1960~2014年降水增加达到最大，多0.64 (mm/d)。 从图1(f)中可以看出西南地区冬季降水距平随时间变化呈下降趋势，但趋势较小，西南地区冬季降水负距平在2009年最大，说明西南地区2009年冬季降水相较于1960~2014年降水减少达到最大，少0.28 (mm/d)，而在1969年西南地区冬季降水正距平最大，说明西南地区1969年冬季降水相较于1960~2014年降水增加达到最大，多0.29 (mm/d)。"
"图2给出了1960~2014年我国西南地区降水异常的空间分布。西南地区春季降水(mm/d)空间分布图中(图2(a))可看出西南地区降水从东往西减少，东部降水最大值达到4 (mm/d)，西部降水最小值达到0.5 (mm/d)，在四川中部有一多雨中心，中心极值达到3.5 (mm/d)；西南地区夏季降水空间分布图(图2(b))中可看出西南地区夏季降水空间分布不均匀，局地差异大，川西高原是少雨区，降水量是5 (mm/d)以下，往东南地区降水量逐渐增大，南部降水最大值可达13 (mm/d)。在四川中部有一多雨中心，中心极值达到10.5 (mm/d)，同时在云南东北部和东南部有少雨中心，中心极值最小可达3 (mm/d)，西南地区夏季降水大致以四川中部、云南南部以及云贵交界这三处多雨区为中心向四周递减；西南地区秋季降水空间分布图(图2(c))中可看出西南地区秋季降水呈现从东北部和南部向西减少趋势，南部降水最大值达到5 (mm/d)，西部降水最小值达到1 (mm/d)，在四川中部有一多雨中心，中心极值达到4 (mm/d)，同时在云南东北部有少雨中心，中心极值最小可达2 (mm/d)；西南地区冬季降水空间分布图(图2(d))中可看出西南地区冬季降水呈现从东向西减少趋势，东部降水最大值达到1.5 (mm/d)，西部降水最小值达到0 (mm/d)；从西南地区全年降水空间分布图中(图2(e))可看出西南地区全年降水呈现从东南向西北减少趋势，由于西南地区降水受西南地区地形的影响，导致西南地区降水分布不均匀，在云南东北部和中部存在少雨中心，同时 图2. 1960~2014年我国西南地区降水异常空间分布(mm/d)。((a) 春季，(b) 夏季，(c) 秋季，(d) 冬季，(e) 全年) 在四川地区中部和云南东南部存在多雨中心，云南东南部多雨中心远大于四川盆地中部，中心极值可达6 (mm/d)。从西南地区全年及春夏秋冬四季日平均降水的空间分布可以看出，降水总体上存在三个特点：一是西南地区降水有从东到西递减的趋势；二是川西高原为少雨区并且在四川中部有一多雨区；三是西南地区夏季是多雨季，降水最大值可达到13 (mm/d)并且降水最小值可达到3 (mm/d)，而冬季是少雨季，降水最大值仅达到1.5 (mm/d)，远小于西南地区夏季降水最小值。"
"对1960~2014年西南地区93站降水做标准化处理，图3给出了1960~2014年我国西南地区全年降水的EOF分析。西南地区全年降水第一主模态解释方差为38%，从其空间分布可以看出图3(a)西南地区整体表现为负异常，仅仅只有四川北部和中东部小片地区为正异常，表现了西南地区全年降水呈现一致变 图3. 1960~2014我国西南地区全年降水的EOF分析。(第一模态(a)、(b)；第二模态(c)、(d)；空间分布(a)、(c)；标准化的时间序列(b)、(d)) 化；EOF1对应的时间序列整体呈现下降趋势，在1990年之前时间系数为正出现的频率较高，而1990年之后时间系数为负出现的频率较高，说明在1990年之前西南地区整体降水偏少，只有四川北部和中东部小片地区降水偏多，而在1990年之后，西南地区年平均降水相反。西南地区全年降水第二主模态解释方差为10%，从图3(c)中可以看出第二主模态的空间分布呈现一个南北走向的“+ −”偶极子分布。正异常出现在云南和贵州南部，而四川、重庆和贵州北部表现为负异常。从EOF2对应的时间序列中可以看出西南地区南部随时间变化降水呈下降趋势，但趋势较小；而西南地区北部降水相反。  图4给出了1960~2014年我国西南地区春季降水的EOF分析。西南地区春季降水第一主模态(EOF1) 解释方差为35%，从其空间分布可以看出图4(a)西南地区整体表现为负异常，仅仅只有贵州和云南交界区域和四川北部小片区域为正异常，表现了西南地区春季降水呈现一致变化；EOF1对应的时间序列整体 图4. 1960~2014我国西南地区春季降水的EOF分析。(第一模态(a)、(b)；第二模态(c)、(d)；空间分布(a)、(c)；标准化的时间序列(b)、(d)) 呈现下降趋势，说明西南地区大部地区春季降水随时间变化呈上升趋势。西南地区春季降水第二主模态解释方差为10.3%，从图4(c)中可以看出第二主模态的空间分布呈现一个西南至东北走向的“+ −”偶极子分布。0等值线基本将四川分成东西两部，正异常出现在云南和四川西部，而贵州、重庆和四川东部表现为负异常。从EOF2对应的时间序列中可以看出整体呈上升趋势，说明西南地区东北部春季降水随时间变化呈下降趋势，而西南地区西南部春季降水随时间变化呈上升趋势。  图5给出了1960~2014年我国西南地区夏季降水的EOF分析。西南地区夏季降水第一主模态解释方差为32%，从其空间分布可以看出图5(a)西南地区整体表现为负异常，仅仅只有四川北部和中东部小片地区为正异常，表现了西南地区夏季平均降水呈现一致变化；EOF1对应的时间序列整体呈现下降趋势，在1990年之前时间系数为正出现的频率较高，而1990年之后时间系数为负出现的频率较高，说明在1990 图5. 1960~2014我国西南地区夏季降水的EOF分析。(第一模态(a)、(b)；第二模态(c)、(d)；空间分布(a)、(c)；标准化的时间序列(b)、(d)) 年之前西南地区整体降水偏少，只有四川北部和中东部小片地区降水偏多，而在1990年之后，西南地区夏季降水相反。西南地区夏季平均降水第一主模态与西南地区全年平均降水第一主模态类似。西南地区夏季平均降水第二主模态解释方差为10.1%，从图5(c)中可以看出EOF2的空间分布呈现一个南北走向的“− +”偶极子分布。0等值线基本沿着四川与云南和重庆与贵州的交界线，重庆和四川北部为负异常，而云南、贵州和四川南部小片区域为正异常；从第二主模态对应的时间序列中可以看出整体呈上升降趋势，说明西南地区南部夏季降水随时间变化呈下降趋势，而西南地区北部夏季降水随时间变化呈上升趋势。  图6给出了1960~2014年我国西南地区秋季降水的EOF分析。西南地区秋季降水第一主模态(EOF1) 解释方差为22%，从其空间分布可以看出图6(a)西南地区整体表现为负异常，仅仅只有重庆北部和四川 图6. 1960~2014我国西南地区秋季降水的EOF分析。(第一模态(a)、(b)；第二模态(c)、(d)；空间分布(a)、(c)；标准化的时间序列(b)、(d)) 东北部小片地区为正异常，表现了西南地区秋季降水呈现一致变化；EOF1对应的时间序列整体呈现下降趋势，但下降趋势较小，说明西南地区秋季降水随时间变化整体呈微弱的上升趋势。西南地区秋季降水第二主模态(EOF2)解释方差为11%，图6(c)、图6(d)分别是西南地区秋季降水EOF2的空间分布和相应的时间系数序列。从图6(c)中可以看出EOF2的空间分布呈现一个西东走向的“+ −”偶极子分布。0等值线基本将四川与云南分成东西两部分，正异常出现在云南及四川西部和重庆东北部，而云南及四川东部、贵州和重庆西南部表现为负异常；从EOF2对应的时间序列中可以看出整体呈上升趋势，说明西南地区东部秋季降水随时间变化呈下降趋势，而西南地区南部秋季降水随时间变化呈上升趋势。  图7给出了1960~2014年我国西南地区冬季降水的EOF分析。西南地区冬季降水第一主模态(EOF1) 解释了总方差的27%，从其空间分布可以看出图7(a)西南地区整体表现为负异常，仅仅只有四川西部和 图7. 1960~2014我国西南地区冬季降水的EOF分析。(第一模态(a)、(b)；第二模态(c)、(d)；空间分布(a)、(c)；标准化的时间序列(b)、(d)) 云南西北部小片地区为正异常，表现了西南地区冬季降水呈现一致变化；EOF1对应的时间序列整体呈现下降趋势，但趋势较小，说明西南地区冬季降水随时间变化整体呈微弱的上升趋势，仅仅只有四川西部和云南西北部小片地区冬季降水随时间变化整体呈微弱的下降趋势。西南地区冬季降水第二主模态(EOF2)解释了总方差的17%，从图7(c)中可以看出西南地区整体表现为负异常，仅仅只有四川西南部和云南南部小片地区为正异常，表现了西南地区冬季降水呈现一致变化；EOF1对应的时间序列整体呈现下降趋势，但趋势较小，在1980~2010年间时间系数为负出现的频率较高，说明在1980~2010年间西南地区整体降水偏多，只有四川西南部和云南南部小片地区降水偏少。"
"本文使用1960~2014年西南地区93个站的逐月降水资料，对西南地区降水的时空特征进行了分析，并对西南地区全年、春季、夏季、秋季和冬季作了进一步的研究。取得主要结论如下： 对西南地区降水的时间分布而言，西南地区全年降水总体在3 mm/d左右，在2011年降水量最小，仅有2.41 mm/d，并且2011年降水负距平达到最大，少0.5 mm/d；而在1968年降水量最大，达到3.33 mm/d，并且1968年降水正距平达到最大，多0.42 mm/d。春季降水总体在2.5 mm/d左右，在1979年降水量最小，仅有1.64 mm/d，并且1979年降水负距平达到最大，少0.73 mm/d；而在1990年降水量最大，达到2.96 mm/d，并且1990年降水正距平达到最大，多0.59 mm/d。夏季降水总体在6.5 mm/d左右，在2011年降水量最小，仅有4.5 mm/d，并且2011年降水负距平达到最大，少1.56 mm/d；而在1968年降水量最大，达到7.35 mm/d，并且1968年降水正距平达到最大，多1.29 mm/d。秋季降水总体在2.5 mm/d左右，在2009年降水量最小，仅有1.72 mm/d，并且2009年降水负距平达到最大，少0.94 mm/d；而在1982年降水量最大，达到3.3 mm/d，并且1982年降水正距平达到最大，多0.64 mm/d。冬季降水总体在0.5 mm/d左右，在2009年降水量最小，仅有0.25 mm/d，并且2011年降水负距平达到最大，少0.28 mm/d；而在1969年降水量最大，达到0.81 mm/d，并且1968年降水正距平达到最大，多0.29 mm/d。 对西南地区降水的空间分布而言，西南地区全年降水呈现从东南向西北减少趋势，在云南东北部和中部存在少雨中心，同时在四川中部和云南东南部存在多雨中心，云南东南部多雨中心远大于四川盆地中部，中心极值可达6 mm/d。春季降水从东往西减少，东部降水最大值达到4 mm/d，西部降水最小值达到0.5 mm/d，在四川中部有一多雨中心，中心极值达到3.5 mm/d。夏季降水大致以四川中部、云南南部以及云贵交界这三处多雨区为中心向四周递减，川西高原是少雨区，降水量是5 mm/d以下，而南部降水最大值可达13 mm/d。秋季降水呈现从东北部和南部向西减少趋势，南部降水最大值达到5 mm/d，西部降水最小值达到1 mm/d。冬季降水呈现从东向西减少趋势，冬部降水最大值达到1.5 mm/d，西部降水最小值达到0 mm/d。降水总体上存在三个特点：一是西南地区降水有从东到西递减的趋势；二是川西高原为少雨区并且在四川中部有一多雨区；三是西南地区夏季是多雨季，降水最大值可达到13 mm/d并且降水最小值可达到3 mm/d，而冬季是少雨季，降水最大值仅达到1.5 mm/d，远小于西南地区夏季降水最小值。 对西南地区降水的EOF分析而言，全年降水方差贡献分别为38%和10%，春季降水方差贡献分别为35%和10.3%，夏季降水方差贡献分别为32%和10.1%，秋季降水方差贡献分别为22%和11%，冬季降水方差贡献分别为27%和17%。我国西南地区全年、春季、夏季、秋季和冬季降水第一模态在空间上都表现为西南地区一致性。全年和夏季降水第二模态在空间上都表现为南北“+ −”走向型；春季降水第二模态在空间上表现为西南–东北“+ −”走向型；秋季降水第二模态在空间上表现为东西“+ −”走向型；冬季降水第二模态在空间上都表现也表现为西南地区一致性。"
