"宫颈癌是妇产科常见的恶性肿瘤之一，在宫颈癌的发生过程中，高危型人乳头瘤病毒(human papillomavirus, HPV)感染是重要的致瘤因素，HPV病毒有多个型别，常见为HPV16、18型感染。近几年的研究表明，宫颈癌的发生发展与人类染色体端粒酶基因扩增有联系。本文就端粒酶基因扩增和宫颈HPV感染的型别的相关研究进行综述。 关键词 :宫颈肿瘤，端粒酶，hTERC基因，HPV感染的型别 Copyright © 2018 by authors and Hans Publishers Inc. This work is licensed under the Creative Commons Attribution International License (CC BY). http://creativecommons.org/licenses/by/4.0/"
"宫颈癌是妇产科常见的恶性肿瘤之一，高危型HPV感染是已知的主要致病因素。HPV是一类双链、环行、嗜上皮性DNA病毒癌变过程中，在某些细胞内外因素的触发作用下，DNA整合到宿主细胞，导致宿主染色体不稳定，抑制抑癌基因 [ 1 ] ，基因被抑制后发挥作用同时会对端粒酶基因及端粒酶的激活产生协同作用，端粒酶活化。 端粒酶的激活与细胞的无限增殖有关。在正常人体组织中，正常体细胞伴随分裂次数增加端粒逐渐缩短，当其长度短至临界点M1 (mortalphage1)时，细胞停止分裂，衰老并走向死亡；而当抑癌基因p53或Rb等突变时，可使细胞逃脱机体监控系统而越过M1期，再经过若干次分裂进入M2期(mortalphage2)；其中极少数细胞由于端粒酶的激活才成为永生细胞。端粒酶的激活是细胞走向永生化的必要途径，端粒酶活化是许多肿瘤发生的必经之路。端粒酶的激活是宫颈癌发生的早期事件，因此端粒酶的高表达可以作为宫颈癌及癌前病变的有效标志物。HPV已知有120多个亚型，高危型与子宫颈上皮内瘤变(cervical intraepithelial neoplasia CIN)：和宫颈癌有关。流行病学资料显示，在99.7%的宫颈癌组织中存在HPV-DNA，且主要为4种高危型HPV (16、18、31、45)感染，其中50%的宫颈癌与HPV16感染有关。HPV16在CIN3中阳性率为68%，在微浸润宫颈癌中为93%。 [ 2 ] [ 3 ] 宿主染色体的不稳定性是由于HPV16整合插入还是HPV16协同？促进了其他类型HPV，引起了抑制抑癌基因更严重的不稳定性？本文对宫颈HPV感染的型别与端粒酶的表达及病变的进展有无关联进行相关研究。现概述如下："
"端粒是现代生物学的研究热点，与肿瘤发生、基因表达调控、衰老有密切关系。端粒维持过程中有2个重要的蛋白—端粒相关蛋白和端粒酶。端粒相关蛋白是直接或间接与端粒结合的蛋白，在维持端粒稳定方面有重要作用。端粒酶是影响端粒长度的主要因素，它是一种特殊的逆转录核糖核蛋白酶，能以其自身的RNA为模板，向端粒末端添加(TTAGGG) n序列，以保持端粒的长度和细胞的生存，从而延长细胞的寿命甚至使其“永生” [ 4 ] 。端粒酶在恶性肿瘤中的阳性表达率达90%~100%，而正常人体细胞几乎未检出端粒酶的活性，现在的观点认为癌细胞正是由于端粒酶活性增强使染色体端粒维持在一定长度而获得了永生和无限增殖 [ 5 ] 。人类端粒酶包括三个主要组成部分，人端粒酶RNA (human telomerase RNA component, hTERC)，人类端粒酶相关蛋白1 (human telomerase associated protein1, hTEP1)，人类端粒酶逆转录酶(human te2 lomerase reverse transcriptase, hTERT)。其中hTERC为端粒酶的主体结构，含有编码端粒DNA的模板区、端粒酶蛋白结合区等。hTERC基因位于3号染色体长臂(3q26, 8q24, SE7) [ 6 ] [ 7 ] ，是端粒酶延长端粒的模板，同时在介导端粒酶组装，活性调节等方面发挥着重要作用 [ 8 ] 。有研究表明 [ 9 ] ，敲除编码小鼠端粒酶RNA基因，端粒酶活性丧失，说明了hTERC基因在端粒酶活性调控中的必要作用。端粒酶特别是其催化亚基TERC在端粒延长过程中起着不可替代的作用，与胞永生化和癌变密切相关。"
"端粒酶活化是许多肿瘤发生的必经之路，肿瘤的发生发展需要端粒酶参与。近年有关端粒酶与肿瘤关系的研究进展表明，在肿瘤细胞中端粒酶还参与对肿瘤细胞的凋亡和基因组稳定的调控过程，与端粒酶多重生物学活性相对应，肿瘤细胞中也存在复杂的端粒酶调控网络。通过蛋白质相互作用在翻译后水平对端粒酶活性及功能进行调控。一旦端粒酶被激活，它能延长缩短的端粒(缩短的端粒其细胞复制能力受限)，从而增强体外细胞的增殖能力，可能参与恶性转化。端粒酶的激活受控于hTERC基因，该基因扩增能够阻止细胞凋亡，导致肿瘤发生。因此hTERC基因是否扩增对研究宫颈癌发生发展及筛查治疗有重要作用。"
"目前的研究已经表明，高危型人乳头瘤病毒感染是宫颈癌发病的首要因素。据统计80%的妇女一生中都会有过一次HPV感染，但由于人体自身具有免疫力，多数HPV会被清除，说明单纯的HPV感染并不能致瘤；仍需要其他因素的参与 [ 10 ] ，这其中细胞内遗传性因素的改变可能具有更重要的意义。高危型HPV的持续感染；改变了宫颈上皮细胞的内外环境，引起细胞内非致死性的DNA损害，这种错误的不断积累导致宫颈上皮恶性转化的可能急剧上升，最终导致癌的发生。研究已经证实，HR-HPV在宫颈良性病变中以游离状态存在为主；癌变过程中，在某些细胞内外因素的触发作用下，DNA整合到宿主细胞，游离态HR-HPV数量减少，E2表达中断。当E2表达降低到一定程度时，失去对共同存在的整合形式的HR-HPV的抑制作用，癌基因E6/E7表达增加 [ 11 ] [ 12 ] ，E6/E7的过表达则增加了整合的HR-HPV的选择优势和宿主染色体的不稳定性。在E6/E7的作用机制中，E7引起染色体异常复制，导致宿主染色体不稳定，使宿主细胞癌变，而E6能抑制抑癌基因p53介导的细胞凋亡，并激活端粒酶 [ 13 ] 。亦有研究指出，p53基因被抑制后发挥作用的同时会对端粒酶基因及端粒酶的激活产生协同作用，促进癌症的发生。这提示HPV的致癌过程也与端粒酶及端粒酶基因密切相关 [ 14 ] 。Snijder等研究认为HPV感染早于端粒酶基因水平上调，是端粒酶活化的原因 [ 15 ] 。Aloysius 等也得出了同样的结果，并且发现HPV的作用十分迅速，在HPV的感染后的第一代细胞中就检测到端粒酶的活性 [ 16 ] 。Hopman等也通过应用FISH方法检测CINII/III、微浸润癌和浸润性宫颈癌的hTERC基因和HPV整合，发现在HPV整合的双倍体病变中，80%可见hTERC基因增加，且在hTERC基因增加的病例，HPV整合突出，提示了HPV整合与hTERC基因扩增的平行及一致性。结合以往研究，人们推测端粒酶基因及端粒酶的激活可能是HPV致癌机制中的重要环节，继发于HPV感染的宫颈上皮病变的发生仍需要端粒酶基因扩增的参与作为首要补充；且这种基因的改变先于恶性基因转变并伴随着从ASCUS至CINIII的进展，是宫颈病变的早期事件 [ 17 ] 。"
"人类乳头瘤病毒有120多种类型，高危型与癌前期病变和宫颈癌有关，近12~15种类型被归类于致癌基因的类型，近年来国内外的研究提示HPV不同亚型对宫颈上片细胞的致病力不同，而且存在较大差异。Hwang [ 18 ] 等报导了不同级别宫颈病变组织(CINI轻度不典型增生，CINII中度不典型增生，CINIII重度不典型增生和(或)原位癌，感染HPV常见亚型(感染率依此递减)，CINI中为HPV16，18，39，35，51，52，56，66。CINII为HPV35，58，16，18，33，66，51，52。CINIII中为HPV16，31，58，33，39，51，52，18。其中50%的宫颈癌与HPV16感染有关。HPV16在CINIII中阳性率为68%,在微浸润宫颈癌中为93%。宿主染色体的不稳定性是由于HPV16整合插入还是HPV16协同？促进了其他类型HPV，引起了抑制抑癌基因更严重的不稳定性？E6、E7高表达，端粒酶的激活，导致肿瘤发生。 综上所述，HPV感染的型别不同，致病力也不同，其与hTERC基因的扩增有无相对应的关系，对疾病的进展有无指导意义，有待于进一步的研究，宫颈癌是一种以HPV感染为关键因子，多因素共同作用导致的恶性肿瘤，探讨HPV感染的型别、hTERC基因异常与宫颈病变进展的关系，希望为宫颈癌的预防、治疗、预后提供新的依据。"
