"小檗碱(berberine, Ber)，是从毛莨科黄连属植物黄连的根和皮中提取的异喹啉类生物碱，有较强的清热解毒作用。近年来研究表明，小檗碱不仅在抗菌、抗炎等方面有显著疗效，对肿瘤、糖尿病、心血管方面的疾病也有很高的临床应用价值，本文主要对小檗碱的药理作用综述如下。 关键词 :小檗碱，药理作用，研究进展 Copyright © 2018 by authors and Hans Publishers Inc. This work is licensed under the Creative Commons Attribution International License (CC BY). http://creativecommons.org/licenses/by/4.0/"
"小檗碱俗称黄连素，是从传统中药黄连中得到的一种生物碱，除了在治疗急性肠胃炎方面有非常显著的疗效，还有许多其它药理作用。胡文祥教授研究小组发现小檗碱能减轻胰岛素抵抗作用，预示其在治疗糖尿病方面具有潜在的应用价值 [ 1 ] ，许多学者对其进行了广泛的研究 [ 2 ] [ 3 ] [ 4 ]。本文综述了其在心血管、抗肿瘤、治疗糖尿病、抗炎、抗氧化等诸多方面的药理作用。"
"小檗碱通过降低室性早搏的发生率和抑制室性心动过速的发生，在大鼠心肌梗死后的拉伸诱发的心律失常中显示出抗心律失常作用 [ 5 ]。在糖尿病大鼠中，小檗碱也产生抗心律失常作用，小檗碱对IK1/Kir2.1的作用可能是这种抗心律失常作用的重要机制 [ 6 ] [ 7 ]。链脲佐菌素诱导的糖尿病大鼠的全细胞膜片钳通过左冠状动脉前降支闭塞进行心脏缺血，表明口服小檗碱(100 mg/kg)可以恢复抑制的I(to)和I(Ca)电流并显著缩短延长的QTc间期。此外，小檗碱还抑制超极化激活的环核苷酸化四通道的电流，这可能有助于起搏器电流(Ifs)及其抗心律失常作用 [ 8 ]。  研究表明，小檗碱显著降低AMPK蛋白浓度、缺血区心肌中二磷酸腺苷/三磷酸腺苷(ATP)和AMP/ATP的比例，以及非缺血区域中AMP/ATP和ADP/ATP的比例 [ 9 ]。在培养的新生大鼠心肌细胞中，小檗碱通过激活AMPK和PI3K-AkteNOS信号传导显示出抗细胞凋亡作用并改善心肌I/R后的心功能恢复 [ 10 ] [ 11 ]。 通过抑制p38丝裂原活化蛋白激酶(MAPK)和磷酸化Akt信号通路的激活 [ 12 ] 和上调Notch1/Hes1-PTEN/Akt信号传导来促进自噬 [ 13 ] 是另一种减轻心肌梗死后左心室重塑和心功能不全的机制。  Ber静脉注射0.1~20 mg/kg能使麻醉犬、猫、兔、大鼠、蛙及清醒大鼠产生明显的降压作用，随剂量的增加，降压幅度和时间也增加，反复给药无快速耐受性，舒张压的降低程度较收缩压大 [ 14 ]。在低剂量时，Ber可阻断血管内皮上的a 1 受体，抑制胆碱酯酶的活性，提高突触间隙内的乙酰胆碱浓度，促进血管内皮合成和释放NO，产生内皮依赖性血管扩张而降压 [ 15 ] [ 16 ] [ 17 ]。在高剂量时，活化某些K + 通道，使血管平滑肌细胞膜电位超极化，产生不依赖内皮的血管扩张而起到降压作用 [ 17 ]。  血脂异常是心血管疾病的主要危险因素，其特征是总胆固醇、甘油三酯和低密度脂蛋白胆固醇(LDL)水平升高，以及高密度脂蛋白(HDL)水平下降 [ 18 ]。AMPK被认为是一种控制细胞内脂质和葡萄糖代谢的关键因素 [ 19 ] ，一旦激活，AMPK就会关闭合成代谢途径，如胆固醇，脂肪酸和甘油三酯的生物合成，以及开启产生三磷酸腺苷(ATP)的分解代谢途径，如脂肪酸氧化。  长期高血脂是导致动脉粥样硬化斑块形成的一个重要原因。据报道，小檗碱会影响肝细胞中的LDL受体以降低肝细胞人体血清胆固醇水平 [ 20 ] [ 21 ] [ 22 ]。在载脂蛋白E基因缺陷(apoE)小鼠中，小檗碱诱导清道夫受体A(SR-A)表达以增加修饰的LDL (DiO-Ac-LDL)的摄取。其次被认为，是由于小檗碱提高了超氧化物岐化酶(SOD)活性，抑制诱导型一氧化氮合酶(inducible nitric oxide synthase, iNOS)活力，阻止NO的过量合成，避免NO与超氧阴离子反应，防止了具有细胞毒性的过氧化亚硝基阴离子生成，减少脂质过氧化物产生，从而预防动脉粥样硬化的发生。  小檗碱具有正性肌力作用，已被用于治疗充血性心力衰竭 [ 23 ]。高剂量小檗碱(63 mg/kg)可降低左心室舒张末期压力，改善[-dp/dt(max)]，延长左心室舒张时间常数，降低舒张期心力衰竭大鼠模型中Ca 2+ 水平 [ 24 ]。小檗碱还可降低慢性充血性心力衰竭大鼠的血浆脑利钠肽水平 [ 25 ]。通过减轻心脏脂质积累并促进葡萄糖转运，小檗碱的强心功效也在由高血糖/高胆固醇血症诱导的心脏功能障碍中发挥作用 [ 26 ]。"
"炎症是许多疾病的常见机制。在炎症病灶处，中性粒细胞可以产生ROS，例如超氧阴离子和一氧化氮(NO)，其诱导组织损伤。脂多糖(LPS)诱导的炎症伴随着IL-6、NO、前列腺素E2(PGE2)的产生，环氧合酶-2(COX-2)和iNOS mRNA的表达，以及小鼠巨噬细胞RAW 264.7细胞中NF-κB的激活 [ 27 ]。 药根碱是小檗碱的主要代谢产物，被证实是一种抗炎化合物。在LPS刺激的RAW 264.7细胞模型中，药根碱(100 μg/mL)表现出抗炎作用，其对iNOS和COX-2表达的抑制活性分别为45%和29% [ 28 ]。在LPS诱导的体外山羊子宫内膜上皮细胞(gEECs)炎症模型中，巴马汀治疗(80 μg/mL)显著降低促炎因子的产生，如TNF-α、IL-1β、IL-6、NO，与对照组相比，增加抗炎因子IL-10和促分辨介质的产生，用酶联免疫吸附试验(ELISA)，定量RT-PCR和蛋白质印迹法测定 [ 29 ]。 NF-κB在先天免疫和炎症的调节中具有确定的作用 [ 30 ]。在炎症期间，趋化因子是小蛋白质的超家族，例如白细胞介素-8和单核细胞趋化蛋白-1(MCP-1)，在募集和激活白细胞中起重要作用 [ 31 ]。小檗碱(1~25 μM)剂量依赖性地抑制IL-1β或TNF-α刺激的人视网膜色素上皮细胞(ARPE-19)中白细胞介素-8和MCP-1表达，蛋白质分泌和NF-κB易位的增加 [ 32 ]。这些发现表明小檗碱的抗炎作用可能受益于其抑制白细胞介素-8的产生 [ 33 ]。"
"糖尿病(DM)是一种代谢紊乱，其特征在于胰腺B细胞不能产生足够的胰岛素而导致的血糖水平升高(高血糖)，或者丧失对胰岛素的有效靶组织反应 [ 34 ]。在1型或胰岛素依赖型糖尿病中，胰腺不能分泌胰岛素。2型糖尿病(T2DM)是以胰岛素抵抗为主的糖代谢紊乱综合征，占糖尿病患者的90%~95%，T2DM在以前称为非胰岛素依赖性糖尿病 [ 35 ]。 小檗碱的降糖作用是在20世纪80年代治疗具有糖尿病的腹泻患者偶然发现的。大量实验研究表明小檗碱能提高胰岛素受体的表达、促进糖酵解、增强胰岛素敏感性、促进胰岛素的释放与分泌、增加肝细胞对葡萄糖的消耗等，因其对T2DM的治疗效果显著，毒副作用小而备受关注。T2DM的发病机制较为复杂，其中主要表现为胰岛素抵抗，胰岛素抵抗是肝脏、肌肉和脂肪组织等周围靶组织细胞对胰岛素等敏感性降低而产生的一系列临床表现，也是目前糖尿病治疗面临的难题。 研究表明，BBR能改善胰岛素抵抗，增强胰岛素敏感性。其表现出与二甲双胍作用无明显差异，均属于胰岛素增敏剂范畴。欧阳礼枝等 [ 36 ] 研究小檗碱对胰岛素抵抗大鼠糖脂代谢相关指标的影响，以小檗碱干预胰岛素抵抗大鼠4周，结果小檗碱组餐后60 min血糖水平下降[分别为(7.2 ± 1.4) mmol/L，(8.0 ± 1.2) mmol/L, P < 0.05]，FFA水平下降[分别为(258 ± 29) mmol/L，(479 ± 34) mmol/L，P < 0.05]，IsI增强[分别为(−4.9 ± 0.3)，(−5.4 ± 0.4)，P < 0.05]，GK活性增强[分别为(13.6 ± 1.7)，(5.6 ± 0.8)，P < 0.05]；二甲双胍阳性对照组取得类似结果。研究表明，小檗碱能调节胰岛素抵抗大鼠的糖脂代谢水平，增强胰岛素敏感性，可作为抗糖尿病药物。  抗肥胖作用归因于抗脂肪形成活性，它还抑制CCAAT/增强子结合蛋白(C/EBP)α，过氧化物酶体增殖物激活受体γ2(PPARγ2)和其他脂肪形成基因的表达。在3T3-L1前脂肪细胞分化的早期阶段，它降低由3-异丁基-1-甲基黄嘌呤和毛喉素诱导的cAMP反应元件结合蛋白磷酸化和C/EBPβ的表达 [ 37 ]。小檗碱增强小鼠肝脏CD36表达并提高甘油三酯水平 [ 38 ]。它以SIRT1依赖性方式促进小鼠的肝基因表达和FGF21的循环水平，以增强高脂肪，高蔗糖饮食喂养的肥胖小鼠肝脏中的自噬。它在肝脏中起调节脂质并维持全身能量代谢的作用，且发现小鼠的肝脏脂质代谢和能量消耗受小檗碱诱导自噬的调节，因为在HFHS饮食喂养的肥胖小鼠和小鼠原代肝细胞的肝脏中存在营养传感器SIRT1的缺乏症 [ 39 ]。"
"关于小檗碱的抗癌作用已有大量报道。研究表明，小檗碱可通过与各种靶标和机制的相互作用来抑制肿瘤细胞的增殖。小檗碱可以改变癌基因和癌发生相关基因的表达，通过上调腺苷一磷酸激活蛋白激酶(AMPK)的活性，小檗碱激活血管平滑肌细胞中肿瘤抑制基因p53的磷酸化 [ 40 ] ，还抑制致癌相关酶 [ 41 ]。据报道，小檗碱剂量依赖性地抑制几种肿瘤细胞中的N-乙酰转移酶活性，包括人膀胱肿瘤(癌)细胞(T24) [ 42 ] ，人结肠肿瘤(腺癌)细胞 [ 43 ] 和脑胶质母细胞瘤多形式(GBM 8401)细胞 [ 44 ]。此外，小檗碱抑制N-乙酰转移酶的基因和蛋白质表达在体外以剂量和时间依赖的方式 [ 45 ]。小檗碱通过与抗癌剂喜树碱相似的机制靶向拓扑异构酶I并抑制断裂的DNA链的再连接，其被归类为拓扑异构酶I毒物 [ 46 ]。此外，小檗碱与DNA和RNA相互作用。事实上，在早期研究中，小檗碱被用于染色DNA和RNA。因此，小檗碱-DNA或小檗碱-RNA复合物的形成被认为是其抗癌作用的一般机制之一。 盐酸小檗碱可减少子宫(HeLa S3)，肺(H69)，胃(KATO III)，结肠(COLO 205)，前列腺(DU145)和神经(SK-N-MC)中热休克蛋白27(HSP27)的产生)癌细胞。HSP27的表达似乎是胃癌的预后因素，与淋巴结转移相关。因此，盐酸小檗碱有利于预防癌症的恶性进展。事实上，黄连提取物主要含有小檗碱，可降低调节因子和标志物的表达，如CDK4，CDK6，细胞周期蛋白D3(G1/S调节因子)，细胞周期蛋白B1(G2/M调节因子)，波形蛋白(间充质标记物)，癌症干细胞中的ALDH1A1，β-catenin和ABCG2(癌症干细胞标记物)，这表明它可以减少它们的生长和转移 [ 47 ]。小檗碱对人肺癌细胞具有选择性细胞毒性(Lu 1, IC50: 11.9 μM) [ 48 ] 但对其他癌细胞无效：人结肠癌(Col2)，鼻咽部表皮样癌(KB)，长春碱抗性KB(KB-V)，和激素依赖性人前列腺癌(LNCaP)细胞(IC50: >59.5 μM)。含有小檗碱的黄连提取物对A549细胞具有细胞毒性(腺癌人肺泡基底上皮细胞，IC50：7 μM)并分别在24和48小时后阻滞细胞周期G1和G2期。"
"氧化应激是一种有害过程，可能是细胞结构受损的重要介质，从而诱发各种疾病状态，如心血管疾病，癌症，神经系统疾病和糖尿病。活性氧(ROS)的过量产生，最常见的是通过细胞因子过度刺激NADPH或通过线粒体电子传递链和黄嘌呤氧化酶，可导致氧化应激 [ 49 ]。羟基(-OH)是ROS的最具反应性的产物。采用电子自旋共振光谱法研究了小檗碱的主要代谢产物的清除活性。在浓度为1 mM时，小檗碱的代谢产物和小檗碱显示出优异的-OH清除活性，分别为85%和23% [ 50 ]。进一步的结果表明，小檗碱的清除活性与其亚铁离子螯合活性密切相关，而小檗碱的C-9羟基是必需的部分。"
"小檗碱被广泛用作传统医学中的抗感染药物 [ 51 ]。小檗碱已显示出对多种细菌具有抗菌活性，包括无乳链球菌(MIC = 78 mug/mL) [ 52 ] ，胸膜肺炎放线杆菌(MIC = 0.3125 mg/mL) [ 53 ] ，不同的葡萄球菌菌株(MIC = 16至512微克/毫升) [ 54 ] 和痢疾志贺氏菌 [ 55 ]。小檗碱还有效地防止在钛盘表面上形成表皮葡萄球菌生物膜，并且是治疗假体周围感染的潜在药剂 [ 56 ] [ 57 ]。 关于可能的抗菌作用的小檗碱机制有几项研究。有研究表明，小檗碱是一种DNA配体，能够在体外结合单链和双链DNA [ 58 ]。因此，小檗碱与细菌中DNA的结合可导致DNA损伤。最近的一项研究表明，小檗碱的抗菌作用的主要机制是由于细胞分裂蛋白FtsZ的抑制。小檗碱与一些常见抗生素具有协同作用，尤其是利奈唑胺，头孢西丁和红霉素 [ 54 ]。这表明小檗碱与其他抗生素联合使用可能作为抗生素耐药性细菌感染的有效治疗工具。  小檗碱在Vero细胞中显示出针对1型和2型单纯疱疹病毒(HSV-1,2)的抗病毒特性 [ 59 ] [ 60 ]。小檗碱在150 μg/mL时对HSV-1斑块的抑制率为76.5%，对HSV-2的抑制率为80% [ 61 ] ，并且强烈抑制甲型流感病毒的两种H1N1毒株(PR/8/34或WS/33)的生长。小檗碱不会阻止关键病毒蛋白的表达，但可以通过诱导宿主细胞细胞质内病毒蛋白聚集体的形成来减少病毒的生长。小鼠体内流感病毒模型也显示小檗碱在感染后第2天将小鼠死亡率从90%降低至55%并降低肺中的病毒滴度 [ 62 ]。小檗碱还抑制呼吸道合胞病毒在上皮细胞中的复制，可能是通过抑制RSV介导的早期p38 MAPK活化 [ 63 ]。"
"二甲双胍，在大鼠单次静脉内共同给予10 mg/kg小檗碱和2 mg/kg二甲双胍，增加了二甲双胍的初始血浆浓度和AUC，并降低了大鼠二甲双胍的分布容积和全身清除率，表明小檗碱通过OCT1和OCT2抑制二甲双胍的处置。小檗碱抑制OCT1和OCT2的转运活性，并且具有与二甲双胍药物相互作用的显著潜力 [ 64 ]。关于小檗碱在糖尿病患者中的常见使用，这种药物-药物相互作用非常重要。 酮康唑，与在雄性大鼠中单独施用酮康唑的那些相比，口服共同施用60 mg/kg小檗碱与10 mg/kg酮康唑使酮康唑的AUC增加至215%。与单用小檗碱相比，小檗碱的AUC增加至173%。这些药代动力学相互作用可能在小檗碱和酮康唑的协同作用中起一定作用 [ 65 ]。"
"1982年Eberhar等用黄连素防治马铃薯疫病获得专利，佟树敏等 [ 66 ] 用小檗碱与0.6%苦参碱复合配方的杀菌剂防治苹果腐烂病、轮纹病及黄瓜霜霉病，均取得较好的治疗效果。有实验表明，小檗碱水剂防治南瓜白粉病效果显著，且安全性较高。更有昆虫毒理学研究表明，小檗碱内部亚甲二氧基苯环结构能作为一种增效基团对毒杀昆虫起增效作用。  余占海等 [ 67 ] 采用细胞培养技术，MTT比色法、考马斯亮蓝法、酶动力学法等研究小檗碱对人牙周膜细胞(PDLC)增殖活性、蛋白合成以及碱性磷酸酶活性的影响。研究表明小檗碱在0.01~0.02 g/L浓度范围内能促进PDLC的增殖及生物合成，使人牙周膜细胞能有效的在根面附着、增殖和分化，从而增强牙周组织的再生。"
"如今小檗碱已可以人工合成，成本比较低，且随着医学研究的发展和化学研究的深入，小檗碱显示出越来越多的药用效果，小檗碱不仅在传统的药理研究中的抗菌、抗炎、抗病毒的作用不可取代，而且在抗肿瘤、抗糖尿病、治疗心脑血管疾病方面也取得显著成果，受到广泛关注。小檗碱因其效果显著且毒副作用小在临床应用方面得以推广，前景广阔。随着细胞生物学的发展，小檗碱的药理作用机制将从细胞水平乃至分子、靶点水平得以阐明，为其临床应用提供更多的理论依据。"
