"调剖选井方法主要有PI决策和RE决策两大技术，整体上看两种技术对于目前油水井动、静态资料的综合利用不够全面，不能反映井组内部动、静态参数非均质的影响。针对目前调剖选井技术特点，利用突进系数计算方法量化各种非均质指标，建立了以井组纵向非均质性、平面非均质性和厚度等静态资料以及产油、产水、含水率等动态非均质参数为评价决策因子，以灰色关联多因素决策为评价方法的多因素调剖选井决策技术。现场应用表明，该方法考虑决策因素全面，评价决策选井结果合理，方法的建立进一步完善了现场调剖选井决策技术，为改善油田开发效果，提高采收率提供有力的技术支持。 关键词 :调剖，非均质性，灰色关联，决策技术 Copyright © 2018 by authors, Yangtze University and Hans Publishers Inc. This work is licensed under the Creative Commons Attribution International License (CC BY). http://creativecommons.org/licenses/by/4.0/"
"相对中高渗储层，特低渗储层受地应力及孔隙、孔喉影响，纵向、平面非均质的表现更强。长庆油田某区块为典型的特低渗油藏，加上压裂改造及自身微裂缝发育影响，地下非均质表现极为突出。为改善特低渗储层开发效果，通常采用水井调剖方式来降低水窜程度，从而提高注水波及系数。目前调剖选井方法主要有PI决策和RE决策两大类型 [ 1 ] [ 2 ] [ 3 ] [ 4 ] ，整体上两种技术对于目前油水井动、静态资料的综合利用不够全面，不能系统反映动、静态参数非均质程度对于选井决策的影响 [ 5 ] [ 6 ] [ 7 ] 。为此以长庆油田某区块为例，从储层静态非均质和油水井动态非均质角度，开展基于静、动态参数的多因素调剖选井决策技术研究，为进一步完善现场调剖选井决策技术，改善油田开发效果，提高采收率提供技术支持。"
"T K = K max K ¯ K ¯ = ∑ i = 1 n K i h i ∑ i = 1 n h i 式中：T K 为突进系数，1； 为渗透率最大值，mD； K ¯ 为渗透率平均值，mD； K i , h i 分别为第i位置的渗透率及权重系数。  1) 注水厚度决策：由于储层非均质及重力作用影响，注水井生产层位厚度越大，则吸水剖面不均匀可能性也越大，即需要调剖的可能性越大，可见注水厚度属于越大越优型。 2) 注水井纵向非均质决策：在注水开发过程中，注入水沿高渗层指进，造成水洗不均，渗透率差别越大，水洗的不均匀程度就越高，需要调剖的可能性也越大，该指标属于越大越优型。 3) 平面非均质渗透率：从注水井组内部平面非均质来看，平面非均质程度越强，则该井组需要调剖的可能性越大，该指标属于越大越优型。  1) 油井产水量突进系数：注水井组内一线油井米产水、米累计产水突进系数大小反映了注采井间水窜程度的大小，可见油井米产水、米累计产水突进系数属于越大越优型。 2) 油井产液量突进系数：注水井组内一线油井米产液、米累计产液突进系数大小反映了油水井间连通性的强弱，可见油井米产液、米累计产液突进系数属于越大越优型。 3) 含水率突进系数：注水井组内一线油井含水率突进系数反映了注水井水窜方向及水窜程度，突进系数越大说明局部水窜情况越严重，可见含水率突进系数属于越大越优型。  1) 米累计产油量：注水井组米累计产油量反映井组产油量的相对多少，对于相同井网形式的注采井组，米累计产油量越大，说明地下剩余油越少，潜力越小，可见该指标属于越小越优型。 2) 综合含水率：注水井组由于平面矛盾的必然存在，综合含水率越高，则该井组需要调剖的可能性也越大，可见该指标属于越大越优型。"
"调剖选井决策受油藏动、静态各种资料的影响，各种因素影响程度不同，且各因素间的关系不完全清楚，所以调剖选井是一个信息不完全的灰色系统。灰色关联分析是邓聚龙教授创建的重要理论，其实质是比较数据到曲线几何形状的接近程度 [ 8 ] [ 9 ] 。  在对所研究问题目标分析的基础上，确定一个因变量和多个自变量因素。设因变量数据构成参考序列，自变量数据构成比较序列，分别记为： x 0 { x 0 ( 1 ) , x 0 ( 2 ) , ⋅ ⋅ ⋅ , x 0 ( n ) } x i { x i ( 1 ) , x i ( 2 ) , ⋅ ⋅ ⋅ , x i ( n ) } i = 1 , 2 , ⋯ , m 式中：x 0 为参考序列；x i 为比较序列；n为序列长度；m为比较序列个数。  由于系统中各因素的物理意义不同，导致原始变量序列数据量纲不同和数量级差悬殊。因此需要对原始数据进行无量纲化、归一化处理，消除其影响。 1) 越大越优型指标，其效用函数的计算为： b i k = r i k − ( r i k ) min ( r i k ) max − ( r i k ) min 2) 越小越优型指标，其效用函数的计算为： b i k = 1 − r i k − ( r i k ) min ( r i k ) max − ( r i k ) min 由此得到函数矩阵R: R = | b i k | ( m + 1 ) × n 式中：r ik 为数据变量集合；(r ik ) min 、(r ik ) max 分别为数据变量集合中的最小值和最大值。  差序列是计算每个点上参考序列和比较序列差的绝对值 Δ 0 i ( k ) ，即： Δ 0 i ( k ) = | x 0 ( k ) − x i ( k ) | Δ max = max i max k | x 0 ( k ) − x i ( k ) | Δ min = min i min k | x 0 ( k ) − x i ( k ) | 式中：x 0 (k)为目标参数原始数据第k列最大值，最终形成由各列最大值组成的最佳组合x 0 序列。x i (k)为比较序列。  关联系数表示第i个比较序列与参考序列在k时刻的关联程度，其表达式为： ξ 0 i ( k ) = Δ min + ρ Δ max Δ 0 i ( k ) + ρ Δ max 式中： ξ 0 i ( k ) 为关联系数；ρ为分辨系数，分辨系数的作用在于提高关联系数间的差异显著性，ρ越小，分辨力越大，ρ的取值区间为[0，1]，一般取0.5。   计算关联度时，采用符合实际情况的非平权处理法，即： γ i = ∑ k = 1 n ξ i ( k ) W (k) 式中： γ i , W ( k ) 分别为灰色关联度值和各因素权重系数。"
"长庆油田某区块长4 + 5储层可分为长4 + 5 1 1 、长4 + 5 1 2 、长4 + 5 2 三个小层，其中长4 + 5 1 1 、长4 + 5 1 2 层为主产层，平均有效厚度18.9 m，岩心分析孔隙度14.5%，渗透率1.22 mD，电测平均孔隙度13.6%，平均渗透率5.23 mD，属特低渗透储层。自2006年8月第一口井投入开发，截止到2011年4月，综合含水率达到71.3%，井组内部矛盾加剧，有待进一步调整。  利用灰色关联分析法，对该区块31个注水井组进行多因素评价决策，计算各口井关联度如表1所示。关联度大于平均值0.5的共有13口井，结合现场井组位置，确定首轮10口调剖井42-52井、42-56井、44-50井、44-52井、44-54井、46-52井、46-54井、48-52井、48-58井、50-52井。 Table 1 排序 井组名 关联度 排序 井组名 关联度 排序 井组名 关联度 1 44-52 0.664521 11 40-56 0.528636 21 50-56 0.473166 2 46-52 0.622397 12 48-52 0.526735 22 52-52 0.461142 3 42-56 0.594967 13 44-50 0.520686 23 42-58 0.459147 4 42-54 0.580363 14 48-54 0.487982 24 40-58 0.454636 5 44-54 0.564699 15 46-56 0.485011 25 157 0.454411 6 42-52 0.559153 16 46-50 0.484064 26 48-56 0.451585 7 42-50 0.548050 17 40-54 0.479116 27 42-48 0.438800 8 46-54 0.542801 18 44-56 0.477594 28 40-52 0.424885 9 48-58 0.536724 19 50-54 0.476768 29 40-60 0.422677 10 50-52 0.531489 20 52-54 0.474942 30 40-50 0.420450 31 48-50 0.409122 表1. 井组多因素评价决策结果表  利用3DSL软件聚合物调驱模块进行区块整体调剖参数优化及调剖效果预测。研究不同地下成胶黏度下，不同调剖半径 [ 10 ] 时，单位黏度累计增产油量，结果如图1所示。 从调剖参数理论优化及现场参数优化的效果预测对比来看：① 随着地下黏度的增大，调剖效果逐步变好，并且效果越发明显；② 调剖等效半径为20 m时，地下成胶黏度不低于60 mPa∙s；③ 地下成胶黏度为100 mPa∙s时，单位黏度增加累计产油量最大，对应调剖半径不低于40 m为最优，且调剖深度越大，增油效果越好。 图1. 不同黏度情况下各调剖半径对应的单位黏度累计增油量随时间的变化  10口注水井调剖前后各口井液量分配情况如图2、图3所示。以调剖半径为60 m，地面成胶黏度为100 mPa∙s的条件进行调剖，调剖后注水井原液量分配较高的井分配比例开始降低，同时液量开始向原不进行液量分配的油井分配。由此可见，通过调剖改善了储层纵向、平面上的非均质性，并提高了采收率。 图2. 调剖前调剖液量分配图 图3. 调剖后液量分配图"
"1) 建立了基于油藏静、动态参数的调剖选井定量化决策技术，并现场应用筛选首次调剖井10口。 2) 区块整体调剖参数优化结果表明，地下成胶黏度为100 mPa∙s时，单位黏度下累计产油量最大，对应调剖半径大于40 m为最优且调剖深度越大增油效果越好。"
