"目的：应用组织多普勒技术(Tissue Doppler Imaging, TDI)对服用SHR-1210治疗的食管癌术后双心室功能回顾比较，探讨术后2年期使用该类药物对心脏功能的影响。方法：比对42例食管癌术后患者使用该类药物前、后二尖瓣侧壁瓣环、间隔瓣环及右室侧壁瓣环舒张期运动速度，右室侧壁瓣环M型运动幅度以及左心室射血分数。结果：服用药物前后左心室二尖瓣侧壁瓣环、间隔瓣环及右室侧壁瓣环舒张期运动速度均明显减低(P < 0.05)；左心室、右心室收缩功能无明显变化(P > 0.05)。结论：服用SHR-1210两年治疗期的食管癌患者左心室、右心室收缩功能无明显变化，但双心室舒张功能均明显降低，提示该类药物可能损害心肌功能。 关键词 :超声心动描记术，食管癌，心室，功能 Copyright © 2019 by author(s) and Hans Publishers Inc. This work is licensed under the Creative Commons Attribution International License (CC BY). http://creativecommons.org/licenses/by/4.0/"
"目前，随着肿瘤患者的日益增多和年轻化，食管癌当发现的时候多为中晚期，只有50%左右的患者有机会接受手术治疗 [ 1 ] 。辅助化疗药物能有效减小肿瘤体积，降低肿瘤分期，给不能手术的食管癌患者带来手术机会，但也可能对患者的脏器功能产生负面影响。国内外很多学者开始关注化疗药物对心脏功能的影响 [ 2 ] [ 3 ] 。为了探讨SHR-1210是否同样存在这样的影响，本研究通过TDI技术评估使用该类药物后患者心脏功能的变化。"
"对比分析2013年2月~2018年6月我院接受SHR-1210治疗的42例食管癌患者，年龄31~55岁，平均32.67 ± 11.12岁，治疗前均通过心脏超声、心电图和常规生化检查为(−)；我院体检中心筛查40例健康对照组，年龄30~56岁，平均33.36 ± 12.45岁，心脏超声、心电图及常规生化检查均(−)。纳入标准：药物治疗前临床检查及病史排除合并高血压、糖尿病和肾脏疾病，心脏超声检查心脏功能正常食管癌患者。  采用GE E9心脏彩超仪，探头Ms5 (频率1.7~3.4 MHz)，在机获取二尖瓣环及三尖瓣环组织多普勒速度参数以及三尖瓣环最大位移。  应用SPSS 16.0分析软件，所有参数满足正态分布以均数 + 标准差表示，组间比较进行t检验，治疗前后采用配对t检验，均以P < 0.05为差异有统计学意义。"
"服用药物前后左心室二尖瓣侧壁瓣环、间隔瓣环及右室侧壁瓣环舒张期运动速度均明显减低(P < 0.05)见表1；左心室、右心室收缩功能无明显变化(P > 0.05)，见表2。 Table 1 二尖瓣 二尖瓣环 E峰(cm/s) A峰(cm/s) e'(cm/s) a'(cm/s) E/e' LVEF (%) 对照组 1.21 ± 0.13 * 0.68 ± 0.14 * 0.19 ± 0.05 * 0.14 ± 0.04 * 3 ± 2 * 72 ± 6 治疗前 1.13 ± 0.20 # 0.57 ± 0.11 # 0.18 ± 0.04 # 0.15 ± 0.04 # 5 ± 2 # 73 ± 6 治疗后 0.59 ± 0.16 *# 1.27 ± 0.17 *# 0.10 ± 0.03 *# 0.16 ± 0.03 * 11 ± 2 *# 68 ± 6 表1. 治疗前后左心室各参数与对照组比较( x ¯ ± s) 注：与对照组比较 * P < 0.05，治疗前后比较， # P < 0.05。 Table 2 三尖瓣 三尖瓣环 E峰(cm/s) A峰(cm/s) e' a' TAPsE (mm) 对照组 0.94 ± 0.15 0.74 ± 0.09 0.20 ± 0.06 0.13 ± 0.03 2.58 ± 0.38 治疗前 0.87 ± 0.22 0.67 ± 0.18 0.18 ± 0.04 0.14 ± 0.05 2.46 ± 0.50 治疗后 0.54 ± 0.16 0.87 ± 0.10 0.10 ± 0.03 0.19 ± 0.04 2.37 ± 0.43 表2. 治疗前后右心室功能与对照组比较( x ¯ ± s) 注：与对照组比较 * P < 0.05，治疗前后比较， # P < 0.05，TAPsE：三尖瓣侧壁瓣环位移。"
"目前有研究表明化疗药物可引起心脏损伤，例如蒽环类药物存在心脏毒性，可以引起心力衰竭、心肌缺血、心律失常等 [ 4 ] [ 5 ] 。近年来，程序性死亡受体(Programmed Celldeath-1 Protein, PD-1)及其配体 PD-L1的单克隆抗体治疗多种恶性肿瘤的临床研究 [ 6 ] [ 7 ] 相继获得成功，先后获得美国食品药品管理局(FDA)批准用于恶性黑色素瘤、非小细胞肺癌、尿路上皮癌及Merkel细胞癌等15种实体瘤。但是，长期服用该药是否存在对心肌功能的损害，目前对化学治疗药物的心脏毒性的评价尚缺乏统一、高效的监测指标。故本研究采用斑点追踪技术及临床应用最为广泛的组织多普勒技术联合评估心肌功能，旨在为临床药物治疗提供参考指标。 应变和应变率成像作为早期检查左室功能障碍的有效方法，这些方法可能在未来既能评估，也能监测癌症患者的心脏功能 [ 8 ] 。有研究表明 [ 9 ] ，剂量累积是心脏毒性发生的独立高危因素。本研究发现，所有完成随访的食管癌患者经过2年的药物治疗后，超声心动图检查提示双室舒张功能均减低，且差异有统计学意义；而患者的双室收缩功能在治疗前后均未见明显改变。说明化疗药物对心肌功能的损伤可能最先表现为心室舒张功能上的改变，在患者未出现相关临床症状时即可发现，但需要临床密切随访、复查。传统的监测指标为左心射血分数，LVEF相比，心肌应变和应变率成像是检测心脏毒性的较敏感的方法，因为它能够提供心肌力学的多维度评估(纵向、径向和环向应变)，在LVEF还没有降低时，就能够发现局部室壁运动异常 [ 10 ] 。而本研究中显示：在左室、右室收缩功能正常情况下，左心室的整体应变值明显降低，右心室的舒张功能也减低。说明传统单一的监测指标不能真实反映患者心脏功能的改变，应该采用更敏感的技术指标综合评估心肌功能，为临床提供更准确、及时信息。 目前在国内，心电图仍为检测恶性肿瘤治疗后心脏损伤的常用诊断措施之一。超声心动图不仅能测量心脏内部血流动力学、心脏结构等，而且通过一些新技术手段还可以早期发现化疗药物对心肌毒性损伤，诸如本研究中的组织斑点跟踪显像技术，对于化疗早期心肌功能的隐匿性改变均可以提供一些敏感指标。 研究不足之处：回顾性分析病例，超声图像由不同超声医师获得，存在一定程度的差异性。"
"总之，本研究认为对于食管癌患者应该密切随访，并建议采用更新更敏感超声技术进行系统评估，早期发现患者心功能改变，提高患者生存率。"
