"在社会化媒体情境下，社会化媒体舆情已成为社会舆情的新视域，社会化大数据分析正显现出日益重要的社会价值和商业价值。在新兴的社会化大数据管理领域，热点话题发现是网络舆情分析和数据治理基础而重要的课题，人们一直在研究和探索先进和适用的热点主题挖掘的理论和方法。针对传统的聚类算法用于微博话题检测时，存在特征向量过于稀疏和维度过高等问题，导致聚类结果不准确。本文通过对在话题传播周期中词语的突发性特征的研究，提出了一种基于传播周期的词语动能聚类(Word Kinetic Energy Clustering, WKEC)模型和算法。该文本聚类模型基于话题生命周期特性，引入物理学中的动能概念，用词语在话题爆发期的最大增长速度来表征词语的动能，并加入到词语权重的计算中，对经典的TF-IDF模型进行了改造。基于Single-Pass的算法设计和新浪微博真实数据集的实验结果表明，WKEC模型可以增强文本特征，提高话题发现的准确率。另外，由于微博话题实时性强，为了得到更接近真实的微博热点话题列表，本文在话题热度计算中引入衰减系数，并以爆发期尾部时间点作为话题热度开始衰减的时刻，给出了一种更加符合实际的话题热度计算方法。 关键词 :大数据分析，话题发现，TF-IDF，Single-Pass，词语突发性，词语动能，新浪微博 Copyright © 2019 by author(s) and Hans Publishers Inc. This work is licensed under the Creative Commons Attribution International License (CC BY). http://creativecommons.org/licenses/by/4.0/"
"近年来，以移动互联网与Web2.0为基础的社会化媒体工具和平台快速发展与广泛渗透，不仅成为最重要的大数据来源之一，更是形成了一种新的、重要的社会化媒体信息情境，深刻地改变了传统电子商务、电子政务的发展面貌与业务模式 [ 1 ]。大数据和社会网络应用的发展使得当今的网络环境成为了一个巨大的、精准映射并持续记录人类行为特征的数字世界 [ 2 ]。人们广泛关注社会化媒体的热门话题，并通过用户生成内容(UGC)、电子口碑(Electronic Word-of-Mouth, eWOM) [ 3 ] 等来表达和传递自己的观点和思想，作为最重要的社会化媒体(社交媒体)之一，微博已融入经济活动与社会生活的方方面面，其内容涉及经济、政治、军事、文化、生活、体育与娱乐等各个领域，正显现出日益重要的商业价值、科学价值与社会价值。在微博等社会化媒体工具或平台已经发展成为人们发表言论、传递公众情绪的重要渠道的时代背景下，对大数据时代政府的舆情管控与数据治理、企业的电子商务管理能力带来了新的挑战 [ 4 ]。 回顾以往所发生的热点事件，几乎都能和微博相关联，微博等社会化媒体舆情已成为社会舆情的新视域，其社会影响力随着微博用户数量的增加而加强 [ 5 ]。因此，微博热点话题发现是进行舆情分析与监管的基础和前提，对热点话题进行有效挖掘，可以对舆论尽早地进行疏导和管控，有助于维护社会稳定。另外，热点话题发现还具有重要的商业价值，企业可以通过微博等社会化媒体分析，随时和顾客保持有效沟通，深入了解顾客需求，以及发现用户兴趣和行为扩散的转变等，从而为企业在大数据环境下的营销决策提供有力支持，进而为企业带来商业价值。 因此，以微博为代表的社会化媒体热点话题的有效挖掘与发现，成为大数据分析和管理的一个热点课题，但一直面临特征向量过于稀疏、维度过高，导致聚类结果不准确等问题 [ 6 ]。由于微博文本字数限制在140字以内，单条微博中每个单词出现的次数都很少，直接导致文本的特征不明显，特征向量稀疏，按照文本特征进行聚类困难。当前对于特征向量稀疏问题的研究主要集中在静态特征提取上，但是这些算法对于微博文本中的动态特征(词语突发性)无法进行有效测算，因而无法充分挖掘利用文本中所蕴含的特征信息。而在那些关注词语突发性的少数研究中，在词语突发性的衡量与评估上并没有结合传播生命周期特性，而传播生命周期正是微博动态特征和时间属性的最好表征。从当前来看，对于传播生命周期内词语突发性的衡量尚缺乏相应的研究理论和方法。并且，现有研究对于话题热度(人气度)计算多停留在微博用户特征和微博文本内容特征上，对于话题热度的时效性考量尚缺乏有效的评估技术，无法满足微博实时性强的特点。因此，在传播生命周期内针对微博短文本进行词语突发性衡量与话题人气度计算对提高聚类准确率以及提升政府和企业的决策能力具有重要意义。"
"随着网络信息爆炸式增长和满足网络舆情分析需求，基于微博平台的热点话题研究成为不同领域学者关注研究的热门领域。 唐晓波等 [ 7 ] 针对文本聚类和LDA主题模型的互补特征，综合考虑了微博特殊文体和短文本聚类效率问题，提出了基于频繁词集的文本聚类和基于类簇的LDA主题挖掘相融合的微博主题检索模型。徐雅斌等 [ 8 ] 提出并使用“频繁词集聚类”(Frequent Words Set Clustering, FWSC)算法来进行微博新话题的抽取，其有效解决了微博文本特征不明显问题。梁晓贺等 [ 9 ] 站在一个全新的视度，把超网络思想引进微博舆情主题发现中，构建了包含用户–观点–情感–时序阶段4层子网的舆情主题发现超网络模型。黄发良等 [ 10 ] 提出了一个基于多特征融合的微博主题情感挖掘模型TSMMF (Topic Sentiment Model based on Multi-feature Fusion)，该模型将情感表情符号与微博用户性格情绪特征纳入到图模型LDA中，以实现微博主题与情感的同步推导。Yan等 [ 11 ] 为了有效地检测微博文本中的热门话题，提出了一种基于潜在语义分析和结构特征相结合的微博话题检测方法，较大提高了微博话题检测模型和方法的性能。Liang等 [ 12 ] 提出情感分布语言模型(Emotion Distribution Language Models, ELM)来模拟微博中的情感分布，并用它来检测热点发现的潜在时间间隔，根据检测到的时间间隔对话题进行分析，进而根据话题的内容和转发度估算每条微博的重要性，通过应用话题模型提取热点话题，将这两步法应用到新浪微博，实验结果表明该方法是有效的。Li等 [ 13 ] 采用BTM (Bi-term Topic Model)主题模型处理新浪微博短文本数据，以缓解稀疏问题，同时，将K-means聚类算法融入到BTM中，进一步进行主题发现，实验结果表明，该方法可以有效地发现话题。Zhao等 [ 14 ] 基于新浪微博应用场景的研究，提出了一种“社交情感感知系统”(Social Emotional Perception System, SEPS)方法，进行每日热点话题检测，并分析这些话题的情感分布，可生成一个实时可视化的系统来监测社会情绪。袁华等 [ 15 ] 提出一种新的数据挖掘方法用于从海量 UGC 中分析出其“热点话题词”和“局部特征词”之间的关联关系，首先从互联网上抓取大量文档内容，并进行分词抽取出包含语义的词作为最初数据集，然后利用域内热点名词词表，抓取出数据集中的热点话题词及其序列，接着利用一种新的词向量切分方法对数据集进行基于热点话题词的切分，并且通过最大置信度这一指标挖掘特定热点话题词下的局部特征词。牛奉高等 [ 16 ] 以优化CLSVSM为出发点，提出了一种新的文本表示语义核模型(Co-occurrence Latent Semantic Vector Space Model Kernel, CLSVSM_K)，具体针对CLSVSM维度较高、计算复杂度较大等诸多问题，构建了CLSVSM的语义核，其构建原理是基于潜在语义分析的思想，对特征词中的同义词进行了合并的同时又对共现矩阵进行了降维处理，大大降低了算法的复杂度，在数字文献资源上的实验结果表明该方法还具有良好的聚类效果，提高了文献资源主题聚合的精度。 在词语突发性概念与规律的研究中，薛薇 [ 17 ] 认为在一个随时间推进的信息流中，若某信息的出现密度突增则认为它具有突发特征。仲兆满等 [ 18 ] 根据微博的时空特点，在综合考虑微博博文及社交关系的基础上，利用词出现频率、词关联用户、词分布地域和词社交行为四类指标，提出了一种新颖的微博网络词突发值计算模型。郑斐然等 [ 19 ] 综合考虑词频以及词频在时间窗口的增长率来产生词语的权重，并通过增量聚类的方法从微博中挖掘新闻话题。林思娟等 [ 20 ] 提出一种基于词语能量值变化的微博热点话题检测方法，该方法引入物理学科中加速度的概念，用词语的加速度来刻画词语在相邻窗口之间速度的变化，并综合考虑词语的加速度和权重值来构造词语的综合能量值。金镇晟 [ 21 ] 结合物体的动能概念，用词语的突发值表示词语在某一时刻所具有的动能，将词语的动能加入到特征权重计算中，提高突发性词语的权重，提出了一种改进的特征提取算法，有利于更好地完成文本聚类。 关于话题的动态变化与热度计算，有学者开展了一些重要研究。Wu [ 22 ] 对在线论坛话题人气度的建模与仿真研究表明，话题人气度(热度)的演化呈现出按一定的长尾幂律(Long-Tail Power Law)进行衰减的重要特性。何跃等 [ 23 ] 从微博用户特征、微博文本内容特征和微博信息传播特征三个维度出发，构建了一种评价微博热度的指标体系。为了得到更符合实际的话题热度计算方法，裴可锋等 [ 24 ] 引入LDA模型，结合话题内容和外在特征两个方面的热度因素，得到话题热度变化的时间序列。杨冠超 [ 25 ] 在微博影响力的计算中，对时间因素引起的影响力降低进行了考察和衡量，引入了影响力衰减系数。 西安交通大学的薛峰、周亚东等人 [ 26 ] 提出了综合的改进思想-在特征选择阶段动态地生成热点词特征库，在文本表示时给予突发性热点词更大的权重，然后进行聚类操作，经过实验证明该方案十分理想。本研究以薛峰、周亚东等人的综合改进思想为指导，从传播生命周期的角度，结合动能定理对词语的突发性进行衡量与评估，并将词语动能加入到TF-IDF权值计算中，提出一种改进的特征提取算法，提高突发性词语的权重，以便更好地完成文本聚类，并在话题热度(人气度)计算中引入衰减系数以对话题的时效性进行考量，研究结果对于辅助和指导企业的营销决策以及政府的舆情管控工作具有重要的参考意义。"
"考虑到微博热点话题的更新交替实时性很强，用户对于一个话题的关注会由于其他的因素如兴趣转移等发生自然的流逝，并且用户u的粉丝数和所发布微博的转发数和评论数是相对静态的，计算出来的热度值不能代表当前的热度值。所以在计算话题热度时要考虑时间因素。杨冠超 [ 25 ] 在微博话题影响力计算中将时间因素引起的影响力降低进行了考虑和衡量，引入了影响力衰减系数d，则微博话题影响力随时间t的变化如式(1)所示。 I n f b , u ( t ) = − d ( t − t 0 ) 2 + | u followed | H T = ∑ Δ I n f T = ∑ ( ∑ i = 1 n I n f b i ) (1) 其中， I n f b , u 为用户u所发布的微博b的直接影响力；d是衰减系数，根据经验取值； t 0 表示微博发布的时间； | u followed | 表示当前关注用户u的人数； Δ I n f T 表示给定一个时间段 Δ t ，话题T的影响力变化； H T 表示话题T从开始发布的时间到当前时间的影响力变化。  “词语动能”(Word Kinetic Energy, WKE)的定义：词语因为运动而具有的能量，称为“词语动能”。在微博话题传播的情境中，“词语运动”是指词语随着文本数量增长而增长的这样一个动态过程，根据词语的增长速度计算而得到的一种值，即“词语动能”。词语的动能，是网络词语的突发性大小的一种度量，用词语的平均增长速度来进行计算 [ 21 ]。词语动能的物理意义表示词语所具有的能量，是一种对词语突发性的衡量；而词语动能的社会意义，则表现为话题传播影响力的强度。 微博热点话题的传播有其特有的生命周期，其传播过程一般会经历潜伏期、爆发期、发展期、消亡期等阶段 [ 27 ]。对于微博话题传播来说，随着时间的推进，相关文本数量会不断增长，即使文本形式和内容会出现一定的演变，但该话题的关键性词语仍然会出现在相关微博中。也就是说话题的关键词语和该话题文本数量具有相一致的增长特性。 词语的突发性大小与其在传播周期中的增长速度有关，并且其增长速度越大，其所呈现出的突发性也就越明显，其对于话题表述就越起着重要的特征描述作用，区分文本的能力也越强。而这和物理学中的动能定理较为相像，即一个物体因运动而具有能量，速度越大，它的动能也就越大。动能定理的基本公式如式(2)所示。 E = ( 1 / 2 ) m ν 2 (2) 其中，m表示物体的质量， ν 表示物体所具有的速度。 在这种理论的启发下，本文引入词语动能的概念，通过研究词语在不同时间窗口中的动能，来对该词语的突发性进行衡量：词语所具有的速度越大，其动能也就越大，词语的突发性也就越明显。本文用词语在不同时间窗口之间词频的变化情况来表示词语的速度v k,j ，如式(3)、式(4)所示。 v k , j = { 0 , k = 0 m k , j − m k − 1 , j T k − 1 , k , k ≠ 0 (3) T k − 1 , k = T k − m i d d l e − T k − 1 − m i d d l e (4) 其中， v k , j 表示词语j在第k个时间窗口的速度； m k , j 表示词语j在第k个时间窗口的词频； m k − 1 , j 表示词语j在第k − 1个时间窗口的词频； T k − m i d d l e 表示第k个时间窗口的中间时刻点； T k − 1 − m i d d l e 表示第k − 1个时间窗口的中间时刻点； T k − 1 , k 表示第k个时间窗口与第k − 1个时间窗口的时间间隔。 物体因运动而具有能量，词语也因运动而具有能量。当词语具有了一定的速度时，也就具有了一定的动能。词语动能的计算由式(5)表示。 E k , j = α ⋅ t f k j ⋅ v k , j 2 (5) 其中， E k , j 表示词语j在第k个窗口的动能； α 是动能权重系数，这是一个经验值，需要通过实验来进行确定； t f k , j 表示词语j在第k个窗口中出现的频率，它等于词语j在第k个窗口的词频除以第k个窗口的词频总数得到； v k , j 是词语j的速度。"
"1) 研究问题一：如何基于传播周期对词语突发性进行衡量与评估？ 在一个随时间推进的信息流中，若某词语的出现密度突增则认为它具有突发特征，那在话题传播所形成的话题相关文本信息流中，话题关键词与话题文本具有相一致的增长趋势，从词语突发性角度来看，不同词语有着不一样的突发性表征，话题关键词比普通词语突发性表征更明显，突发性表征越明显的词语，越有可能是话题关键词。而同一个词语在整个传播周期中，其突发性表征也会呈现出一定的周期性，在潜伏期和发展期相对比较平缓，在衰亡期呈现负的突发性，而相对于整个传播周期来说，词语在爆发期的突发性特征是比较明显的，并且词语突发性大小经历了先增大后减小的过程，所以，词语突发性最明显的地方出现在爆发期的偏中间部分，这个时候的词语突发性在整个传播周期中最具代表性。在词语突发性的衡量与评估方面，本文结合动能定理，采用词语在爆发期的最大增长速度来计算词语的动能，以表征词语的突发性，并将其加入到TF-IDF权重中。本文希望通过识别突发性词语来找到话题关键词，并加大其权重，以达到增强文本特征的目的，从而提高话题聚类准确率。 2) 研究问题二：如何基于传播周期对话题热度(人气度)进行时效性考量？ 微博信息大多为实时性信息，热点话题的参与人数会随着讨论的深入逐渐增加，而到达讨论的高峰之后由于用户注意力的转移等因素，会逐渐进入一个平台期，其影响力保持不变或处于波动状态。之后，与新闻信息相同，随着时间的流逝，前一段时间内的热点话题的讨论热度将不断降低，而用户在平台上的活动又使得一些新的话题成为热点话题。把某一话题下的相关微博条目视为一个时间轴上的文本流，以上变化过程就表现为话题的传播周期特性。而热点话题发现建模要求我们判断话题是否为当前热点，而不是已经过时的热点，而话题本身所特有的传播周期特性使得判断话题是否为当前热点这一命题可以通过数学计算计算出来。  1) 对经典特征词权重计算方法TF-IDF的改进 由于词语在潜伏期和消亡期的增长速度很小甚至为0为负，其会拉低词语在整个传播周期内的平均增长速度，所以，根据平均增长速度计算得到的动能并不能很好地对词语突发性进行衡量。根据词语的传播周期曲线可知，词语在爆发期的增长速度，相对于整个传播周期来说，数值是比较大的，并且速度是先增大后减小，其最大增长速度出现在爆发期的偏中间部分，这也是词语突发性最明显的时候。因此，采用词语在爆发期的最大增长速度来计算其动能，并加入到其权重中，可以更有效的增强文本特征，其公式如式(6)所示。 ω i j = t f i j ⋅ log ( N / n j + 0.01 ) ∑ p = 1 k [ t f i j ⋅ log ( N / n j + 0.01 ) ] 2 + E k , j (6) 其中，公式(6)的前半部分是规范化的TF-IDF， ω i j 表示在文本i中特征词j的权重， t f i j 是特征词j在文本i中出现的频率，N是数据集中的文本总数， n j 是数据集中包含特征词j的文本数， E k , j 表示特征词j的动能，采用特征词j在爆发期的最大增长速度计算得到。 2) 引入词语动能的文本相似度的计算 文本聚类的基础是文本间相似度的计算。本文选取应用最为广泛的余弦相似度公式来计算文本间的相似度值，其值一般在0到1之间，余弦法则公式如式(7)所示。 cos ( x , y ) = ∑ k = 1 n ω x k × ω y k ∑ k = 1 n ω x k 2 × ∑ k = 1 n ω y k 2 (7) 其中，x和y是进行相似度值计算的两个文本向量， ω x k 表示向量x的第k个特征词的权重， ω y k 表示向量y的第k个特征词的权重，n表示x和y的特征词数量。  本文话题发现的核心算法是Single-Pass聚类算法 [ 6 ]。Single-Pass算法是单遍聚类算法，其对输入语料的顺序很敏感，具体表现为：该算法选择聚类中心时一般直接选取输入文档集的第一个文档成为第一个类别的质心，余下文本与该文档运算相似度，进而进行聚类。如果这篇文档不太具有代表意义，就不能全面的对一个类中的话题含义进行很好的阐述，那么最后的聚类效果不会让人满意。 图1. Single-Pass聚类算法流程图 为解决这个问题，本文采用文献 [ 28 ] (孙胜平，2011)提出的基于微博的转发数、评论数和用户粉丝数的微博热度计算公式来计算微博语料的热度。并把微博语料按照热度从高到低排序，依次输入到Single-Pass聚类算法中，以便更好地适应该算法对语料输入顺序需求 [ 27 ]。Single-Pass算法会顺序地处理输入的文本，每次处理一篇，增量地更新聚类结果。算法具体步骤如图1所示。 聚类算法完成后，会形成若干独立的话题向量，每个话题向量由一组特征词及其权重值构成。把每个话题向量中的特征词按照权值从大到小进行排序，即可辨识出话题的主要内容。  根据话题传播周期可知，话题在爆发期和发展期是处于热度持续上升的阶段，但为了计算方便，本文假定发展期话题热度是衰减的，所以以话题爆发期尾部时间点为话题热度开始衰减的时刻，引入热度衰减系数 β ，提出更符合实际的话题热度计算方法，如式(8)所示。 T H i = ∑ k = 0 n b h i k − β ( t − t 0 ) 2 = ∑ k = 0 n ( 2 r e k + c m k + f l k ) − β ( t − t o ) 2 (8) 其中，TH i 表示第i个话题的热度；bh ik 表示第i个话题内的第k条微博的热度值，其计算基于孙胜平提出的微博博文热度计算方法 [ 28 ] ，re k 代表第k条微博的转发数，其权重系数为2，cm k 代表第k条微博的评论数，其权重系数为1，fl k 代表第k条微博的博主粉丝数，其权重系数为1/2； β 是热度衰减系数，根据经验取值；t表示计算话题热度时的时间；t 0 表示话题i的爆发期尾部时间点。 公式(8)结合了话题在传播周期中的发展趋势，把时间因素所引起的影响力降低进行了更好的考虑和衡量，所计算出来的话题热度值更加接近现实，代表话题当前的热度，符合微博话题实时性强的特点。"
