"液滴碰撞水平壁面的最大铺展系数，已有大量半经验公式或近似公式，目前尚无理论解。将液滴碰壁过程分解为跌落、碰撞和铺展三个子过程，引入圆柱状液滴假设，利用层流不可压缩轴对称驻点流动模式，推导了最大铺展系数的理论公式，并结合文献数据对该理论公式进行了验证，发现，在雷洛数不大于21,698的情况下，理论公式和实际结果有较好的符合性，并对部分半经验公式和近似公式有良好的解释作用。 关键词 :最大铺展系数，液滴碰壁，轴对称驻点流动，雷诺数 Copyright © 2019 by authors and Hans Publishers Inc. This work is licensed under the Creative Commons Attribution International License (CC BY). http://creativecommons.org/licenses/by/4.0/"
"液滴碰撞壁面的效应，在化工流体流动、飞机动力学、石油开采、喷墨印刷、农药喷洒、焊接熔接等领域有着重要的应用，人们大都关注液滴碰壁后的形貌演化和其能量转化，其中液滴碰壁后的最大铺展系数是研究的重要参数之一。 液滴碰壁可演化为多种形式，如碰撞水平壁面、球型壁面或管状壁面；进行垂直碰撞、倾斜碰撞或水平碰撞；进行常温碰撞、高温碰撞、过冷或过热碰撞，或进行超疏水壁面碰撞或植物液面碰撞等等。在所有的碰撞形式中，液滴在常温下碰撞水平壁面是最基础的碰撞模式，对其最大铺展系数问题，前人做了大量的研究工作，并总结出许多半经验公式(见表1)。 Table 1 年份 作者 公式 1991 Chandra [ 1 ] β max 2 = W e + 4 3 ( 1 − cos θ e ) 1995 Scheller; bousfield [ 2 ] β max ∝ 0.61 ( R e 2 O b ) 1 / 6 = 0.61 R e 1 / 5 ( W e R e − 2 / 5 ) 1 / 6 1996 Pasandidch-Fard [ 3 ] β max 2 = W e + 12 3 ( 1 − cos θ α ) + 4 ( W e / R e ) 2003 Kwon [ 4 ] β max 2 = − ( 1 − cos θ e ) + ( 1 − cos θ e ) 2 + 6 W e R e ( W e 3 + 4 ) 3 W e / R e 2004 Clanet [ 5 ] β max ∝ W e 1 / 4 2005 Ukiwe; kwok [ 6 ] [ 3 ( 1 − cos θ d ) + 4 W e R e ] β max 3 − ( W e + 12 ) β max + 8 = 0 2009 Roisman [ 7 ] β max ∝ 0.87 R e 1 / 5 − 0.4 R e 2 / 5 W e − 1 / 2 2010 Eggers [ 8 ] β max = R e 1 / 5 f ( P ) 2013 陈石 [ 9 ] β max = β ∞ + 1 + ( R e + C 1 ) 2 3 C 2 R e 2 / W e − C 1 2 2015 李大树 [ 10 ] β max = W e + 12 3 ( 1 − cos θ e ) + 3 W e / R e ≈ 1 3 R e 0.25 2016 J.B.Lee [ 11 ] β max 2 = R e 2 / 5 W e ( 7.6 + W e 1 / 2 ) 2 + β V i → 0 2 2018 黄海梦 [ 12 ] { 3 4 ( W e R e + W e ∗ R e * ) β max 4 + 3 ( 1 − cos θ α ) β max 3 − ( W e + 12 ) β max + 8 = 0 , V 0 < V ∗ 3 4 ( W e R e + W e ∗ R e * R e * R e ) β max 4 + 3 ( 1 − cos θ α ) β max 3 − ( W e + 12 ) β max + 8 = 0 , V 0 > V ∗ 表1. 最大铺展系数的半经验公式 求解最大铺展系数的过程，核心是建立能量守恒方程，一般情况下，方程左边是宏观能量差值，方程右边是能量损耗项。大多数研究中，宏观能量差值包含了机械能差值和内能差值，能量损耗项仅关注粘性耗散，并在处理粘性耗散函数中引入大量假设或近似公式。 将液滴和壁面看作一个系统，在铺展过程的任意时刻，由表面能、吸附能和变形能组成的系统内能项是守恒的，因此宏观能量差值不应有内能，而应仅有机械能项 [ 13 ] 。在建立液滴的流体力学模型后，能量损耗可进行完整的理论推导。同时，在干态铺展中，能量损耗中占到主导作用的应是三相接触线损耗，而不是通常认为的粘性损耗，因此，三相接触线损耗是不能忽略的。 在此思路下，通过圆柱型液滴的假设，利用轴对称不可压缩驻点流动模型，重新对最大铺展系数进行了理论推导，并得出了较为满意的结果。"
"将液滴碰撞水平壁面的过程分解成3个过程。并引入以下无纲量参数： 铺展系数： β = r / r 0 比速度： U β = U R / U 0 比能： E β = E / E D 0 雷诺数： R e = 2 r 0 ρ U 0 / μ 韦伯数： W e = 2 r 0 ρ U 0 2 / γ L 付鲁德数： F r = U 0 2 / 2 g r 0 邦德数： B d = ρ g r 0 2 / γ L 式中：r：液滴铺展半径；r 0 ：球型液滴初始半径；U R ：三相接触线速度；U 0 ：液滴撞击壁面时的速度；E D 0 ：液滴初始动能；ρ：液滴密度；μ：液滴粘度；γ L ：液滴表面张力；g：重力加速度。  过程1为液滴的跌落过程，半径为r 0 球状液滴进行跌落，和水平壁面距离为零时跌落过程结束，此时液滴速度为U 0 。 当液滴为球型时，液滴的初始机械能E J 0 为动能E D 0 、附加压力能E Y 0 和势能E S 0 的和： E J 0 = E D 0 + E Y 0 + E S 0 = 1 2 m U 0 2 + 2 m γ L ρ r 0 + m g r 0 (1) 因此液滴的初始比能为 E β , J 0 = 1 + 8 W e + 1 F r (2) 将液滴变形为半径为R 1 ，高度为H 1 的圆柱体，变形前后液滴的内能守恒，令液滴变形前后机械能相等，因动能未在变形过程中发生变化，因此可得： m γ L ρ 1 R 1 + 1 2 m g H 1 = 2 m γ L ρ 1 r 0 + m g r 0 (3) 整理可得： R 1 = 1 + 8 3 ( ρ g r 0 2 γ L + 1 ) 2 − 5 3 4 + 2 ρ g r 0 2 γ L r 0 (4) 即： β 1 = 1 + 8 3 ( B d + 1 ) 2 − 5 3 4 + 2 B d (5) 因 r 0 ∈ ( 0 , ∞ ) ，可得 β 1 ∈ ( 1 2 , 2 3 ) 。  过程2为液滴的碰撞过程。以圆柱状液滴底面圆心为零点，建立r-h-θ的柱坐标系，并假设： a) 在碰撞过程中液滴形状不发生变化； b) 碰撞过程中动能守恒，液滴的垂直速度U h 转化为水平速度U r ； c) U H 2 等于零时碰撞结束。 根据圆柱体在不同方向上的体积微分可知： 2 π r h d r = − π r 2 d h (6) 可解得： U H = − 2 H R U R (7) 假设液滴铺展过程中保持圆柱状，在任意r处的环形截面，其单位时刻的体积流量应保持相等，即： (8) 考虑到公式(7) (8)的形式，可以假设液滴在铺展过程中的速度分布满足： { U r = a r U h = − 2 a h (9) 在铺展的确定时刻，a为比例常数。因此可以将铺展过程看作轴对称驻点流动的类型。以圆柱状液滴顶面的垂直速度U H 和三相接触线速度U R 表示，液滴动能方程可表示为： E D 2 = 1 4 m U R 2 2 + 1 6 m U H 2 2 = 1 2 m U 0 2 (10) 碰撞结束时， U H 2 = 0 ,可解得 U R 2 = 2 U 0 。  过程3为液滴的铺展过程。液滴在初始机械能的作用下进行铺展，在壁面摩擦力和粘性耗散的作用下减速至零，此时的液滴半径R max 对应最大铺展系数β max 。 在铺展的任意时刻，液滴的比能为： E β , J 3 = U β 2 ( 1 2 + 64 27 β 6 ) + 4 W e β + 1 6 F r β 2 (11)"
"液滴铺展过程中系统内能守恒，液滴必然具备压缩性。但由于其压缩比很低，可以近似认为铺展过程是不可压缩流动。液滴的铺展过程是非定常流动，定常流动解可看作是该流动的零阶近似。根据K Hiemenz假设 [ 14 ] ，定常不可压缩轴对称驻点流动的粘性流动速率满足： { u r = r f ′ ( h ) u h = − 2 f ( h ) (12) 该流体的N-S方程可变形为： φ ‴ + 2 φ φ ″ − φ ′ 2 + 1 = 0 (13) 方程的边界条件为： { ξ = 0 ;   φ = 0 ,   φ ′ = 0 ξ = ∞ ;   φ ′ = 1 (14) 其中： ξ = a ρ μ h , f ( h ) = a μ ρ φ 根据边界层理论，轴对称驻点流动的边界层厚度为： δ 0.99 = κ μ a ρ (15) 式中边界层厚度系数 κ = 1.9445 。 铺展过程的能量耗散由粘性耗散、三相线耗散和前驱膜耗散组成。忽略前驱膜的耗散，铺展过程的比能量守恒方程可表述为： E β , J 0 − E β , J 3 = W β , N + W β , S (16)  柱坐标下粘性耗散函数 ϕ 可表示为 [ 15 ] ： ϕ = 2 μ [ ( ∂ u r ∂ r ) 2 + ( u r r ) 2 + ( ∂ u h ∂ h ) 2 ] + μ ( ∂ u r ∂ h ) 2 (17) 将各关系式带入整理可得 ϕ = 12 μ a 2 φ ′ 2 + ρ r 2 a 3 φ ″ 2 (18) 和右边第二项相比，右边第一项为小量，可以忽略，因此粘性耗散函数可简化为： ϕ ≈ ρ r 2 a 3 φ ″ 2 (19) 耗散函数的体积积分 Φ 为： Φ = ∫ 0 v ϕ d V = ∫ 0 H ϕ π R 2 d h = π ρ μ R 1.5 U R 2.5 ∫ 0 κ φ ″ 2 d ξ (20) 记 ε = ∫ 0 κ φ ″ 2 d ξ ，则 Φ = π ε ρ μ R 1.5 U R 2.5 (21) 公式(13)无解析解，N.Fröessling [ 16 ] 给出了数值解，利用该数值解，可求得 ε = 0.7982 。 液滴铺展过程的粘性损耗比能可表示为： W β , N = ∫ 0 t Φ d t E D 0 = π ε ρ μ E D 0 ∫ 0 t R 1.5 U R 2.5 d t = 1 R e 3 2 ε 2 r 0 2.5 U 0 1.5 ∫ R 1 R R 1.5 U R 1.5 d R = 3 2 ε 2 R e ∫ β 1 β β 1.5 U β 1.5 d β (22)  虽然在K Hiemenz假设下，液滴和壁面的接触面存在滑移，壁面摩擦力会造成损耗，但其滑移位移不可解，我们仅考虑三相接触线的移动造成的摩擦损耗，而忽略接触面滑移损耗。 三相接触线处，壁面的切应力： τ ( 0 ) = μ ( ∂ u r ∂ h ) h = 0 = φ ″ ( 0 ) ρ μ U R 1.5 R 0.5 (23) 其中 φ ″ ( 0 ) = 1.312 半径为dR的圆柱体，其单元三相线摩擦力可表述为： d F s = 2 πd R τ ( 0 ) = 2 π φ ″ ( 0 ) ρ μ U R 1.5 R 0.5 d R (24) 三相线摩擦力的耗散比能为 W β , s = ∫ S d F s E D 0 = 2 π 2 φ ″ ( 0 ) ρ μ E D 0 ∫ R 1 R U R 1.5 R 1.5 d R = 3 2 π φ ″ ( 0 ) R e ∫ β 1 β β 1.5 U β 1.5 d β (25)  能量守恒方程(16)本身是无法求解的，为了简化计算，我们忽略铺展过程中的垂直动能、残余附加压力能和残余势能，由式(16) (22)和(25)，并记： ω = 3 2 π φ ″ ( 0 ) + 3 2 2 ε = 19.1804 可得： 1 + 8 W e + 1 F r − 1 2 U β 2 = ω R e ∫ β 1 β β 1.5 U β 1.5 d β (26) 将式(26)进行微分： − U β U ′ β = ω R e β 1.5 U β 1.5 (27) 解该方程，得： U β 0.5 = C − ω 5 R e β 2.5 (28) C为积分常数，将式(28)带入(26)可求得: C = 2 4 ( 1 + 8 W e + 1 F r ) 1 / 4 + ω 5 R e β 1 2.5 (29) 因此，液滴碰壁后的铺展速度满足方程： U β 0.5 = 2 4 ( 1 + 8 W e + 1 F r ) 1 / 4 − ω 5 R e ( β 2.5 − β 1 2.5 ) (30) 公式(30)各项有着明确的物理意义。 ω / R e 是能量耗散系数， ( 1 + 8 / W e + 1 / F r ) 是液滴的初始比能，β 1 是初始铺展系数，其他均为积分常数。 将式(30)分离变量，进行再次积分，可得到铺展系数β和时间t的关系，但由于其积分公式无法求解，我们只能近似得到关系： β ∝ t 1 / 4 (31) 这和通过标度分析得到的结果一致 [ 17 ] 。  当液滴铺展到最大半径时， U β = 0 ，由式(30)可得： β max 2.5 = 5 2 4 ω R e ( 1 + 8 W e + 1 F r ) 1 / 4 + β 1 2.5 (32) 将ω值带入，可知： β max ∝ 0.626 R e 0.2 (33) 或： β max ∝ 0.626 R e 0.2 ( 1 + 8 / W e ) 0.1 (34) 在文献 [ 1 ] [ 3 ] [ 4 ] [ 10 ] 等的研究中，最大铺展系数β max 的幂次大都为2，这一差异均是在其估算能量耗散公式时，采用的各参数预估模型的误差导致。因此带来和雷诺数的幂次关系出现非0.2的现象。在文献 [ 1 ] [ 3 ] [ 4 ] [ 6 ] [ 10 ] [ 12 ] 等研究中，方程出现和接触角相关的关系，是由于在宏观能量差值中考虑了表面能或其他内能因素。如果去除这一问题，其方程均可变形为类似公式(34)的形式。"
"公式(32)并不适合产生飞溅、破碎和指进现象的撞击过程，因为飞溅和破碎现象带走了一部分机械能，导致方程(16)左边产生差异。指进现象没有统一的铺展系数。对于产生铺展、振荡、回缩甚至回弹现象的液滴碰壁过程，公式(32)均应有良好的解释力。 其次，公式(16)未考虑热交换过程，因此高温、过冷或过热情况下的液滴碰壁过程不适合公式(32)。 再次，轴对称驻点模型适应于边界层是层流的状态，光滑平板的临界雷诺数为3.5×10 5 左右 [ 18 ] ，因此对于超过临界雷诺数的撞击，公式(32)不适用。 从13篇中外文献中提取了符合以上要求的84个实验数据 [ 10 ] [ 19 ] - [ 30 ] (见表2)，液滴材质涉及水、乙醇、柴油、甘油、石蜡等多项物质，壁面材质涉及玻璃、不锈钢、铝、石蜡和塑料。液滴直径r 0 范围0.6~5.0 mm；碰撞速度U 0 范围0.5~4.37 m/s；雷诺数Re范围41~21698，韦伯数We范围9~1310；付鲁德数Fr范围8.5~1773.3；邦德数Bd范围0.01~0.84；最大铺展系数β max 范围1.16~5.79。 使用公式(32)对文献数据进行拟合(见图1)，发现拟合度良好，计算值和实验值的相关系数R 2 = 0.74，进行单因素方差检验，得出在显著性水平α = 0.05时，P = 0.57 > 0.05，F = 0.33 < 3.89，因此可认为计算值和实验值无显著差异。 Table 2 液滴/壁面 液滴半径r 0 mm 碰撞速度U 0 m/s 雷诺数Re 韦伯数We 付鲁德数Fr 邦德数Bd 最大铺展系数β max 文献 实验值 计算值 柴油/玻璃 1.19 1.49 1255 115 95.2 0.30 2.79 2.65 [ 10 ] 柴油/不锈钢 1.19 0.67 564 23 19.2 0.30 2.62 2.33 [ 10 ] 柴油/不锈钢 1.19 1.49 1255 115 95.2 0.30 3.00 2.65 [ 10 ] 柴油/不锈钢 1.25 1.49 1319 121 90.5 0.33 3.08 2.68 [ 10 ] 柴油/不锈钢 1.30 1.49 1372 126 87.0 0.36 3.15 2.70 [ 10 ] 柴油/不锈钢 1.35 1.49 1420 130 84.1 0.39 3.30 2.72 [ 10 ] 柴油/铝板 1.19 1.49 1255 115 95.2 0.30 3.00 2.65 [ 10 ] 甘油/不锈钢 1.30 1.49 41 112 87.0 0.32 1.16 1.39 [ 10 ] 水/不锈钢 1.35 1.49 3995 82 83.8 0.25 2.90 3.34 [ 10 ] 水/不锈钢 1.32 1.94 5096 136 145.3 0.23 3.51 3.49 [ 19 ] 水/不锈钢 1.32 2.14 5621 166 176.8 0.23 3.54 3.55 [ 19 ] 水/不锈钢 1.32 3.17 8327 364 388.0 0.23 4.34 3.83 [ 19 ] 水/石蜡板 1.32 0.56 1471 11 12.1 0.23 1.70 2.87 [ 19 ] 水/石蜡板 1.32 1.94 5096 136 145.3 0.23 3.35 3.49 [ 19 ] 水/石蜡板 1.32 2.14 5621 166 176.8 0.23 3.37 3.55 [ 19 ] 水/石蜡板 1.32 3.17 8327 364 388.0 0.23 3.83 3.83 [ 19 ] 甘油/铝板 1.63 1.78 61 200 99.1 0.50 1.41 1.50 [ 20 ] 甘油/铝板 1.63 2.28 78 327 162.5 0.50 1.55 1.56 [ 20 ] 甘油/铝板 1.63 2.70 93 458 227.6 0.50 1.61 1.61 [ 20 ] 水/铝板 1.94 1.78 6858 169 83.2 0.51 3.41 3.70 [ 20 ] 水/铝板 1.94 2.28 8785 277 136.6 0.51 3.53 3.88 [ 20 ] 水/铝板 1.94 2.70 10395 387 191.2 0.51 4.18 4.01 [ 20 ] 无水乙醇/铝板 1.46 2.28 4364 535 182.1 0.73 3.94 3.37 [ 20 ] 无水乙醇/铝板 1.46 1.78 3407 326 111.0 0.73 3.83 3.22 [ 20 ] 水/玻璃 0.78 1.30 2014 36 110.4 0.08 2.06 2.94 [ 21 ] 水/玻璃 1.32 1.30 3395 61 65.5 0.23 2.57 3.24 [ 21 ] 水/玻璃 1.73 1.30 4467 80 49.8 0.40 2.66 3.42 [ 21 ] 水/玻璃 2.05 1.30 5280 95 42.1 0.56 3.04 3.53 [ 21 ] 水/玻璃 1.13 0.94 2100 27 40.0 0.17 2.68 2.99 [ 22 ] 水/玻璃 1.13 1.37 3061 58 85.0 0.17 2.86 3.18 [ 22 ] 水/玻璃 1.13 1.64 3664 83 121.9 0.17 3.16 3.28 [ 22 ] 水/不锈钢 1.13 0.94 2100 27 40.0 0.17 2.31 2.99 [ 22 ] 水/不锈钢 1.13 1.37 3061 58 85.0 0.17 2.77 3.18 [ 22 ] 水/不锈钢 1.13 1.64 3664 83 121.9 0.17 2.86 3.28 [ 22 ] 水/铝板 1.13 0.94 2100 27 40.0 0.17 2.26 2.99 [ 22 ] 水/铝板 1.13 1.37 3061 58 85.0 0.17 2.75 3.18 [ 22 ] 水/铝板 1.13 1.64 3664 83 121.9 0.17 3.00 3.28 [ 22 ] 水/PVC板 2.50 1.13 5611 88 26.0 0.84 2.92 3.58 [ 23 ] 水/PVC板 2.50 2.24 11122 344 102.3 0.84 4.19 4.06 [ 23 ] 水/PVC板 2.50 4.37 21698 1310 389.3 0.84 5.79 4.63 [ 23 ] 农药/枸杞叶 1.20 1.98 4469 246 166.7 0.37 3.33 3.39 [ 24 ] 农药/枸杞叶 1.20 2.80 6320 492 333.3 0.37 3.33 3.63 [ 24 ] 农药/枸杞叶 1.30 2.43 5929 400 230.8 0.43 2.69 3.58 [ 24 ] 农药/枸杞叶 1.10 2.43 5017 338 272.7 0.31 2.27 3.47 [ 24 ] NaCL溶液(200 g/l)/不锈钢 1.25 0.99 1798 33 40.0 0.21 1.99 2.89 [ 25 ] NaCL溶液(200 g/l)/不锈钢 1.25 1.40 2543 67 79.9 0.21 2.75 3.06 [ 25 ] NaCL溶液(200 g/l)/不锈钢 1.25 1.71 3106 100 119.2 0.21 3.29 3.17 [ 25 ] NaCL溶液(50 g/l)/不锈钢 1.25 0.99 2392 33 40.0 0.21 2.13 3.06 [ 25 ] 水/不锈钢 1.25 0.99 2458 34 40.0 0.21 2.28 3.07 [ 25 ] 水/不锈钢 1.25 1.40 3476 67 79.9 0.21 2.75 3.25 [ 25 ] 水/不锈钢 1.25 1.71 4245 100 119.2 0.21 3.13 3.37 [ 25 ] 水/PMMA 1.13 1.23 2741 47 68.2 0.17 2.50 3.12 [ 26 ] 庚烷/不锈钢 0.75 0.93 2300 43 58.8 0.18 4.00 3.02 [ 27 ] 水/玻璃 0.31 2.61 2084 59 1127.3 0.01 3.47 2.94 [ 27 ] 水/玻璃 0.39 3.29 3298 118 1421.9 0.02 4.07 3.20 [ 27 ] 水/玻璃 0.44 3.71 4258 171 1580.0 0.03 4.20 3.36 [ 27 ] 水/玻璃 0.49 4.00 5057 219 1669.4 0.03 4.30 3.47 [ 27 ] 水/玻璃 0.53 4.28 5833 271 1773.3 0.04 4.40 3.57 [ 27 ] 水/蜂蜡 0.39 3.29 3298 118 1421.9 0.02 3.18 3.20 [ 27 ] 水/蜂蜡 0.44 3.71 4258 171 1580.0 0.03 3.45 3.36 [ 27 ] 水/蜂蜡 0.49 4.00 5057 219 1669.4 0.03 3.79 3.47 [ 27 ] 水/蜂蜡 0.53 4.28 5833 271 1773.3 0.04 3.91 3.57 [ 27 ] 水/乙酸纤维素 0.31 2.61 2084 59 1127.3 0.01 3.15 2.94 [ 27 ] 水/乙酸纤维素 0.39 3.29 3298 118 1421.9 0.02 3.56 3.20 [ 27 ] 水/乙酸纤维素 0.44 3.71 4258 171 1580.0 0.03 3.82 3.36 [ 27 ] 水/乙酸纤维素 0.49 4.00 5057 219 1669.4 0.03 4.10 3.47 [ 27 ] 水/乙酸纤维素 0.53 4.28 5833 271 1773.3 0.04 4.24 3.57 [ 27 ] 水/铝板 1.50 0.50 213 26 8.5 0.76 2.20 1.95 [ 28 ] 石蜡/铝板 1.50 1.00 427 102 34.1 0.75 2.50 2.17 [ 29 ] 石蜡/铝板 1.50 1.50 641 230 76.7 0.75 2.60 2.33 [ 29 ] 石蜡/铝板 1.50 2.00 854 410 136.4 0.75 2.70 2.46 [ 29 ] 石蜡/铝板 1.50 2.50 1067 641 213.1 0.75 3.00 2.56 [ 29 ] 水(SDS 100 ppm)/不锈钢 1.01 1.00 2112 27 50.5 0.13 2.16 2.99 [ 30 ] 水(SDS 1000 ppm)/不锈钢 1.04 1.00 2112 28 49.2 0.14 2.62 2.99 [ 30 ] 水/不锈钢 1.03 1.00 2112 27 49.7 0.14 2.15 2.99 [ 30 ] 水/蜂蜡 0.31 2.61 2084 59 1127.3 0.01 2.65 2.94 [ 30 ] 表2. 最大铺展系数的应用数据和计算数据 图1. β max 的实验值和计算值的对比 对文献数据进行处理，拟合Re 0.2 和β max ,得到的关系式为(见图2)： β max = 0.627 R e 0.2 (35) 其关系系数和公式(33)几乎无差异。 图2. β max 实验值和Re 0.2 拟合图"
"1) 建立液滴碰撞壁面的过程假设，利用轴对称驻地流动模型，得出最大铺展系数的理论关系式，该关系式有明确的物理意义，具有良好的解释力。 2) 通过实验数据的对比，计算值和实验值有较强的符合性。"
