"目的：探讨大学生性健康教育的基本现状。方法：采用大学生性健康教育问卷对584名大学生进行问卷调查。结果：大学生性健康教育处于中等水平；性别在性知识(t = 3.636, P < 0.01)和性教育(t = 2.415, P < 0.05)上存在显著差异；是否有恋爱经历在性知识(t = 6.739, P < 0.01)、性心理(t = 4.031, P < 0.01)、性观念(t = 4.631, P < 0.01)和性教育(t = 3.431, P < 0.01)上存在显著差异；地域在性知识(t = 4.110, P < 0.01)、性心理(t = 3.643, P < 0.01)、性观念(t = 2.399, P < 0.05)和性教育(t = 4.943, P < 0.01)上存在显著差异；年级在性知识(t = 23.341, P < 0.01)、性心理(t = 12.925, P < 0.01)、性观念(t = 9.753, P < 0.01)和性教育(t = 4.665, P < 0.01)上存在显著差异。结论：大学生性健康教育处于中等水平，还需要进一步提升。 关键词 :大学生，性健康教育，现状 Copyright © 2019 by author(s) and Hans Publishers Inc. This work is licensed under the Creative Commons Attribution International License (CC BY). http://creativecommons.org/licenses/by/4.0/"
"大学生性健康教育是指大学生在家庭、学校和社会环境背景下接受相关性方面的教育，在正确掌握性知识的基础上，能有积极的性观念，能够处理好在性欲和性行为上出现的心理特征 [ 1 ] 。2016年《“健康中国2030”规划纲要》和2017年教育部印发的《普通高等学校健康教育指导纲要》中都提到开展性健康教育的重要性，可见，性健康教育在我国健康教育中已成为决策层面高度关注的重要问题之一。受传统文化和观念的影响，大学生在接受性健康教育方面还有所欠缺，学校对性健康教育的忽视也影响到性健康教育的正常开展，而性健康教育对大学生的身心和人格发展有重要的影响。本研究旨在了解大学生性健康教育的现状，分析存在的问题，为学校开展性健康教育提供有效的理论和实践指导。"
"采取随机取样的方法，选取云南师范大学600名大学生进行问卷调查，收回有效问卷584份，有效率为97.3%。被试的人口统计学特征如表1所示。"
"采用自行编制的大学生性健康教育问卷。在查阅大学生性健康教育文献的基础上，经过访谈和专家咨询，将性健康教育归纳为性知识、性观念、性心理和性教育四个方面的内容，并得到22个具有代表性和普遍性的条目。"
"1) 题总相关 抽取800名在校本科生作为被试，进行预测。收回有效问卷747份，收回率达93.3%。其中男生254名，女生493名；大一学生为183名，大二学生为188名，大三学生为180名，大四学生为196名。根 Table 1 变量 人数 所占比例(%) 性别 男 251 43.0 女 333 57.0 是否有恋爱经历 是 385 65.9 否 199 34.1 地域 城镇 168 28.8 农村 416 71.2 年级 大一 147 25.2 大二 143 24.5 大三 149 25.5 大四 145 24.8 表1. 被试的人口统计学特征(N = 584) 据心理测量学原理，先将反向计分题目进行转换，再算出每个被试的总分及各个题目的鉴别指数，项目鉴别指数D ≥ 0.40区分度很好，0.30 ≤ D < 0.40区分度较好，0.20 ≤ D < 0.30区分度尚可，D < 0.20区分度差。一般来说，项目与问卷总分的相关系数小于0.3，表示该项目的区分度低，应将其删除。分析结果表明，第11题(区分度0.291)和第16题(区分度0.266)的代表性不好，应将其删除。剩下20个代表性较好的题目，可以用来做进一步的分析。 2) 临界比率(CR值) 计算剩下的20个题目的临界比率，先将所剩下的20个题目的总分从高到低排列，高分组为前27%的得分，低分组为后27%的得分，然后对高低二组进行独立样本t检验。如果临界比值达到显著标准，表示该题能鉴别出不同被试的反应程度，反之应予删除。分析结果表明，20个题的CR值都达到显著水平，因此不删除任何题目，可以用来做进一步分析。"
"研究采用KMO和Bartlett’s球型检验进行探索性因素分析。结果表明，KMO值为0.819，Bartlett’s球型检验的近似卡方c 2 = 4341.414，P < 0.001，达到了非常显著的水平，认为变量间不是彼此独立，而是相互关联，初测数据适宜做主成分/因子分析。研究结果表明20道题目都符合要求进行探索性因素分析(见表2)。 结果表明，从20个题中抽取出4个公共因素，这4个公因素可解释总变量的51.76%，具有一定的解释力。根据研究的内容将四个因素定义为：性教育是指个体在家庭、学校和社会环境下接受的关于性方面的教育，因素方差贡献率为16.071%；性知识是指两性在性和性器官方面获取的有关知识，因素方差贡献率为15.783%；性观念是指个体在性生理现象和性道德规范上的观念，因素方差贡献率为10.836%；性心理是指在性生理的基础上，与性欲和性行为有关的心理特征，因素方差贡献率为9.070%。"
"采用内部一致性系数对构成大学生性健康教育四个因素的各项目之间及总问卷所有项目之间进行考察(见表3)。结果显示，各维度信度在0.5~0.7之间，可以说明问卷的信度良好。 为考察各项目的内在一致性效度，以各项目分数与所属因素因子分的相关系数为指标进行研究(见表4)。结果显示，所有项目与所属因素的相关系数均在0.4以上(P < 0.01)，表明该问卷的20个项目具有良好的内在一致性效度。 Table 2 题号 因子 1 2 3 4 共同度 14 0.854 0.752 20 0.764 0.649 9 0.745 0.561 10 0.709 0.592 22 0.675 0.490 17 0.644 0.531 4 0.534 0.410 12 0.458 0.449 6 0.771 .627 15 0.664 0.463 8 0.523 0.546 1 0.479 0.487 19 0.465 0.442 21 0.676 0.467 2 0.662 0.525 5 0.661 0.538 18 0.461 0.440 3 0.644 0.479 7 0.621 0.460 13 0.603 0.442 特征值 3.214 3.157 2.167 1.814 因子方差贡献率(%) 16.071 15.783 10.836 9.070 累计方差贡献率(%) 16.071 31.853 42.690 51.76 表2. 大学生性健康教育问卷探索性因素分析结果(N = 747) Table 3 性知识 性心理 性观念 性教育 总问卷 a系数 0.645 0.624 0.534 0.777 0.793 表3. 性健康教育问卷及其维度的信度分析结果 Table 4"
