"多因子选股模型是量化投资中的主流方法。本文首次引入高效的核主成分分析(Efficient Kernel Principal Component Analysis, EKPCA)算法，以高效的核主成分为自变量建立回归方程预测收益率，构建多因子选股模型。本文基于上证180的成分股进行实证分析，选取包含基本面、技术指标及投资者情绪指标等50多个影响因子，引用EKPCA算法确定基本模式，在高维特征空间提取高效核主成分。与经典KPCA算法对比，EKPCA算法具有更高的特征抽取效率。回测结果显示，构造的投资组合的贝塔系数和夏普比率在所选时间段内均优于市场基准水平，这表明该模型具有较好的选股效果。 关键词 :EKPCA算法，多因子选股，通用熵，特征提取，核函数 Copyright © 2019 by author(s) and Hans Publishers Inc. This work is licensed under the Creative Commons Attribution International License (CC BY). http://creativecommons.org/licenses/by/4.0/"
"人工智能技术的高速发展，机器学习算法的持续改进，使得量化投资更具实用价值。1971年，美国巴克莱国际投资管理公司发行了世界上第一只指数基金，这标志着量化投资交易正式拉开帷幕。在美国，量化投资交易己有将近50年的历史，量化投资交易量从开始到现在己经占到美国金融市场交易量的30%以上。量化投资起源于美国，却在全球资本市场的浪潮中得到快速的发展。国外成熟金融市场的发展经验表明，利用量化投资可以有效提高金融交易市场的资金流动性。在2004年，国内首次出现量化基金——光大保德信量化核心基金，此后因为各种原因，发展比较缓慢。最主要的量化投资策略就是多因子策略、CTA策略和对冲策略。其中，多因子策略2007年在国内出现，此后一直占据量化投资策略的主导地位；CTA策略在2011年进入国内市场后，并没有较大发展空间，直到2015年才开始发展起来；对冲策略出现在2012年左右，主要依托股指期货的对冲效应 [ 1 ] 。量化投资减少了主观判断等因素的影响，比传统投资更具科学性，越来越受投资者的青睐。 国际上经典的选股模型是资本资产定价模型(CAPM)、套利定价理论模型(APT)、法玛和弗伦奇的三因子模型。当前，中国的股票市场对于多因子模型的研究还处在一个初级阶段，绝大多数的研究都局限于证券公司的专业研究部门，在学术界算是比较新兴的领域。 国内学者通过借鉴国外先进的量化模型，构建了不同类型的量化选股模型。范烨 [ 2 ] 构建了多因子模型进行选股研究，对多因子进行排序打分，并且确定相关阈值对因子进行筛选；李娜 [ 3 ] 等提出基于k-means聚类的选股模型，该模型利用数据的自动学习来对数据进行特征分类选取因子；苏治 [ 4 ] 构建了基于核主成分遗传算法改进的支持向量回归机人工智能选股模型，提高了传统模型的预测精度；贾秀娟 [ 5 ] 使用随机森林处理变量，提出基于随机森林的支持向量机模型进行选股研究，提高了模型的识别精度。其中，多因子选股模型有两种判别方法，一种是打分法 [ 2 ] [ 6 ] ，另一种是回归法 [ 7 ] 。与打分法相比，回归法可以根据股票市场上的突发情况，能够及时地调整模型对各个因子的敏感度，而且简单、快速，更便于程序化交易。因此，本文采用回归法对多因子模型进行实证研究。 我国股票市场存在T + 1制度，缺乏有效的做空机制和金融衍生工具，这些都限制了量化投资在中国市场的发展。我国A股市场发展还不完善，风格多变，多处于弱有效状态，因子之间关系复杂，内在混乱，各个财务指标之间的线性关系不明显，这里利用普通的线性降维效果并不理想。为了探究适应我国A股市场的量化投资策略，本文提出高效的核主成分分析方法，在高维空间中提取主要的非线性特征。经典KPCA方法常用于特征提取、图像识别、人脸识别等 [ 8 ] 。KPCA作为抽取复杂数据特征的一种非线性方法，当训练样本的规模很大时，它的抽取效率并不高，因此本文提出一种新型EKPCA算法来提高特征抽取效率。EKPCA算法的基本思想是剔除对特征抽取贡献小的训练样本，确定贡献大的训练样本，即确定基本模式，运用特征相关分析来逐个确定基本模式，基本模式的个数可由用户根据需要自己设置。再用已确定的基本模式重新建立KPCA模型，在高维空间进行特征抽取，将抽取的主成分进行收益率回归。本文首次将该算法应用到多因子选股模型中，为量化投资策略提供新的研究思路。"
"本文选取的因子包括上市公司的基本面数据，技术指标数据及投资者情绪指标数据 [ 9 ] 等50多个因子。表1给出了所选因子： Table 1 因子类型 因子名称 规模类因子 流通A股(十亿股)、总股本(十亿股)、总市值(十亿)、股东权益 估值类因子 市盈率(PE)、市净率(PB)、市销率(PS)、市现率(PCF)、每股净资产(BPS)、股息率 风险类因子 Alpha、Beta、Sharpe、Treynor、Jensen、可决系数 每股指标因子 每股收益(EPS)、每股营业收入、每股息税折旧摊销前利润 盈利能力因子 净资产收益率(ROE)、总资产收益率(ROA)、销售净利率、投入资本回报率(ROIC)、 销售毛利率、净资产/营业总收入、息税前利润/营业总收入 收益质量因子 经营活动净收益/利润总额、营业利润/利润总额 资本结构因子 资产负债率、权益乘数 短期偿债能力因子 流动比率、速动比率、现金比率 营运能力因子 总资产周转率、营业周期 成长能力因子 每股收益同比增长率、净利润同比增长率、营业利润同比增长率、 现金流量净额同比增长率、营业收入同比增长率、净资产同比增长率 技术指标因子 成交量、换手率、MACD指数平滑异同平均、DMI趋向指标、RSI相对强弱指标、 ROC变动速率、KDJ随机指标、OBV能量潮、STD标准差 分析师预测因子 预测PEG、预测净利润增长率、预测营业收入增长率 情绪能量因子 PSY情绪指标、BRAR人气意愿指标 表1. 选取的影响因子"
"本文选取的影响因子比较多，因子之间可能存在较高的相关性，这会严重影响选股模型的准确性，使得之后的回归预测失效。因此，本文引用方差膨胀因子(VIF)检验法 [ 10 ] ，影响因子 x i 的方差膨胀因子记为VIF，它的计算方法为： VIF = 1 1 − R 2 式中， R 2 是以 x i 为因变量时对其它影响因子 x j ， j ≠ i 回归的模型拟合优度。如果最大的VIF超过10，常常表示多重相关性将严重影响回归参数的估计值。基于我国股票市场弱有效且经济因素复杂的背景下，多维度的因子之间不存在明显的线性相关关系。因此，本文引用EKPCA算法进行非线性降维解决上述问题。"
"经典KPCA是传统PCA的一种非线性拓展，其目的是从数据中抽取最具表现力的特征 [ 11 ] 。因子之间存在非线性相关关系，不能直接用PCA进行降维，而KPCA的基本思想是将原始训练样本通过一个合适的非线性隐函数 Φ ( x ) 映射到高维特征空间中，原空间中非线性可分变量很大程度可以转化为高维特征空间中的线性可分变量，然后在高维空间中运行PCA，从而抽取数据的特征。通过研究映射到高维空间中的点的几何性质，我们知道点之间的距离和夹角都可以用核函数 κ 来表示，不需要知道 Φ ( x ) 的具体形式。常用的核函数有线性核、多项式核、高斯核、拉普拉斯核、Sigmoid核等，本文根据模型需要主要引入表2中的两种核函数： Table 2 名称 表达式 参数 多项式核 κ ( x i , x j ) = ( x i T x j + c ) d c ≥ 0 ，d为多项式的次数且是正整数 高斯核 κ ( x i , x j ) = exp ( − ‖ x i − x j ‖ 2 2 σ 2 ) 为高斯核的带宽(width) 表2. 常见的核函数 其中， x i ， x j 为原始输入空间的训练样本。利用核函数建立核矩阵K，核矩阵K其实是内积矩阵，且一定是半正定矩阵 [ 12 ] ，其中 K i j = 〈 Φ ( x i ) , Φ ( x j ) 〉 = Φ ( x i ) T Φ ( x j ) = κ ( x i , x j ) ,   i = 1 , 2 , ⋯ , N ;   j = 1 , 2 , ⋯ , N (1) 式中， x i ， x j 为训练样本，N为训练样本的个数。 由上述表达式可知核矩阵的规模与训练样本的个数成正比，则KPCA的计算效率与训练样本的个数成反比，多因子选股模型一般选取的股票数量都较多，KPCA抽取效率较低。近年来，很多算法被提出用来提高KPCA的计算效率 [ 13 ] 。本文引用其中一种特征抽取效果较好的EKPCA算法，该算法可以用小部分训练集(基本模式)的线性组合来近似表达KPCA的特征抽取效果。对全体训练样本进行特征抽取时，每个特征分量其实就是一系列核函数的线性组合，训练样本越多，特征抽取效率越低。同时，在特征抽取过程中，有些训练样本对特征抽取的贡献非常小。EKPCA算法的基本思想是在进行特征抽取前，先剔除对特征抽取贡献小的训练样本，保留贡献大的训练样本，保留下来的训练样本即基本模式，这里运用特征相关分析来逐个确定基本模式，基本模式的个数由用户自己设置。再重新构建KPCA模型。 EKPCA算法与KPCA算法相比主要有两个优点：第一，基本模式的个数一般远远小于全体训练样本的个数，这使得EKPCA算法比KPCA算法的抽取效率高；第二，在特征抽取时，KPCA需要对 N × N (N是全体训练样本的个数)的核矩阵进行特征分解，而EKPCA只需要对 s × s (s是基本模式的个数)的核矩阵进行特征分解，这说明EKPCA比KPCA需要更少的存储空间 [ 14 ] 。  首先，对训练样本进行z-score标准化处理，即使处理后的数据均值为0，标准差为1。 其次，引入最大通用熵来确定多项式核函数的参数c和d以及高斯核函数的参数 θ 。主要步骤如下： 步骤1：定义特征空间中点之间的余弦距离 c i j = Φ ( x i ) T Φ ( x j ) ‖ Φ ( x i ) ‖ ⋅ ‖ Φ ( x j ) ‖ ,     i = 1 , 2 , ⋯ , N ;   j = 1 , 2 , ⋯ , N (2) 将(1)式带入(2)式得到下式 c i j = κ ( x i , x j ) ‖ κ ( x i , x i ) ‖ ⋅ ‖ κ ( x j , x j ) ‖ ,   i = 1 , 2 , ⋯ , N ;   j = 1 , 2 , ⋯ , N (3) 由上述表达式可知，如果引用高斯核函数，则 c i j = κ ( x i , x j ) (4) 同样，如果引用多项式核函数或其他的核函数，则特征空间中每个样本向量的长度标准化为1，也可以得到 c i j = κ ( x i , x j ) 。那么，核矩阵在某种程度上是特征空间中余弦矩阵的一种特殊形式，因此，理论上可以用余弦矩阵来学习核矩阵及其参数 [ 8 ] 。如果 c i j → 0 ，则特征空间中的向量很可能相互正交，它们的类间散度和类内散度都很大 [ 12 ] ，该情形下，很难正确分开样本数据。如果 c i j → 1 ，则特征空间中的所有样本向量将会集中于一点，或者位于同一直线上，显然该情形也不利于样本分类。 步骤2：定义通用熵如下： Entro ( c i j ) = − ∑ i = 1 N ∑ j = 1 N | c i j | log | c i j | (5) 将(4)式代入(5)式得到： Entro ( c i j ) = − ∑ i = 1 N ∑ j = 1 N | κ ( x i , x j ) | log | κ ( x i , x j ) | (6) 根据前面提到的两种情况 c i j → 0 和 c i j → 1 ，通用熵 Entro ( c i j ) 将会取到最小值0，这将妨碍样本的分类。因此本文选取通用熵的最大值对应的参数建立核函数，便于对数据进行分类。这就是一个凸优化问题： Max   Entro ( c i j ) s . t .   { 0.1 ≤ c ≤ 10.0 1 ≤ d ≤ 10 d 为 整 数 或 1.0 ≤ θ ≤ 10.0  有两种常见的确定基本模式的方法，一种是前向选择算法，另一种是后向选择算法 [ 11 ] 。考虑时间复杂度，本文选用前向选择算法，耗时较小。特征抽取的一项基本原则是，由不同投影方向得到的特征之间应尽量互不相关，因此，确定基本模式的要求是由两个基本模式得到的特征集之间具有较小的特征相关，这样特征抽取结果的贡献率比较大，综合信息的能力较强。利用核矩阵列向量 v i = ( k ( x 1 , x i ) , k ( x 2 , x i ) , ⋯ , k ( x N , x i ) ) T 之间的特征相关即核矩阵列向量之间的余弦距离，来确定基本模式。两个核矩阵列向量 v i 和 v j 之间的余弦距离为 cos ( v i , v j ) = ( v i , v j ) ‖ v i ‖ ⋅ ‖ v j ‖ 确定基本模式的过程如下： 步骤1：确定前两个基本模式。 找出两个核矩阵的列向量 v m 和 v n 满足 cos ( v m , v n ) = min 1 ≤ i , j ≤ N cos ( v i , v j ) ( 1 ≤ m , n ≤ N ) (7) 然后，将它们对应的原始训练样本 x m 和 x n 作为前两个基本模式，重新标记为 x ′ 1 和 x ′ 2 ，将它放入新的集合A中， A = { x ′ 1 , x ′ 2 } ，构成新的矩阵 K 2 = [ k ( x 1 , x ′ 1 ) k ( x 2 , x ′ 1 ) ⋮ k ( x 1 , x ′ 2 ) k ( x 2 , x ′ 2 ) ⋮ k ( x N , x ′ 1 ) k ( x N , x ′ 2 ) ] 。 步骤t：确定第t个基本模式 ( 3 ≤ t ≤ s ) 。 假设已经在前面 t − 1 步中，确定了基本模式 x ′ 1 , x ′ 2 , ⋯ , x ′ t − 1 ，并且 A = { x ′ 1 , x ′ 2 , ⋯ , x ′ t − 1 } ，由这些基本模式构成了下面的新矩阵： K t − 1 = [ k ( x 1 , x ′ 1 ) ⋯ k ( x 1 , x ′ t − 1 ) k ( x 2 , x ′ 1 ) ⋯ k ( x 2 , x ′ t − 1 ) ⋮ ⋱ ⋮ k ( x N , x ′ 1 ) ⋯ k ( x N , x ′ t − 1 ) ] 对于任意 x ∈ X − A ，设候选的核矩阵列向量是 v p ， v p = ( k ( x 1 , x p ) , k ( x 2 , x p ) , ⋯ , k ( x N , x p ) ) T . 定义候选向量 v p 与矩阵 K t − 1 之间的余弦距离为 cosdis ( v p , K t − 1 ) = 1 t − 1 ∑ q = 1 t − 1 cos ( v p , v q ) (8) 式中， v q 是 K t − 1 的第q列向量： v q = ( k ( x 1 , x ′ q ) , k ( x 2 , x ′ q ) , ⋯ , k ( x N , x ′ q ) ) T 。利用式(7)确定 cosdis ( v p , K t − 1 ) 的最小值，与最小值对应的原始训练样本就确定为第t个基本模式，记为 x ′ t ，将它加入到集合 中。将样本 x ′ t 对应的核矩阵列向量加到 作为该矩阵的最后一列，变为新矩阵 K t 。 重复上述过程直到 t = s ，就确定了所有的基本模式 x ′ 1 , x ′ 2 ， ⋯ , x ′ s ( s < N ) 以及新的矩阵 K s = [ k ( x 1 , x ′ 1 ) ⋯ k ( x 1 , x ′ s ) k ( x 2 , x ′ 1 ) ⋯ k ( x 2 , x ′ s ) ⋮ ⋱ ⋮ k ( x N , x ′ 1 ) ⋯ k ( x N , x ′ s ) ] N × s 。  将训练样本 x i 映射到高维之后，对映射后的数据 Φ ( x i ) 进行中心化处理，即均值满足 Φ ¯ = 1 N ∑ i = 1 N Φ ( x i ) = 0 我们知道将一个向量 x i 在v方向上的投影，若投影方向的模长 ‖ v ‖ = 1 ，则投影后的向量为 〈 x i , v 〉 v 。这就意味着在单位向量上投影后的坐标为 〈 x i , v 〉 = x i T v = v T x i 。那么特征抽取要求投影之后的数据尽可能互不相关，即要求找到一个投影方向v，使得投影后的数据方差最大。投影后的方差为 σ 2 = 1 N ∑ i = 1 N ( v T x i − μ ) 2 = 1 N ∑ i = 1 N ( v T x i ) 2 = 1 N ∑ i = 1 N ( v T x i ) ( v T x i ) T = 1 N ∑ i = 1 N v T x i x i T v = v T ( 1 N ∑ i = 1 N x i x i T ) v = v T C v (9) 上式中，假设所有样本已经经过中心化处理， μ = 0 为投影点的均值， C = 1 N ∑ i = 1 N x i x i T 为原训练样本的协方差矩阵则找出最优投影方向的问题可转化为下面的优化问题： v = arg max v T C v (10) s . t .     ‖ v ‖ = 1 为解决该问题，引入拉格朗日乘子 λ ，建立拉格朗日函数 f ( v , λ ) = v T C v − λ ( v T v − 1 ) (11) 令 f ( v , λ ) 对v和 λ 的偏导数为零得 C v = λ v (12) v T v = 1 (13) 将(12)式和(13)式代入(10)式可转为 v = arg max λ (14) 那么求解该优化问题可转化为求解协方差矩阵C的最大特征值。因此，对高维特征空间进行特征抽取时可转化为求解高维空间的协方差矩阵D (D为原始训练样本映射到高维空间后的协方差矩阵)的前p (p为主成分的个数)个最大特征值。高维特征空间的协方差为： 对D进行特征分解的特征方程为 λ α = D α (15) 式中， α 为该特征方程非负特征值对应的特征向量。 由于直接对该协方差矩阵进行特征分解无法得到具体特征值，可以转化为对已确定的基本模式构建的核矩阵 K 2 进行特征分解得到特征值。其中， K 2 = [ k ( x 1 , x ′ 1 ) ⋯ k ( x 1 , x ′ s ) k ( x 2 , x ′ 1 ) ⋯ k ( x 2 , x ′ s ) ⋮ ⋱ ⋮ k ( x s , x ′ 1 ) ⋯ k ( x s , x ′ s ) ] s × s = [ Φ ( x ′ 1 ) T Φ ( x ′ 1 ) ⋯ Φ ( x ′ 1 ) T Φ ( x ′ s ) Φ ( x ′ 2 ) T Φ ( x ′ s ) ⋯ Φ ( x ′ 1 ) T Φ ( x ′ s ) ⋮ ⋱ ⋮ Φ ( x ′ s ) T Φ ( x ′ s ) ⋯ Φ ( x ′ 1 ) T Φ ( x ′ s ) ] = [ Φ ( x ′ 1 ) T ⋮ Φ ( x ′ s ) T ] [ Φ ( x ′ 1 ) ⋯ Φ ( x ′ s ) ] (16) 令 D = 1 N Φ ( x j ) Φ ( x j ) T , (17) 令 K 1 = ( K s ) T = k ( x ′ i , x j ) = Φ ( x ′ i ) T Φ ( x j ) , (18) 令 K 2 = Φ ( x ′ i ) T Φ ( x ′ r ) , (19) 其中， i , r = 1 , 2 ， ⋯ , s , j = 1 , 2 , ⋯ , N 。 将(17)式代入特征方程(15)可以得到： λ α = 1 N Φ ( x j ) Φ ( x j ) T α (20) 将上述等式两边同时左乘 Φ ( x ′ i ) T ，右乘 Φ ( x ′ i ) ，得： λ ( Φ ( x ′ i ) T Φ ( x ′ r ) ) β = 1 N ( Φ ( x ′ i ) T Φ ( x j ) ) ( Φ ( x j ) T Φ ( x ′ i ) ) β (21) 其中， β = [ β 1 , β 2 , ⋯ , β s ] T 为新特征方程(21)式的特征向量。 将(18)式和(19)式代入(21)式，得： λ K 2 β = 1 N K 1 ( K 1 ) T β (22) 求解方程(22)得到前p个最大特征值 λ t ( t = 1 , 2 , ⋯ , p ) 以及其对应的特征向量 β t ∗ ( t = 1 , 2 , ⋯ , p ) 。因此，原始训练样本的映射在高维空间特征向量上的投影(即主成分)可以如下表示： B = [ ∑ i = 1 s β 1 i ∗ k ( x ′ i , x ) λ 1 , ∑ i = 1 s β 2 i ∗ k ( x ′ i , x ) λ 2 , ⋯ , ∑ i = 1 s β p i ∗ k ( x ′ i , x ) λ p ] T (23) 其中， β 1 i ∗ 是向量 β t ∗ 的第i个分量 [ 11 ] ，s为已确定的基本模式的个数。  在高维特征空间中抽取了样本的p个主成分，对这p个主成分建立多元线性回归模型，如下： y = ∑ k = 1 p ω k B k + ε (24) 其中，y是股票收益率， ω k 为回归系数， B k 为主成分矩阵B的第k个分量， ε 为残差矩阵。利用最小二乘法进行回归参数估计，得到 ω ^ = ( B T B ) − 1 B T y (25) 再将上式结果进行因变量y的预测为 y ^ = ∑ k = 1 p ω ^ k B k 利用方差分析法中的F统计量的P值(即显著性值)对回归方程进行显著性检验，一般P值小于0.05表示回归方程具有统计学意义。"
"本文选用上证180成分股作为研究对象，选用前文所述的50多个因子进行基于EKPCA算法的多因子选股模型实证分析。其中，基本面数据选取上市公司2013至2018年这六年财务报表的季度数据，技术指标数据选取2013至2018年的周行情数据。这些数据时间跨度大，范围广，层面宽，获取数据样本充足，构建的投资组合考虑方面越周到，数据获取遵循可靠性，实效性，全面性，精确性，可操作性等原则。数据来源为东方财富网站Choice金融终端，该数据库较权威，数据采集质量高，实验结果可信度高。当某只股票的指标数据空缺较多时，认为该样本不具备研究价值并且直接剔除，对于其它空缺值，本文通过MATLAB2016a软件进行数据预处理。由于因子之间的量纲不同，需要先将这50多个因子标准化之后，再通过SPSS 22.0统计软件进行多重共线性检验，下表3为输出的结果： Table 3 影响因子 共线性统计 容许 VIF 流通A股 0.005 212.185 总股本 0.004 238.606 总市值 0.024 41.174 股东权益 0.016 62.108 市盈率 0.379 2.64 市净率 0.073 13.776 市销率 0.131 7.651 市现率 0.441 2.27 每股净资产 0.026 38.864 股息率 0.218 4.59 Alpha 0.039 25.404 Beta 0.09 11.063 Sharpe 0.131 7.608 Treynor 0.534 1.873 Jensen 0.079 12.662 可决系数 0.235 4.258 EPS 0.006 156.609 每股营业收入 0.121 8.235 每股息税折旧摊销前利润 0.009 112.911 ROE 0.061 16.396 ROA 0.028 36.207 销售净利率 0.192 5.201 ROIC 0.026 37.753 销售毛利率 0.147 6.794 净资产/营业总收入 0.011 94.02 息税前利润/营业总收入 0.015 64.638 经营活动净收益/利润总额 0.439 2.279 营业利润/利润总额 0.537 1.863 资产负债率 0.051 19.617 权益乘数 0.088 11.361 流动比率 0.051 19.552 速动比率 0.037 26.939 现金比率 0.069 14.413 总资产周转率 0.125 7.991 营业周期 0.059 17.023 每股收益同比增长率 0.375 2.668 净利润同比增长率 0.139 7.17 营业利润同比增长率 0.136 7.374 现金流量净额同比增长率 0.426 2.348 营业收入同比增长率 0.205 4.872 净资产同比增长率 0.19 5.257 成交量 0.213 4.701 换手率 0.313 3.198 MACD指数平滑异同平均 0.298 3.358 DMI趋向指标 0.4 2.499 RSI相对强弱指标 0.052 19.171 ROC变动速率 0.157 6.367 KDJ随机指标 0.103 9.668 OBV能量潮 0.209 4.779 STD标准差 0.036 27.471 预测PEG 0.464 2.157 预测净利润增长率 0.373 2.682 预测营业收入增长率 0.375 2.667 PSY情绪指标 0.207 4.82 BRAR人气意愿指标 0.209 4.795 表3. 共线性检验 由表3可见，最大方差膨胀因子为238.606远远大于10，认为这些因子之间的多重共线性比较严重，不能真实反映股票的收益率走向。因此，利用EKPCA算法模型进行降维处理，首先，找到最大通用熵对应的多项式核参数c和d分别是1和4，高斯核参数 θ 为8.2；然后，吴世农 [ 15 ] 等采用非回置式随机抽样方式确定上海股市适度的组合规模为21~30种股票，这一适度的组合规模可以较好地减少总风险，根据这一理论确定基本模式为30只股；最后，将这30只股票映射到高维空间进行特征抽取，对比两种核函数的特征抽取效率，发现多项式核函数只需抽取4个高效核主成分即可达到95%的方差贡献率，而高斯核函数需要抽取21个高效核主成分才能达到同样的效果，因此，本文采用多项式核函数建立核函数进行特征抽取。经过MATLAB 2016a程序输出结果如下： 图1. 方差贡献率直方图与累计贡献率折线图 图2. 特征值碎石图 由图1和图2可知选取前4个最大的特征值，它们的累计方差贡献率可以达到95%，具有较强的综合因子差异的能力。再对比EKPCA算法与KPCA算法的特征抽取时间，发现KPCA算法完成特征抽取平均需要0.1158秒，而EKPCA算法平均只需0.0154秒，这表明EKPCA算法确实提高了特征抽取效率。 将确定的30个基本模式对应的收益率与抽取的4个高效核主成分进行以收益率为因变量，高效核主成分为自变量的多元线性回归分析，预测基本模式的收益率。收益率的计算公式为 y = p 1 − p 0 p 0 其中， p 1 为当期收盘价， p 0 为前期收盘价，本文使用月收益率效果更好。通过SPSS 22.0输出回归结果如表4所示： Table 4 模型 非标准化系数 标准系数 t 显著性 共线性统计 B 标准错误 贝塔 容许 VIF 1 (常量) 6.722 2.038 3.298 0 高效核主成分1 −1.54E−07 0 −0.083 −0.432 0.027 0.996 1.004 高效核主成分2 3.82E−06 0 0.19 0.99 0.003 0.995 1.005 高效核主成分3 3.19E−06 0 0.152 0.793 0.73 0.996 1.004 高效核主成分4 −3.95E−06 0 −0.127 −0.664 0.872 0.996 1.004 表4. 多元线性回归的参数估计 根据方差分析表中F检验对应的P值(显著性)为0.012 < 0.05，说明至少有一个自变量能够有效预测因变量，回归模型具有实际应用价值。 再根据吴世农 [ 14 ] 等人的理论，本文选用收益率最高的前25只股票进行等权重分配的投资组合。投资组合结果如表5所示： Table 5 排名 证券代码 证券名称 1 603019.SH 中科曙光 2 603799.SH 华友钴业 3 600025.SH 华能水电 4 600298.SH 安琪酵母 5 601360.SH 三六零 6 600519.SH 贵州茅台 7 600977.SH 中国电影 8 600352.SH 浙江龙盛 9 600900.SH 长江电力 10 601933.SH 永辉超市 11 600516.SH 方大炭素 12 601985.SH 中国核电 13 600061.SH 国投资本 14 601233.SH XD桐昆股 15 600585.SH 海螺水泥 16 601828.SH 美凯龙 17 600177.SH 雅戈尔 18 600688.SH 上海石化 19 600158.SH 中体产业 20 600518.SH 康美药业 21 600643.SH 爱建集团 22 600705.SH 中航资本 23 600011.SH 华能国际 24 600028.SH 中国石化 25 600598.SH 北大荒 表5. 投资组合"
