"目的：通过meta分析分别研究组间昼夜收缩压、舒张压及其波动幅度的差异，了解系统血压的高低及其昼夜血压波动幅度对开角型青光眼发病的影响。方法：检索Cochrane library，Web of Science，PubMed， MEDLINE，CNKI和美国国立卫生研究院试验注册平台(www.clinicaltrials.gov)等数据库，查找自1990年5月起至2019年4月的关于POAG、NTG和血压波动的相关文献。通过STORBE statement观察性研究评价方法对文献进行评估，涉及315名参与者的5篇文献满足条件纳入分析。结果：开角型青光眼患者和对照组之间昼夜平均收缩压、舒张压差异不具有显著性，昼夜收缩压波动不具有显著性。青光眼患者的舒张压波动幅度(Z = 2.99, p = 0.003 < 0.05)高于对照组，差异有显著性，具有统计学意义。结论：昼夜舒张压波动与原发性开角型青光眼(Primary Open Angle Glaucoma, POAG)和正常眼压性青光眼(Normal Tension Glaucoma, NTG)密切相关，这被高度提示其为POAG和NTG的发病危险因素。 关键词 :开角型青光眼，正常眼压型青光眼，动态血压，血压波动，Meta分析 Copyright © 2019 by author(s) and Hans Publishers Inc. This work is licensed under the Creative Commons Attribution International License (CC BY). http://creativecommons.org/licenses/by/4.0/"
"作为以视野丧失和视神经受损为特征的疾病，青光眼是世界主要致盲疾病之一 [ 1 ] [ 2 ]。在房角开放性青光眼中，最常见的类型是原发性开角型青光眼(Primary Open Angle Glaucoma, POAG)和正常眼压性青光眼(Normal Tension Glaucoma, NTG)。尽管青光眼发病机理的假说仍存在争议，但已被明确的青光眼损害风险只有高眼压(Intraocular Pressure, IOP) [ 3 ]。POAG和NTG具有相似的疾病进展，二者均表现为进行性的视野丧失和视网膜神经纤维层变薄 [ 4 ]。区别在于，与POAG相比，NTG的IOP几乎不会超过21 mmHg [ 3 ]。这些现象表明，发生房角开放性青光眼损害不仅是高眼压的结果，还有其他尚未明确定义的因素。 年龄，种族，遗传因素，中央角膜变薄，近视和糖尿病 [ 5 ]，跨层板筛网压 [ 6 ] [ 7 ] [ 8 ]，血管功能障碍是青光眼患病和进展的危险因素 [ 9 ]。甚至有些研究认为，血压和IOP的调节可能存在共同或交叉的通路 [ 10 ]。血压(Blood Pressure, BP) 24小时内动态变化，可以反映循环系统的血管功能和同动力状态 [ 2 ] [ 11 ]。已有研究证明，血压波动是心脏，肾脏和大脑等多个终末器官损伤的危险因素 [ 12 ]。此外，青光眼的眼底损害与视盘(Optic Nerve Head, ONH)的眼血流量(Ocular Blood Flow, OBF)紊乱显著相关 [ 13 ]。其中ONH的营养可能取决于眼灌注压(Ocular perfusion pressure, OPP)，后者反映了平均动脉血压和IOP之间的差异。对于血压对青光眼眼底损害进展的影响研究逐渐受到重视，一些研究者认为较高的血压水平有促进POAG和NTG的发展的作用 [ 14 ]，但另一些研究者却则认为低水平血压才是POAG和NTG的发病机制 [ 15 ]。因此，我们旨在通过系统的回顾和meta分析来探究BP在POAG和NTG的病理过程中所起的作用。"
"对于此meta分析，我们搜索了Cochrane Library、Web of Science、PubMed、MEDLINE数据库以及clinial.gov临床实验注册网，以找1990年5月至2019年4月的到相关对照试验。有关搜索策略的详细信息，请参阅附录一。该研究无注册信息。 纳入标准和排除标准 1) 纳入标准 (1) 根据典型的青光眼眼底变化被、视野缺损和开放性前房角而IOP始终高于21 mmHg诊断为POAG，IOP始终低于21 mmHg患者诊断为而NTG； (2) 对照试验； (3) 独立的昼夜血压数据； (4) 独立的收缩压和舒张压数据； (5) 对测量动态血压的方式有详细说明。 2) 排除标准 (1) 资料不完整； (2) 不同种类的参数无法合并分析； (3) 二次研究。  两名研究者(LY，ZXH)独立选择研究，并根据“STROBE声明–观察研究报告中应包括的项目清单” [ 16 ] 评估了研究质量，其中有22项，每满足一项记为1分，15分及以上纳入研究。  两名研究者(LY，ZXH)从纳入的试验中提取了相关信息。识别的数据通过RevMan软件(版本5.2；Cochrane Collaboration，英国牛津)进行了分析。所有数据均为连续数据，采用倒差法进行分析。BP波动的均值和标准差结果计算方法如下 [ 17 ]。 Δ mean = mean daytime − mean nighttime SD mean = SD daytime 2 + SD nighttime 2 − 2 ρ ∗ SD daytime ∗ SD nighttime  我们采用了随机效应分析合并数据，包括效应量(Mean Deviation, MD)及其置信区间(Confidence Interval, CI)。所有数据均报告为平均值(mean) ± 标准差(SD)。森林图用来表示结果，其中线条代表不同研究的估计值，方框以图形表示每个研究的权重。"
"我们检索获得了510篇已发表的候选文献(见图1)。通过浏览标题和摘要排除了461项研究。此外，全文阅读后排除了44项研究，其中20项因缺失昼夜血压的独立数据，9项研究目的及设立结果不同不能合并，15项研究数据结果采用了不同的数据分析方法。符合所有标准的5项研究 [ 18 ] [ 19 ] [ 20 ] [ 21 ] [ 22 ] 被纳入本研究。 图1. 文献筛选流程图  共收集从1996年到2013年的5项研究，共包括315名受试者(见表1)。所有研究均为横断面研究。POAG、NTG和对照组之间在性别比和年龄上没有显着差异。如果研究间异质性较大则应用随机效应模型将合并研究结果。动态血压监测装置的版本来自原始文献。表2和表3列出了从纳入研究中收集和计算的各项数据。 Table 1 作者 年份 研究对象 样本量 性别比(男/女) 动态血压测量仪器 Mroczkowska, S. 2013 POAG 39 21/18 Cardiotens-01; Meditech Ltd Ramli, N 2013 NTG 127 61/66 NIblood pressure VS800 Plange, N 2006 NTG 79 34/45 SpacelabsMedical, Redmond, WA, USA Riccadonna, M 2003 POAG 30 10/20 TM-2421, A&D, LTD, Japan Meyer, J. H 1996 NTG 40 27/13 90207-32 monitor, Spacelabs 表1. 纳入文献的基本特征 POAG原发性开角型青光眼；NTG正常眼压性青光眼。  对于纳入的结果分析，只有POAG和NTG患者的昼夜舒张压(Diastolic Blood Pressure, DBP)波动显著高于阴性对照组(平均差异2.41，95%置信区间[CI] 0.08至4.0) (见图2)。POAG和NTG患者昼夜收缩压(systolic blood pressure, SBP)波动与对照组相比(MD 2.37，95%CI −0.99至5.74)没有显着差异(见图3)。此外，组间独立的日间及夜间SBP和DBP的结果不显著(见图4~7)。 敏感性分析显示，分别排除了研究中包含的任一研究，异质性始终存在，但先前的分析结果没有改变，两组之间昼夜DBP波动仍然存在显着差异(见附录二)。 Table 2 作者 发表年限 分组 日间 夜间 波动幅度 样本量 Mroczkowska, S. 2013 病例组 133.2 ± 18.86 115 ± 17.34 15.47 ± 4.31 19 对照组 125.3 ± 11.87 107.7 ± 7.4 17.6 ± 4.94 20 Ramli, N. 2013 病例组 135.78 ± 16.57 124.36 ± 18.98 11.44 ± 4.63 72 对照组 136.1 ± 25.4 131.84 ± 15.58 4.26 ± 10.66 55 Plange, N. 2006 病例组 131.8 ± 12.3 116 ± 11.2 15.8 ± 2.85 51 对照组 128.2 ± 15.3 111.2 ± 11.7 17 ± 4.68 28 Riccadonna, M. 2003 病例组 126.6 ± 9.1 104.7 ± 9.4 21.9 ± 2.09 13 对照组 123.4 ± 9.6 106.6 ± 7.2 16.8 ± 3.04 17 Meyer, J. H. 1996 病例组 129 ± 13.41 118 ± 14.75 11 ± 3.41 20 对照组 131 ± 12.07 123 ± 11.62 8 ± 4.56 20 表2. 昼夜收缩压波动数据 表内血压数据均报告为平均值(mean) ± 标准差(SD)。 Table 3 作者 发表年限 分组 日间 夜间 波动幅度 样本量 Mroczkowska, S. 2013 病例组 77.93 ± 12.49 62.09 ± 11.31 15.84 ± 4.34 19 对照组 73.69 ± 9.9 61.3 ± 6.1 12.29 ± 4.17 20 Ramli, N. 2013 病例组 78.5 ± 9.6 73.3 ± 8.64 13.4 ± 2.09 72 对照组 79.2 ± 7.6 76.24 ± 8.31 2.96 ± 1.91 55 Plange, N. 2006 病例组 82.4 ± 8.3 69 ± 8.6 15.99 ± 8.4 51 对照组 79.8 ± 9.3 63.9 ± 7.4 13.1 ± 1.31 28 Riccadonna,M. 2003 病例组 78 ± 5.9 64.9 ± 5.9 21.9 ± 2.09 13 对照组 76.3 ± 4.4 65.4 ± 6.4 10.9 ± 2.32 17 Meyer, J. H. 1996 病例组 79 ± 9.39 66 ± 10.28 13 ± 2.37 20 对照组 76 ± 9.8 68 ± 8 8 ± 2.68 20 表3. 昼夜舒张压波动数据 表内血压数据均报告为平均值(mean) ± 标准差(SD)。 图2. 病例组及对照组昼夜舒张波动存在统计学差异(Z = 2.96, P = 0.003) 图3. 病例组及对照组昼夜收缩压波动无显著差异(Z = 1.38, P = 0.17) 图4. 病例组及对照组日间收缩压无显著差异(Z = 1.34, P = 0.18) 图5. 病例组及对照组夜间收缩压无显著差异(Z = 0.19, P = 0.95) 图6. 病例组及对照组日间舒张压无显著差异(Z = 1.31, P=0.19) 图7. 病例组及对照组夜间舒张压无显著差异(Z = 0.08, P = 0.94)"
"青光眼的通常被认为是多种因素导致的视神经病变，而其中血管相关因素是可疑风险之一 [ 23 ]。24小时动态血压监测可以直接观察青光眼与血压波动之间的关系。血管功能是决定DBP水平的决定因素之一。这项meta分析的结果证明较大的昼夜舒张压波动是POAG和NTG发生的高风险因素。 在健康和高血压个体中已广泛观察到夜间血压降低程度约为日间血压水平的10%~20%。然而，越来越多的研究表明，过大的昼夜血压波动(超过20%的水平)是造成终末器官损害的危险因素 [ 24 ] [ 25 ]。近来实验证据表明血压波动对于而同属于终末器官ONH的损伤可能与NTG的发病机制有关 [ 26 ]。青光眼患者视盘血管可能更容易受到血压过度波动的影响，从而导致视盘出血(Optic Disc Hemorrhages, ODH)。视盘血管血流减少引起微循环障碍和青光眼性视盘损害 [ 26 ] [ 27 ]。Tokunaga的报道指出，在NTG和POAG中，夜间血液的非生理性减少(包括过大和最小的BP波动)与青光眼的进展有关 [ 15 ]。Lee等人的研究提到，与夜间血压无下移和低下移的NTG患者相比，血压过度下移(夜间血压的降低水平大约是日间平均血压水平的20%左右)的视野缺损的进展显著加快 [ 28 ]。越来越多的证据表明，青光眼患者合并存在血管功能障碍，这是引起昼夜DBP过度波动的原因 [ 29 ]。青光眼患者的眼底浅表血管复合物和视网膜血管丛密度均低于常人，因此更容易受到较大的血压波动的影响 [ 30 ]。Mitchell等人的研究个结果提示开角型青光眼(OAG)的眼底视网膜小动脉直径明显比正常人小，而正常眼压和高眼压青光眼之间的小动脉直径无显着差异 [ 30 ]。另一项超过14个月的随访研究提出表明POAG眼的黄斑血管密度损失明显快于健康人 [ 31 ]。 OPP是计算出的BP与IOP之差，可以用于衡量眼血流量大小 [ 29 ]。生理状态下，即使OPP发生了变化，但通过眼部自动调节(局部机制)可以使眼血流量保持在恒定水平 [ 32 ]。既往研究表明，青光眼患者对于急性OPP改变自身调节调节出现异常，导致眼部血流异常，继而引起视神经缺血 [ 33 ] [ 34 ]。据报道，NTG和POAG患者的视盘出血(ODH)发生率比正常人高 [ 34 ] [ 35 ]。一些研究暗示在随访期间ODH的检测可能与某些NTG患者的夜间血压异常波动有关，ODH可能与NTG患者的视觉缺陷有关 [ 36 ]。由于ONH的实际血流不能直接测量，在临床研究中一直使用OPP对其进行测量 [ 2 ]。可以假设，由于BP与OPP之间的密切关系，BP波动幅度的增加可能引起了OPP变异性或波动性的增加，这对ONH的血流量有一定影响 [ 37 ]。随访期间检测ODH发生率是前瞻性研究中观察视野缺损进展(Visual Defect Progression, VDP)的有效预测指标 [ 38 ]。 此外，最近的一项研究表明，NTG患者在5年进展期，其BP和OPP的舒张参数均显著降低，这使研究者认为夜间DOPP降低是NTG患者青光眼视野进展的独立预测因素 [ 27 ]。Topouzis等已经证明，由抗高血压治疗引起的DBP大幅波动也与无青光眼患者的视杯扩大和视盘边缘减少有关 [ 39 ]。这种相互作用表明，控制高血压病史引起的血压波动可能会促进青光眼神经病的进展，这使临床相关治疗陷入了窘境 [ 40 ]。因此，需要进行更多的前瞻性研究来探究明确血压波动幅度和时间与ODH、VDP之间相互作用的关系。我们可以更多地关注不同程度的血压下降与青光眼神经病变之间的关系，以及血压波动是否与VDP有关，以及动态血压监测设备在青光眼的早期发现和早期治疗中的临床应用。 我们的研究中也存在一些局限性。首先，问题来自文献本身，大多数相关研究是横断面研究，其可靠性不如队列研究和随机对照试验。其次，检索出研究中参数和数据分析方法千差万别，以至于我们难以提取适当的数据。第三，目前的文献缺乏对于ODH如何影响视野丧失进展的特定机制的研究。此外，我们的研究仅发现舒张压波动对POAG和NTG有积极作用，而SBP波动的作用尚不清楚，这需要更多的实验来证明。 综上，根据我们的综述和meta分析，舒张压波动被证实与POAG和NTG显着相关，这表明舒张压波动是其中的高风险因素。因此，动态血压监测应广泛应用于眼科实践中的监测，尤其是对于那些怀疑有POAG和NTG的受试者。一旦舒张压血压波动异常增加，还可以对视网膜神经纤维层进行光学相干断层扫描、视野和IOP检查、以明确诊断POAG和NTG。"
"本文采用meta分析的方式检索了1990年5月至2019年4月的到相关对照试验，对符合目的的文献筛选整理合并后获得了血压与青光眼疾病发生之间联系的统计结果，其中昼夜舒张压波动与POAG和NTG的发展密切相关，这高度提示昼夜舒张压波动为POAG和NTG的发病危险因素。此前的相关研究均针对青光眼患者个体，研究间存在一定差异致使二者关系仍存在争议，本文将符合要求的文献进行合并，为研究血压和青光眼之间的相关性提供统计学数据。"
