"本试验目的在评估液态发酵樟芝菌丝体粉末之免疫调节功能，依照卫生福利部公告的《健康食品免疫调节功能评估方法》，以喂管喂食BALB/c小鼠模式，藉由小鼠体重、抗体、细胞激素、吞噬细胞活性、自然杀手活性等等测试与分析，以进行评估。将雌性BALB/c小鼠随机分成4组，分为控制组及三液态发酵樟芝菌丝体粉末剂量组；三剂量组分别相当于成人每日液态发酵樟芝菌丝体粉末建议剂量的0.5倍(0.5XAc, 1890 mg/day/kg)、1倍(1XAc, 3780 mg/day/kg)和2倍(2XAc, 7560 mg/day/kg)。并使用卵白蛋白(ovalbumin, ova)诱发特异性免疫反应。结果显示，对照组与各剂量组小鼠的体重没有显著差异，显示液态发酵樟芝菌丝体粉末对于小鼠生长均无不良的影响。观察脾脏中淋巴细胞数目消长，发现三测试剂量均不影响MHC I、MHC II、T及B细胞次群之比率，显示在测试剂量范围内，液态发酵樟芝菌丝体粉末对于小鼠脾脏淋巴细胞次群无异常的影响。在非特异性免疫反应方面，液态发酵樟芝菌丝体粉末可显著活化自然杀手细胞，促进IgM抗体早期生成，提升脾脏T淋巴细胞的增生，同时能促进脾脏细胞自发性IL-2及IFN-γ的分泌。至于特异免疫反应方面，液态发酵樟芝菌丝体粉末对ova特异淋巴细胞之增生有提升的作用，以及明显的提升脾脏ova特异性淋巴细胞分泌IL-2和IFN-γ的分泌，并可显著的抑制脾脏ova特异性淋巴细胞分泌IL-4。综上所述，液态发酵樟芝菌丝体粉末具有活化自然杀手细胞，促进淋巴细胞增生，调节细胞激素分泌，倾向于增加Th1免疫反应的表现。 关键词 :樟芝，菌丝体，液态发酵，非特异性免疫，特异性免疫，卵白蛋白 Copyright © 2020 by author(s) and Hans Publishers Inc. This work is licensed under the Creative Commons Attribution International License (CC BY). http://creativecommons.org/licenses/by/4.0/"
"樟芝(Antrodia cinnamomea)是台湾特有的真菌之一，被认为具有调节免疫、保护肝脏的功能 [ 1 ]。樟芝主要寄生在牛樟树，而牛樟树是台湾特有的树木之一，因此樟芝被认为是台湾国宝级的真菌。但牛樟树生长速度缓慢，且遭遇人工滥伐，进而造成野生樟芝子实体面临被灭绝的危险之中 [ 2 ]。近年来已发展出人工培育樟芝的方法，其中深层发酵是一种快速、清洁卫生、可控制质量的生产方法，并可透过调控发酵条件以产生特定活性物质。樟芝所含的生理活性也逐渐明朗，包括抗发炎、抗癌、增强免疫能力及保护肝脏等功能，深具研究及商业开发价值 [ 3 ]。免疫系统为生物体重要的防御系统，当外来病菌突破皮肤、消化道和呼吸道黏膜部份等第一道防线而进入人体时 [ 4 ]，免疫系统随即启动，包括分泌细胞激素、吞噬作用(phagocytosis)、自然杀手细胞毒杀作用(cytotoxity)及发炎反应(inflammation)等 [ 5 ]，此即为先天性免疫(innate immunity)。由于其并非针对特定致病微生物的，故又称为一般性、非特异性的免疫(nonspecific immunity)。身体的第二道免疫防御机制是以T细胞为主的细胞性免疫反应(cell-mediated immunity)及以B细胞为主的体液性免疫，为后天性免疫反应(adaptive immune response)或特异性免疫(specific immunity) [ 6 ]。靠免疫系统抵御外来病菌侵入，是维持健康的第一道防线，免疫功能失调不仅会降低体内对外界之抵抗力，也容易导致疾病的发生，或是推迟罹病痊愈的时间。本研究依照卫生福利部公告的《健康食品免疫调节功能评估方法》 [ 7 ]，针对樟芝液态发酵菌丝体粉末(简称樟芝菌丝体，Ac)的特异性及非特异性免疫功能进行免疫调节功能的评估。"
"樟芝(A. cinnamomea) (BCRC 35398)菌种购自台湾新竹市食品工业发展研究所生物资源保存及研究中心。在生物安全柜中，将PDA平板上长好的樟芝菌丝，取0.5 cm大小正方的菌块，接种入2 L三角瓶中(内含1 L液体培养基)，于25℃、100 rpm中震荡培养2周，后接种入500公升级发酵槽，在90 rpm的搅拌，0.5 vvm的通气量、25℃中培养7天，再接种入50吨级发酵槽，以50 rpm的搅拌，0.5 vvm的通气量、25℃中继续培养14天后，得樟芝菌丝体发酵液；经冷冻干燥、磨粉后得樟芝菌丝体发酵全液冻干粉。液体培养基组成：1.0%葡萄糖、0.5%黄豆粉、0.5%蛋白胨、0.3% (NH 4 ) 2 SO 4 、0.1% MgSO 4 ∙7H 2 O。  七周龄、雌性BALB/c小鼠 [ 8 ] [ 9 ] [ 10 ] 购自乐斯科生物科技(BioLASCO Taiwan Co., Ltd. Taipei, Taiwan)；饲养条件为23 ± 2℃、50 ± 10%相对湿度、12小时光照/黑暗交替、饲料饮水不限制；本实验设计经食品工业发展研究所(新竹，台湾)动物实验管理小组审核通过(动管字第93-033号)，并根据动物使用方案进行研究。  使用同一组小鼠进行非特异性免疫反应与特异性免疫反应试验。将动物随机分成4组，并根据给予物质种类或剂量，分为一个对照组(n = 10)，及三组樟芝菌丝体剂量组(n = 12)；三剂量组分别相当于成人每日樟芝菌丝体建议剂量的0.5倍(0.5XAc, 1890 mg/day/kg)、1倍(1XAc, 3780 mg/day/kg)和2倍(2XAc, 7560 mg/day/kg)。采用胃管口服给予喂食。以卵白蛋白(ovalbumin, ova)作为特异性免疫反应用之抗原，采皮下注射抗原的模式进行，以Freund’s adjuvant作为佐剂：第一次使用complete adjuvant，其后使用incomplete adjuvant。在管喂1周后以腹腔注射方式给予2 μg ova诱导小鼠；在第6及第8周时，施以皮下注射10 μg ova刺激小鼠。在第3、7及9周时进行尾部采血收集血清，第10周牺牲，采血、取腹水及脾脏已进行免疫反应相关指标之检测。  每管加入1 × 10 6 个脾脏细胞，分别加入不同的荧光抗体，(FITC/PEisotype controls, α-H2Kd FITC, α-I-A FITC, α-CD3 FITC/α-CD19 PE)结合到细胞表面分子后，以流式细胞仪对淋巴细胞亚群(MHC I/II，T与B)做进一步的分析。  利用Phagotest kit (ORPENGEN Pharma, Heidelberg, Germany, catalog number: 3884)检测血液中吞噬细胞的吞噬活性。将上述100 ml抗凝之全血与20 ml opsonized FITC-labelled E. coli混合，置于37℃水浴槽(实验组)或冰上(阴性对照组)作用10分钟，然后置于冰上以终止吞噬作用，加入100 ml ice-cold quenching solution，混合均匀。离心、清洗。加入200 ml之DNA staining solution，置于冰上，避光反应10分钟，而后在60分钟内以流式细胞仪进行分析。吞噬作用活性(%) = 实验组之吞噬作用(%) − 阴性对照组之吞噬作用(%)。 2.6. 自然杀手细胞毒杀试验 [ 11 ] 用10 ml RPMI 1640培养基冲洗腹膜腔，并将流洗液以300×g离心10分钟。将制备的细胞重新悬浮于RPMI 1640培养基中，铺板，37℃培养1小时，洗涤3次，除去未贴附之细胞。再透过LIVE/DEAD Cell-Mediated Cytotoxicity Kit (Molecular Probes, USA)测定分离于腹腔巨噬细胞的自然杀手细胞毒杀目标细胞(Yac-1)的能力。  抗凝之全血保存于4℃，以sandwich ELISA kits (Bethyl, Montgomery, USA)测定其中所含IgM、IgG总抗体及ova特异性IgM、IgG抗体的浓度。  取约4 × 10 6 cells/ml脾脏细胞悬浮液，加入96孔盘(0.1 ml/well)中，再分别依据非特异性免疫反应或特异性免疫反应，在含有添加10% FBS、2 mM L-glutamine和抗生素的RPMI 1640培养液中，分别加入最终浓度为10 μg/ml的洋刀豆血球凝集素(concanavalin A, ConA)、或50 μg/ml的脂多醣(lipopolysaccharide, LPS)、100或200 μg/ml的ova，以5% CO 2 、37℃培养72小时；之后，在各孔盘中加入20 μl过滤后的MTT溶剂(5 mg/ml)，于37℃下放置4小时；再加入DMSO萃取，测定O.D. 570 nm吸光值。增生指数(stimulation index)计算公式 [ 12 ] 为(A 570nm treatment − A 570nm medium control)/(A 570nm cell only − A 570nm medium control)。  取约4 × 10 5 cells/well从脾脏分离得的淋巴细胞，分别依据非特异性免疫反应或特异性免疫反应，在1 ml培养基中分别加入ConA (5 μg/mL)或ova (100及200 μg/mL)，培养24小时至48小时；收集细胞上清液并保存于−20℃，以供测定细胞激素使用。利用sandwich-ELISA法测试lL-2、IFN-γ、IL-4及IL-5的含量。 2.10. 数据整理与分析 [ 13 ] 试验结果是以平均值 ± 标准误差(Mean ± SD)表示。数据以One-way ANOVA单因子变异数进行检定，再以Dunnett’s t-test来检定各组组间之差异性比较，*表示组间具有显著性的差异(p < 0.05)。"
"本研究旨在评估液态发酵所得之樟芝菌丝体粉末对于免疫系统的影响。参考卫生福利部公告的《健康食品免疫调节功能评估方法》，利用管喂方式喂食BALB/c小鼠樟芝菌丝体，藉由分析脾脏细胞增生反应、脾脏细胞细胞激素分泌量、自然杀手细胞活性、吞噬细胞活性及抗体分泌量，评估非特异性免疫反应之影响；并以皮下注射ova致敏小鼠，藉由分析ova特异性抗体、ova特异性脾脏细胞增生反应及ova特异性细胞激素的分泌，评估特异性免疫反应的影响。  在试验期间，经8周的管喂，在小鼠生长情况方面，对照组及樟芝菌丝体各剂量组小鼠的体重无显著差异(图1)，显示樟芝菌丝体具安全可食用性。 图1. 试验期间对BALB/c小鼠平均体重之影响  以细胞表面特定抗原分析，观察脾脏中淋巴细胞次群所占百分比的影响，于喂食樟芝菌丝体的各剂量组的期间，对于小鼠脾脏中MHC I、MHC II、T及B淋巴数量之比率皆无明显差异(图2)，显示喂食樟芝菌丝体对于ova致敏BALB/c小鼠脾脏中各类淋巴细胞次群所占百分比无影响。 图2. 试验期间樟芝菌丝体对BALB/c小鼠脾脏淋巴细胞分型的影响  取全血以ORPENGEN Pharma之Phagotest Kit，利用吞噬荧光标示之大肠杆菌的能力，进行血液中吞噬细胞之活性分析(图3)；结果显示(图4)，实验组与对照组间无差异。 图3. 吞噬试验结果示意图 图4. 试验期间樟芝菌丝体对BALB/c小鼠血液吞噬细胞吞噬作用的影响  利用DIOC18标示之Yac-1细胞作为目标细胞，以目标细胞：腹腔细胞 = 1:200之比率混合，作用4小时，以流式细胞仪进行分析，检测腹腔细胞中自然杀手细胞毒杀Yac-1的能力；由(图5)可知喂食2XAc剂量的小鼠，其腹腔中自然杀手细胞之活性非常显着地高于对照组(p < 0.01)。 图5. 试验期间樟芝菌丝体对BALB/c小鼠自然杀手细胞毒杀作用的影响  于第一次免疫后，三剂量组均可非常显着地提升小鼠血中非特异性抗体IgM含量(p < 0.01) (表1)；不过，随着追加免疫，各组间之total IgM或total IgG含量及无明显差异。 Table 1 Control (n = 8) 0.5X (n = 8) 1X (n = 10) 2X (n = 9) Total IgG (μg/mL) 1st 365.8 ± 97.5 366.1 ± 124.3 401.5 ± 123.5 390.2 ± 132.7 2nd 559.4 ± 149.0 578.8 ± 124.3 559.3 ± 142.8 543.1 ± 103.5 3rd 695.3 ± 134.1 773.5 ± 223.9 680.8 ± 265.8 661.9 ± 173.9 Total IgM (μg/mL) 1st 330.2 ± 87.5 529.4 ± 90.4** 551.3 ± 113.5** 586.6 ± 99.5** 2nd 464.0 ± 136.9 413.9 ± 114.8 400.9 ± 119.3 455.5 ± 85.0 3rd 482.9 ± 113.9 507.1 ± 99.1 500.6 ± 111.8 472.1 ± 85.7 Anti-ova IgG (relative unit × 10 3 /mL) 1st 0.76 ± 0.39 0.78 ± 0.39 0.85 ± 0.53 0.82 ± 0.46 2nd 48.9 ± 25.0 53.3 ± 35.9 60.7 ± 33.3 48.9 ± 11.7 3rd 86.2 ± 20.1 103.2 ± 42.0 83.2 ± 43.2 80.3 ± 33.0 Anti-ova IgM (relative unit × 10 3 /mL) 1st 0.21 ± 0.04 0.23 ± 0.05 0.20 ± 0.04 0.22 ± 0.06 2nd 0.45 ± 0.08 0.42 ± 0.06 0.44 ± 0.06 0.44 ± 0.04 3rd 0.88 ± 0.13 0.87 ± 0.14 0.85 ± 0.12 0.86 ± 0.12 表1. 试验期间樟芝菌丝体对BALB/c小鼠血清抗体含量的影响 Results are presented as mean ± SD (n = 8 - 10); 1st, 2nd, and 3rd indicated after first ova immunization and second and third boost, respectively; *and **represent p < 0.05 and p < 0.01, respectively (Student’s t-test).  以MTT法进行分析小鼠脾脏淋巴细胞增生反应的影响，结果显示，于ConA刺激下，0.5XAc可显着地促进脾脏T淋巴细胞的增生(图6)，较高剂量的1XAc和2XAc则可能因变异较大，因此与对照组间无统计上的差异性。三剂量组间彼此无显着差异。而以特异性抗原ova作为刺激物，与脾脏细胞共同培养，发现1XAc和2XAc剂量可使小鼠脾脏中对ova抗原具有特异性的免疫细胞明显增生。 图6. 试验期间樟芝菌丝体对BALB/c小鼠脾脏淋巴细胞增生的影响  脾脏细胞于自发状况、ConA、LPS或特异性抗原ova刺激下，于5% CO 2 、37℃下培养24或48小时后，收集上清液，分别检测Th1细胞激素IL-2、INF-γ，及Th2细胞激素IL-4、IL-5之分泌量。由表2可知，喂食0.5XAc、1XAc或2XAc剂量之小鼠可显著地提升自发性IL-2及INF-γ的分泌，1XAc及2XAc剂量皆可促进ova特异性IL-2、INF-γ的分泌，2XAc剂量并可促进于ConA刺激下之IL-2、INF-γ的分泌。喂食0.5XAc、1XAc或2XAc剂量之小鼠可使特异性IL-4之分泌量显著降低，对于其他自发性或ConA刺激下Th2细胞激素的分泌量则无影响。"
"本试验参照卫生福利部《健康食品免疫调节功能评估方法》，以ova免疫BALB/c小鼠，藉由小鼠体重、抗体、细胞激素、吞噬细胞活性、自然杀手活性等等测试与分析，评估液态发酵所得之樟芝菌丝体粉末对于免疫系统的影响。  在非特异性免疫功能方面，主要测试颗粒性球与单核球的吞噬能力或是自然杀手细胞的活性，在免疫反应中，吞噬细胞的活化是人体防御系统的第一防线，而对于肿瘤与受病毒感染的细胞，主要还是由自然杀手细胞透过非特异性免疫的结合来对抗 [ 14 ]，在先前的研究中指出，饮食的改变可以显著的影响自然杀手细胞的活性 [ 15 ] ；结果显示，如图5，2XAc剂量组之自然杀手细胞毒杀活性显著高于对照组(p < 0.01)，对于血液吞噬细胞吞噬能力则无作用(图4)；虽然对吞噬细胞能力的活化并无显着差异，但在2XAc剂量组可以显着增加自然杀手细胞的活性。血清抗体的生成影响方面，喂食樟芝菌丝体可以明显地提升 Table 2 Control (n = 8) 0.5X (n = 8) 1X (n = 10) 2X (n = 9) IL-2 (pg/mL) cell only 11.7 ± 4.4 21.8 ± 6.1** 16.5 ± 4.5* 18.4 ± 8.8* ConA 1017.4 ± 159.3 1019.9 ± 204.7 1107.7 ± 239.2 1685.5 ± 212.4** ova 100 168.1 ± 45.5 209.7 ± 109.3 272.5 ± 67.2** 252.0 ± 76.9* ova 200 211.2 ± 70.0 277.5 ± 123.6 258.9 ± 109.1 266.0 ± 91.2 IFN-γ (pg/mL) cell only 2.11 ± 1.97 6.53 ± 5.26** 7.34 ± 5.47** 12.12 ± 4.10** ConA 127.8 ± 50.1 160.9 ± 53.8 163.8 ± 62.7 418.1 ± 205.1** ova 100 329.6 ± 22.0 381.4 ± 131.7 469.9 ± 162.4* 494.8 ± 170.5* ova 200 420.9 ± 80.1 442.7 ± 132.0 537.9 ± 142.7* 686.4 ± 138.8** IL-4 (pg/mL) cell only 0.0 ± 0.0 0.0 ± 0.0 0.0 ± 0.0 0.0 ± 0.0 ConA 321.3 ± 113.2 354.0 ± 107.6 365.9 ± 91.1 370.7 ± 88.1 ova 100 4.20 ± 1.93 2.50 ± 1.94* 2.58 ± 1.93* 0.59 ± 0.91** ova 200 2.20 ± 1.58 2.68 ± 1.59 3.59 ± 1.15 1.08 ± 1.20* IL-5 (pg/mL) cell only 0.0 ± 0.0 0.0 ± 0.0 0.0 ± 0.0 0.0 ± 0.0 ConA 79.3 ± 30.1 52.6 ± 17.2* 76.1 ± 35.5 79.4 ± 30.6 ova 100 47.0 ± 30.6 27.5 ± 11.7 28.6 ± 11.5 41.4 ± 17.5 ova 200 58.8 ± 20.5 41.3 ± 15.6 53.1 ± 18.4 59.0 ± 16.8 表2. 试验期间樟芝菌丝体对BALB/c小鼠脾脏细胞激素分泌量的影响 Results are presented as mean ± SD (n = 8 - 10); 1X stands for 1-fold dose of Ac which was set at 180 g/pack/day/60-kg person, or 9.675 mg/20-g mouse; * and ** represent p < 0.05 and <0.01, respectively (Student’s t-test). 早期阶段的非特异性血清IgM抗体生成量(p < 0.01) (表1)；在初期即显著性的增加IgM的含量，但在中后期则未达到明显差异，推测樟芝菌丝体能够快速地提升血清中抗体，并增加其数量，以抵御外来抗原入侵。在脾脏细胞增生能力方面，低剂量(0.5X)的樟芝菌丝体可以促进脾脏细胞T淋巴细胞在ConA刺激下的增生能力(p < 0.05)，高剂量(1XAc及2XAc)则未达统计上的显著差异(图6)。使用裂殖素LPS刺激时，并无显著性差异，表示对脾脏细胞中的B淋巴细胞没有增生作用，但在ConA的刺激下，0.5XAc剂量组相对于对照组具有显著性的差异，表示具有提升脾脏细胞中T淋巴细胞的增生能力。T淋巴细胞具有多种形态及功能，Th1 (cell-mediated immunity)可与单核吞噬细胞交互作用并帮助消灭病原，Th2 (cell-mediated immunity)可协助B细胞分裂、分化及制造抗体；过去研究指出，当身体处于压力状态下，体内的免疫反应会从Th1转成以Th2为主 [ 16 ]，而过度抑制Th1细胞免疫功能，将造成致死率徒增 [ 17 ] [ 18 ]，唯有身体内Th1及Th2相互作用维持平衡，才能共同维护身体免外来者的入侵 [ 19 ]。在脾脏细胞细胞激素之分泌量，测试Th1细胞激素IFN-γ & IL-2，Th2细胞激素IL-4 & IL-5 [ 20 ]，如表2所示，当未添加任何裂殖素时，喂食樟芝菌丝体可显著增加了Th1细胞激素IL-2和IFN-γ的量，2XAc剂量并可提升ConA刺激下的IL-2和IFN-γ的分泌量(p < 0.05)。由非特异性免疫反应细胞激素分泌量之结果可知，樟芝菌丝体可促进Th1细胞激素IFN-γ & IL-2的分泌，IFN-γ & IL-2具有活化毒杀型T细胞、自然杀手细胞和B细胞的作用 [ 21 ] [ 22 ]，推测喂食樟芝菌丝体的小鼠，其脾脏细胞IFN-γ & IL-2分泌量升高可能因此进而影响自然杀手细胞的活性。  特异性免疫反应是以ova作为特定的抗原，仿真病毒、微生物或外来物质感染的模式，在血清抗体生成的影响方面，特异性血清抗体anti-ova IgG的量在第二次致敏之后大幅的增加，不过喂食樟芝菌丝体并无法进一步促进雌性BALB/c小鼠之特异性血清抗体生成(表1)。在脾脏细胞增生能力方面，ova主要是刺激抗原专一性T细胞的活性，试验结果发现，如图6所示，在ova刺激脾脏细胞增生能力的影响中，在1XAc及2XAc剂量组具有显著性的提升(p < 0.05)，说明樟芝菌丝体具有刺激特异性免疫细胞的增生作用。在脾脏细胞ova特异性细胞激素之分泌量，测试Th1细胞激素IFN-γ &IL-2，Th2细胞激素IL-4 &IL-5；结果显示，1XAc及2XAc剂量组的IL-2和IFN-γ生成量皆显著地增加，而其IL-4量则是减少的(p < 0.05) (表2)。"
"综合以上，皆证实樟芝菌丝体具有免疫调节功能。BALB/c小鼠经过8周喂食0.5倍、1倍及2倍剂量的樟芝菌丝体后，在非特异性免疫方面可增加自然杀手细胞活性及抗原IgM初期含量，以ConA刺激后可提升脾脏细胞的增生能力，并促进Th1细胞激素IFN-γ & IL-2的分泌；特异性免疫方面则是在ova的刺激下，可使Th1细胞激素中IFN-γ &IL-2的分泌量显著提高，且可降低Th2细胞激素IL-4的含量。先前研究显示，当生物体受到了病毒、微生物或外来物质侵害感染时，抗原呈现细胞及巨噬细胞等免疫细胞就会被活化，并使体内的免疫反应倾向于Th1免疫反应 [ 23 ] [ 24 ]，本研究在经过非特异性及特异性的免疫反应结果中得知，樟芝菌丝体是倾向于增加Th1免疫反应的表现。"
