"作为一种脑功能成像新方法，近红外光光谱分析仪(Near-infrared spectroscopy, NIRS)越来越多地应用于脑功能性疾病发病机制的研究。目前NIRS主要应用于抑郁症、精神分裂症、惊恐障碍、进食障碍等疾病的前额叶血液动力学检测。但是在中西医结合诊断治疗抑郁症方面的近红外研究开展得较少。本文分别论述抑郁症中医及西医诊治的近红外相关研究进展，总结NIRS现阶段应用在抑郁症(郁病)的优点及不足，并探究NIRS作为中西医结合辅助诊断和治疗抑郁症(郁病)新手段的可能性和应用前景。 关键词 :NIRS，抑郁症，中西医结合，郁病 Copyright © 2020 by author(s) and Hans Publishers Inc. This work is licensed under the Creative Commons Attribution International License (CC BY 4.0). http://creativecommons.org/licenses/by/4.0/"
"抑郁症是一种常见的情感性精神障碍，其核心特征包括情绪低落、快感缺乏、动机缺乏等(Andrade, Nelson, & Fink, 2003; Cooper, Arulpragasam, & Treadway, 2018; Insel, 2009; Kendler, Neale, Kessler, Heath, & Eaves, 1992)，伴有认知功能缺损(杜巧荣，王彦芳，李素萍，张克让，2014；张颖，李刚，刘丽荣，王若梅，2018)，且抑郁程度越高认知损害越严重，生活质量越差(许敬敬，2013)。而该病患病率较高，根据世界卫生组织的统计，全世界范围内约有3.5亿人患病，并且反复发作，持续多年，给家庭和社会造成沉重的负担(Smith, 2014)。诊断标准有CCMD-3、ICD-10、DSM-IV等。 抑郁症属于中医郁病范畴(张琳园，许凤全，2012)，是由于情志不舒、气机郁滞所致，以心情抑郁、情绪不宁、胸部满闷、胁肋胀痛，或易怒易哭，或咽中如有异物梗塞等症为主要临床表现的一类病证。治宜辨证施治，证型不同，临床表现各有特色，治疗也各有特点。如李杰根据五脏化生紊失常导致五脏病变的因果关系将抑郁按照五脏分型法(李杰，2002)分为5型进行辨证施治；而尹冬青等针对临床的150条中医四诊信息进行降维处理提取证候要素，采用偏相关的方法，对所获得的证候要素进行相关分析，对相关系数在0~1范围内的证候要素进行应证组合并结合专家经验共获得中医证型6个(尹冬青，2013；尹冬青，田金洲，时晶，苗迎春，贾竑晓，2015)，指导临床辨证施治。目前中医药管理局将郁病纳入临床路径的有五型(高新军，2011)，根据证型指导临床规范化治疗。"
"近红外技术基于近红外光对人体组织的一定的穿透性和人体组织对血红蛋白的选择性吸收。最主要的应用于脑功能的研究。当大脑受刺激时，近红外光谱能在体测量大脑额叶血流量变化，进而可用于脑功能参数的测量。使用近红外进行脑功能成像时，一些光纤头固定在研究对象的头皮上，光束透过颅骨由组织产生光散射后，一些光束射出，由距光源几公分远的光学传感器检测并在计算机上成像。尽管近红外光谱(Doi, Nishitani, & Shinohara, 2013)的空间和时间分辨率相对较低，但与其他侵入性或者非侵入性的神经激活测量方法相比，近红外研究过程中，受试者保持相对自然状态，且此方法具有无伤害、非介入、实时连续、快速、无污染等突出的优点，因而受到国际神经生物学界的广泛重视，被认为是对功能性磁共振成像(FMRI)、正电子发射断层扫描(PET)等方法的重要补充。NIRS的独特特性使其有潜力成为研究前额叶皮层在情绪处理中的作用的工具(Doi et al., 2013)。目前近红外已被广泛运用于各种研究，如阿尔茨海默症(Zhu et al., 2017)、抑郁脑卒中(李泓钰，等，2018)、脑外伤(Morries, Cassano, & Henderson, 2015)等脑功能疾病的研究等等。"
"目前，有研究者将近红外脑功能检测被作为反应患者额叶区功能恢复情况一检测手段。如有人采用言流畅性测试(VFT)任务，对30名抑郁患者进行了在电休克(ECT)治疗前后的近红外光谱(NIRS)检测，以及对108名健康对照组进行了言流畅性测试(VFT)任务近红外光谱(NIRS)检测，发现额叶区对认知任务的异常功能反应的恢复可能与ECT治疗抑郁症的急性疗效有关(Hirano et al., 2017)。 有研究者将近红外脑功能检测作为鉴别早期晚期抑郁的一检查手段。如有研究者运用多通道近红外光谱(NIRS)，对早期抑郁及晚期抑郁进行近红外脑功能成像检测，发现晚期抑郁(LOD)左侧前额叶和颞叶区域的功能激活减弱，从而区分晚期抑郁(LOD)和早期抑郁(EOD) (Yanagata et al., 2008)。 还有研究者将近红外脑功能检测作为监测反应抑郁患者社会功能自我评价情况的检测手段。如Pu等招募了24名晚期抑郁(LOD)受试者和30名年龄和性别匹配的健康受试者，使用52通道近红外光谱技术(NIRS)测量了语言流畅性任务(verbal fluent task, VFT)过程中前额叶和颞上皮层表面积血红蛋白浓度的变化，发现晚期抑郁(LOD)患者前额叶和颞上皮层的广泛区域的激活较少，额极区激活减少与患者群体社会功能自我评价得分降低有显著正相关(Pu et al., 2008)。 还有研究者将近红外光作为抑郁治疗的手段。如有研究者利用红光和近红外光(NIR)进行光生物调节(PBM) (也称为低强度光疗法：是一种低风险、廉价的治疗方法，以非视网膜暴露为基础)治疗重度抑郁症(MDD) (Caldieraro & Cassano, 2019)，发现非视网膜PBM有作为一种新的MDD治疗方法的潜力。 还有研究者将近红外脑功能检测作为检测卒中后抑郁(PSD)脑功能情况的检测工具。如李泓钰开展近红外脑功能成像对卒中后抑郁神经机制的研究，观察卒中后抑郁(PSD)患者在认知加工期间前额叶氧合血红蛋白(Oxy-Hb)相对浓度变化值，探讨PSD的神经机制和工作记忆功能变化。发现PSD患者在负性情绪面孔图片呈现后，前额叶激活程度降低，左侧前额叶工作记忆功能受损，前额叶有氧代谢功能失调(李泓钰，等，2018)等。"
"中医郁病近红外研究较少，目前有研究者发现近红外脑功能检测可被作为监测针灸治疗疗效的手段。如苗萌萌等开展基于近红外脑功能检测研究针灸对重性抑郁障碍患者前额叶皮质的影响，发现针灸和西药来士普两种治疗方法均可改善患者的抑郁症状，与口服西药相比，针灸治疗抑郁障碍的不良反应少；抑郁障碍患者的病情变化与前额叶的血氧饱和水平密切相关；经过针灸和西药治疗，患者对不同的情绪的调控均有所提升(苗萌萌，2016)。 综上，在郁病的研究方面，前人做了一些研究工作，取得了一定的成果。但仍存在许多不足：1) 中医现有的相关诊断标准多是根据一些专家的经验产生，西医抑郁症也是根据病史采集做临床诊断，其诊断过程依靠精神科医生对患者的既往史和现病史的问诊或者中医的望闻问切。临床检查缺乏客观、有效的脑功能成像辅助识别与诊断技术，疾病的早期识别、诊断和治疗受到影响。2) 缺乏中西医结合临床路径治疗疗效与西医临床路径治疗疗效的对比研究。3) 缺乏反映郁病治疗疗效的中西医结合的临床影像学指标。"
"目前由于郁病辨证分型多样，开展基于近红外技术郁病的中西医结合研究极具挑战而鲜少研究，并且开展关于郁病中西医结合临床路径诊断治疗及疗效评价研究也更无人开展，不利于中西医结合及祖国医学发展。将来有望开展考察患者进行中西医结合临床路径诊疗方案治疗与单纯西医治疗前后的临床疗效及近红外波形图谱改变，为中西医结合诊疗方案提供实证依据及影像学指标，指导郁病(抑郁症)中西医结合规范化临床治疗。将中西医结合起来，促进祖国医学发展及中西医医学技术融合。为优化中医郁病诊断及中西医结合规范化诊治(治疗方案及疗效评价方案)提供一个新思路。"
