"本研究以MDCK犬肾上皮感染H1N1流感病毒模式，评估液态发酵虎乳灵芝(Lignosus rhinocerus)菌丝体萃取物之抗A型流感病毒(H1N1)能力，其中使用MTS法测定病毒或萃取物对宿主细胞之毒杀性，再依药物与病毒作用时间点之不同，分别设定为萃取物预处理、共处理以及后处理三组。结果显示酒萃物之保护效果在共处理组明显优于水萃物，因此将同一批次之虎乳灵芝菌丝体酒萃物进行层析纯化，共获得四种分层，分别为水层(Lr H2O)、正丁醇层(LrBtOH)、乙酸乙酯层(Lr EA)以及正己烷层(Lr Hex)。其中，以Lr H2O、Lr Hex两组在共处理试验(分别为p < 0.01, p < 0.001)以及后处理试验(分别为p < 0.01, p < 0.01)中皆可见显著提升细胞存活率之效果。因此两种成分的极性差异悬殊，故推估液态发酵虎乳灵芝菌丝体的酒萃物中可能具有两种抗H1N1流感病毒之功效成分。 关键词 :A型流感(H1N1)，液态发酵虎乳灵芝菌丝体，萃取物 Copyright © 2020 by author(s) and Hans Publishers Inc. This work is licensed under the Creative Commons Attribution International License (CC BY 4.0). http://creativecommons.org/licenses/by/4.0/"
"流感病毒属于正黏液病毒科(Orthomyxoviridae)，其遗传物质为RNA，根据其核蛋白(nucleoprotein)的差异，可区分为A、B、C三型。新型H1N1流感病毒是A型流感病毒的一种，也是人类最常感染的流感病毒之一。该病毒首次暴发于2009年春天，由于在人群中快速传播的能力，感染全球200多个国家估计影响人数超过100万人。有至少20,000证实死亡，而死亡病患大多是20到40岁的壮年人。典型的临床症状与季节性流感类似，包括发烧、咳嗽、喉咙痛、全身酸痛、头痛、发冷与疲劳，最后出现严重的肺炎，有些病例则会出现腹泻、呕吐症状 [ 1 ]。H1N1原是一种于猪只中感染的疾病，并且包含多种猪流感病毒株的基因，但除了来自不同的猪流感病毒的基因外，其中还发现了包含人类和禽流感病毒的遗传物质。因此认为H1N1病毒是通过基因重排进化而来的。疫苗注射虽是目前减低流感冲击最有效的方法，但依然不可能及时生产和施用有效疫苗来中止正在进行的全球大流行，因此近年来利用抗病毒药物来治疗及预防流感亦已成为另一种防治的策略。现阶段获准使用的抗病毒药物包括金刚胺(amantadine)、金刚烷乙胺(rimantadine)、瑞乐沙(zanamivir)、及克流感(oseltamivir)等四种。依据目前现有的各种资料，这四种药物在对于减少A型流感的发病病程上仅限于那些没有并发症的患者有效，也没有任何资料显示这些药物可以减缓流感并发症。此外在中枢神经、胃肠的药物副作用及长时间使用药物治疗可能产生的病毒抗药性，亦是医师用药时的考量。由于用途上限制相当多，因此找出具有抗病毒效用的天然物质为非常需要正视的课题。 虎乳灵芝(Lignosus rhinocerus)为传统中草药，在中国及马来西亚具有相当悠久的食用历史。完整的虎乳灵芝子实体惟菌核具有功效，而菌核实为菌丝体聚集而成，生长于土壤中。由于野外数量极低，被当地居民视为珍贵药材，在马来西亚甚至称之为国宝，2005年中国也将虎乳灵芝列在中国最有开发前景的主要药用真菌名单之内 [ 2 ]。中医学上将虎乳灵芝用于治疗胃溃疡和肝脏相关疾病如慢性肝炎和肝癌 [ 3 ]。明朝李时珍于《草本纲目》中亦有记载，虎乳灵芝具有治疗胃病、哮喘及高血压的功能。研究指出，虎乳灵芝含有高达33.95%的β-葡聚糖，具调节免疫力 [ 4 ] [ 5 ] [ 6 ]、抗发炎 [ 7 ]、抑制癌细胞增生 [ 8 ] [ 9 ] 的能力且对正常细胞没有毒杀作用。此外虎乳灵芝更被指出具有抗氧化性 [ 10 ] [ 11 ] 及神经刺激作用 [ 12 ]。亦有文献指出虎乳灵芝具有抗登革热病毒及HIV-1病毒之效果 [ 13 ] [ 14 ]。 综合上述，本研究旨在探讨液态发酵培养之虎乳灵芝菌丝体是否可产生有效抑制H1N1流感病毒之感染功效及成分，以期后续可以大量生产低廉辅助抗流感病毒之产品。"
"本篇报告所用虎乳灵芝菌丝体取自马来西亚虎乳灵芝朵菌种分离纯化，并以ITS-1引子进行菌珠DNA序列分析(表1)，经由NCBI 之BLAST Search 比对证实所纯化获得之菌种与虎乳灵芝序列具有99%相似度。序列比对结果如下：ITS1 Lr-230 bp (定序公司：明欣生物科技有限公司) GGGTTGTAGCTGGCTTTCTCCGGGAGGCATGTGCACGCCCTGCTCAATCCACACTCTTACACCTGTGCACTCACTGTGGGTTTTCAGCCGGCGTTTGCATCCGTGCGGCGTTGACTGTGGGCCTGCGTTATCCACTACAAACCACACTGTCAGTATCAGAATGTTCATACGTTTGCGATGTTCAAACGCATAATTACAACTTTCAGCAACGGATCTCTTGGCTCTCGCAT Table 1 Sample Query coverage MAX identity Gaps Lignosus rhinocerus 100% 229/230 (99%) 1/230 (0%) 表1. ITS-1序列鉴定结果 [ 9 ]  切取虎乳灵芝菌丝体琼脂平板约1 cm3之小方块接种至2 L之三角摇瓶(内含2% 葡萄糖、0.6%酵母抽出物、0.03% MgSO4，并将溶液调整至pH 5)，并于25℃、转速120 rpm 之条件下震荡培养7天，而后逐步由摇瓶接种至500 L以及20 ton大型发酵槽。经10天的培养后，加热所得之菌丝体发酵液再经过浓缩冻干以及磨粉等程序，即可进一步分析或萃取。  虎乳灵芝菌丝体萃取物之制备 将虎乳灵芝菌丝体冻干粉末与纯水依重量比1:20之比例混合，超音波震荡1小时后将去除沉淀物之上清液进行冷冻干燥即得水萃取物。另将虎乳灵芝菌丝体冻干粉末用乙醇以重量比1:20之比例混浸泡震荡萃取1小时，连续萃取三次，过滤后的萃取液经减压浓缩即为酒萃取物。接着将酒萃取物依序与正己烷、乙酸乙酯及正丁醇溶剂进行三次十倍比例之分配分离萃取(Partition)，即可得正己烷层(LrHex)、乙酸乙酯层(LrEA)、正丁醇层(LrBtOH)及水层(LrH2O)共四个分层，可分别进行活性测试。   A型流感病毒A/WSN/33 (H1N1)，由中央研究院基因体研究中心詹家琮博士所提供，在1993年分离之病毒株。  将100 μL (约100 TCID50) A型流感病毒(H1N1)液注射入SPF (Specific pathogen free)鸡胚蛋的尿囊膜后以蜡封住洞口进行繁殖，放在培养箱中培养1至2天，再放入4℃等待凝结，再将尿囊膜中液体抽出，置于−80℃保存。   MDCK (Madin-Darby Canine Kidney cells)：犬肾上皮细胞，细胞株编号为BCRC 60004。购自食品工业研究所之生物资源中心(Bioresource Collection and Research Center, BCRC)。  细胞经计数后，将其浓度调整为1 × 106细胞/mL，添加培养液与最适培养浓度之FBS，并加入10% DMSO作为抗冻剂，再注入冻管中。将冻管放入注满异丙醇(isopropanol)之渐冻盒，再置于−80℃隔夜后转存放于液态氮中保存。  首先于细胞培养皿中加入9 mL DMEM及1 mL FBS备用，再将保存于−80℃冻藏柜或是液态氮中的细胞株在37℃水浴槽中回温至稍有残冰，尔后吸出细胞液至先前准备好的培养液中，置于37℃及5% CO2之培养箱中培养。  当细胞长到八分满的时进行继代培养，首先吸除旧有细胞培养液，用磷酸缓冲生理食盐水PBS洗去残留的血清及代谢物，加入1 mL胰蛋白酶typsin-EDTA后，置于37℃下作用3~5分钟，轻拍细胞盘侧促使贴附于盘底之细胞脱落，镜检确认细胞被切下后，以0.5 mL胎牛血清FBS 中止胰蛋白酶的作用，以DMEM medium冲下细胞并收集于50 mL离心管中进行离心(条件设定为500 xg，5分钟，4℃)，而后吸除上清液，再以DMEM medium回溶沉淀之细胞并进行计数，将细胞浓度调整为3 × 105细胞/盘，最后种于细胞培养皿，并加入含有10% FBS之DMEM medium共10 mL，培养于37℃及5% CO2之培养箱。  将1 × 104细胞/孔的MDCK种在96孔盘中，置于含有37℃与5% CO 2 培养箱中培养24小时后，再分别加入不同浓度之虎乳灵芝萃取物作用48小时，利用MTS assay测其细胞存活率。培养液与MTS reagent添加的比例为5:1，将MTS reagent加入细胞液后，于培养箱中避光反应1小时，再使用ELISA reader在490 nm测量其吸光值进行计算。  先将虎乳灵芝水萃物和酒萃物分别以PBS以及DMSO溶解至适当浓度，将MDCK培养至96孔盘内，隔夜培养待细胞贴附后，于不同感染时间点以MTS assay测定虎乳灵芝萃取物对H1N1感染MDCK存活率之影响。  先于细胞中加入不同浓度虎乳灵芝萃取液于培养箱中作用1 小时，吸除培养液，再加入moi = 0.05 (病毒感染剂量Multiplicity of infection, MOI)之H1N1溶液，置于培养箱作用1小时，再移除培养液并加入含2% FBS之新鲜DMEM 培养液，继续于5% CO 2 、37℃下培养48小时，最后以MTS assay测其细胞存活率。  将不同浓度之虎乳灵芝萃取液与moi = 0.05之H1N1先混合共培养1小时后，将各浓度混和液分别加入细胞中，于培养箱作用1小时，再移除原培养液，并随即加入含2% FBS之新鲜DMEM培养液，于5% CO 2 、37℃下培养48小时，最后以MTS assay测其细胞存活率。  于细胞中加入moi = 0.05 之H1N1 并放入培养箱中作用1小时后，吸除培养液，再分别加入不同浓度之虎乳灵芝萃取液于培养箱中作用1小时，然后移除原培养液并加入含2% FBS之新鲜DMEM培养液，于5% CO 2 、37℃培养箱培养48小时，最后以MTS assay测其细胞存活率。  采用MTS assay 测定细胞存活率。 MTS [3-(4,5-dimethylthiazol-2-yl)-5-(3-carboxymethoxyphenyl)-2-(4-fulfophenyl)-2H-tetrazolium, inner salt]为tetrazolium salt的黄色物质，原理为活细胞内粒线体会产生NADPH能将tetrazolium salt还原成褐色的formazan，而细胞存活率与formazan的产生量呈正比。再利用波长490 nm测定吸光值即可推算出细胞存活率。"
"进行虎乳灵芝萃取物抗病毒试验前，先评估其在何种浓度下会对于病毒宿主细胞MDCK造成毒性，继而找出存活率大于80%之供试剂量(图1)。虎乳灵芝酒萃物以DMSO配置成浓度2 mg/mL，再连续对半稀释至0.0625 mg/mL，水萃物则以PBS配成最高浓度2 mg/mL，经连续对半稀释至0.0625 mg/mL，再进行MTS评估，结果显示虎乳灵芝酒萃物于1 mg/mL对于MDCK的细胞存活率大于80%，在不造成细胞毒性之考虑下，乃选择以0.25 mg/mL浓度进行实验；水萃物则于2 mg/mL对于MDCK细胞的细胞存活率大于80%，同样选择以1 mg/mL以下浓度进行实验。  如(图2)结果所示，虎乳灵芝酒萃物以及水萃物在各供试剂量下皆无法有效改善因H1N1病毒感染所造成的细胞毒杀现象。  虎乳灵芝酒萃物先与H1N1病毒反应一小时后，再感染MDCK细胞，结果发现可增加细胞存活率(与H1N1组相比增加14.9%)；但水萃物则与H1N1之共处理组则对MDCK存活率无显著影响(图3)。 图1. 虎乳灵芝萃取物对MDCK细胞之抑制性评估 图2. 虎乳灵芝萃取物预处理MDCK细胞后，对于受H1N1病毒感染细胞的存活率影响 图3. 虎虎乳灵芝萃取物处理H1N1病毒后，对感染细胞的存活率之影响(共处理试验)  虎乳灵芝酒萃物组对于预先以H1N1攻毒后之细胞存活率与H1N1组相比无显著差异，显示细胞一旦受感染后，酒萃物无助于减缓病毒毒杀作用，水萃物亦同样无减缓病毒毒杀之功效(图4)。 图4. 虎乳灵芝萃取物对于既受H1N1病毒感染之细胞的存活率影响(后处理试验)  首先以MTS assay再次评估虎乳灵芝酒萃物分层在不同浓度下对MDCK之毒杀性，依据实验结果挑选存活率大于80%之浓度作为后续抗病毒试验之最高剂量，因此将LrH2O、LrBtOH、LrEA、LrHex的最高浓度分别配成1000、1000、250、250 μg/mL四组最高浓度，再依序对半稀释成各种浓度(图5)。 图5. 虎乳灵芝取物各分层对MDCK细胞的存活率之影响  预防处理时，与对照之H1N1组相比，500 μg/mL的Lr H2O及LrBtOH之细胞存活率分别提升5.14% (p < 0.05)以及7.47 % (p < 0.01)，其中LrBtOH于250 μg /mL浓度下仍然可具有显著差异；而250 μg/mL的Lr Hex及Lr EA之细胞存活率分别提升6.30% (p < 0.01)以及6.43% (p < 0.05)，且LrEA于125 μg/mL浓度下仍然具有显著改善细胞存活率之效果(图6)。  与H1N1组相比，1000 μg/mL 的Lr H2O及LrBtOH之共处理可以分别提升细胞存活率25.47% (p < 0.01)及12.07% (p < 0.01)，且两者浓度降至500 μg/mL时，仍然可具有显著之改善存活率效果；至于250 μg/mL的Lr EA及Lr Hex之细胞存活率分别提升18.25% (p < 0.05)及15.48% (p < 0.001)，且Lr Hex于125 μg/mL的浓度下仍然具有显著效果(图7)。 图6. 虎乳灵芝萃取物分层对于受H1N1病毒感染之细胞的存活率影响(预处理试验) 图7. 虎乳灵芝取物各分层之共处理对于受H1N1病毒感染之细胞的存活率影响  在治疗模式之后处理组中，1000 μg/mL的Lr H2O、LrBtOH之细胞存活率与H1N1组相比，分别提升22.09% (p < 0.01)、11.34% (p < 0.001)，且Lr H2O于500 μg/mL的浓度下仍有显著提升效果；Lr Hex在250 μg/mL之细胞存活率提升23.89% (p < 0.01)，甚至浓度低至31.25 μg/mL亦皆可达统计上之显著差异。Lr EA则皆无效果(图8)。 图8. 虎乳灵芝萃取物各分层对于既受H1N1病毒感染之细胞的存活率影响(后处理试验)"
"病毒性疾病向来于人类史上造成数度浩劫，其中尤以流行性感冒最为人知，A型流感是一种具高度传染性的急性呼吸道感染症，即使在医療科技及预防保健发达的今天，仍是会导致相当高的致病率与死亡率，到目前为止虽有药物或疫苗可对抗流感病毒，但由于流感病毒属RNA 病毒，具有极高变异性，几乎每年流行的病毒株都会有所改变，原施打的疫苗对不同抗原之病毒便不具免疫力，导致保护效果降低 [ 15 ]。 本次采用之虎乳灵芝菌丝体，取自马来西亚虎乳灵芝朵菌种分离纯化，以液态发酵培养而得，并完成多项动物实验证实其食用安全性 [ 16 ] [ 17 ]。实验以H1N1病毒感染MDCK犬肾细胞作为感染模式，进而探讨经样品处理后是否可以防止因病毒感染而死亡的细胞存活率，为一种广泛被使用的细胞筛选模式。结果显示，虎乳灵芝酒萃物在共处理试验中的效果显著优于水萃物，但两样品于预防及后处理试验中皆未看见明显保护作用。由于大分子物质如多糖等可能会藉由包覆病毒颗粒或是覆盖于宿主细胞表面达到阻隔遮蔽病毒感染效果，进而达到保护及预防感染的结果 [ 18 ]，此现象尤易发生在in vitro试验中。然对比本报告之研究结果，易含多糖体或是部分胜肽类物质之水萃物组，并未看到显著抗病毒之效用，反观酒萃物则可显著提升细胞存活率，因此推测虎乳灵芝酒萃物中具有抗病毒功效可能偏向小分子化合物。 进一步将酒萃物内物质依其极性分作四层，分离萃取(Partition) 获得正己烷层(Lr Hex)、乙酸乙酯层(Lr EA)、正丁醇层(LrBtOH)及水层(Lr H2O)共四个分层，分别进行活性测试。结果显示无论是在预防、共处理或是后处理试验组，四个分层与H1N1感染组相比，都可有效提升细胞存活率。其中Lr H2O、Lr BtOH在共处理及后处理组的效果尤佳；Lr EA在共处理试验效果最佳，而Lr He则是以后处理尤佳，共处理效果次之，预处理结果为末。 本次实验中，发现到无论是虎乳灵芝酒萃取物或是其分层，皆属共处理试验最为有效，考虑其试验设计，基于会先将样品与病毒进行接触混合培养，再将其混合液与细胞接触进行攻毒，而此结果即造成病毒感染力下降，由此推测可能是样品即可直接对于病毒产生影响，使其对于细胞的杀伤力下降，产生保护效果。 另外，预防试验的保护效果皆不如治疗试验组，此现象与现今讨论度极高之抗病毒药物瑞德西韦(Remdesivir)雷同，亦是治疗效果胜于预防，查其治疗机转，药理机制为当病毒与药物接触时无法产生直接影响，作用点是在当病毒感染进入细胞后，准备进行复制时，药物即会作用在病毒用以复制(replication)自身核酸所用之复制酶，进而使病毒无法顺利于感染细胞内增殖，达到阻断细胞被进一步感染的危机。"
"经由本次实验可以推测，以此报告内配方所培养之虎乳灵芝菌丝体萃取物可有效缓解细胞因病毒感染而导致的死亡现象，达到保护效果，尤其是以Lr H2O、Lr Hex两组在共处理试验以及治疗试验中提升细胞存活率之效果最为显著。虽尚未能确知其功效性物质，但可以从初步纯化的实验结果得知，虎乳灵芝得酒萃物中至少含有两项抗病毒之功效成分，且极性相差甚大。往后可再设计进一步纯化，并搭配进行抗病毒活性实验，以利找出虎乳灵芝分层中化合物对于流感病毒的关键性功效物质。经确认后即可进行虎乳灵芝菌丝体的制程优化，以期能发挥更加良好的抗病毒效用。"
