"室温磷光(Room Temperature Phosphorescence, RTP)现象的发现大大拓展了磷光材料的应用和研究方向。具有良好生物适应性的凝胶体系可以为磷光体提供更好的聚集效果，隔绝猝灭三线态的氧分子，并成为研究RTP现象的重要微环境。本文将综述凝胶基质中室温磷光现象的研究与应用，并对该研究方向进行了展望。 关键词 :室温磷光，聚集诱导磷光，凝胶 Copyright © 2020 by author(s) and Hans Publishers Inc. This work is licensed under the Creative Commons Attribution International License (CC BY 4.0). http://creativecommons.org/licenses/by/4.0/"
"磷光是区别于荧光的另一种光致发光现象，具有比荧光更长的发光寿命，可以达到微秒、毫秒级甚至更长。早期一些报道显示有机染料溶液在低温(77 K)条件下可以产生磷光，因此在六十年代发展起来的常规磷光光度法往往受到深冷实验条件的限制 [ 1 ]。而在之后兴起的室温磷光法(Room Temperature Phosphorescence, RTP)开始引起分析研究者的重视，并在随后的几十年间逐渐发展起来 [ 2 ]。常见的产生室温磷光的分析手段有重原子诱导室温磷光法 [ 3 ]、超分子组合室温磷光法 [ 4 ]、固体基质室温磷光法 [ 5 ] 和无保护介质的室温磷光 [ 6 ] 等。总之，凭借长发光寿命、较大Stokes位移等特点，磷光在生物成像、药物化学、环境科学等领域较荧光而言更具优势。 现有的RTP材料主要有三类：1) 金属掺杂的无机材料；2) 金属复合物材料，涵盖了目前大部分的RTP材料；3) 不含金属的纯有机磷光材料，具有结构便于设计调节、毒性低、成本低等优点。但是纯有机磷光材料往往量子产率较低，提高量子产率的策略有：a) 提高系间窜跃系数(k ISC )，例如引入重原子或杂原子，用以提高激发单线态和激发三线态之间的自旋轨道耦合；b) 提高体系的刚性，减少非辐射弛豫过程，可以采用结晶、聚合物聚集、超分子聚集等手段。凝胶在有机体的组成中占重要地位，是一种具有良好生物适应性且有利于发生RTP现象的材料，在生物成像等方面具有潜在应用价值。本文将着重讨论凝胶体系中的RTP现象，并对这些RTP材料的应用进行综述，对磷光材料未来在生物分子逻辑体系中的潜在应用价值进行分析和讨论。"
"将磷光体作为客体掺入主体大环分子中已经被证明是一种产生RTP的有效方法。主体可以是杯芳烃、环糊精、葫芦素等，它们可以基于主客体之间的相互作用，与特定的客体分子形成稳定的包合物，发挥着固定客体、限制分子振动、保护客体免受氧分子猝灭等作用。早在1982年Turro等就发现当有β-环糊精(β-Cyclodextrin, β-CD)存在时，1-溴萘和1-氯萘可以在氮气氛围下产生RTP现象 [ 7 ]。近些年来，研究者们利用环糊精的主体作用与磷光体结合设计了多种超分子凝胶。Ma和Tian等人 [ 8 ] 基于β-CD主体聚合物(poly-β-CD)和α-溴萘聚合物(poly-BrNp)，构建了具有RTP现象的超分子凝胶，当引入偶氮聚合物时，还可以通过254和365 nm光照下偶氮的光异构化来调节RTP的强度。  将磷光体共价连接到聚合物基质中，是在各种无定形聚合物体系中实现RTP的有效途径。田禾教授课题组 [ 9 ] 曾报道了以丙烯酰胺和3种有机磷光体进行简单共聚的方法，制备的无定形聚合物可以实现高效率的RTP。该设计机制是将磷光体共价连接到聚丙烯酰胺的侧链上，从而限制其分子振动，减少非辐射弛豫。由于聚丙烯酰胺溶于水，这类聚合物也可以被用于湿度传感。  分子间p-p相互作用对RTP效应起着重要作用 [ 10 ]。若要进行单组分RTP分子的设计，首先要增强分子间p-p相互作用。主要有两种思路：分别是减小p-p排斥力和增大p-p吸引力。在分子堆叠系统中，如果引入吸电子基团(如重原子Br、Cl、F等)可以降低被取代的p系统的p电子密度，进而减小了两个堆叠环之间的p-p排斥力。而静电相互作用、偶极–偶极相互作用可以在密集的p-p堆积中增大p-p吸引力。在一个分子中更好地整合电子的供体和受体有利于这两种相互作用的产生，进一步增强p-p吸引力。Huang、Liu和Chen等人 [ 11 ] 就曾提出可以在H聚集的强耦合作用下有效稳定激发三线态。若要进行无重原子磷光材料的设计，就要引入N、O等具有孤对电子的元素，这有助于系间窜跃的产生，也有利于n-p*跃迁。Zhang和Chi等人 [ 12 ] 曾引入O、S元素设计了一种无重原子的蝴蝶型砜的衍生物，其中二苯砜和二苯并噻吩被用于构筑单元，得到一种白色RTP材料。此外，在晶体中的强制p-p堆积使得电荷转移更容易发生，也有利于RTP的产生 [ 13 ]。  以上三种设计思路具有一定的共性，比如环境适应性强，均适用于固体、液体和凝胶体系。但在相互作用、操作难度和材料选择性等方面也存在明显差异(表1)。此外，将磷光体掺入适宜的主体当中或者将磷光体共价连接到聚合物侧链上，均可以实现通过限制分子振动、减少非辐射弛豫，进而产生室温磷光的效果。从操作手段上来看，这两种方法显然更加简便易行，而单组分分子设计是新型室温磷光材料开发和设计的重要思路。事实上，新型室温磷光材料的日益增多也为前两种设计思路拓宽应用范围。室温磷光材料的设计构建思路有很多，本文对其中较为普遍的思路进行了总结，但随着相关研究的不断推进，相信会有更多新的自成体系的设计思路出现。 Table 1 设计思路 调节的相互作用 操作难度 材料选择性 主客体系统 主客体相互作用 [ 7 ] 较简便 受限主体材料 共聚法 共价作用 [ 9 ] 较简便 受限聚合物主链材料(如聚乳酸、聚氨酯、聚酰胺等 [ 30 ] ) 单组分分子设计 非共价相互作用(如π-π相互作用、静电相互作用、偶极-偶极相互作用等) [ 10 ] 设计难度较大 普及性强，受限较小 表1. 不同设计思路的对比"
"为克服低温磷光的深冷实验条件缺陷，实现RTP可采取的手段有：将磷光体固定在固体基质中使其刚性化，或利用某些保护介质减少非辐射弛豫和氧气对激发三线态的猝灭。凝胶体系可以实现对磷光体的良好保护作用，主要原因是减少了非辐射碰撞失活并有效保护了激发三线态。  纯有机磷光材料的凝胶体系可以分为两种情况：一种是将磷光体包埋在凝胶体系中。例如Yang等 [ 14 ] 曾报道，将商品化小分子3-溴喹啉(3-BrQ)包埋在山梨糖醇衍生物(DBS)自组装形成的超分子凝胶中，由于凝胶态能够有效限制3-BrQ的分子振动，使得体系可以产生较强的RTP。材料的制备无需除氧条件，且制得凝胶中的磷光不会被Cu 2+ 、NO− 2离子猝灭，这可能是由于DBS凝胶的微观结构阻止了离子与3-BrQ的相互作用，也可能是3-BrQ结构中的N的非共价电子对已经与芳环结合形成了π键。 另一种是磷光体自身可以发生自组装得到凝胶。Yuan和Zhang等人 [ 15 ] 通过将叔丁基基团修饰到一种具有聚集诱导磷光现象的咔唑和二苯甲酮的共轭物(CZBP)上，得到一种无金属元素和重原子的纯有机磷光材料，叔丁基有利于胶凝过程，当浓度大于20 mg/mL时，它可以在二甲基亚砜中自组装形成凝胶，得到的凝胶在紫外灯下发出蓝色磷光。该分子被包埋在其他聚合物中时，也依然保有磷光性质。  含有金属元素的磷光材料有两类，一类是金属掺杂无机材料，另一类是金属复合物材料，但在凝胶体系中一般使用后者。Wang等 [ 16 ] 曾报道将磷光体钯卟啉(Pd-TCPP)封装在由胶凝剂N,N'-二苯甲酰基-1-半胱氨酸(DBC)和一种双极表面活性剂形成的胶束杂交超分子凝胶中，可以在紫外线照射10 min后获得极强的磷光。作者认为该体系中磷光增强的机制与紫外线照射下由溶解氧产生的单线态氧有关，单线态氧将DBC中的二硫键氧化为带有负电荷且更易形成氢键的磺酸基，使得凝胶结构变得更为致密，磷光体Pd-TCPP的自由度受到限制，产生更强的RTP。"
"室温磷光材料作为一种功能化的新材料，在诸多领域都有着广泛的应用前景，除了已经研究的非常多的加密防伪领域外，也在生物传感、光动力疗法等领域有颇多的应用(如图1)。凝胶在有机体的组成中占重要地位，是一种具有良好生物适应性且可能发生RTP现象的材料，在生物成像等方面具有潜在应用价值。 图1. 室温磷光材料在凝胶体系中的应用方向。左上：薄膜的pH敏感行为 [ 18 ]；右上：体内活化后发光纳米粒子的检测 [ 22 ]；左下：光催化芳基卤化物功能化示意图 [ 24 ]；右下：光动力疗法中主要光物理和光化学过程示意图 [ 25 ]  分子开关的研究以化学学科为中心，包含了微电子物理学、生物科学、计算机科学等多个领域的内容。开关分子或分子体系必须拥有双稳态或者多个稳态结构，在外部刺激下，不同稳态结构间可以相互转变，且这种转变最好是可逆的，便于设计分子开关，且能通过自身不同状态的转变，进行信息(0和1)的存储。  在凝胶体系中，富含氢键的凝胶网络结构有助于磷光体的固定，并且一定程度上抑制了氧气对磷光的猝灭，但当湿度足够高时，氢键的断裂会导致材料的塌陷，从而影响RTP材料原本的发光性质。基于这种性质，田禾教授课题组将基于组氨酸稳定的金纳米簇(AuNC@histidine)和RTP材料——一种4-溴-1,8-萘酐衍生物聚合物(Poly-BrNpA)结合到富含氢键的聚乙烯醇(PVA)网络中，受湿度的影响，该材料在紫外光下的颜色可以在绿色–白色–红色之间切换，并且构建了湿度调节RTP强度大小的可逆的分子开关 [ 17 ]。事实上，以富氢键结构实现对磷光体的聚集是一种很常见的方式，支撑材料除了PVA外，还有环糊精及其衍生物等。  当磷光体结构受到外界物质的调节，影响了体系中电荷转移，同样可能构成分子开关。Tanaka和Chujo等人 [ 18 ] 合成出了具有聚集诱导磷光现象的硼二亚胺，随后将硼二亚胺与芴共轭后，合成的聚合物薄膜显示出红色磷光，将薄膜置于充满三氟乙酸蒸汽的小容器中，氨基发生了质子化，因此氨基和硼螯合环之间的强供体-受体相互作用被抑制，这使得薄膜在紫外灯下发射的磷光由红色变为黄色，当薄膜被置于三乙胺蒸汽中时，磷光体又恢复为原有的结构。该研究中，可以借助酸碱相互作用调节取代基中供电子和受电子的能力，进而可逆调节聚合物薄膜的磷光性质。将该薄膜分别暴露于三氟乙酸蒸汽和三乙胺蒸汽中，可以实现磷光在红色和黄色之间的可逆转换，取红色为开，黄色为关，即可构成可逆分子开关。  生物成像技术在研究生物体组织结构和各种生理功能方面具有重要作用。通过生物成像技术获得的图像可以分析了解生物体中的各种生理过程。目前生物成像技术在临床医学中的应用也逐渐受到重视 [ 19 ]。室温磷光材料具有一些便于应用在生物成像领域的光物理性质：明显的Stokes位移、易于在可见光甚至近红外光范围内调节的激发和发射波长、便于消除生物自发荧光的长寿命等。这些特点都使得室温磷光材料在这一领域具有了广泛的应用前景。 对于凝胶体系来说，磷光成像的成功应用受到其在水性环境中较差的生物相容性和分散性的限制。但是使用凝胶体系进行细胞成像的研究近些年也有报道。Sun和Huang等人 [ 20 ] 将一种具有聚集诱导磷光活性的Pt(Ⅱ)配合物掺入水溶性丙烯酰胺基热敏聚合物中，构建了一种磷光热敏探针P1。当温度从28℃提升到35℃时，磷光强度显著增高，这来源于聚合物链从扩展结构到聚集结构的变化导致的体系微环境刚性提升。通过比较P1和线粒体追踪剂的染色区域，可以发现这些磷光体主要分布在线粒体周围。P1在HepG2细胞中不同区域的磷光强度不同，表明其在细胞内温度分布成像方面的应用前景。 考虑到含有重金属配合物的磷光体具有一定的生物毒性，往往需要复杂的修饰和保护才能消除，研究者们将视线转向了不含金属的纯有机磷光体。Lei、Kaminski和Liu等人 [ 21 ] 通过将碳点(Carbon Dots, CDs)包封在亲水性基质胶态二氧化硅中，得到了一种易于分散在水中的RTP材料(CDs-SiO 2 )，在保护三线态免受环境猝灭剂影响的同时，使体系具有了良好的亲水性。这种凝胶材料可以实现在植物样品和动物细胞中的吸收和磷光成像，体系细胞毒性低，可以区分组织自发荧光。 在细胞成像基础上进行的组织成像研究也颇受关注。Scherman和Richard等人 [ 22 ] 介绍了一种铬掺杂的没食子酸锌光学探针，可以用于活体组织成像。该光学探针发出的磷光在紫外光激发结束后2小时仍可以检测到，在可见光照明下也可以得到持久的发光信号，并且经过体内注射实验证明，这种纳米粒子集中于小鼠的肝脏组织中。  光催化是光化学和催化科学的交叉学科，常常指有催化剂参与的光化学反应。早在20世纪70年代，光催化氧化就已经成为了环保领域研究的热点。在20世纪80年代，光催化有机合成也进入了研究者们的视野。基于光催化剂在光照条件下具备的氧化还原能力，可以实现物质合成、转化，净化污染物等目的。在大多数光催化反应中，光敏剂的激发态必须具有较长的寿命，才能使电子通过扩散-碰撞而从电子供体向受体转移。在某些光催化反应中，长寿命激发三线态(T 1 )被认为是反应中间体。这也使得基于室温磷光材料的光催化反应可能发生。Kurrmochi和Satake等人 [ 23 ] 设计了一种Re(I)的卟啉配合物，使用一种苯并咪唑衍生物作为电子供体，苯酚作为电子受体，所形成的配合物可以实现CO 2 的光催化还原。通过磷光测量证实，在还原反应过程中，锌卟啉部分的激发三线态(T 1 )是反应的中间体，反应过程被证实是光致电子转移(PET)的光催化还原反应。 光化学可以受益于密闭空间，研究者们采用了一系列受限的介质来改善光化学过程。其中超分子凝胶——作为受限介质的一种，通常由低分子量化合物(即胶凝剂)制成，可以通过非共价相互作用(例如氢键、范德华力、电荷转移、偶极、p-p堆积等)进行自组装，并对外部刺激因素产生可逆的凝胶-溶胶相转变响应。Díaz等人 [ 24 ] 报道了通过低能光照射嵌在超分子凝胶中的供体/受体对，分别使用罗丹明6G和二氯三(1,10-菲咯啉)钌(Ru(phen) 3 Cl 2 )作为光催化剂，通过研究芳基卤化物的官能化以及芳烃的三氟甲基化这两个反应过程，发现凝胶网络中的光催化过程与严格除氧的均相体系具有相似的产率。其机理可能为：在凝胶网络的部分区域内可能存在某些分子间的相互作用，或使凝胶的粘度增强从而限制了氧的扩散，而光催化剂的疏水–亲水平衡、溶剂的性质以及凝胶网络的类型等的适当调节都可以促进凝胶内反应的发生。 基于室温磷光材料的光催化反应报道多见于金属配合物材料，为了进一步扩大底物范围，必须合成和研究可用作光催化剂的新型金属配合物。  光动力疗法(Photodynamic Therapy, PDT)是一种非侵入性技术，利用基于染料的光敏剂与光和氧结合产生活性氧，以选择性除去恶性组织和感染性微生物。要使PDT成为常规疗法，需要解决光敏剂溶解度的问题，开发具有安全性、生物相容性、靶向性的制剂。 PDT过程中使用的光敏剂在基态(S 0 )被适当波长的光照射后可以被激发到短寿命的激发单线态(S 1 )，此时光敏剂可以以荧光形式释放吸收的能量，又或者通过系间窜跃到达激发三线态(T 1 )，由于T 1 状态具有足够长的寿命，可以参与不同的化学反应，得到活性氧(单线态氧或者其他活性氧)，这意味着合适的光敏剂必须具有较高的三线态量子产率 [ 25 ]。 室温磷光材料中有相当一部分金属配合物，可以催化生成单线态氧，进而杀灭癌细胞。Sun和Li等人 [ 26 ] 使用Ir(Ⅲ)配合物(Irpy)和透明质酸(HA)进行静电自组装，得到具有稳定球状纳米结构的Irpy-HA，其中HA可以与癌细胞中过量表达的CD44受体结合，使得Irpy-HA可以进入癌细胞，而吡啶正离子的靶向能力则可以使得Irpy-HA在线粒体中累积，当有绿光照射时，产生大量的单线态氧用以杀灭癌细胞。 通过克服溶解性等问题，凝胶制剂能同时提高了光敏剂的选择性和靶向性，是满足理想PDT平台所有要求的潜在研究方向。虽然目前有少量将金属配合物材料包埋在凝胶体系中用于光动力疗法的研究 [ 27 ]，但是暂时没有室温磷光材料相关的研究报道。凝胶体系可以有效克服传统光敏剂的选择性差及长期定位效果不好的缺点，现在更有研究者开发出了活性氧响应的光降解凝胶，可以实现化学光动力联合疗法 [ 28 ]。未来室温磷光材料在凝胶体系中的光动力疗法应用会走向何方，也是一个很值得期待的命题。"
"磷光材料在分子开关中的应用并不鲜见，无论是基于磷光材料基质的结构变化还是磷光体自身的变化，所形成的性质开关均具有分子逻辑，可进一步与生物分子与生物化学反应结合，构建生物分子逻辑体系。虽然曾报道过将氧敏性的磷光材料与乳酸酶结合使用，通过磷光强度变化进行乳酸含量的检测 [ 29 ]，但鲜有将磷光材料用于生物分子逻辑体系中。 磷光材料有潜力被用作生物分子逻辑体系的组成部分的原因有：1) 磷光材料大多具有氧敏感性，而氧气作为生物反应中的重要组成部分，具备以之为桥梁构建酶级联反应的条件，而酶级联反应正是设计复杂生物分子逻辑体系的一个重要思路。2) 一些磷光材料具备光催化功能，这意味着磷光材料可能不仅可以作为氧敏检测单元出现，还可以作为光催化反应的催化剂参与其他反应的催化。 室温磷光材料在生物成像领域的应用备受重视，对于传感、诊断和治疗都有着重要的意义，但是相较于磷光染料的蓬勃发展，其在小动物体内的研究相对较少。且现有的磷光探针多为重金属配合物，它们的细胞毒性等还需要通过各种配体修饰进行改良，未来将不含金属的室温磷光材料应用于生物成像领域是一个值得深入探讨的课题。此外，开发具有多功能的磷光材料也成为当前研究的一个趋势，如何在复杂的生物体系中实现生物成像、光催化、光治疗等多种功能是研究者们所面临的新挑战。"
