"众所周知，一个好的模型不仅要具有优良的拟合度，而且还要具有简洁的形式，那么究竟怎样平衡模型的精确度与复杂度呢，这就需要进行模型选择了。而AIC, BIC及CV恰好能平衡模型这种关系，恰好解决了当下模型选择的难题。本文依据AIC, BIC及CV准则来进行模型选择，对WAGE2数据进行建模。首先对12个变量通过简单统计量及其统计作图得到数据的一些分布特征及其相关关系。接着用AIC, BIC及CV来进行统计建模，选出最优模型，并用最小二乘法求得拟合方程，然后进行经济学意义的解释。最后为了让模型的选择更具有说服力，重复1000次实验选出最优模型，与之前的模型进行比较，得到一致最优的模型。 关键词 :模型选择，精确度，复杂度，AIC，BIC，CV，最小二乘法 Copyright © 2020 by author(s) and Hans Publishers Inc. This work is licensed under the Creative Commons Attribution International License (CC BY 4.0). http://creativecommons.org/licenses/by/4.0/"
"随着社会科学的发展，模型选择是很多研究学者讨论的一个重要话题，究竟应该怎样评判一个模型的好坏呢，它的拟合优度及其参数选择怎样才更合理呢，这是一个值得研究与探索的问题。 模型选择一定伴随着参数估计的问题，有很多学者采用极大似然函数作为目标函数，这也是评判拟合优度的一个标准。为了提高模型的精度，我们可以选用较多的训练样本，但是，一般情况下，模型精度的提高伴随着另一个问题就是模型的复杂度变大了，为此，就可能出现另外一种结果，出现过度拟合的情况，因此，对于模型的选择是一个迫切需要研究的课题，要怎样在模型的精确度与复杂度之间平衡呢？AIC, BIC [ 1 ] 及其CV [ 3 ] 在这方面就很好的平衡了这两者之间的关系，而本文就依托这三个模型选择的准则来选择最优模型。  关于模型识别国内外有很多学者做了相关研究，特别是关于AIC, BIC准则的模型识别。 YUHONG YANG [ 1 ] 在AIC和BIC的优势可以共享吗？模型辨识与回归估计的关系这篇文章中提出在模型选择中，BIC在选择真模型时是一致的，AIC在估计回归函数时是最优的极大极小率。最近的一个发展方向是自适应模型选择，与AIC和BIC相比，惩罚项是数据相关的。在自适应模型选择的支持下，已经取得了一些理论和实证结果，但目前还不清楚它是否能真正共享AIC和BIC模型的结合或平均的强度，已引起越来越多的关注，这是克服模型选择不确定性的一种方法，贝叶斯模型平均值是否是估计模型的最佳方法？最小极大意义上的回归函数？我们发现，这些问题的答案基本上是否定的：对于任何一个模型选择准则都是一致的，它必须表现出次优的行为来估计覆盖率极小极大值项下的回归函数；而贝叶斯模型平均不能成为回归估计的极小极大值。Cheryl J. Flynn [ 2 ] 在规范化参数选择的效率——误判模式的惩罚似然估计这篇文章中提出，在经典回归中，当最大候选模型的维数与样本量之间存在较大的相关性时，AIC往往会选择过于复杂的模型，仿真研究表明，AIC在使用惩罚回归时，会有一些缺点。因此，提出了使用经典校正AIC(AICC)作为替代方案，并证明它保持了所需的渐近性质。Jun Shao [ 3 ] 在交叉验证发的线性模型的选择这篇文章中提出可以通过使用遗漏n交叉验证，可以纠正遗漏1交叉验证的一致性，并且给出了使用遗漏交叉验证方法的动机、理由和一些实用性的讨论，并给出了仿真研究的结果。  本文主要的研究问题有5个： 1)：对给出的12个变量进行描述性的统计分析； 2)：依托全部数据用AIC, BIC, CV准则从12个模型中选出最优模型； 3)：对最优模型用最小二乘法进行拟合，求得参数，获得模型的方程。 4)：对所获得的最优方程进行经济学意义的解释。 5)：重复进行1000次实验，把数据分为训练集与测试集，用AIC, BIC, CV来进行模型选择，选出最优模型。  本文的研究思路是先对对数据进行描述性统计分析，然后再利用AIC, BIC及CV准则来进行模型选择。 本文具体的行文安排如下：第一章绪论部分，从模型选择的研究意义出发说明研究本文的必要性，然后分析了模型选择的研究现状，并给出本文的研究思路及行文框架。第二章主要是相关知识准备，主要包括AIC, BIC及CV的简介原理及其实现步骤。第三章是对数据进行描述性的统计分析。第四章主要依托第二章的相关知识用AIC, BIC及CV这三个准则进行模型选择。先用这三个准则进行模型选择，接着再用最小二乘法对最优模型进行拟合，求得参数，获得最优方程，并且对最优方程进行经济学解释。最后，为了让结果更具有说服力，重复进行1000次实验，来选出最优模型。第五章为研究结论，主要是针对本文所做的分析做一个总结。"
"1) AIC的简介及原理 AIC是赤池信息准则的简称，是日本的一个统计学家赤池宏次提出的，它的用途是衡量统计模型拟合度是否优良，对多个模型做出选择判别。不仅如此，它在估计模型的复杂度方面也有很大的用途。AIC准则主要在熵的基础上建立的，一般情况下，认为AIC越小，所对应的模型拟合度越好，模型越精确。 [ 4 ] AIC的一般表达式为： AIC = ( 2 k − 2 L ) / n (1) k表示的是模型中参数的个数，L表示的是对数似然函数，n是样本量。 我们要想选取AIC最小的那个模型，需要做到两点： 一是要提高极大似然函数的拟合度，即提高模型的拟合度。 二是：要降低过度拟合的可能性，这就需要加入惩罚项，使模型的参数尽可能少。 显然，AIC准则在合理控制了参数的同时也使得似然函数尽可能大，模型的拟合度尽可能高。 特别注意的是AIC的使用条件一定是在误差项服从正太分布的情况下。 2) BIC的简介及原理 BIC是贝叶斯信息准则的简称，是Schwarz提出的，它与AIC准则相似，也是用于模型选择。当增加参数k的数量时，就增加了模型的复杂度，似然函数也会增大，与AIC相似，也易导致过度拟合的现象。针对此现象，AIC, BIC的处理方式相似，都引入了与参数相关的惩罚项，但是BIC的惩罚项会更大一点相对AIC而言，因此，考虑了样本量，样本量较大时，就有效的解决了由于模型精度过高导致的复杂度也较高的问题。 BIC的一般表达式为： BIC = k ln ( n ) − 2 ln ( L ) (2) k表示的是模型中参数的个数，L表示的是对数似然函数，n是样本量， k ln ( n ) 表示惩罚项。 3) CV的简介及原理 CV是交叉验证法的简称，它也是一种分类的统计分析方法，它的基本思想是对原始的数据集分组为两部分，训练集与验证集。先对训练集进行训练，然后再用验证集对训练的模型进行测试，进一步进行分类评价。 最常见的CV方法主要有2种： a) 一种是将原始数据进行分组，将其中的一组数据作为验证，其余的K-1组作为训练集，这样就可以得到k个模型，一般情况k大于2，分类结果还是相对有效的。 b) 另外一种方法与第一种方法的不同是将每个样本都做一次验证集，剩下的全部样本作为训练集，假设有n个样本，则共有n个模型。最终可以取分类准确率的平均数来作为分类的性能指标。几乎用上了所有样本作为训练集，最接近原始的样本，几乎没有信息损失，结果更为可靠，这种方法更受欢迎。 本文的CV方法采用的就是第二种方法。  1) AIC, BIC模型的实现步骤 a) 计算总体的概率密度。假设 y i , i = 1 , ⋯ , n ，是来自总体 的样本。 y i = X i β + ε i (3) 其中 y i ~ N ( X ′ i , σ 2 ) ， ε i ~ i i d N ( 0 , σ 2 ) 若 y i 的密度函数为 f ( y i | β , σ 2 ) = 1 2 π σ 2 exp ( − ( y i − X ′ i β ) 2 2 σ 2 ) (4) 则似然函数为 L = f ( y | β , σ 2 ) = ∏ 1 n f ( y i | β , σ 2 ) = ∏ i = 1 n { 1 2 π σ 2 exp ( − ( y i − X ′ i β ) 2 2 σ 2 ) } (5) b) 计算对数似然函数。对数似然函数为 ln L = − n 2 ln ( 2 π ) − n 2 ln ( σ 2 ) − { ∑ i = 1 n ( y i − X ′ i β ) 2 2 σ 2 } (6) c) 求出参数 σ 2 的极大似然估计 σ ^ 2 = ∑ i = 1 n ( y i − X ′ i β ) 2 n (7) d) 计算 β 的最小二乘估计 在正太分布的情况， β 的极大似然估计与最小二乘估计无大的区别。在本文中用的是最小二乘估计。 β ^ = ( X ′ X ) − 1 X ′ y (8) e) 计算AIC与BIC。将计算得到的参数估计值代入计算AIC, BIC A I C = − 2 L ( β ^ , σ ^ 2 | Y ) + 2 ( p + 1 ) (9) B I C = − 2 L ( β ^ , σ ^ 2 | Y ) + ( p + 1 ) ln ( n ) (10) 其中p表示的是参数的数目，n表示的是总的样本量。 2) CV模型的实现步骤 设总的数据的样本书目为n， y i 为因变量， x i 为自变量，用CV来选择模型。 第一步：删除 ( x 1 , y 1 ) ，用 ( x 2 , y 2 ) , ⋯ , ( x n , y n ) 作为训练集，用最小二乘法来做参数估计。 β ^ [ − 1 ] = ( X ′ X ) − 1 X ′ y (11) 其中 β ^ [ − 1 ] 表示已经去除了第一个样本的参数估计值。预测误差为 ( y 1 − x ′ 1 β ^ [ − 1 ] ) 2 。 第二步：删除 ，用 ( x 1 , y 1 ) , ( x 3 , y 3 ) , ⋯ , ( x n , y n ) 作为训练集，用最小二乘法来做参数估计。 β ^ [ − 2 ] = ( X ′ X ) − 1 X ′ y (12) 其中 β ^ [ − 2 ] 表示已经去除了第二个样本的参数估计值。 预测误差为 ( y 2 − x ′ 2 β ^ [ − 2 ] ) 2 。 第三步往后，依次删除一个样本，用这个删除的样本作为测试集，用剩下的样本来做参数估计，并求得预测误差。 最后一步：删除 ( x n , y n ) ，用 ( x 1 , y 1 ) , ⋯ , ( x n − 1 , y n − 1 ) 作为训练集，用最小二乘法来做参数估计。 β ^ [ − n ] = ( X ′ X ) − 1 X ′ y (13) 其中 β ^ [ − 2 ] 表示已经去除了第二个样本的参数估计值。 预测误差为 ( y n − x ′ n β ^ [ − n ] ) 2 总共进行了n次，则有n个预测误差。 计算累加的误差之和。 CV = ∑ 1 n ( y i − x ′ i β ^ [ − i ] ) 2 (14) 则CV就是当前模型的误差。 如果有k个模型，只需要比较这k个CV值，选择最小CV值对应的模型就是最优的模型。"
"本文的数据来源于WAGE2，共有935个样本，12个变量，本文主要对这12个变量进行数据分析，变量说明如下表1。 Table 1 y x1 x2 x3 x4 x5 lwage hours IQ KWW educ exper x6 x7 x8 x9 x10 x11 tenure age married black south urban 表1. WAGE2中的变量说明  运用MATLAB来进行统计分析，运行代码，得到的统计结果如下表2~5，代码见附录1。 1) 平均值 Table 2 y x1 x2 x3 x4 x5 x6 x7 x8 x9 x10 x11 6.779 43.929 101.28 35.744 13.468 11.564 7.2342 33.08 0.893 0.1283 0.3412 0.7176 表2. WAGE2中的变量的平均值 2) 中位数 Table 3 y x1 x2 x3 x4 x5 x6 x7 x8 x9 x10 x11 6.8079 40 102 37 12 11 7 33 1 0 0 1 表3. WAGE2中的变量的中位数 3) 众数 Table 4 y x1 x2 x3 x4 x5 x6 x7 x8 x9 x10 x11 6.9078 40 96 38 12 11 1 30 1 0 0 1 表4. WAGE2中的变量的众数 4) 方差 Table 5 y x1 x2 x3 x4 x5 x6 x7 x8 x9 x10 x11 0.1774 52.19 226.58 58.351 4.8253 19.137 25.758 9.6584 0.0956 0.112 0.225 0.2028 表5. WAGE2中的变量的方差 通过(1) (2) (3) (4)平均数，中位数，众数，与方差的数据特征，我们可以发现，y，x4，x8，x9，x10，x11的数据方差比较小，说明数据分布是较为集中的，它们的中位数与众数都是几乎相同的，说明在中位数附近的数据是较为集中的。 5) 图1是12个变量的相关系数矩阵 图1. WAGE2中的变量的相关系数 由12个变量的相关系数图可以看出，对数工资y与变量x1，x9，x10成反比，与x2，x3，x4，x5，x6，x7，x8，x11成正比，其中与x2的相关性最大，其相关系数为0.3148，说明了对数工资与智商之间的相关性最强。  通过统计作图可以直观的发现数据特征，运用MATLAB画图，得到的统计结果如下，代码见附录2。 1) 12个变量的盒形图，见图2。 图2. WAGE2中的变量的盒形图 上图盒形图更加直观的体现了数据的集中于分散程度，还提供了上四分位数，中位数，下四分位数的信息，能够跟家直观的反应统计特征信息。例如从上图可以观察到变量y与x8，x9，x10，x11的数据都是较为集中，并且还可以根据分位点，中位数来判断数据的分布情况。 2) 样本概率图形。 对y这个变量做概率图形，由前面的概率特征可知，平均值为6.779众数为6.9078。我们想要求得对数工资y在区间[6, 7.5]概率，如下图3结果。 图3. 对数工资的样本概率图形 可以直观的发现对数工资y在区间[6, 7.5]概率是92.4%，这说明的大多数数据都集中在6到7.5这个区间，只有极小部分不在这个区间。也可以类似的去查看其他变量的数据分布所占比例。"
"本章用线性模型研究“对数薪水”和其他协变量之间的关系，考虑12个带有嵌套结构的备选模型 模型1： y i = β 0 + ε i ， ε i ~ i i d N ( 0 , σ 2 ) 模型2： y i = β 0 + β 1 x i + ε i ， ……… 模型12： y i = β 0 + β 1 x i + ⋯ + β 11 x 11 ε i ， ε i ~ i i d N ( 0 , σ 2 ) 旨在用AIC, BIC, CV来从这12个模型中选择合适的模型，更好的解释对数薪水与其他协变量之间的关系，其中的变量说明见表1。  1) 本节目的：依托WAGE2中所有的935个数据，使用CV，AIC和BIC，从上述12个备选模型里选择合适的模型。 2) 根据2.2节AIC, BIC模型的实现步骤先对全部数据进行模型选择，运行MATLAB代码，见附录3，可以得到AIC, BIC选择模型的结果。 结果如下表6。 Table 6 12个模型的AIC MODEL1 MODEL2 MODEL3 MODEL4 MODEL5 MODEL6 MODEL7 MODEL8 MODEL9 MODEL10 MODEL11 MODEL12 1039.3 1039.2 940.51 899.48 880.18 859.21 842.4 843.43 823.75 814.16 800.79 759.2700765 表6. 12个模型的AIC值 其中最小的AIC的值为759.2700765，对应的模型为12，故有AIC准则确定最优的模型应该为第12个。 Table 7 12个模型的BIC MODEL1 MODEL2 MODEL3 MODEL4 MODEL5 MODEL6 MODEL7 MODEL8 MODEL9 MODEL10 MODEL11 MODEL12 1049 1053.7 959.87 923.68 909.23 893.09 881.13 887 872.16 867.4 858.87 822.1971814 表7. 12个模型的BIC值 由表7知，其中最小的BIC的值为822.1971814，对应的模型为12，故由BIC准则确定最优的模型也是第12个。 3) 用CV来对全部数据处理，选出最优的模型。 用935个数据，每次抽出一行作为验证集，剩下的934个样本作为训练集，总共需要进行935次，运行MATLAB代码得到如下次结果，代码见附录4。 将CV记作12个模型935次预测误差求和，则最小的CV值就对应最优的模型。 Table 8 12个模型的CV(935次的预测误差求和) MODEL1 MODEL2 MODEL3 MODEL4 MODEL5 MODEL6 MODEL7 MODEL8 MODEL9 MODEL10 MODEL11 MODEL12 166.01 166.14 149.5 143.1 140.21 137.11 134.71 134.87 132.06 130.7 128.87 123.2714065 表8. 12个模型的CV值 由上表8的结果知，最小的CV值为123,2714065，对应的模型为第12个，故由CV的判别准则第12个模型是最优的。 综上：AIC, BIC, CV这三个判别准则所选的模型都是第12个模型，所以第12个模型就是最优模型。 4) 用最小二乘法对第12个模型进行拟合，运行MATLAB代码，见附录5，加结果如下： 第12个模型中y与x的散点图如下图4。 图4. 第12个模型的散点图 最小二乘估计的参数结果如下表9。 Table 9 β 0 β 1 β 3 β 4 β 5 β 6 β 7 β 8 β 9 β 10 β 11 5.2797 −0.006 0.0033 0.0035 0.0492 0.0105 0.01 0.0054 0.195 −0.142 −0.081 0.1775 表9. 12个模型的CV值 第12个模型拟合的方程如下 y = 5.2797 − 0.006 x 1 + 0.0033 x 2 + 0.0035 x 3 + 0.0492 x 4 + 0.0105 x 5 + 0.01 x 6     + 0.0054 x 7 + 0.195 x 8 − 0.142 x 9 − 0.081 x 10 + 0.1775 x 11  由4.2的结果知，AIC, BIC与CV所选的模型都为第12个模型，且由最小二乘估计得到了第12个模型的拟合的方程 y = 5.2797 − 0.006 x 1 + 0.0033 x 2 + 0.0035 x 3 + 0.0492 x 4 + 0.0105 x 5 + 0.01 x 6     + 0.0054 x 7 + 0.195 x 8 − 0.142 x 9 − 0.081 x 10 + 0.1775 x 11 我们发现， 1) y与变量x1的系数为负值，说明lwage与hours是成反比的关系，hours每减少1个单位，lwage增加0.006个单位，说明了现代社会对效率的要求越来越高，效率越高，报酬越多； 2) y与变量x2的系数为正值，说明lwage与IQ是成正比关系，说明智商每增加一个单位，对数工资就增加0.0033个单位，同时也说明了智商高的人获得的工资报酬就越高； 3) y与变量x3的系数为正值，说明lwage与kww是成正比关系，说明世界工作知识得分每增加一个单位，对数工资就增加0.0035个单位； 4) y与变量x4的系数为正值，说明lwage与educ是成正比关系，说明教育每增加一个单位，对数工资就增加0.0492个单位； 5) y与变量x5的系数为正值，说明lwage与exper是成正比关系，说明工作经验每增加一个单位，对数工资就增加0.0105个单位。 6) y与变量x6的系数为正值，说明lwage与enure是成正比关系，说明与现任雇主共事年限每增加一个单位，对数工资就增加0.01个单位。 7) y与变量x7的系数为正值，说明lwage与age是成正比关系，说明在一定的年龄范围内，年龄每增加一个单位，对数工资就增加0.0054个单位。因为在一定年龄范围内，年龄大的人相对来讲工作经验会多一点，知识储备会多一些，所以获得的工资报酬也会相对的高一些。 8) y与变量x8的系数为正值，说明lwage与married是成正比关系，说明已婚每增加一个单位，对数工资就增加0.195个单位。 9) y与变量x9的系数为负值，说明lwage与black是成反比关系，说明黑人获得的工资会更少一些，同时也说明了现代社会依然存在着种族歧视。 10) y与变量x10的系数为负值，说明lwage与south是成反比关系，说明越靠近南边，工资越少，因为当前全球区域经济发展不平衡，例如南非，经济发展落后，所以工资报酬会更低一点。 11) y与变量x11的系数为正值，说明lwage与urban是成正比关系，说明了生活在标准城市统计区的人工资报酬会更高一点。因为标准城市区域经济会相对发达一点，所以工资报酬会相对较高一点。  在4.2节中，我们只对模型进行了一次选择，并不很具有说服力，所以在本小节，我们对模型重复进行1000次选择，采用随机抽样的方法将数据集随机地分为训练集(500个样本)和测试集(435个样本)，依托训练集，使用CV，AIC和BIC，从12个备选模型里选择模型，并用选出的模型预测测试集里的测试样本，考察预测误差评价CV，AIC和BIC三种模型选择准则中哪种准则的表现最好。 运行MATLAB代码，得到结果，代码见附录6。 1) 图5是12个模型与运行1000次得到的AIC，维度为12行1000列。由于空间有限，仅显示部分结果。 图5. 运行1000次得到的AIC值 可以发现，1000次运行结果中都是第12个模型的AIC的值最小，故选择第12个模型为最优模型。 下图是最小AIC对应模型的预测误差(即第12个模型的预测误差)，因为重复进行1000次，故有1000个预测误差，空间有限仅显示前10次的结果，见表10。 Table 1 0 最小AIC对应模型的预测误差(即第12个模型的预测误差) 第1次 第2次 第3次 第4次 第5次 第6次 第7次 第8次 第9次 第10次 0.12283 0.12899 0.13141 0.13486 0.12908 0.14693 0.13845 0.1344 0.12962 0.11813 表10. 最小AIC对应模型的预测误差 2) 下图是12个模型与运行1000次得到的BIC，也仅展示部分结果，见图6。 图6. 运行1000次得到的BIC值 同样可以发现，1000次运行结果中都是第12个模型的BIC的值最小，故选择第12个模型为最优模型。 下图是最小BIC对应模型的预测误差(即第12个模型的预测误差)，因为重复进行1000次，故有1000个预测误差，空间有限仅显示前10次的结果，见表11。 Table 1 1 最小BIC对应模型的预测误差(即第12个模型的预测误差) 第1次 第2次 第3次 第4次 第5次 第6次 第7次 第8次 第9次 第10次 0.122830573 0.128987541 0.131413267 0.134855128 0.129082835 0.146934749 0.138448017 0.134397175 0.129622311 0.118126556 表11. 最小BIC对应模型的预测误差 3) 下图是CV运行1000次得到的预测误差，共12行1000列，篇幅限制，仅展示部分结果，见图7。 图7. 运行1000次CV的预测误差 下图是1000次中每次选中的模型，篇幅限制，仅展示部分结果，见表12。 Table 1 2 1000次中每次选中的最优模型 第1次 第2次 第3次 第4次 第5次 第6次 第7次 第8次 第9次 第10次 7 11 4 6 7 12 12 1 3 12 表12. 1000次中每次选中的最优模型 下图是1000次中每个模型被选中的概率。 Table 1 3 1000次中每个模型被选中的比例 MODEL1 MODEL2 MODEL3 MODEL4 MODEL5 MODEL6 MODEL7 MODEL8 MODEL9 MODEL10 MODEL11 MODEL12 0.114 0.093 0.111 0.088 0.052 0.062 0.043 0.038 0.036 0.042 0.093 0.228 表13. 1000次中每个模型被选中的比例 由表13，可以发现第12个模型被选中的比例最高，为22.8%，其他模型被选中的比例明显都比较小，所以CV模型选中的依然是第12个模型。 综上：AIC, BIC, CV三个模型选出的全部为第12个模型最优，故认为第12个模型为最优的模型。"
"依托前面的知识准备，通过第三章的描述性统计分析，可以清楚直观的看到数据的分布特征及其变量的相关关系。然后在第四章用AIC, BIC, CV准则依托全部数据来进行模型选择，最后3个准则选出的最优模型均为第12个模型，故此，对第12个模型用最小二乘法进行了拟合，求得参数，得到方程，进而用经济学原理对求得的第12个模型进行解释。但是考虑到一次实验结果并不是十分具有说服力，因此，又将实验重复1000次，再次看模型选择的结果，结果发现AIC, BIC在这1000次实验中一致选择的是第12个模型，而CV选择的模型依概率算是占比最高的，为22.8%，说明在1000次实验中，选择第12个模型的次数占228次。而选择其他模型的比例最高占据11.4%，故此一致认为第12个模型是最优的。"
