"本研究使用事件相关电位技术(Event Related Brain Potential, ERP)和连续闪烁抑制范式(Continuous Flash Suppression, CFS)对比了面孔吸引力在有、无意识条件诱发的神经活动。有意识条件下，请被试判断面孔性别。无意识条件下，使用CFS范式，在优势眼呈现彩色噪音图，同时在非优势眼呈现低对比度的面孔，请被试报告噪音图的对比度变化(实际是考察被试在不能意识到面孔存在的情况下能否加工面孔吸引力)。结果发现，有意识条件下，高、低吸引力面孔诱发了N170、P2、N3和LPC的差异。表明人们能自动提取面孔吸引力信息。无意识条件没发现面孔吸引力的效应，但完整面孔和打散面孔诱发了P2和N3的差异。结果表明，无意识条件会阻碍个体加工面孔吸引力信息，面孔吸引力的加工需要意识的参与。 关键词 :面孔吸引力，意识，无意识加工，ERP，连续闪烁抑制 Copyright © 2020 by author(s) and Hans Publishers Inc. This work is licensed under the Creative Commons Attribution International License (CC BY 4.0). http://creativecommons.org/licenses/by/4.0/"
"人类向往成为美丽的人，也乐于选择美丽的人成为自己的伴侣。“美丽”即吸引力(attractiveness)，在社会交往中扮演重要的角色。面孔吸引力(facial attractiveness)是人际印象的重要方面，是指“目标人物面孔所诱发的积极愉悦的情绪体验并驱使他人产生一定程度的接近意愿”(寇慧等，2013；李鸥，陈红，2010)。当前是一个看脸的时代，很多人不但追捧“小鲜肉”和“女神”，还关注美容、美妆等时尚产业，以提升自己的面孔吸引力。面孔吸引力能被快速的感知，进而影响注意、时间知觉、学习、记忆和决策等认知过程(尚俊辰，陈文锋，季琭妍，2018)。 近年来，许多研究者使用功能磁共振成像(functional magnetic resonance imaging, fMRI)技术探讨面孔吸引力加工所激活的脑区。研究发现，面孔吸引力会激活与奖赏有关的脑区，包括杏仁核(Winston, O’Doherty, Kilner, Perrett, & Dolan, 2007)、前扣带回(Cloutier, Heatherton, Whalen, & Kelley, 2008; Liang, Zebrowitz, & Zhang, 2010; Tsukiura & Cabeza, 2011a, 2011b)、伏隔核(Aharon et al., 2001; Cloutier et al., 2008; Liang et al., 2010)、眶额皮层(Cloutier et al., 2008; Liang et al., 2010; O’Doherty et al., 2003; Shen et al., 2016; Tsukiura & Cabeza, 2011a; Tsukiura & Cabeza, 2011b; Wang et al., 2015)、尾状核(Liang et al., 2010; Shen et al., 2016)、内侧前额叶皮层(Cloutier et al., 2008; O’Doherty et al., 2003)、壳核(Liang et al., 2010; Wang et al., 2015)和腹侧被盖区(Liang et al., 2010)等。虽然不同吸引力面孔对这些脑区激活程度差异不一致，但多数研究发现高吸引力面孔对奖赏脑区激活程度更大(Shen et al., 2016; Tsukiura & Cabeza, 2011a; Wang et al., 2015)。表明高吸引力面孔是奖赏刺激。 另一些研究者使用具有较高时间分辨率的ERP技术探讨面孔吸引力引起的脑内时程动态变化。使用吸引力评价任务的研究中，Schacht, Werheid和Sommer (2008)发现高、低吸引力比中等吸引力面孔在150 ms左右诱发了更大的早期成分(在大脑后部为正波, 大脑前部为负波)及LPC (Late positive component, 492~792 ms)。但该研究的面孔表情评分与吸引力评分相关。与以上研究类似，Marzi和Viggiano (2010)发现高吸引力比低吸引力面孔诱发波幅更大的P2 (150~200 ms)、N170 (150~200 ms)和LPC (300~500 ms)。张妍等控制了面孔的情绪效价、唤醒度和优势度，发现高吸引力比低吸引力面孔诱发更大的N3和LPC (350~550 ms) (张妍等，2010；Zhang et al., 2011)。Lu, Wang, Wang, Wang和Qin (2014)发现高吸引力比低吸引力卡通面孔对男性诱发更大的N170和LPC (400~600 ms)，而对女性来说，高吸引力比低吸引力卡通面孔诱发更小的N170，LPC没有显著差异。Zhang和Deng (2012)使用oddball范式结合吸引力评价任务，发现高吸引力比低吸引力面孔诱发更大的P2 (150~230 ms)和N3 (230~330 ms)。此外，个别研究还发现面孔吸引力诱发了EPN (early posterior negativity, Marzi & Viggiano, 2010)、P1 (陈红，朱岚，2012；Zhang & Deng, 2012)和P3b (Zhang & Deng, 2012)的差异。很多使用与吸引力评价无关的任务的研究则发现面孔吸引力诱发了N170 (Marzi & Viggiano, 2010; Zhang, Wei, Zhao, Zheng, & Zhang, 2016)、P2 (张妍等，2010; Chen et al., 2012; Cui, Cheng, Lin, Lin, & Mo, 2019; Marzi & Viggiano, 2010; van Hooff, Crawford, & van Vugt, 2011; Zhang et al., 2011; Zhang et al., 2016)、N3 (张妍等，2010；张妍，孔繁昌，郭英，任俊，陈红，2012；Zhang et al., 2011)和LPC (张妍等，2010；Chen et al., 2012; Cui et al., 2019; Ma, Hu, Jiang, & Meng, 2015; Ma, Qian, Hu, & Wang, 2017; Ma, Zhang, Pei, & Abdeljelil, 2017; Marzi & Viggiano, 2010; Pei & Meng, 2018; van Hooff et al., 2011; Wiese, Altmann, & Schweinberger, 2014; Zhang et al., 2011)的差异。此外，个别研究还发现面孔吸引力诱发了N1 (刘金平，李藏，2018；张妍等，2012)、N2 (汝涛涛等，2017；张妍等，2012；Chen et al., 2012; Jin, Fan, Dai, & Ma, 2017; Ma et al., 2015; Ma, Zhang, Pei, & Abdeljelil, 2017; Marzi & Viggiano, 2010; Pei & Meng, 2018)、EPN (Wiese et al., 2014)、P1 (Zhang et al., 2016)和P300 (Ma, Zhang, Pei, & Abdeljelil, 2017; Oliver-Rodriguez, Guan, & Johnston, 1999)的差异。 上述研究中，面孔都是可见的，缺少对面孔吸引力无意识加工的探讨。几项行为研究探讨了面孔吸引力的无意识加工，认为面孔吸引力在无意识条件下仍能被加工。Olson和Marshuetz (2005)使用前后掩蔽范式，先呈现39 ms的前掩蔽刺激，之后呈现13 ms的目标面孔刺激，再呈现39 ms的后掩蔽刺激。要求被试尽可能判断目标面孔的吸引力。结果发现，被试对高吸引力面孔的评分显著高于低吸引力面孔。说明尽管面孔呈现时间很短，吸引力仍能被感知。Hung, Nieh和Hsieh (2016)使用突破连续闪烁抑制范式(breaking continuous flash suppression, b-CFS)，在被试的优势眼呈现彩色噪音图(蒙德里安图片)，同时在非优势眼呈现一张面孔刺激，目标面孔的对比度不断增加，要求被试一旦看见面孔的任何部分就按键。结果发现，高吸引力面孔比低吸引力面孔优先突破抑制进入意识。Nakamura和Kawabata (2018)认为不设置控制条件，无法知晓美丽面孔的快速知觉是否仅是被试对其反应更快所致。因此Nakamura和Kawabata使用相同范式对实验进行完善，实验中既有面孔被抑制成不可见的条件(优势眼呈现彩色噪音图，非优势眼呈现面孔，面孔的对比度不断增加)，又有面孔不被抑制的条件(即控制条件，优势眼和非优势眼都呈现彩色噪音图，面孔刺激在噪音图上叠加呈现，且面孔刺激的对比度不断增加)。要求被试无论在哪个条件下，一旦看到面孔的任何部位就立刻按键报告面孔所在位置。结果发现，在面孔被抑制成不可见的条件下，高吸引力面孔优先突破抑制进入意识，验证了Hung等(2016)的研究。然而在面孔不被抑制的条件下，吸引力没有影响知觉速度。表明面孔吸引力在无意识条件下能被加工，人们对面孔吸引力的评价是自发的，不一定依赖于对面孔的感知。但是b-CFS范式中，面孔图片的对比度逐渐增加，被试最终需要看到面孔的一部分才做反应，体现了目标刺激从不可见到可见的过程。其反应时间不能反映严格意义的无意识加工。Tsikandilakis, Bali和Chapman (2018)发现了不同于前三项研究的结果。他们使用后掩蔽范式将刺激呈现33.33 ms，让被试判断看到的图片是不是面孔。如果看到的是面孔，被试则判断面孔表情和评价吸引力。如果看到的不是面孔，则报告自己的情绪体验并评价刺激的吸引力。结果发现，被试在对面孔能正确探测的情况下，对高吸引力面孔的评分要高于较低吸引力面孔。但是，对面孔不能正确探测的情况下，吸引力评分没有显著差异，表明吸引力的评价需要意识。但该研究刺激呈现时间较长，而且对意识的检测不够严格，即使被试报告看到的不是面孔，也不能保证被试没有有意识的感知到该刺激，可能只是没看清楚刺激是什么，因此不能保证被试不能意识到面孔存在。 上述研究都是通过行为指标，只能对面孔吸引力加工进行间接的推测，不能直接反映无意识条件下大脑对面孔吸引力加工的机制，也不清楚面孔吸引力在有、无意识条件下诱发的神经活动是否相同。因此，本研究在有意识条件下使用性别判断任务，在无意识条件下使用CFS范式，借助ERP技术记录面孔吸引力在有、无意识条件下诱发的脑电活动。以往研究使用CFS范式探讨了面孔表情加工的神经机制，Jiang等(2009)发现，当面孔不可见时，与中性面孔和打散面孔相比，恐惧面孔诱发了更大的N1。随后，Jiang, Wu, Saab, Xiao和Gao (2018)发现，当被试不能意识到面孔存在时，与中性面孔相比，恐惧面孔诱发了更大的晚期成分。尽管两个研究都使用CFS范式探讨的都是面孔表情加工，但结果并不一致。另外，表情研究以不同表情的刺激图片为实验材料，而本研究使用中性表情的面孔，面孔表情加工与面孔吸引力加工可能存在差异。本研究假设：在使用严格的意识检测任务前提下，无意识条件下被试不能对面孔吸引力进行加工，有意识条件下面孔吸引力会诱发早期成分和晚期成分的差异。"
"招募50名高校学生参加实验(23男，27女，M = 22.04岁，SD = 2.47岁)，剔除9名被试的数据(其中，3名被试能看到最低对比度的面孔。5名被试在意识检测阶段的正确率不在二项分布的有效范围内，表明其对面孔是否呈现的判断超出随机水平，面孔对其可见。1名被试的脑电数据在去伪迹时统计值过高导致不能叠加平均)，剩余有效被试41人(17男，24女)。所有被试之前都未参加过类似实验，视力或矫正视力正常，无精神类疾病。被试在实验前签订知情同意书，实验结束后给予相应的报酬，本实验经辽宁师范大学伦理委员会批准。  从CUHK Face Sketch Database (CUFS, Wang & Tang, 2009)和CAS-PEAL Face Database (Gao et al., 2008)两个图片库中挑选出495张面孔图片与以往研究(Wang, Tong, Shang, & Chen, 2019)中的244张图片合并，共包括443张男性面孔和296张女性面孔。本研究先招募了33名没有参加正式实验的高校学生(20女，13男，M = 21.30岁，SD = 2.14岁)对面孔材料进行评定，要求被试对每张图片的吸引力水平进行7点评分(1 = 吸引力水平最低，4 = 吸引力中等，7 = 吸引力水平最高)。从中选取120张面孔图片作为ERP实验中的材料，其中，高、低吸引力各60张，男女各半。对两组面孔图片的吸引力评分进行单因素方差分析，结果显示：高吸引力面孔(M = 4.31，SD = 0.62)的吸引力评分显著高于低吸引力面孔(M = 2.18，SD = 0.12)，F(1，118) = 693.21，p < 0.001， η p 2 = 0.855，95% CI [0.82，0.88]。 使用Photoshop CS软件将120张面孔图片尺寸统一为120 × 180像素，作为原始面孔刺激。对120张原始图片的对比度进行调整，分别调成三个档次(分别是原始图片对比度的10%、20%和30%)。另外，使用Matlab R2012b软件，按8 × 8像素将每张原始面孔刺激打成若干小块，将小块的顺序打乱重新随机排列组合生成120张打散图。同样对原始打散图的对比度进行调整，分别调成三个档次(分别是原始打散图对比度的10%、20%和30%)。选择20张蒙德里安图片作为噪音图，大小与面孔图片相同，其中10张用作CFS正式实验，10张用作填充实验(再将其中的5张噪音图对比度调低50%)。在120张正式实验图片之外的面孔中选出20张作为练习图片，用相同的方法生成相对应的三个对比度的练习图片和练习的打散图。 用E-prime 2.0软件编制实验程序，刺激在宽为59.8 cm，高为33.6 cm的AOC液晶显示器(屏幕分辨率为1024 × 768，刷新频率为100 Hz)上呈现。实验在无噪音的暗室内进行，保证被试坐在椅子上的舒适程度，用头托固定被试的头部。使用平面立体镜将电脑左右两侧图像分别反射至被试的左眼和右眼。  采用2 (面孔吸引力水平：高、低) × 2 (面孔性别：男、女)被试内实验设计。自变量是面孔吸引力和面孔性别。有意识条件的因变量是N170、P2、N3和LPC的平均波幅，无意识条件的因变量是N170、P2和N3的平均波幅。  首先用Dolman法(Anderson, Siegel, White, & Barrett, 2012)测定被试的优势眼。请被试正面坐在屏幕前面，被试眼睛与屏幕中心的距离为1 m。首先，我们通过一个调试程序对每一名被试进行平面立体镜校正，直到两侧的图像很好地在视野中央融合。正式实验分为无意识和有意识两部分，被试先做无意识部分，再做有意识部分。 无意识条件包括三个部分(调整对比度、CFS正式实验、意识检测)，程序改编自Jiang等(2009)和Jiang等(2018)。首先，调整图片对比度任务用来找到适合被试的对比度等级，保证目标面孔不可见(见图1(a))。双眼同时呈现中央注视点，注视点与屏幕中心的距离为9.2 cm。300~700 ms后，优势眼的方框中呈现彩色噪音图，以20 Hz的频率变化。同时，非优势眼的方框中呈现低对比度面孔图片。面孔图片和噪音图片的视角相同(4.1˚ × 4.5˚)，呈现时间为500 ms。图片消失之后，请被试回答两个问题。第一，是否看到面孔，看到按1，没看到按2。第二，看到人脸的清晰程度，1代表完全没看到，2代表模糊地看到，3代表几乎清楚地看到，4代表完全清楚地看到。被试根据实际情况作答即可，至此一个试次结束。对比度调整部分共包括6个练习试次和20个正式试次，面孔呈现的顺序随机。若被试看不到对比度为原始图片对比度的30%的面孔刺激(第一题答对的次数小于14，且对第二个问题的答案是完全看不到的试次大于14)，程序就会自动跳转到含有该对比度面孔的CFS正式实验。若被试能看到该对比度的面孔刺激(第一题答对的次数大于14，且对第二个问题的答案是完全看不到的试次小于14)，程序就会跳转到对比度低一级的对比度调整程序。以此类推，若被试仍能看到对比度为原始图片对比度的10%的面孔，程序就会跳转到结束部分，说明面孔一直对被试是可见的，该被试不能参加正式CFS实验。CFS正式实验(见图1(b))的具体流程和调整对比度部分大体一致，但是不需要被试回答看到人脸的清晰程度。另外，CFS正式实验部分还加入了填充试次。填充试次的目的是让被试集中注意力，被试的优势眼呈现噪音图，其中五张噪音图的对比度调低50%，同时非优势眼只呈现外周方框。CFS正式实验中，要求被试判断噪音图的亮度是否变暗，如果发现变暗，就要立刻按“↓”键，被试按键的试次数据不分析。正式实验之前，被试先做10个练习试次。CFS正式实验共包括720个试次，面孔呈现的顺序随机。对于120张完整面孔图片，每张面孔呈现4次。对于120张打散面孔图片，每张面孔呈现1次。被试做完60个试次就休息一分钟。最后，为检验被试是否不能意识到面孔存在，设置了意识检测部分(见图1(a))。意识检测的实验流程和调整对比度实验完全相同。被试先做6个练习试次，共包括240个试次，面孔呈现顺序随机，被试做完60个试次就休息一分钟。每张面孔呈现1次。 有意识部分中(见图1(c))，实验图片和无意识条件一致。被试先进行练习实验，共6个试次。正式实验中，先呈现注视点。300~700 ms后，呈现面孔图片，呈现时间为500 ms。之后请被试判断面孔性别，认为面孔是男性就按1，女性就按2。这部分共包括360个试次，共120张面孔，每张面孔呈现3次。面孔刺激呈现的顺序随机，被试做60个试次就休息一次。 图1. 流程图  使用德国Brain Products公司的64导ERP记录与分析系统采集数据，采样频率为500 Hz，以双侧乳突作为参考电极点，接地点在FPz和Fz中间，另有一个电极记录眼电。所有电极处的头皮电阻保持在5 KΩ以下，在完成连续记录EEG之后进行离线(offline)处理数据。使用Analyzer 2.0软件对数据进行预处理，滤波带通为0.01~30 Hz。分别分析有、无意识条件下面孔出现后所诱发的ERP，对–200~1000 ms的数据进行分段和叠加平均。分析时程为面孔出现后1000 ms，用面孔出现前的200 ms作为基线进行校正。另外，排除伴有眨眼、肌电等伪迹的数据，以±80 μV为排除标准。 根据前人研究和本研究得到的波形图，最终分析的成分和时间窗口为N170 (130~180 ms) (Marzi & Viggiano, 2010)、P2 (190~240 ms) (Huffmeijer, Eilanger, Mileva-Seitz, & Rippe, 2018)、N3 (280~380 ms) (Zhang et al., 2011; Zhang & Deng, 2012)和LPC (450~560 ms) (Ma, Zhang, Pei, & Abdeljelil, 2017)。分别对面孔诱发的脑电成分的平均波幅做2 (面孔吸引力水平：高、低) × 2 (面孔性别：男、女) × 3 (区域：左、中、右) × 5 (脑区：额区、额中区、中央区、中央顶区、顶区)重复测量方差分析，用Greenhouse-Geisser对不符合球形假设的结果进行校正。"
"为确保正式实验中被试看不到面孔，使用二项分布来分析意识检测任务的正确率，以剔除能看到面孔的被试。μ = np = 120，σ = npq = 7.75，二项分布正确率的上限为：(μ + 1.645σ)/240 = 0.5531，下限为：(μ – 1.645σ)/240 = 0.4469，因此有效范围为(0.4469，0.5531)，正确率在此范围内即是随机水平。凡是正确率大于0.5531或者小于0.4469的被试，表明其能看到面孔，并将其数据剔除。共剔除4名男性，1名女性。 在无意识条件CFS正式实验部分中，将被试反应为“看到面孔”的试次的ERP数据剔除，只分析反应为“没看到面孔”的试次。CFS正式实验中总试次为29520个，其中剔除200个无效试次，无效试次占总试次的0.68%。   N170 (130~180 ms)：面孔吸引力、面孔性别和区域交互作用显著，F(2，80) = 3.52，p = 0.034， η p 2 = 0.081，95% CI [0，0.17]。简单简单效应检验发现，在左侧区域，高吸引力男性面孔(M = −4.66 μV，SD = 3.20 μV)比低吸引力男性面孔(M = −4.29 μV，SD = 3.64 μV)诱发更大的N170，F(1，40) = 26.27，p < 0.001，95% CI [0.20，0.54]。在中间区域，高吸引力男性面孔(M = −6.08 μV，SD = 3.63 μV)比低吸引力男性面孔(M = −5.78 μV，SD = 3.74 μV)诱发更大的N170，F(1，40) = 26.38，p < 0.001，95% CI [0.20，0.54]，高吸引力女性面孔(M = −6.49 μV，SD = 3.23 μV)比低吸引力女性面孔(M = −6.24 μV，SD = 3.72 μV)诱发更大的N170，F(1，40) = 12.05，p = 0.001，95% CI [0.06，0.39]。在右侧区域，高吸引力女性面孔(M = −4.89 μV，SD = 2.86 μV)比低吸引力女性面孔(M = −4.54 μV，SD = 3.19 μV)诱发更大的N170，F(1，40) = 12.12，p = 0.001，95% CI [0.06，0.39]。面孔吸引力的主效应以及面孔吸引力与其他变量的交互作用皆不显著，Fs < 1.12，ps > 0.35。 P2 (190~240 ms)：面孔吸引力、面孔性别和脑区交互作用显著，F(1.54，61.48) = 3.77，p = 0.039， η p 2 = 0.086，95% CI [0，0.20]。简单简单效应检验发现，在每一脑区，高吸引力男性面孔都比低吸引力男性面孔诱发更大的P2，Fs > 5.64，ps < 0.023。在中央区，高吸引力女性面孔(M = −0.57 μV，SD = 4.76 μV)比低吸引力女性面孔(M = −0.62 μV，SD = 4.33 μV)诱发更大的P2，F(1，40) = 50.75，p < 0.001，95% CI [0.37，0.67]，然而在其他四个脑区，低吸引力女性面孔比高吸引力女性面孔诱发更大的P2，Fs > 19.81，ps < 0.001。另外，面孔吸引力的主效应以及面孔吸引力与其他变量的交互作用皆不显著，Fs < 2.96，ps > 0.08。 N3 (280~380 ms)：面孔吸引力和脑区交互作用显著，F(1.79，71.54) = 3.78，p = 0.032， η p 2 = 0.086，95% CI [0，0.19]。此外，面孔吸引力、面孔性别和脑区交互作用显著，F(1.55，61.85) = 3.63，p = 0.043， η p 2 = 0.083，95% CI [0，0.20]。简单效应检验发现，在每一脑区，低吸引力女性面孔都比高吸引力女性面孔诱发更大的N3，Fs > 77.61，ps < 0.001。在顶区，低吸引力男性面孔(M = 1.31 μV，SD = 3.38 μV)比高吸引力男性面孔(M = 1.17 μV，SD = 3.61 μV)诱发更大的N3，F(1，40) = 42.61，p < 0.001，95% CI [0.32，0.63]，然而在其他四个脑区，高吸引力男性比低吸引力男性诱发更大的N3，Fs > 14.15，ps < 0.002。另外，面孔吸引力的主效应以及面孔吸引力与其他变量的交互作用皆不显著，Fs < 3.16，ps > 0.08。 LPC (450~560 ms)：面孔吸引力和面孔性别交互作用显著，F(1，40) = 4.11，p = 0.049， η p 2 = 0.093，95% CI [0，0.25]。简单效应检验发现，女性面孔吸引力的简单效应显著，F(1，40) = 4.23，p = 0.046，95%CI [0，0.25]，高吸引力女性面孔(M = −0.65 μV，SD = 4.77 μV)比低吸引力女性面孔(M = −1.80 μV，SD = 3.52 μV)诱发更大的LPC。另外，面孔吸引力的主效应以及面孔吸引力与其他变量的交互作用皆不显著，Fs < 2.26，ps > 0.12。  N170 (130~180 ms)：面孔吸引力的主效应以及与面孔吸引力有关的交互作用皆不显著，Fs < 1.69，ps > 0.19。 P2 (190~240 ms)：面孔吸引力的主效应以及与面孔吸引力有关的交互作用皆不显著，Fs < 0.75，ps > 0.45。 N3 (280~380 ms)：面孔吸引力的主效应以及与面孔吸引力有关的交互作用皆不显著，Fs < 1.15，ps > 0.33。  虽然无意识条件没发现面孔吸引力效应，但为检验被试能否对面孔进行一定程度加工，我们对完整面孔和打散面孔进行了分析。根据无意识条件脑电波波形，对面孔诱发的P2 (210~260 ms)和N3 (310~380 ms)的平均波幅做2 (面孔结构：完整、打散) × 3 (区域：左、中、右) × 5 (脑区：额区、额中区、中央区、中央顶区、顶区)重复测量方差分析。 在P2 (210~260 ms)成分上，面孔结构和脑区交互作用显著，F(1.48，59.35) = 5.49，p = 0.012， η p 2 = 0.121，95% CI [0.02，0.24]。简单效应检验发现，无论在哪个脑区，面孔结构的简单效应都显著，Fs > 25.63，ps < 0.001。在额区和额中区，打散面孔比完整面孔诱发更大的P2，Fs > 25.63，ps < 0.001，然而在中央区、中央顶区和顶区，完整面孔比打散面孔诱发更大的P2，Fs > 49.11，ps < 0.001。面孔结构的主效应以及面孔结构与其他变量的交互作用皆不显著，Fs < 2.96，ps > 0.05。 在N3 (310~380 ms)成分上，面孔结构和脑区交互作用显著，F(1.64，65.75) = 3.90，p = 0.032， η p 2 = 0.089，95% CI [0，0.20]。简单效应检验发现，无论在哪个脑区，完整面孔都比打散面孔诱发更大的N3，Fs > 24.96，ps < 0.001。面孔结构的主效应以及面孔结构与其他变量的交互作用皆不显著，Fs < 1.51，ps > 0.19。"
