"目的：探讨安罗替尼联合同步放化疗对局部晚期食管癌的治疗效果及安全性分析。方法：选取2019-01-01到2020-04-30间我院收治的252例接受同步放化疗的局部晚期食管癌患者作为回顾性分析研究对象，其中21例加用盐酸安罗替尼药物联合同步放化疗方案，231例采用无盐酸安罗替尼的常规同步放化疗方案，利用倾向评分匹配(Propensity Score Matching, PSM)方法排除年龄、性别等非研究因素的干扰 [ 1 ]，最终入组42名病人(21名采用“安罗替尼 + 同步放化疗”方案，21名采用“常规同步放化疗”方案)，分别在治疗后第12周、24周、36周、48周、60周对患者进行疗效评价及不良反应评估，并跟踪统计两组患者食管癌的局部控制率。结果：安罗替尼联合同步放化疗方案组患者肿瘤局部控制率显著优于常规同步放化疗组患者(P < 0.05)。安罗替尼组患者常见不良的反应为手足综合征(HFS)，安罗替尼组的患者手足综合征分级均为II级以下。常规同步放化疗方案组患者的主要不良反应为放射性食管炎及放射性肺炎。结论：安罗替尼联合同步放化疗较常规同步放化疗方案可明显提高食管癌局部晚期患者的肿瘤局部控制率，改善治疗效果。 关键词 :食管癌，安罗替尼，同步放化疗，局部控制率 Copyright © 2020 by author(s) and Hans Publishers Inc. This work is licensed under the Creative Commons Attribution International License (CC BY 4.0). http://creativecommons.org/licenses/by/4.0/"
"食管癌，是一种广泛发生于全球多个国家和地区，具有恶性程度高、死亡率高、复发率高、治疗效果差、放化疗不敏感、五年生存率低等临床特点的恶性肿瘤 [ 2 ] [ 3 ]。中国是食管癌的高发国家之一，平均每年约有15万人死于食管癌，中国的食管癌患者中，90%以上食管癌的临床病理类型为鳞状细胞癌。由于食管癌隐匿性高，早期临床症状不易察觉，大多数食管癌发现时已处于局部晚期，丧失手术切除的条件 [ 4 ]。目前，临床上对于局部晚期的食管癌患者(主要为食管发生癌变，侵及食管及周围组织，但没有重要脏器与远处转移的患者)的治疗方案主要是同步放化疗 [ 5 ]。其中，化疗方案主要为以5-FU、顺铂和紫杉醇为主的联合化疗方案进行治疗，放疗方案目前我院采用常规剂量适形调强放疗联合化疗，放疗剂量为54~60.0 Gy，每次1.8 Gy或2.0 Gy (颈段食管癌患者每次2.0 Gy，总剂量为60 Gy)。盐酸安罗替尼是一种新型的小分子多靶点酪氨酸激酶抑制剂，可有效抑制血管内皮细胞生长因子受体(VEGFR)、血小板衍生生长因子受体(PDGFR)、成纤维细胞生长因子受体(FGFR)和c-Kit等激酶，具有显著抗肿瘤血管生成和抑制肿瘤生长的作用 [ 6 ]。"
"本研究选取自2019-01-01至2020-04-30之间接受治疗的局部晚期食管癌患者共252例(其中21例采用安罗替尼联合放射治疗方案，231例采用常规同步放化疗方案)，利用倾向评分匹配(PSM)方法匹配以排除年龄、性别、基础疾病等非研究混杂因素的干扰，最终入组21例安罗替尼联合同步放化疗的患者，21例采用常规同步放化疗方案的患者。该研究项目的内容及过程遵循国际及国家颁布的有关生物医学研究的伦理要求，并已获得郑州大学第一附属医院伦理审查委员会的伦理许可。患者纳入标准为：① 符合《食管和食管胃结合部癌规范化诊治指南》中食管癌的相关诊断标准 [ 7 ]；② 患者均经紫杉醇类、铂类和氟尿嘧啶类药物两药或三药联合治疗失败，目前为三线治疗；③ 卡氏功能状态(Karnofsky performance status, KPS)评分 ≥ 60分，预计生存期 > 3个月；④ 均有可测量的病灶，病灶长度不超过10 cm；⑤ TNM分期为II/III期的局部晚期食管癌患者；⑥ 符合安罗替尼靶向治疗的临床指征。排除标准：① 食管癌TNM分期为III期但T分期为T4的患者(有出血倾向)；② 存在食管或胃肠道溃疡；③ 肝、肾功能不全，特别是尿蛋白定量 > 3.0 g/24h；④ 血小板计数 < 75 × 10 9 。安罗替尼联合同步放化疗组共21人，其中男14人，女7人。常规同步放化疗方案组共21人，其中男13人，女8人。   放射治疗，给予直线加速器高能X线三维适形放射治疗，5次/周，1.8~2.0 Gy/次，总剂量为54~60 Gy (GTV 60 Gy；CTV 54 Gy；颈段食管癌患者2.0 Gy每次，总剂量为60 Gy)，连续治疗6周。同时给予化疗方案(顺铂 + 氟尿嘧啶)，顺铂剂量为25 mg/m 2 d1-3；氟尿嘧啶剂量为1800 mg/m 2 d1q4w*2 (四周方案)。治疗室每隔2周对患者进行一次钡餐摄片检查，以明确患者有无穿孔情况。盐酸安罗替尼的给药方式为12 mg，1次用两周停一周，21天为一周期。  常规同步放化疗组与安罗替尼联合放疗组的放疗方案一致，直线加速器高能X线三维适形放射治疗，5次/周，1.8~2.0 Gy/次，总剂量为54~60 Gy (GTV 60 Gy；CTV 54 Gy；颈段食管癌患者2.0 Gy每次，总剂量为60 Gy)，连续治疗6周。同时给予化疗方案(顺铂 + 氟尿嘧啶)，顺铂剂量为25 mg/m 2 d1-3；氟尿嘧啶剂量为1800 mg/m 2 d1q4w*2 (四周方案)。治疗室每隔2周对患者进行一次钡餐摄片检查，以明确患者有无穿孔情况。无盐酸安罗替尼用药。  通过计算患者各阶段局部控制率和来评价其总体疗效。局部控制定义为食管X线片提示食管癌消失，黏膜无破坏或治疗结束肿瘤有残留，随诊过程中稳定或有缩小并维持2个月以上。毒副反应评价标准：放疗急性反应和晚期反应评价采用1995年RTOG标准 [ 8 ]；化疗采用NCI普通毒性标准-CTC2.0 [ 9 ]。  数据采用SPSS 21.0统计软件进行分析，比率的比较采用卡方检验，生存情况分别用接受治疗后的第12周、24周、36周、48周、60周的局部控制率情况进行评估，以P < 0.05为差异具有统计学意义。"
"两组患者(安罗替尼联合同步放化疗组与常规同步放化疗方案)在年龄、性别、病变部位、病变直径、ECOG评分、分化程度及TNM分期方面经倾向评分匹配(PSM)后均无统计学差异(P > 0.05，见表1)。 Table 1 组别 安罗替尼同步放化疗 常规同步放化疗方案 c 2 值 P值 性别 男 14 (66.67%) 13 (61.90%) 1 0.872 女 7 (33.33%) 8 (38.10%) 中位年龄 62 65 >50 5 (23.81%) 7 (33.33%) 1 0.881 <50 16 (76.19%) 14 (66.67%) 病变部位 颈段 3 (14.29%) 3 (14.29%) 1 0.765 胸上段 5 (23.81%) 6 (28.57%) 胸中段 9 (42.86%) 7 (33.33%) 胸下段 4 (19.05%) 5 (23.81%) 病变长度(cm) 5.7 ± 1.3 5.4 ± 1.5 —— 0.821 分化程度 高 4 (19.05%) 6 (28.57%) 1 0.698 中 10 (47.62%) 9 (42.86%) 低 7 (33.33%) 6 (28.57%) TNM分期 II期 9 (42.86%) 10 (47.62%) 1 0.631 III期(除T4) 12 (57.14%) 11 (52.38%) ECOG评分 0 6 (28.57%) 7 (33.33%) 1 0.664 1 11 (52.38%) 10 (47.62%) 2 4 (19.05%) 4 (19.05%) 表1. 两组患者的一般特征比较  根据两组患者12周、24周、36周、48周、60周的局部控制率比较，安罗替尼联合同步放化疗组的局部控制率为63.9%、69.4%、72.2%、80.1%、82.8%，显著高于常规同步放化疗方案组(P < 0.05，见表2)。 Table 2 组别 安罗替尼同步放化疗 常规同步放化疗方案 P值 12周 63.9% 44.7% 0.0171 24周 69.4% 46.1% 0.0085 36周 72.2% 49.2% 0.0105 48周 80.1% 52.3% 0.0063 60周 82.8% 56.5% 0.0056 表2. 两组患者各观察期内的局部控制率比较  安罗替尼联合同步放化疗组的患者主要出现的不良反应为手足综合征(HFS)，患者出现的手足综合征分级均为II级以下(I级患者可自行恢复，II级患者经皮肤科对症处理后可恢复)。常规同步放化疗方案组患者出现的不良反应主要为放射性食管炎与放射性肺炎。放射性食管炎及放射性肺炎经支持治疗及对症处理后均可恢复。两组患者除手足综合征外其余非特异性不良反应发生情况均无统计学差异(P > 0.05，见表3)。患者手足皮肤反应的分级按照手足皮肤反应分级标准(NCI-CTC AE 4.0)评价(见表4)。 Table 3 组别 安罗替尼同步放化疗 常规同步放化疗方案 P值 手足皮肤反应 I级 6 (28.57%) —— —— II级 2 (9.52%) —— —— 血压升高 2 (9.52%) 1 (4.76%) 0.822 放射性皮炎 4 (19.05%) 6 (28.57%) 0.779 放射性气管炎 7 (33.33%) 6 (28.57%) 0.814 放射性食管炎 4 (19.05%) 7 (33.33%) 0.612 白细胞减少 6 (28.57%) 7 (33.33%) 0.797 中性粒细胞减少 2 (9.52%) 4 (19.05%) 0.721 血红蛋白减少 3 (14.29%) 1 (4.76%) 0.798 表3. 两组患者的毒副反应发生情况比较 Table 4 分级 定义 I级 轻微皮肤改变或皮肤炎(局部红肿、水肿、角化过度、无痛)，但不影响日常生活 II级 皮肤改变明显(剥落、水泡、出血、肿胀、角化过度)，疼痛，影响日常生活和活动 III级 重度皮肤改变(剥落、水泡、溃疡、出血、水肿、角化过度)，疼痛明显，个人自理能力受限 表4. 手足皮肤反应分级标准(NCI-CTC AE 4.0)"
"根据最新版食管癌临床规范化治疗指南，目前食管癌的治疗依旧首选手术治疗，术式可根据患者病情、意愿等情况选择开放食管癌切除术或微创食管癌切除术 [ 10 ]。但食管癌起病较隐匿，临床症状出现周期较晚，常常一经诊断即进入食管癌局部晚期，甚至出现远处转移，丧失手术治疗的机会，5年生存率不足20.0%，且术后复发率与转移率一直维持高位，为此需要同步放化疗已改善患者预后 [ 4 ] [ 11 ]。目前针对局部晚期食管癌，指南仍然推荐首选同步放化疗方案，可有效提高食管癌患者治疗的局部控制率并改善远期生存状态 [ 12 ]。RTOG 8501研究显示同步放化疗可以显著提高肿瘤局部控制率，增加远期生存率，5年生存率优于单纯放疗 [ 13 ]。RTOG 8501研究后，同步放化疗逐渐成为食管癌非手术治疗的标准方案，并已被美国NCCN推荐列为治疗不可切除的局部晚期食管鳞状细胞癌患者的标准方案。 肿瘤的发生、发展、扩散和转移都需要充足的营养供应，与丰富的血管与淋巴管道密切相关。研究证明血管内皮生长因子(VEGF)是一种强效诱导血管生成的蛋白质，在生理及病理条件下均可直接作用于血管内皮细胞从而影响肿瘤的增殖、转移和血管形成 [ 14 ]。同时，有研究表明VEGF高表达与包括食管癌在内的多种肿瘤的预后情况差密切相关 [ 15 ] [ 16 ]。食管癌组织中常常检测出高表达的VEGF。目前针对VEGF靶向治疗药物的临床应用研究较少。盐酸安罗替尼是我国自主研发的新型小分子多靶点酪氨酸激酶抑制剂，可强效针对性抑制VEGFR、PDGFR、FGFR等多个靶点，具有抑制肿瘤血管生成和肿瘤生长的作用。同时安罗替尼为口服型药物，使用方便，不良反应较轻，患者依从性较好，可提高患者的生存质量。"
"本实验旨在验证安罗替尼应用于临床诊断食管癌局部晚期病例的治疗效果，取得了显著疗效。本实验共入组42名患者，其中联合安罗替尼同步放化疗组共21人，至观察期结束(60周)总体局部控制率为82.8%，显著高于常规同步放化疗方案组，应用联合安罗替尼同步放化疗的患者局部控制率及观察期内生存率均显著高于常规同步放化疗方案组。联合安罗替尼同步放化疗组的患者不良反应与常规同步放化疗方案组患者发生情况的组间差别无统计学意义。 综上研究结果表明联合安罗替尼同步放化疗方案较常规同步放化疗方案可更有效地治疗局部晚期食管癌，提高患者的生存质量，值得临床广泛应用。远期的生存状况及对患者带瘤生存状况的影响有待更大规模、更长周期的回顾性或前瞻性临床探索。"
