"目的：评估术前预后营养指数(prognostic nutritional index, PNI)与IB1~IIA2期宫颈癌(cervical cancer)临床病理特征的关系，以及评估盆腔淋巴结转移(pelvic lymphnode metastasis, PLNM)的意义。方法：采集2018年12月~2020年6月于青岛大学附属医院接受初始治疗方式为根治性子宫切除术及盆腔淋巴结切除术的101例IB1~IIA2期宫颈癌患者的检验结果及病理报告。采用受试者工作特征(ROC)曲线分析PNI预测IB1~IIA2期宫颈癌盆腔淋巴结转移的最佳临界值。统计学比较PLNM阴性和阳性组患者的临床病理特征，采用单因素、多因素logistic分析可能影响IB1~IIA2期宫颈癌PLNM的因素。结果：101例IB1~IIA2期宫颈癌中，PLNM阳性和阴性患者分别为31例和70例。依据ROC曲线，PNI预测IB1~IIA2期宫颈癌PLNM的最佳临界值为52.2，其中PNI ≤ 52.2者44例，PNI > 52.2者57例。单因素、多因素logistic回归分析均证明，PNI是预测IB1~IIA2期宫颈癌PLNM的指标(P < 0.05)。结论：术前外周血PNI是IB1~IIA2期PLNM的独立预测指标。"
"在全球女性发病率与死亡率的统计学分析中，宫颈癌居于第四位。其中仅2018年，全世界新增宫颈癌患者57.0万例，占所有女性癌症发病的6.6%；死亡患者31.1万例，占所有女性死亡的7.5% [ 1 ]。宫颈癌标化发病率为13.1/10万，女性0~74岁累积发病风险为1.36%。在中国，每年新增宫颈癌病例约14万，死亡约3.7万 [ 2 ]。有研究证实，盆腔淋巴结转移是提示宫颈癌复发和不良预后的关键指标，有淋巴结转移的患者术后均需补充放疗或化疗 [ 3 ]。其中，对于IA1期宫颈癌，如无淋巴脉管间隙浸润，该期淋巴结转移率低于1%，不需要切除淋巴结。IA1期伴淋巴脉管间隙浸润和IA2期，可选择行宫颈锥切术及盆腔淋巴结切除术，或直接行根治性子宫颈切除术及盆腔淋巴洁切除术 [ 3 ]。IB1~IIA2期宫颈癌患者的宫颈癌手术方式可选择行根治性子宫切除术 + 盆腔淋巴结切除术 ± 主动脉旁淋巴结切除术等 [ 4 ]，但该手术可能导致患者出现多种并发症，如尿路感染、尿潴留、盆腔淋巴结囊肿、淋巴瘘、输尿管膀胱瘘、膀胱阴道瘘、肾积水、下肢淋巴水肿、神经损伤、腹膜炎、盆腔脓肿、肺栓塞、下肢静脉血栓 [ 5 ] 等，严重影响宫颈癌患者的生活质量和心理健康。宫颈癌分期(FIGO 2018)中将有影像学或病理学依据的盆腔淋巴结转移归为IIIC期，同期放化疗为其首选治疗方式，因此宫颈癌患者如果影像学诊断有淋巴结转移，应建议患者行同期放化疗，以期尽量避免手术和放化疗多重治疗造成的损伤 [ 6 ]。因此，在IB1~IIA2期宫颈癌治疗方案的选择上，鉴别宫颈癌患者有无淋巴结转移非常重要。所以，对于术前影像学检查阴性的宫颈癌患者，选择合适的指标以便准确评估盆腔淋巴结转移情况，对于改变患者的临床分期及选择合适的治疗方式至关重要。 肿瘤细胞的发生、侵袭与机体的营养与免疫状态密切相关，在选择治疗方案以及评估患者预后方面均具有重要的临床意义 [ 7 ]。PNI代表了机体的营养与免疫状态。近些年来，许多研究表明，PNI对于评估癌症患者的生活质量及生存期具有重要的临床意义，而且在肺癌、食管癌、胃癌、结直肠癌 [ 8 ] [ 9 ] 等恶性肿瘤中，PNI的预后评估价值已经得到临床研究证明，但与IB1~IIA2期宫颈癌PLNM的关系报道较少。目前，PLNM诊断的金标准仍是术后组织病理学检查，而CT、MRI、PET-CT等影像检查费用相对较高，且假阳性率及假阴性率较高，术前缺乏评估宫颈癌患者PLNM的指标。PNI由淋巴细胞计数总值 × 5 +血清白蛋白之和 [ 10 ] 计算得来，淋巴细胞、血清白蛋白均为宫颈癌患者术前的常规检查项目，检查费用相对较低，且计算较为简便。本文旨在评估PNI与宫颈癌临床病理特征的关系，以及其预测IB1~IIA2期宫颈癌PLNM的价值，为制定宫颈癌患者的治疗方案及评估预后提供参考依据。"
"收集2018年12月~2020年6月于青岛大学附属医院首选根治性子宫切除术及盆腔淋巴结切除术的IB1~IIA2期宫颈癌患者的检验结果及病理报告。纳入标准：患者术前FIGO (2018)分期IB1~IIA2；行根治性子宫切除术及盆腔淋巴结切除术；术前宫颈活检明确诊断为宫颈恶性肿瘤，术后组织病理学再次证实为宫颈恶性肿瘤；术前完善血常规、肿瘤细胞标记物、生化、CT等检查。排除标准：术前影像学提示淋巴结转移者；术前盆腔淋巴结穿刺活检病理提示淋巴结转移者；术前已行放疗、化疗或免疫治疗等辅助治疗者；合并有其他器官恶性肿瘤者；合并血液系统疾病或免疫系统疾病者；合并肝炎、肝硬化等疾病者。  采集患者的年龄、术前FIGO分期、组织学分级、组织病理学类型、PLNM、脉管癌栓、宫旁浸润、间质浸润深度、肿瘤直径、阴道切缘等临床资料，术前SCCA值、淋巴细胞计数、白蛋白值，并由淋巴细胞 * 5 + 白蛋白之和计算得到PNI。  使用SPSS26.0软件。绘制PNI预测IB1~IIA2期宫颈癌PLNM的ROC曲线，并确定其最佳临界值、特异度和灵敏度；对PLNM阳性和阴性两组IB1~IIA2期宫颈癌患者，采用χ 2 检验比较临床病理特征；采用logistic回归分析影响IB1~IIA2期宫颈癌PLNM的独立因素。以双侧检验为准，P < 0.10为差异有统计学意义。"
"101例宫颈癌患者的中位年龄50岁(32~68岁)，中位体重指数(body mass index, BMI) 24.81 kg/m 2 (16.57~34.77 kg/m 2 )。FIGO分期：IB期者有53例(52.5%)，IIA期者有48例(47.5%)；组织病理学类型：鳞癌78例(77.2%)，腺癌21例(20.8%)，腺鳞癌1例(1%)，神经内分泌癌1例(1%)；组织学分级：G1者9例(8.9%)，G2者47例(46.5%)，G3者45例(44.6%)；脉管癌栓：阳性44例(43.6%)，阴性57例(56.4%)；间质浸润深度 > 1/2者55例(54.5%)，≤ 1/2者46例(45.5%)；腹主动脉旁淋巴结转移阳性31例(30.7%)，阴性70例(69.3%)。中位肿瘤直径3.1 cm (0.1~8.8 cm)，中位SCCA 3.57 ng/ml (0.37~100.00 ng/ml)，中位淋巴细胞计数1.79 × 10 9 [(0.70~3.48) × 10 9 ]，白蛋白值43.4 g/l (31.1~52.2 g/l)。  根据最大约登指数原理，PNI预测IB1~IIA2期宫颈癌PLNM的最佳临界值为52.2。ROC曲线下面积(AUC)为0.752 (95% CI: 0.653~0.851, P < 0.05)，敏感性为69.4%，特异性为74.4%。如图1。PNI > 52.2者57例(56.4%)，PNI ≤ 52.2者44例(43.6%)。如图1。 图1. PNI预测IB1~IIA2期宫颈癌PLNM的ROC曲线  PLNM阳性组与阴性组在FIGO分期、脉管癌栓、间质浸润深度、PNI等方面的临床病理学特征差异有统计学意义(P < 0.10)，但在年龄、组织学分级、组织病理类型、宫旁浸润、肿瘤直径、阴道切缘及SCCA等方面无显著性差异(P < 0.10)，见表1。 Table 1 变量 n PLNM (+) (n = 31) PLNM (−) (n = 70) t或χ 2 p 年龄(岁) 49.26 ± 8.48 50.67 ± 8.63 0.763 0.679 FIGO分期 5.178 0.023 IB1~IB3 53 11 42 IIA1~IIA2 48 20 28 组织学分级 0.333 0.564 G1 9 2 7 G2/G3 102 29 63 组织病理学类型 1.122 0.289 鳞癌 23 5 18 非鳞癌 78 26 52 脉管癌栓 29.556 <0.001 阳性 44 26 18 阴性 57 5 52 宫旁浸润 0.717 0.397 阳性 15 6 9 阴性 86 25 61 间质浸润深度 15.605 <0.001 >1/2 31 26 5 ≤1/2 46 5 41 肿瘤大小(cm) 1.443 0.23 <4 61 16 45 ≥4 40 15 25 阴道切缘 1.881 0.17 阳性 3 2 1 阴性 108 29 69 SCCA (ng/ml) 12.23 ± 3.80 7.10 ± 1.43 1.585 0.216 PNI 50.11 ± 1.09 53.23 ± 0.64 2.484 0.012 表1. PLNM阳性和阴性组患者的临床病理学特征比较  Logistic回归分析显示脉管癌栓、间质浸润 > 1/2和PNI是IB1~IIA2期宫颈癌PLNM的有效预测因子(P < 0.10)。FIGO分期、组织病理类型、病理分化程度、肿瘤直径、阴道切缘、宫旁浸润、SCCA在单因素和多因素分析中均无统计学意义(P > 0.10)，如表2。 Table 2 变量 单因素 多因素 β OR P β OR 95% CI P 年龄 −0.002 0.998 0.955 −0.002 0.998 0.930~1.071 0.957 分期 0.838 2.311 0.213 0.953 2.594 0.641~10.498 0.182 病理 0.421 1.523 0.614 0.756 2.129 0.353~12.834 0.410 分化 1.078 2.939 0.322 1.262 3.533 0.364~34.257 0.276 阴道 −0.175 0.839 0.770 −21.344 0.000 0.000 1.000 直径 −0.508 0.602 0.729 −0.404 0.668 0.188~2.376 0.533 宫旁 0.753 2.122 0.370 1.387 4.003 0.565~28.367 0.165 脉管癌栓 −2.817 0.060 0.000 −2.700 0.067 0.017~0.264 0.000 间质浸润 −1.814 0.163 0.006 −1.907 0.148 0.039~0.566 0.005 SCC −0.019 0.981 0.176 0.010 1.010 0.971~1.051 0.610 PNI 0.093 1.098 0.026 0.106 1.111 0.985~1.254 0.087 表2. IB1~IIA2期宫颈癌PLNM影响因素的logistic分析结果"
"有研究证实，PLNM与宫颈癌的预后有关 [ 11 ]，而PNI可用于预测某些恶性肿瘤淋巴结转移情况 [ 12 ]。到目前为止，PNI与宫颈癌PLNM的关系尚不明了。本研究ROC曲线提示，PNI取值52.2时，曲线下面积最大，为0.752，此时敏感度为69.4%，特异度为74.4%。故将评估IB1~IIA2期宫颈癌PLNM的最佳临界值设定为52.2。本研究单因素、多因素Logistic回归分析均提示，PNI与IB1~IIA2期宫颈癌PLNM显著相关(β = 0.03，OR = 1.098，95% CI为0.985~1.254)。提示PNI > 52.2时，PLNM阴性可能性大，肿瘤增殖、侵袭、转移发生率较低，死亡率较低；PNI ≤ 52.2时，PLNM阳性可能性大，肿瘤增殖、侵袭、转移发生率较高，死亡率较高。本研究证实，脉管癌栓、间质浸润深度、PNI与IB1~IIA2期宫颈癌PLNM有关(P < 0.10)。但运用于术前预测宫颈癌PLNM，相比PNI，宫旁浸润的确定需≥2名主任医师及MRI或CT等辅助检查共同确定，操作相对复杂；而脉管癌栓则需术后组织病理学最终确诊。  既往研究发现，血清白蛋白下降可致机体合成所需的各种酶减少，酶活性降低，机体免疫力下降，感染机会增加，加强炎症反应。故白蛋白减少是营养不良和免疫防御系统较弱的指标，低蛋白血症提示预后不良 [ 12 ]。淋巴细胞计数可反应患者机体抗肿瘤细胞免疫应答反应作用，血清白蛋白水平和淋巴细胞计数的PNI与恶性肿瘤预后有关 [ 7 ] [ 13 ] [ 14 ] [ 15 ]。PNI由外周血中血清白蛋白水平和淋巴细胞计数确定，预测宫颈癌PLNM的机制可能与反映了宫颈癌患者的PLNM与机体抗肿瘤细胞免疫应答反应作用及营养状态的平衡有关：低水平PNI提示机体抗肿瘤细胞免疫应答反应作用与营养状态较差，宫颈癌恶性转化、侵袭和转移可能性较大，PLNM 可能性较大，术中需行子宫颈根治性手术治疗，术后生存率相对较差；高水平PNI往往提示机体抗肿瘤细胞免疫应答反应作用与营养状态较好，宫颈癌恶性转化、侵袭和转移可能性较小，PLNM可能性较小，术中可不行盆腔淋巴结切除术，术后生存率及生活质量相对较好。PNI具有廉价、方便获取、计算简单、实用、有效等优点；纳入了较多可能有影响的变量，结果具有可信性；样本量较多，减少了误差；采血时间间隔短，排除了可能的治疗或药物对结果的干扰。但本研究尚有以下不足：患者术前诊断需由宫颈活检确诊，而后者可能对全身免疫状态有影响；本研究为回顾性、单中心研究，不能排除选择偏倚，各地选择的炎性指标及术前检测项目可能不同，不是所有的血液炎症标记物纳入本研究中；本研究入选病例数较少，FIGO分期、组织病理学类型、病理分化程度、肿瘤直径、阴道切缘阳性、宫旁浸润在单因素及多因素分析中均无统计学意义，而以上指标对宫颈癌的预后与治疗方式选择均有较大影响，需要在今后进行更加深入的研究。综上所述，PNI可作为预测IB1~IIA2期宫颈癌PLNM的独立预测指标，可为该期患者是否行淋巴结清扫提供参考数据，但仍需更多前瞻性、多中心、对照试验证实以上结论。而且，关于PNI的精确取值范围以及其动态变化与宫颈癌PLNM之间的具体联系及机制尚未明确，需要今后进行更加深入的研究论证。"
"此研究已获得患者知情同意。"
