"女性膀胱出口梗阻(Female Bladder Outlet Obstruction, FBOO)是一类常见的女性下尿路疾病，严重影响患者生活质量。由于以往对该疾病认识不足及尚未有统一的诊断标准，使得FBOO患者的就诊率、确诊率偏低。近年来，随着尿动力学检查、膀胱尿道镜检、逼尿肌超声检查、影像尿动力学检查等逐渐用于诊断FBOO，越来越多的患者得到了及时诊治。其中尿动力学检查被认为是诊断男性膀胱出口梗阻的金标准，然而由于男女解剖结构差异，女性患者的诊断标准仍处于研究中，尚无一致定论。本文重点对尿动力学检查在诊断女性膀胱出口梗阻时的诊断标准进行综述，旨在为临床上诊断FBOO提供相对准确的依据。"
"女性膀胱出口梗阻是女性下尿路梗阻性疾病，临床症状缺乏特异性，常常与逼尿肌收缩乏力相混淆，主要表现为尿频、尿急、夜尿增多、排尿费力、尿不尽感，常合并有膀胱过度活动症，严重影响女性生活质量。尿流动力学检查被认为是男性膀胱出口梗阻的金标准，但由于女性尿道解剖学及生理学特点，其克服梗阻代偿过程所需要的压力升高不如男性患者显著，因此不能简单地将男性膀胱出口梗阻诊断标准直接用于女性 [ 1 ]。正确的诊断对于患者制定治疗方案至关重要，但是目前对于FBOO尚未有一种公认的诊断标准，这在一定程度上造成了FBOO诊断和治疗上的混乱。FBOO的诊断仍然是一个棘手的问题，其尿流动力学诊断标准一直处于研究之中，近年来许多学者开展了大量的研究工作，希望能够制定出更加准确完善的尿动力学诊断标准，本文就其近年相关研究进展综述如下。"
"FBOO是指在一个足够力量、速度、时间的逼尿肌收缩下产生一个弱的尿流，是一组由不同原因、不同发病机制所引起的膀胱出口梗阻综合征。FBOO的诊断需要结合完整的病史、临床症状、体格检查，以及相关辅助检查，如排泄性膀胱尿道造影、膀胱尿道镜检、尿动力学检查等。随着时间的推移，梗阻可导致逼尿肌的功能和解剖变化(肥大、逼尿肌过度活动、小梁化和膀胱憩室)以及膀胱传入、传出神经元的改变，长期未能得到诊治的FBOO患者可能出现尿潴留和上尿路失代偿改变 [ 2 ] [ 3 ]。尿动力学检查被公认为能较准确地判断是否存在BOO，尤其适用于膀胱残余尿增多的疑似梗阻患者，其中最大自由尿流率((maximum flow rate, Q max )和排尿期最大尿流率时逼尿肌收缩压(detrusor pressure at maximal urine flow rate, Pdet.Q max )是诊断FBOO两个最常用指标 [ 4 ] [ 5 ]。FBOO尚无明确统一的诊断标准，这导致FBOO的诊断率有较大差异，据统计，近年来FBOO的患病率约为2.7%~29% [ 6 ]。随着尿动力学研究的发展和尿道膀胱镜、逼尿肌超声检查及影像尿动力学的广泛应用，对排尿机制及FBOO有了科学的认识，FBOO的早期诊断率显著增高。 FBOO在临床上主要表现为：尿频、尿急、排尿困难、淋漓不尽、排尿时间延长等非特异性下尿路症状，患者多同时具备储尿期和排尿期症状，常见于反复泌尿道感染、多产史的围绝经期及绝经后女性。其特点包括排尿压力高、尿流率低，排尿时膀胱颈不能形成漏斗状，膀胱尿道镜检查可发现膀胱颈后唇抬高，膀胱壁小梁样增生等 [ 7 ]。Groutz A等 [ 8 ] 研究发现29%的患者只有刺激性症状，8%的患者只有梗阻性症状，63%的患者两类症状均存在。Blaivas JG等 [ 9 ] 在2000年的研究结果表明有58%的患者既有梗阻性症状，又有刺激性症状，32%的患者只有刺激性症状，10%的患者只有梗阻性症状。Sachin Malde [ 10 ] 研究认为患者储尿期症状是最普遍的，其中尿频为最常见症状，60%的解剖型FBOO患者可有较明显的排尿功能障碍。Rosenblum N [ 11 ] 报道以下尿路症状为主诉的女性患者，有71%尿动力学检查结果无异常。可以看出，FBOO的临床症状缺乏特异性，仅凭症状很难确定FBOO，尿动力学检查是必须的。 在排除了神经源性膀胱引起的排尿困难后，我们可以将FBOO分为解剖性和功能性梗阻。解剖性梗阻以医源性抗尿失禁术后并发症、III/IV盆腔器官脱垂(Pelvic Organ Prolapse, POP)为主，此外还包括尿道狭窄和纤维化、膀胱尿道占位性病变、尿道憩室、尿道旁囊肿等，尤其是随着抗尿失禁手术数量的增加，医源性梗阻数量越来越多 [ 12 ]。相关研究报告了经耻骨后尿道悬吊术术后排尿功能障碍的发生率为3%，而行经闭孔尿道中段悬吊术术后的患者几乎不会发生排尿障碍 [ 13 ]。功能性梗阻包括尿道外括约肌痉挛、逼尿肌–括约肌协同失调、原发性膀胱颈梗阻等 [ 14 ]。原发性膀胱颈梗阻某种程度上可理解为膀胱颈硬化的早期表现。Groutz A等 [ 8 ] 报道，抗尿失禁术后并发症和III/IV POP是FBOO最常见的病因。Brucker BM等人 [ 15 ] 也有类似报道，认为解剖性BOO在FBOO中所占比例更大。最近一项专家研究表明在下尿路症状患者(Lower Urinary Tract Symptoms, LUTS)中19%成年女性存在FBOO，其中64%为解剖型 [ 10 ]。然而，Sheng-Mou Hsiao [ 16 ] 发现BOO最常见的病因是功能性排尿障碍及外括约肌松弛不良，而非解剖性BOO。FBOO发病机制在诊断和治疗中十分重要，但因其病因机制复杂性，目前研究尚不十分清楚，主要观点有：1) 炎症刺激导致的尿道充血、水肿及炎症细胞浸润，黏膜肥厚增生；2) 长期慢性炎症导致纤维组织增生挛缩，大量的平滑肌组织被弹性纤维组织代替；3) 膀胱颈部和后尿道存在丰富的α受体，长期炎症刺激导致膀胱颈部肌肉增生肥厚，逼尿肌和括约肌共济失调；4) 中老年女性卵巢功能下降，激素水平失调导致尿道周围腺体增生，且多伴有黏膜、黏膜下层和神经肌肉的退行性病变。此外，女性膀胱出口梗阻引起排尿不畅，导致反复尿路感染，长期炎症刺激进一步加重梗阻程度，二者互为因果。"
"随着临床诊疗技术的不断发展与相关检测技术、设备的引进更新，目前泌尿外科多使用尿流动力学检查作为临床中下尿路疾病患者的检查手段，能在较大程度上明确疾病类型与特征。尿动力学检查项目包括：自由尿流率、膀胱压力–流率测定、膀胱压力容积测定、尿道压力曲线测定、尿道外括约肌肌电图。当女性出现下尿路症状时，应警惕FBOO，除病史和体格检查外，诊断前首先要排除尿路感染导致的LUTS。尿动力学检查被认为是诊断男性BOO的金标准，女性由于尿道短而宽，其生理解剖结构与男性有很大差异，正常情况下女性最大自由尿流率比男性大、排尿期最大流率时逼尿肌收缩压比男性小，所以不能套用男性膀胱出口梗阻诊断标准，只有用敏感性比较高的指标才能筛选出可疑病例，引起医患共同的重视，通过进一步的检查而获得确诊，进而提高FBOO的临床诊断率，使患者得到早期诊断、治疗。 将尿动力学检查用于诊断FBOO的相关研究越来越多，自1988年以来，已经有超过15种不同的标准被提出来 [ 17 ]。Chassagne S [ 18 ] 研究了一组以排尿梗阻为主诉的女性患者，用Q max ≤ 15 mL/s，Pdet.Q max ≥ 20 cm H 2 O的标准诊断FBOO时，敏感性74.3%、特异性91.1%。Gravina GL [ 19 ] 统计分析了133例表现为尿频、排尿困难并临床诊断为FBOO的女性患者，以Q max < 15 mL/s、RV > 50 mL为标准，结果37名患者被排除诊断，其敏感性和特异性分别为80.8%和86.1%。Lemack GE等 [ 20 ] 对临床诊断为FBOO的87例女性患者进行了压力–流率分析，得出当以Q max < 11 mL/s，Pdet.Q max > 21 cm H 2 O作为诊断梗阻的标准时，它的敏感性为91.5%，特异性为73.6%。Defreitas GA [ 21 ] 等的研究中发现最佳截点值为Q max < 12 ml/s和Pdet.Q max > 25 cm H 2 O。Kuo [ 22 ] 使用的诊断标准是排尿压力大于35 cm H 2 O和Q max < 15 ml/s，或排尿压力大于40 cm H 2 O。Blaivas和Groutz [ 9 ] 使用的定义为Q max < 12 ml/s，并且Pdet.Q max > 20 cm H 2 O。Nitti [ 23 ] 的研究中强调对于尿动力学检查提示高压、低流、残余尿增多的患者结合影像尿动力学资料可以明确诊断。Chia-Da Lin [ 24 ] 将FBOO诊断标准总结为：① Pdet.Q max > 20 cmH 2 O、Q max < 12 mL/s，膀胱尿路造影有或者无梗阻影像；② Pdet.Q max > 35 cm H 2 O、Q max < 15 mL/s，膀胱尿路造影有或者无梗阻影像；③ Pdet.Q max > 40 cm H 2 O，膀胱尿路造影有或者无梗阻影像。如果病人符合标准①应高度怀疑FBOO；如果符合标准②或③，诊断为FBOO的准确性更高。当Q max < 12 mL/s且Pdet.Q max 在20~35 cm H 2 O时，此时造影的影像学结果对鉴别FBOO与逼尿肌收缩力低下至关重要。Akikwala等 [ 25 ] 比较了常用的诊断FBOO的方法，发现1998年的Q max < 15 mL/s，Pdet.Q max > 20 cm H 2 O标准符合率最高，为78.9%，值得注意的是Blaivas-Groutz列线图高估了梗阻的程度，因此不应该单独使用测量。William C de Groat [ 2 ] 的研究发现，与FBOO的影像学证据相比，Blaivas-Groutz列线图是最敏感和最不特异的，Solomon-Greenwell列线图为定量评估膀胱出口梗阻提供了一种高敏感性(86%)和特异性(93%)的方法，并证明了与FBOO影像学检查数据有最大一致性。 尿动力学检查不仅在诊断女性膀胱出口梗阻中具有重要意义，而且能有效区分功能性梗阻和解剖性梗阻。相关研究结果表明解剖性膀胱出口梗阻患者的Q max 低于功能性膀胱出口梗阻患者，Pdet.Q max 高于功能性膀胱出口梗阻患者，且解剖性膀胱出口梗阻经治疗后，Q max 、残余尿、Pdet.Q max 均较治疗前明显改善 [ 26 ]。这些结果表明了尿动力学可有效地区分功能性和解剖性膀胱出口梗阻，且对解剖性膀胱出口梗阻的治疗效果具有有效的评价作用。"
"除了尿动力学检查外，膀胱尿道镜检、逼尿肌超声检查及影像尿动力学检查也常用于FBOO的辅助诊断，并且常常需要联合几种检查方法来提高诊断的准确性。影像尿动力学同时具有影像学检查与尿动力学检查的特点，被认为是诊断FBOO的最佳标准，通过同步放射显影，可观察解剖异常、分析尿动力学参数与影像之间的关系，有助于了解梗阻部位，对FBOO的诊断更加准确 [ 27 ]。在膀胱逼尿肌持续收缩下，膀胱颈或尿道膜部不开放，确定近端或远端尿道梗阻，解决了普通尿动力学检查仅仅从功能学上，而不能从形态学上同步印证、解释疾病诊断的弊端。相关研究表明，影像尿动力学检查发现排尿期逼尿肌压力持续升高，加上同步影像显示膀胱出口存在梗阻，就可以考虑FBOO的诊断 [ 28 ]。但由于患者对辐射暴露和侵入性检查的抗拒以及检查费用昂贵，操作复杂，难以广泛开展，临床适用性不高。膀胱尿道镜检查常常用于怀疑膀胱尿道器质性病变的患者，是一种泌尿外科常见的侵入性检查。通过膀胱尿道镜检可以发现膀胱颈缩窄，膀胱颈后唇明显抬高，膀胱壁有小梁样增生，而在未发现尿道其他病变时可诊断为膀胱颈梗阻。但其只是对膀胱、尿道内部情况进行检查，对膀胱颈部周围病变不能直接观察，对膀胱出口梗阻的病因诊断并不明确，与尿动力学检查相比较其诊断敏感性及特异性较低。近年来，超声检查越来越多的应用于FBOO的辅助诊断，因其简便、无创、廉价及可重复性高，并能观察膀胱、尿道内外情况，可测量残余尿量，易为临床和患者所接受。因此，当患者有LUTS时，可通过超声测量逼尿肌厚度排除FBOO，避免进一步行有创的尿动力学检查。但是尿动力学检查在评价排尿期的同时，也可以对储尿期进行评价，而且对于逼尿肌不增厚的患者，仍需进一步完善尿动力学检查，所以超声在诊断精度及特异性方面不如尿动力学检查 [ 29 ]。此外，近年分子生物学成为研究热点，在动物模型和人类受试者中研究的多种潜在生物标志物(如神经生长因子、前列腺素E2、三磷酸腺苷等)与BOO相关，有望用于诊断 [ 30 ]。"
"综上所述，目前尿动力学检查仍然是诊断FBOO最重要的检查方法，逼尿肌超声检查、膀胱尿道镜检查及影像尿动力学检查各有优缺点，彼此不能互相取代，应根据具体情况选择辅助检查联合患者病史、临床以提高FBOO的早期诊断率。就尿动力学检查用于诊断FBOO的研究现状看来，在国内外现有的旨在定义FBOO的列线图和诊断标准中，不能单一地选择任何一种版本用来诊断FBOO。由于缺乏对女性膀胱出口梗阻的认识和对各种诊断标准的科学性验证，以及现有可用标准可能低估或高估FBOO的可能性，使得建立女性膀胱出口梗阻诊断标准成为一项挑战。随着近年来临床上对女性膀胱出口梗阻诊断的重视、对病理机制的认识以及各种检查方法的应用，相信不久的将来FBOO的诊断标准会更加明确精准。"
