"目的：评估Caprini及Padua两种风险评估模型在内科住院患者静脉血栓栓塞症风险的有效性，同时探讨内科住院患者发生VTE的危险因素。方法：采用回顾性病例对照研究，将2019年1月至2019年12月青岛大学附属医院确诊VTE的115例患者作为VTE组，同时选取同时期同科室的出院诊断非VTE的115例内科住院患者作为对照组，收集2组患者既往病史、实验室检查结果等临床资料，分别对2组患者进行Caprini评分、Padua评分，比较2种风险评估模型评分，并用二元logistic回归模型对内科住院患者VTE危险因素进行分析。结论：Caprini评分和Padua评分中VTE组均高于对照组，其中Caprini评分中VTE组和对照组分别为(6.783 ± 2.481, 3.357 ± 1.650) (t值为12.332，P < 0.05)；在Padua评分中，两组评分为(4.452 ± 1.846, 1.748 ± 1.835) (t值为11.143，P < 0.05)。Caprini评分诊断VTE的ROC曲线下面积分别为(0.890 ± 0.0216) (95% CI为0.842~0.927)，Padua评分诊断VTE的ROC曲线下面积为(0.855 ± 0.0257) (95% CI为0.802~0.898)，比较二者曲线下面积，差异有统计学意义(Z = 3.961, P = 0.0001)，提示Caprini评分敏感性高于Padua评分。多因素logistic回归提示BNP、红细胞压积及肺动脉压力为内科住院患者发生VTE的独立危险因素。"
"静脉血栓栓塞症(venous thromboembolism, VTE)包括肺栓塞(pulmonary embolism, PE)和深静脉血栓形成(deep venous thrombosis, DVT)，是由遗传性和获得性等多种危险因素共同作用的一组全身性疾病。该病的特点为高发病率，高病死率，高漏诊率 [ 1 ]。作为三大常见血管性疾病之一，VTE的发病率仅次于急性冠状动脉综合征及脑卒中 [ 2 ]。据国外一项研究证明，在195例与死亡相关的PE患者中，有83%患者(162例)同时合并DVT，只有9例在生前被怀疑或者确诊为PE。据国外的流行病学调查报道，PE相关死亡大部分发生在内科住院患者 [ 1 ]。基于VTE的疾病特点及流行病学，在临床工作中，及时应用科学有效的风险评估模型识别VTE患者并采取有效的预防措施具有重要意义。2012年美国胸科医师协会公布的第9版《抗栓治疗及血栓预防指南》推荐Padua风险评估模型应用于内科住院患者VTE风险筛选 [ 3 ]，同时推荐Caprini评分作为骨科大手术患者发生VTE危险因素评估 [ 4 ]。本研究旨在验证Caprini及Padua预测评分在青岛大学附属医院内科住院患者的有效性，同时探讨青岛大学附属医院内科住院患者发生VTE的危险因素。"
"收集2019年1月至2019年12月在青岛大学附属医院内科住院患者中诊断为VTE (包括DVT及PE)的临床资料。DVT通过下肢静脉彩超和/或静脉造影确诊；PE通过CT肺动脉造影、核素肺通气和/或灌注扫描中1项或2项确诊。排除标准：1) 既往VTE病史；2) 入院 < 72小时；3) 年龄 < 18岁；4) 病历资料不完整。最终共有115例患者纳入VTE组。对照组：按照1:1的比例，采用随机数字表法，随机选取同时期同科室入院的115例出院诊断非VTE的患者为对照组。排除标准：1) 既往VTE病史；2) 入院 < 72小时；3) 年龄 < 18岁；4) 病历资料不完整；5) D-二聚体升高。  本研究为回顾性病例对照研究。对所有入选患者分别进行Caprini评分及Padua评分。根据Caprini评分 [ 5 ]，VTE危险分层为：0~1分为低危，2分为中危，3~4分为高危，≥5分为极高危。根据Padua评分 [ 6 ]，VTE分层为：<4分为低危，≥4分为高危。收集入选患者的性别、年龄、BMI、BNP、红细胞压积、血小板计数、平均血小板体积、血小板体积分布宽度、APTT、右心室基底宽度及肺动脉压力。本研究符合《赫尔辛基宣言》中的原则。  采用SPSS25.0统计学软件进行统计学分析。计量资料 x ¯ ± s表示；计数资料以例数和率(%)表述；正态分布资料组间比较采用两独立样本的t检验；非正态分布资料组间比较采用χ 2 检验或秩和检验；采用MedCalc统计学软件计算曲线下面积，并行Z检验；采用二元logistic回归模型计算血栓风险等级的相对危险度(OR)值及95% CI。P < 0.05为差异有统计学意义。"
"在两种风险评估模型中，VTE组的评分均高于对照组。在Caprini评分中，VTE组和对照组分别为6.783 ± 2.481、3.357 ± 1.650，t值为12.332，P < 0.05；在Padua评分中，两组评分为4.452 ± 1.846、1.748 ± 1.835，t值为11.143，P < 0.05。进一步按照评分分层进行分析，在Caprini评分中，高危组VTE患者比例低于低危组患者(χ 2 = 41.257, P < 0.05)，极高危组VTE患者比例高于低危组患者(χ 2 = 108.671, P < 0.05) (表1)。在Padua评分中，低危组VTE患者比例低于对照组(χ 2 = 81.160, P < 0.05)，高危组VTE患者比例高于对照组(χ 2 = 81.160, P < 0.05) (表2)。以Caprini及Padua评分分值为检测变量，以分组为状态变量，通过SPSS软件绘制ROC曲线。Caprini评分诊断VTE的ROC曲线下面积为(0.890 ± 0.0216) (95% CI为0.842~0.927)，Padua评分诊断VTE的ROC曲线下面积为(0.855 ± 0.0257) (95% CI为0.802~0.898)。通过MedCalc软件比较二者曲线下面积，计算正态离差值Z = 3.961，P = 0.0001，差异具有统计学意义。  将收集的指标纳入单因素分析，结果显示：两组患者在性别、年龄、BMI及血小板计数、右心室基底宽度差异无统计学意义。VTE组的红细胞压积低于对照组(t值分别为−4.262，P值 < 0.05)；VTE组BNP高于对照组(Z值为−11.964，P值 < 0.05)；VTE组平均血小板体积、血小板体积分布宽度、APTT、肺动脉压力均高于对照组(t值分别为2.078、3.248、3.828、6.632，P值 < 0.05)。具体实验室指标见表3。 Table 1 Caprini评分 VTE组 对照组 χ 2 P值 0~1 1 12 9.865 0.002 2 2 25 22.199 0.000 3~4 13 58 41.257 0.000 ≥5 99 20 108.671 0.000 5 19 7 6.244 0.012 6 25 9 8.836 0.003 7 14 1 1.651 0.199 8 21 2 17.400 0.000 ≥9 20 1 18.918 0.000 均值 ± 标准差 6.783 ± 2.481 3.357 ± 1.650 12.332 (t值) 0.000 表1. 内科住院患者VTE组和对照组Caprini评分 Table 2 Padua评分 VTE组 对照组 χ 2 P值 <4 29 97 81.160 0.000 ≥4 86 18 81.160 0.000 4 36 9 20.141 0.000 5 17 4 9.218 0.002 6 18 1 16.580 0.000 7 9 2 4.678 0.031 8 4 1 1.840 0.175 ≥9 2 1 0.338 0.561 均值 ± 标准差 4.452 ± 1.846 1.748 ± 1.835 11.143 (t值) 0.000 表2. 内科住院患者VTE组和对照组Padua评分 Table 3 组别 例数 男性[例数(%)] 年龄( x ¯ ± s) BMI ( x ¯ ± s) BNP (中位数) 红细胞压积( x ¯ ± s) VTE组 115 61 (53.04%) 63.704 ± 14.075 25.037 ± 4.135 613.200 28.822 ± 3.751 对照组 115 64 (55.65%) 63.252 ± 13.905 24.365 ± 4.188 48.600 31.297 ± 4.974 统计值 χ 2 = 0.158 t = 0.245 t = 1.224 Z = −11.964 t = −4.262 P值 0.691 0.807 0.222 0.000 0.000 表3. 内科住院患者危险因素的单因素分析  对单因素分析有统计学意义的指标进行多因素logistic回归分析，其中BNP (OR为1.017，95% CI为1.011~1.023，P = 0.000)、红细胞压积(OR为0.752，95% CI为0.622~0.909，P = 0.003)、肺动脉压力(OR为1.125，95% CI为1.028~1.231，P = 0.011)是内科住院患者发生VTE的独立危险因素。"
"本研究中115例内科住院患者中，肺栓塞占12.17% (14例)，深静脉血栓形成占68.69% (79例)，同时有肺栓塞和深静脉血栓形成者占19.13% (22例)。内科住院患者VTE组Caprini评分及Padua评分均高于对照组。在Caprini评分中，VTE组的极高危患者高于对照组，差异具有统计学意义。在Padua评分中，VTE组低危患者低于对照组，高危患者高于对照组，差异具有统计学意义。单因素分析及多因素logistic回归分析提示BNP、红细胞压积及肺动脉压力为VTE的独立危险因素。 Caprini评分根据量表的危险因素评分划分患者的VTE等级，并推荐相应的预防措施。第9版《抗栓治疗及血栓预防指南》采纳了该风险评估 [ 4 ]。本研究中，所有纳入的230例患者中82.61%评分在3分以上，VTE患者有99例评分在5分以上，对照组有20例在5分以上。对比两组极高危患者，VTE组患者6分以上明显均多于对照组，两者对比有统计学差异，提示VTE组患者Caprini评分更高。这与Caprini评分年龄细化及更多相关临床症状、体征纳入相关。这与周海霞 [ 7 ]、吴玉兰 [ 8 ] 等人研究相一致，提示Caprini评分对于我国内科住院患者VTE风险评估有积极的效果。 Padua风险评估模型根据患者临床症状、病史对其进行量化评分并评估其VTE风险。我国2015发布的《内科住院患者VTE预防的中国专家指南》中指出该风险评估模型可用于我国内科住院患者VTE风险筛选 [ 9 ]。在本研究中，VTE组评分 ≥ 4分(高危)占74.78% (86例)，对照组评分 < 4分(低危)占84.35% (97例)，评分在6分以上者，VTE组高于对照组，差异有统计学意义。这提示Padua评分可以有效的筛选出内科住院患者VTE的高危人群。 目前对于Caprini与Padua的比较性研究仍相对较少。在Zhou [ 10 ] 等人的研究中提示Caprini评分和Padua评分都能够有效的识别内科住院患者VTE高危患者并根据其临床特征及诊断进行血栓危险分层，但是Caprini评分敏感性更高，原因在于Caprini评分个人风险评估因素多于Padua风险评估模型，且Padua风险评估模型的11项危险因素包含在Caprini风险评估模型中。由于Caprini评分包含了更多综合因素，对于预防受益的内内科住院患者可能敏感性更高，并且具有预测死亡率的潜力，这为下一步研究提供了新的方向。同时在本研究中，通过绘制ROC曲线，比较二者曲线下面积，差异有统计学意义，Caprini评分ROC曲线面积大于Padua评分，更加说明Caprini评分可以更有效的对内科住院患者进行血栓风险分层。 内科住院患者发生VTE风险因素分析提示，BNP为独立危险因素，这与王勇 [ 11 ] 等人的研究结果是一致的。同时发现红细胞压积及肺动脉压力也是VTE的独立危险因素。VTE组红细胞压积低于对照组，这与Tashijian TZ [ 12 ] 等人的研究相一致，但具体原因需要进一步研究；超声心动图检测PTE的间接征象主要表现为右心负荷加重及肺动脉高压 [ 13 ]，本研究中VTE组肺动脉压力明显高于对照组，可能与栓子阻塞肺动脉，肺血管阻力增大，造成右心负荷增加，右心系统扩大相关。根据Jamal Rahmani [ 14 ] 等人的研究，肥胖是与VTE发病率相关的一个重要危险因素，但在本研究中BMI在VTE组和对照组相比差异无统计学意义，可能与本文为回顾性研究，样本例数较少相关。因此还需要多中心大样本进一步证明。"
"总之，Caprini和Padua风险评估模型能够对内科住院患者进行有效的血栓风险分层，相较于Pudua评分，Caprini评分敏感性更高，并且具有预测死亡率的潜力。同时结合患者的BNP、红细胞压积及肺动脉压力，可以作为两种风险评估模型的补充诊断指标，及早地识别临床VTE高危患者并采取相应的预防措施。"
