"基于密文策略的属性代理重加密方案可以同时实现灵活的访问控制和云端密文共享功能。但现有的属性代理重加密方案多以双线性映射构造而成，面临着加解密运算效率低的问题。为解决上述问题，本文提出一种新的加密方案：离线/在线的可验证外包属性代理重加密方案(offline/online attribute-based proxy re-encryption with verifiable outsourced decryption, VF-OO-ABPRE)。基于已有的外包解密属性加密方案，利用离线/在线加密技术，对加密算法进行改进，提高加密效率，结合代理重加密的思想，实现密文共享。同时将解密工作外包给云服务商，并且能够快速地验证外包解密计算结果的正确性。理论分析表明本方案在随机预言机模型中满足选择明文攻击的不可区分安全性，并且提供了外包的可验证性证明，同时能抵抗共谋攻击。"
"基于属性的加密(attribute-based encryption, ABE) [ 1 ] 可以实现加密数据的细粒度访问控制，在数据的隐私保护场景中应用广泛。主要有两种形式：基于密文策略的属性加密 [ 2 ] (ciphertext-policy attribute-based encryption, CP-ABE)和基于密钥策略的属性加密 [ 3 ] (key-policy attribute-based encryption, KP-ABE)。前者私钥关联授权属性集合，密文关联属性集合满足的访问策略，后者则相反。2007年，Bethencourt等 [ 2 ] 第一次提出基于密文策略的属性加密方案(CP-ABE)，采用访问树的结构进行秘密共享。2011年，Waters等 [ 4 ] 第一次提出线性秘密共享方案(linear secret sharing scheme, LSSS)的CP-ABE，较Bethencourt等 [ 2 ] 的方案在共享效率上有所提升，但是面临着私钥生成，数据加密和解密阶段的大量运算，且计算量与属性集合或者访问策略的复杂度成线性增长，这将会给移动用户端带来严重的计算负担和电量消耗，为解决上述问题，2011年，Green等 [ 5 ] 提出一种解密外包的ABE方案，在解密阶段首先将数据密文发送给解密外包服务器，由解密外包服务器对数据密文进行一次密文转换，生成部分密文再发送给用户，用户利用自身私钥解密出数据明文，可以缓解数据用户端的解密计算压力。运用相同的思想，更多的外包ABE方案 [ 6 ] [ 7 ] [ 8 ] [ 9 ] 被相继提出。除了解密外包，一些学者也实现了加密外包。2012年，Li等 [ 10 ] 构造加密外包的CP-ABE方案中，用户只需要做一些简单的操作就可以获得部分密文，云服务器将通过使用外包加密密钥继续完成大部分的加密操作，以获取密文的其他部分。然而，该方案仍然需要用户做大量与属性相关的求幂运算。2016年，Wang等 [ 11 ] 提出了一种可验证外包的ABE方案，实现加密、解密和密钥生成外包。但在方案中，密文的大小过大造成了密文存储空间的浪费。 2014年，Hohenberger等 [ 12 ] 提出离线/在线的ABE技术，将加密分成两个阶段进行，离线阶段在不知道相关的属性集合或者访问结构时，自动完成大量的加密计算预处理工作，在线阶段可以进行较少的计算快速完成属性加密工作。通过这种技术，可以将计算量大的工作尽可能多地在离线阶段完成，减少在线阶段的加密工作量。相较于加密外包，离线/在线同样减轻了用户加密阶段的计算负担，同时保证了数据的机密性。但是该方案不支持外包解密。2017年，Liu等 [ 13 ] 提出可验证外包解密的离线/在线ABE加密方案，采用离线/在线技术结合可验证外包计算技术，在标准模型下被证明是选择性明文攻击安全的，但是方案中离线/在线技术只用于私钥的生成，用户端的加密负担仍然存在。 单纯的离线/在线加密技术不足以解决解密授权转让和密文共享的问题，代理重加密 [ 14 ] (proxy re-encryption, PRE)是一种很好的解决方式。2009年，Liang等 [ 15 ] 首次在ABE方案中引入代理重加密技术，提出第一个基于密文策略的属性代理重加密方案(ciphertext-policy attribute-based proxy encryption, CP-ABPRE)，解决了ABE方案中共享访问策略更新和数据密文共享的问题，访问策略采取“AND”门，策略的表达性不高。2013年，Liang等 [ 16 ] 结合LSSS提出一个CP-ABPRE方案，能抵抗选择明文攻击(chosen plaintext attack, CPA)和选择密文攻击(chosen ciphertext attack, CCA)，在合数阶双线性群中的CP-ABPRE方案被相继提出 [ 17 ] [ 18 ]，都能实现标准模型中的自适应CCA安全。同样地，重加密的密钥生成和重加密都需要大量的计算。为弥补一般服务器在计算和存储能力上的不足问题，2014年，Gritti等 [ 19 ] 提出在线/离线的CP-ABPRE方案，虽然引入了代理重加密，实则利用代理者进行外包加密，不具备解密授权转让的功能。2015年，Kawai等 [ 20 ] 提出将重加密密钥外包的CP-ABPRE方案，重加密密钥不再由用户端生成，而是由授权中心来生成，这无疑增加了授权中心的计算负担。2017年，Sepehri等 [ 21 ] 提出将用户属性集合与共享访问策略用向量表示的CP-ABPRE方案，只有二者内积为0时，才能重加密密文，达到实现策略隐藏的目的。Yin等 [ 22 ] 在2017年提出一种改进的具有访问策略隐藏功能的CP-ABPRE方案，采用“AND”门共享访问策略，表达性较低。Hong等 [ 23 ] 在2018年提出一种具有密钥隔离功能的CP-ABPRE方案，实现了重加密密钥和用户密钥的前向安全。但是，以上的方案都存在加解密效率较低的问题。 基于上述研究，考虑资源受限用户利用移动设备进行加解密和数据共享的现实需求。本文在Green等 [ 5 ] 提出的外包CP-ABE方案基础上，结合离线/在线加密(offline/online encryption)技术，提出一种离线/在线的可验证外包属性代理重加密方案(offline/online attribute-based proxy re-encryption with verifiable outsourced decryption, VF-OO-ABPRE)。主要贡献如下： 1) 通过结合离线/在线ABE加密技术和外包解密技术来实现属性代理重加密方案，是率先以最小的在线计算代价同时实现数据的访问控制功能和密文共享功能。 2) 本文的方案中，大量的计算操作将在离线阶段执行或者外包给云服务商来执行，用户端在线加密和解密的计算控制在常数级别的指数运算，不会随属性集合或访问策略的复杂度而增加计算开销。 3) 给出了本文方案的安全性分析，分析表明方案基于判定性q-parallel BDHE假设在随机预言机模型下具有选择明文攻击的不可区分安全性，同时提供本方案的可验证性和抗共谋攻击证明，理论分析表明本方案在功能性和效率方面有优势。"
"令 Γ 和 Γ T 是两个 p 阶乘法循环群，定义一个双线性映射 e : Γ × Γ → Γ T ，满足以下性质： 1) 双线性：对于 ∀ u , v ∈ Γ ， a , b ∈ ℤ p ， e ( u a , v b ) = e ( u b , v a ) = e ( u , v ) a b ； 2) 非退化性：存在 g 是 Γ 的生成元，使得 e ( g , g ) ≠ 1 ； 3) 可计算性： ∀ u , v ∈ Γ ，存在一个有效算法可计算出 e ( u , v ) 。  判定性q-parallel BDHE假设：给定一个安全参数 κ ∈ Ν ，整数q，设 Γ ， Γ T 是两个素数阶p的乘法循环群。群生成器 G ( κ ) 生成一个双线性群组 ( p , Γ , Γ T , e ) ， g 是 Γ 的生成元，取随机值 a , s , b 1 , ⋯ , b q ∈ ℤ p 。公开： Y = g , g s , g a , · · · , g a q , g a q + 2 , ⋅ ⋅ ⋅ , g a 2 q ， ∀ 1 ≤ j ≤ q , g s ⋅ b j , g a / b j , · · · , g a q / b j , g a q + 2 / b j , ⋅ ⋅ ⋅ , g a 2 q / b j ， ∀ 1 ≤ j , k ≤ q , k ≠ j , g a ⋅ s ⋅ b k / b j , ⋅ ⋅ ⋅ , g a q ⋅ s ⋅ b k / b j ， R ∈ Γ T 。在概率多项式时间(probabilistic polynomial time, PPT)内不存在算法 B 以不可忽视的优势区分出随机元素 R ∈ Γ T 和 T = e ( g , g ) a q + 1 s ∈ Γ T 。则称判定性q-parallel BDHE假设是成立的。 CDH假设(computational Diffie-Hellman, CDH)：给定一个安全参数 κ ∈ Ν ，设 Γ ， Γ T 是两个素数阶 p 的乘法循环群。群生成器 G ( κ ) 生成一个双线性群组 ( p , Γ , Γ T , e ) ， g 是 Γ 的生成元，取随机值 α , β ∈ ℤ p ，计算 g α , g β , g α β 。在多项式时间(PPT)内不存在算法 B 以不可忽视的优势在已知 g α 和 g β 情况下计算出 g α β ，则称CDH假设是成立的。  Green等 [ 5 ] CPA安全的解密外包的ABE方案一共包含五个算法：系统初始化算法 S e t u p 、密钥生成算法 K e y G e n 、外包密钥生成算法 K e y G e n o u t 、加密算法 E n c r y p t 、转换密文生成算法 T r a n s f o r m o u t 、转换密文解密算法 D e c r y p t o u t 。算法运行过程如下： S e t u p ( λ , U ) ：输入系统参数 λ ∈ Ν 和属性全集 U = { 0 , 1 } * ，选择两个 p 阶的循环群 Γ 和 Γ T ， Γ 的生成元为 g ， e ( g , g ) ⊂ Γ T ，定义杂凑函数 F : { 0 , 1 } * → Γ 。选择两个随机数 α , a ∈ ℤ p * ，输出系统主密钥 M S K = ( g α , P K ) 和系统公钥 P K = ( g , e ( g , g ) α , g a , F ) ，公开 P K 。 K e y G e n ( P K , M S K , S ) ：输入系统主密钥 M S K 、系统公钥 P K 属性集合 S ，随机选择 t ∈ ℤ p ，对于所有的 x ∈ S ，计算 K = g α g a t ， L = g t ， { K x = F ( ρ ( x ) t ) } x ∈ S 。输出私钥 S K S = ( S , K , L , { K x } x ∈ S ) 。 K e y G e n o u t ( M S K , S , S K S ) ：输入系统主密钥 M S K 、属性集合 S ，私钥 S K S ，随机选择 z ∈ ℤ p ，计算 K t k = K ( 1 / z ) ， L t k = L ( 1 / z ) ， { K x , t k = K x ( 1 / z ) } x ∈ S ，输出外包密钥 D T K S = ( S , K t k , L t k , { K x , t k } x ∈ S ) ，用户解密密钥 K e y = ( z , D T K S ) 。 E n c r y p t ( P K , m , ( M , ρ ) ) ：输入系统公钥 P K 和明文 m ，属性 S 满足的LSSS访问结构 ( M , ρ ) (其中 M 是一个 l × n 的矩阵， ρ ( ⋅ ) 是一个单射函数可以把矩阵 M 的每一行映射成一个属性)， s ∈ ℤ p 是共享的秘密值，取随机数 y 2 , ⋅ ⋅ ⋅ , y n ∈ ℤ p ，向量 v = ( s , y 2 , ⋅ ⋅ ⋅ , y n ) ∈ ℤ p n ， M i 表示矩阵M的第i行，计算 λ i = { M i v T } i ∈ { 1 , ⋯ , l ) 。取随机数 r 1 , ⋅ ⋅ ⋅ , r n ∈ ℤ p ，对于任意 i ∈ { 1 , ⋯ , l } ，计算得到密文组件： C = m ⋅ e ( g , g ) α s ， C 1 = g s ， { C 2 , i = g a λ i F ( ρ ( i ) ) − r i , C 3 , i = g r i } i ∈ { 1 , ⋯ , l } 。输出密文 C T = ( C , C 1 , { C 2 , i , C 3 , i } i ∈ { 1 , ⋯ l } ) 。 T r a n s f o r m o u t ( D T K S , C T ) ：输入密文 C T 和外包密钥 D T K S ，若用户属性集 S 不满足访问结构 ( M , ρ ) ，则输出 ⊥ 。若用户属性集 S 满足访问结构 ( M , ρ ) ，则定义 I ⊂ { 1 , ⋯ , l } 为 I = { i : ρ ( i ) ∈ S } ， { λ i } 是根据矩阵 M 对秘密 s 的有效共享，存在一个常数集 { ω i ∈ ℤ p } i ∈ I ，使得 ∑ i ∈ I ω i ⋅ λ i = s 。计算： C T p a r t = e ( C 1 , K t k ) / ∏ i ∈ I ( e ( C 2 , i , L t k ) ⋅ e ( C 3 , i , K ρ ( i ) , t k ) ) ω i = e ( g , g ) α s / z 。输出外包解密转换密文 T C = ( C , C T p a r t ) 。 D e c r y p t o u t ( K e y , C T ) ：输入密文 C T 和解密密钥 K e y ，若密文 C T 未进行外包解密，则首先运行转换密文生成算法 T r a n s f o r m o u t ( D T K S , C T ) ，若算法输出 ⊥ ，最终也输出 ⊥ 。否则，计算 C / C T p a r t z = m 。"
"本方案的系统中，主要包含5个实体：属性授权中心(attribute authority, AA)、数据拥有者(data owner, DO)、数据用户(data user, DU)、存储云服务商(storage-cloud service provider, S-CSP)、解密云服务商(decryption cloud service provider, D-CSP)、云服务代理商Proxy。 属性授权中心AA提供密钥生成服务，是一个完全可信的机构；数据拥有者DO可以使用移动设备加密明文信息并存储在云端；数据用户DU可以使用移动设备从云端下载密文并解密，包含两类：授权用户DU和被授权用户DU，授权用户DU可以直接解密由数据拥有者DO加密的原始密文，当数据需要重加密时，生成重加密密钥发送给云服务代理商Proxy，被授权用户DU用户只能解密被重加密的密文；云服务代理商Proxy提供数据密文重加密服务；存储云服务商S-DCP提供数据存储服务；解密云服务商D-CSP提供数据解密服务，所有的云服务商都是诚实且好奇的。  离线/在线的可验证外包属性代理重加密方案(VF-OO-ABPRE)包含八个算法：系统初始化算法 S e t u p 、密钥生成算法 K e y G e n 、外包密钥生成算法 K e y G e n o u t 、加密算法Encrypt (包含离线加密算法 O f f l i n e . E n c 和在线加密算法 O n l i n e . E n c 两种)、重加密密钥生成算法 R e K e y G e n 、重加密算法 R e E n c r y p t 、重加密验证算法 R e E n c r y p t V e r i f y 、解密算法Decrypt (包含转换密文生成算法 T r a n s f o r m o u t 、转换密文解密算法 D e c r y p t o u t 两种)。其中，解密算法包含了初始密文解密算法Dec 1 和重加密密文解密算法Dec 2 。算法运行过程如下： 1) 系统初始化算法 S e t u p ( 1 λ , U ) ：由可信方AA执行，输入系统参数 λ ∈ ℕ 和属性全集U，系统主密钥MSK和系统公钥PK，公开PK。 2) 密钥生成算法 K e y G e n ( P K , M S K , S ) ：可信方AA根据系统公钥PK，系统主密钥MSK和与用户相关的属性集S，为用户生成私钥SK S 并通过安全通道分发给用户。 3) 外包密钥生成算法 K e y G e n o u t ( S , S K S ) ：用户DU输入自己的私钥SK S ，属性集合S，生成解密密钥Key用户秘密保存，外包密钥 D T K S 通过安全通道发给解密云服务商D-CSP。 4) 加密算法Encrypt a) 离线加密算法 O f f l i n e . E n c ( P K , P ) ：数据拥有DO在闲时执行，输入系统公钥PK和假设用户最大可能的属性集合 P ⊆ U 。生成临时密钥TK保存在本地，输出中间密文ICH并将其上传至存储云服务商S-CSP。 b) 在线加密算法 O n l i n e . E n c ( P K , m , I C H , T K , ( M , ρ ) ) ：数据拥有者DO在真正加密时执行，输入系统公钥PK，明文信息m，中间密文ICH，临时密钥TK，以及属性S满足的访问结构 A = ( M , ρ ) ，生成初始密文 C ( M , ρ ) 和验证标识 V K m 发送给存储云服务商S-CSP进行存储。 5) 重加密密钥生成算法 R e K e y G e n ( P K , S K S , ( M ′ , ρ ′ ) ) ：授权用户DU根据系统公钥PK，用户自己私钥 S K S 和另一个访问结构 ( M ′ , ρ ′ ) ，生成重加密密钥 R K S → ( M ′ , ρ ′ ) 并发送给云服务器代理商Proxy。注意：其中访问结构 ( M , ρ ) 和访问结构 ( M ′ , ρ ′ ) 是不相交的。 6) 重加密算法 R e E n c ( P K , R K S → ( M ′ , ρ ′ ) , C T ( M , ρ ) ) ：云服务代理商Proxy根据系统公钥PK，重加密密文组件 R K S → ( M ′ , ρ ′ ) ，加密初始密文 C T ( M , ρ ) 得到重加密密文 C S → ( M ′ , ρ ′ ) 和验证标识 V K m 并发送给解密云服务商D-CSP。 7) 重加密验证算法 R e E n c V e r i f y ( P K , δ , C 6 , C 7 ) ：授权用户DU输入系统公钥PK，群元素 δ ，重加密密钥组件 ( C 6 , C 7 ) ，验证重加密密文是否被云服务代理商Proxy正确加密。 8) 解密算法 D e c r y p t a) 初始密文解密算法Dec 1 · 转换密文生成算法 T r a n s f o r m o u t ( P K , D T K S , C ( M , ρ ) ) ：解密云服务商D-CSP输入系统公钥 P K ，外包密钥 D T K S 和初始密文 C ( M , ρ ) ，系统首先检验外包密钥 D T K S 中的属性集合 S 是否满足 C ( M , ρ ) 中的访问结构 ( M , ρ ) ，若满足，则预解密初始密文 C ( M , ρ ) 得到外包解密转换密文 T C 并发送给授权用户DU。否则，输出 ⊥ ，终止操作。 · 转换密文解密 D e c r y p t o u t ( P K , K e y , T C , V K m ) ：授权用户DU执行，输入解密密钥 K e y 、来自解密云服务商的外包解密转换密文 T C 、验证标识 V K m ，解密并对结果进行验证，验证正确得到明文 m 。否则，输出 ⊥ 。 b) 重加密密文解密算法Dec 2 · 转换密文生成算法 T r a n s f o r m o u t ( P K , D T K S ′ , C S → ( M ′ , ρ ′ ) ) ：解密云服务商D-CSP输入系统公钥 P K ，外包密钥 D T K S ′ 和重加密密文 C S → ( M ′ , ρ ′ ) ，系统首先检验外包密钥 D T K S ′ 中的属性集合 S ′ 是否满足 C S → ( M ′ , ρ ′ ) 中的访问结构 ( M ′ , ρ ′ ) ，若满足，则预解密重加密密文 C S → ( M ′ , ρ ′ ) 得到外包解密转换密文 T C ′ 并发送给被授权用户DU。否则，输出 ⊥ ，终止操作。 · 转换密文解密 D e c r y p t o u t ( P K , K e y ′ , T C ′ , V K m ) ：被授权用户DU执行，输入解密密钥 K e y ′ 、来自解密云服务商的外包解密转换密文 T C ′ 、验证标识 V K m ，解密并对结果进行验证，验证正确得到明文m。否则，输出 ⊥ 。  选择性选择明文攻击(selective chosen plaintext attack, s-CPA)安全博弈游戏：一个VF-OO-ABPRE方案是s-CPA安全的，则没有一个敌手 A 能在概率多项式时间(PPT)内以不可忽略的优势赢得下面的博弈。定义 C 为挑战者， λ 为系统安全参数， U 为属性全集。博弈游戏如下： 初始化阶段 I n i t A 选择一个挑战的访问结构 ( M * , ρ * ) 。 系统建立阶段 S e t u p C 运行系统初始化算法 S e t u p ( 1 λ , U ) 得到系统主密钥 M S K 和系统公钥 P K ，输出系统公钥 P K 给 A ，自己保留主密钥 M S K 。 查询阶段1 P h a s e   1 A 可以重复向预言机进行如下查询： 1) 私钥查询 O s k ( S ) ： A 提交一个属性集合S，该属性集合S不满足挑战访问结构 ( M * , ρ * ) ， C 运行私钥生成算法 K e y G e n ( P K , M S K , S ) 和外包密钥生成算法 K e y G e n o u t ( S , S K S ) ，并返回私钥 S K S 和外包密钥 D T K S 给 A 。 2) 重加密密钥查询 O r k ( S , ( M ′ , ρ ′ ) ) ： A 提交一个属性集合S，该属性集合S不满足挑战访问结构 ( M * , ρ * ) ，满足访问结构 ( M ′ , ρ ′ ) ， C 运行重加密密钥生成算法 R e K e y G e n ( P K , S K S , ( M ′ , ρ ′ ) ) 返回 R K S → ( M ′ , ρ ′ ) 给 A 。其中 S K S 由算法 K e y G e n ( P K , M S K , S ) 生成。 挑战阶段 C h a l l e n g e A 输出两个相同长度的消息 m 0 和 m 1 给 C 。 C 随机选择 b ∈ { 0 , 1 } 并运行加密算法 O n l i n e . E n c ( P K , m b , I C H * , T K * , ( M * , ρ * ) ) 得到挑战密文 C b 给 A 。其中 O f f l i n e . E n c ( P K , P ) → ( T K * , I C H * ) 。 查询阶段2 P h a s e   2 A 继续查询阶段1中的查询。 猜测阶段 G u e s s A 输出一个猜测 b ′ ∈ { 0 , 1 } 。如果 b ′ = b ，则 A 获胜。 A 获胜的优势被定义为： ε 1 = A d v A s − C P A ( λ ) = | P r [ b ′ = b ] − 1 2 | 。 定义3.1 一个VF-OO-ABPRE方案是s-CPA安全的，则没有一个敌手 A 能在概率多项式时间(PPT)内以不可忽略的优势赢得上面的博弈，即 ε 1 ≤ n e g l ( λ ) 。 可验证博弈游戏：可验证主要是确保外包解密阶段的转换密文是否被正确执行。一个VF-OO-ABPRE方案具有可验证性，则没有一个敌手 A 能在概率多项式时间(PPT)内以不可忽略的优势赢得下面的博弈。定义 C 为挑战者， λ 为系统安全参数， U 为属性全集。博弈游戏如下： 系统建立阶段 S e t u p C 运行系统初始化算法 S e t u p ( 1 λ , U ) 得到系统主密钥 M S K 和系统公钥 P K ，输出系统公钥 P K 给 A ，自己保留主密钥 M S K 。 查询阶段1 P h a s e   1 A 可以重复向预言机进行如下查询： 1) 私钥查询 O s k ( S ) ： A 提交一个属性集合S，该属性集合S不满足挑战访问结构 ( M * , ρ * ) ， C 运行私钥生成算法 K e y G e n ( P K , M S K , S ) 和外包密钥生成算法 K e y G e n o u t ( S , S K S ) ，并返回私钥SK S 和外包密钥 D T K S 给 A 。 2) 重加密密钥查询 O r k ( S , ( M ′ , ρ ′ ) ) ： A 提交一个属性集合S，该属性集合S不满足挑战访问结构 ( M * , ρ * ) ，满足访问结构 ( M ′ , ρ ′ ) ， C 运行重加密密钥生成算法 R e K e y G e n ( P K , S , S K S , ( M ′ , ρ ′ ) ) 返回 R K S → ( M ′ , ρ ′ ) 给 A 。其中SK S 由算法 K e y G e n ( P K , M S K , S ) 生成。 挑战阶段 C h a l l e n g e A 输出两个相同长度的消息 m 0 和 m 1 以及一个挑战访问结构 ( M * , ρ * ) 给 C 。 C 随机选择 b ∈ { 0 , 1 } 并运行加密算法 O n l i n e . E n c ( P K , m b , I C H * , T K * , ( M * , ρ * ) ) 得到挑战密文 C b 给 A 。其中 O f f l i n e . E n c ( P K , P ) → ( T K ∗ , I C H ∗ ) 。 查询阶段2 P h a s e   2 C 按照查询阶段1的方式响应 A 的询问。但是 A 不能询问满足访问结构 ( M * , ρ * ) 的属性集合S。 猜测阶段 G u e s s A 输出满足挑战访问结构 ( M * , ρ * ) 的属性集合 S * 和满足属性集合 S * 的外包解密转换密文 T C * 。若能成功恢复出明文 m b ，则 A 获胜。 A 获胜的优势为 ε 2 = A d v A V e r . ( λ ) = | P r [ A Wins ] | 。 定义3.2 一个VF-OO-ABPRE方案具有可验证性，则没有一个敌手 A 能在概率多项式时间 ( P P T ) 内以不可忽略的优势赢得上面的博弈，即 ε 2 ≤ n e g l ( λ ) 。 抗共谋攻击博弈游戏：一个VF-OO-ABPRE方案是抗共谋攻击的。则没有一个敌手 A 能在概率多项式时间(PPT)内以不可忽略的优势赢得下面的博弈。定义 C 为挑战者， λ 为系统安全参数， U 为属性全集。博弈游戏如下： 系统建立阶段 S e t u p C 运行系统初始化算法 S e t u p ( 1 λ , U ) 得到系统主密钥 M S K 和系统公钥 P K ，输出系统公钥 P K 给 A ，自己保留主密钥 M S K 。 查询阶段Phase重加密密钥查询 O r k ( S * , ( M ′ , ρ ′ ) ) ： A 提交一个属性集合 S * ⊆ U ，该属性集合 S * 不满足访问结构 ( M ′ , ρ ′ ) ，如果 S * 从未被询问过， C 首先运行 K e y G e n ( P K , M K , S * ) 生成 S K S * ，运行重加密密钥生成算法 R e K e y G e n ( P K , S * , S K S * , ( M ′ , ρ ′ ) ) 并返回 R K S * → ( M ′ , ρ ′ ) 给 A 。同时运行 K e y G e n ( P K , M K , S ′ ) 得到 S K S ' 发送给 A ，其中 S K S ' 满足访问结构 ( M ′ , ρ ′ ) 。 挑战阶段 C h a l l e n g e 最后， A 提交一个密钥 S K S ' ' ，如果 S K S ″ = S K S * 则 A 赢得游戏。 A 赢得游戏的优势为 ε 3 = A d v A C R ( λ ) = | P r [ S K S ″ = S K S * ] − 1 2 | 。 定义3.3 一个VF-OO-ABPRE方案是抗共谋攻击的。则没有一个敌手 A 能在概率多项式时间(PPT)内以不可忽略的优势赢得上面的博弈，即 ε 3 ≤ n e g l ( λ ) 。"
