"目的：比较特立帕肽与唑来膦酸对青岛地区绝经后低转化型骨质疏松症(postmenopausal osteoporosis, PMOP)的临床疗效。方法：120例绝经后低转化型骨质疏松症患者分成特立帕肽组和唑来膦酸组，观察所有患者用药前及用药后6个月及12个月腰椎1~4 (L1~4)、股骨颈、全髋骨密度(BMD)，血清I型前胶原氨基端前肽(PINP)，I型胶原羧基端β降解产物(β-CTX)，视觉模拟评分法评分(VAS评分)及药物不良反应。结果：治疗后6个月及12个月，两组患者各部位BMD较治疗前水平均提高(P < 0.05)，其中特立帕肽组患者腰椎1~4、股骨颈BMD升高水平优于唑来膦酸组(P < 0.05)；与基线相比，治疗后3个月、6个月及12个月，特立帕肽组PINP、β-CTX水平明显升高(P < 0.05)，唑来膦酸组PINP、β-CTX水平明显降低(P < 0.05)；特立帕肽组VAS评分低于唑来膦酸组(P < 0.05)；两组患者均未出现严重不良事件，安全性较好。结论：特立帕肽和唑来膦酸均可明显提高患者骨密度，减轻疼痛，且安全性好。其中在提高腰椎骨密度及降低VAS评分方面，特立帕肽治疗效果优于唑来膦酸。"
"骨质疏松症(osteoporosis, OP)作为一种全身性骨代谢疾病，以骨量减少、骨质破坏为特点，表现为骨脆性增加以及骨折风险增加增高。骨质疏松症可以分为两种类型，一种为原发性骨质疏松症，包括：青少年型骨质疏松，绝经后骨质疏松(I型骨质疏松症)，男性骨质疏松，以及老年性骨质疏松(II型骨质疏松症)。另一种为继发性骨质疏松症，是指由任何其他疾病或者药物等病因引起骨质疏松 [ 1 ]。绝经后骨质疏松症作为原发性骨质疏松症中最常见的一种，是一种与年龄密切相关的疾病 [ 2 ]。绝经后妇女平均每年的骨量丢失率为1.2%~2%，这一过程以绝经后2~3年内丢失最快，随之会减慢，进入老年期后，破骨细胞和成骨细胞的活性都下降。同龄女性，绝经早者更容易发生骨质疏松 [ 3 ]。 目前我国人口老龄化形势严峻，据推测2020~2030年将会进入老龄化高速发展期，至2050年我国60岁及以上老年人口总量为4.98亿，其中女性老年人口占比明显增长 [ 4 ]。根据2018年中国骨质疏松症流行病学调查显示，我国女性骨质疏松症患病率水平显著高于欧美国家，与日韩等亚洲国家接近。骨质疏松症已成为我国50岁以上人群的重要健康问题，其中以中老年女性骨质疏松问题尤为严重 [ 5 ]。 骨质疏松症的药物治疗仍以西药为主，目前治疗PMOP和老年性骨质疏松的药物大致可分为两大类：一类为促进骨质形成、增加骨密度的药物；另一类为抑制骨质吸收、防止骨质丢失，维持骨量平衡的药物。适当的钙剂和维生素D制剂作为基础治疗药物，可以联合骨吸收抑制剂或骨形成促进剂使用 [ 1 ] [ 6 ] [ 7 ] [ 8 ]。结合疗效和骨折风险效果以及治疗成本等因素考量，通常不推荐骨形成促进剂和骨吸收抑制剂联合使用。本研究所涉及的两种药物，特立帕肽和唑来膦酸分别属于促进骨形成药物及抑制骨吸收药物，两种药物均可用于极高骨折风险患者的初始治疗，本研究通过两种药物针对骨密度、骨转换标志物、VAS评分、不良反应等方面治疗效果的比较，为临床用药选择提供相关依据。"
"筛选2018年12月~2019年12月就诊于青岛大学附属医院的老年女性骨质疏松症患者共120例，根据患者用药情况分为特立帕肽组和唑来膦酸组。纳入标准：1) 符合2017版《原发性骨质疏松症诊疗指南》骨质疏松症诊断标准，即符合以下三者之一：a) 经双能X线检测法测定中轴骨(腰椎1~4、股骨颈或全髋)骨密度或桡骨远端1/3骨密度T值 ≤ −2.5；b) 椎体或髋部曾发生脆性骨折；c) 骨密度测量提示低骨量(−2.5 < T值 < −1.0)但伴有肱骨近端、骨盆或前臂远端脆性骨折史。2) 年龄 ≥ 55岁的绝经后妇女。3) 符合2020年AACE/ACE指南确定的极高骨折风险患者诊断标准。排除标准：1) 其他影响骨转换的疾病如甲状腺疾病、甲状旁腺疾病、肾上腺疾病等内分泌系统疾病；影响钙及维生素D吸收的消化和肾脏系统疾病；类风湿性关节炎、系统性红斑狼疮等免疫系统疾病；神经肌肉疾病；血液系统疾病；恶性肿瘤等；2) 代谢性骨病如佝偻病、Paget病等；3) 伴严重的肝肾功不全或心、肺原发性疾病；4) 近期应用过影响骨转换药物如糖皮质激素或抗骨质疏松药物等；5) 对特立帕肽或唑来膦酸成分过敏者。120例绝经10年以上妇女，年龄、绝经时间等方面无明显差异(P > 0.05)。纳入患者均签署知情同意书。  本研究共纳入绝经后低转换型骨质疏松症患者120例，根据用药情况分为特立帕肽组和唑来膦酸组。特立帕肽组(n = 58)，予以特立帕肽(商品名：复泰奥，美国礼来公司) 20 μg/天，皮下注射，注射部位选择腹部或大腿。唑来膦酸组(n = 62)，予以唑来膦酸(商品名：密固达，北京诺华制药有限公司) 5 mg/年，恒定速度静脉滴注，滴注时间大于15 min，用药前予以0.9%生理盐水500 ml静脉滴注扩容，用药后予以0.9%生理盐水100 ml冲管，并嘱患者多饮水促进药物排泄。两组患者均予以阿法骨化醇(商品名：盖诺真，青岛正大海尔制药有限公司) 0.25 μg/d，口服和碳酸钙D3 (商品名：钙尔奇D，惠氏制药有限公司) 1片/d，口服。观察所有患者至第12个月。  骨密度：采用双能X线骨密度吸收仪(DXA) (dual energy X-ray absorptiometry, DXA) (GE-LUNAR Prodigy Advance)测定所有患者用药前、用药6个月及12个月后腰椎1~4 (L1~4)、股骨颈、全髋骨密度(BMD)。 骨转换标志物检测：患者清晨空腹状态，采用德国罗氏诊断公司提供的骨转换检测试剂盒，以电化学发光免疫测定法测定所有患者用药前、用药3个月、6个月及12个月后血清I型前胶原氨基端前肽(PINP)、I型胶原羧基端β降解产物(β-CTX)。 视觉模拟评分法评分(VAS评分)：对所有患者治疗前、用药3个月、6个月及12个月后分别进行VAS评分检测，评估其骨痛程度，分值为1~10分，0：无痛；1~3：轻度疼痛，不影响睡眠，可耐受；4~6：明显疼痛，影响睡眠，可耐受；影响睡眠和食欲，难以耐受。 不良反应：观察并记录两组患者出现不良反应例数，持续时间及缓解情况。包括发热、恶心呕吐、头晕头痛、肌肉关节疼痛、心律失常、晕厥、呼吸困难、下颌骨坏死等。  采用SPSS21.0软件对所有结果进行统计学分析，正态分布的计量资料用均数±标准差表示，计数资料以频数和百分比进行统计描述；同组患者的组内比较采用配对t检验，同时期两组之间的比较采用独立样本t检验；非正态分布的计量资料用中位数和四分位数间距描述，组间比较使用非参数检验；P < 0.05认为差异具有统计学意义。"
"特立帕肽组和唑来膦酸组所有患者的年龄、绝经年龄、身体质量指数(BMI)、治疗前腰椎1~4 (L1~4)、股骨颈、全髋骨密度(BMD)、血清I型前胶原氨基端前肽(PINP)、I型胶原羧基端β降解产物(β-CTX)、视觉模拟评分法评分(VAS评分)比较，差异均无统计学意义(P > 0.05)。见表1。 Table 1指标 特立帕肽组(n = 58) 唑来膦酸组(n = 62) P值 年龄(岁) 67.22 ± 4.26 67.36 ± 5.23 0.821 绝经年龄(年) 16.45 ± 2.25 16.54 ± 2.13 0.877 BMI (Kg/m 2 ) 25.11 ± 2.16 25.31 ± 1.25 0.649 腰椎1~4 (g/cm 2 ) 0.788 ± 0.038 0.818 ± 0.023 0.094 股骨颈(g/cm 2 ) 0.755 ± 0.232 0.763 ± 0.029 0.196 全髋(g/cm 2 ) 0.780 ± 0.025 0.741 ± 0.027 0.474 PINP (ng/L) 29.58 ± 6.01 28.76 ± 7.14 0.643 β-CTX (ng/L) 0.24 ± 0.04 0.24 ± 0.05 0.422 VAS评分 6.26 ± 0.70 6.10 ± 0.54 0.765 表1. 两组患者基线资料比较( x ¯ ± s )  与治疗前相比，治疗后6个月及12个月，两组患者各部位BMD均较基线水平提高(P < 0.05)，其中治疗后6个月，特立帕肽组患者腰椎1~4 BMD升高水平优于唑来膦酸组(P < 0.05)，治疗后12个月，特立帕肽组患者腰椎1~4、股骨颈BMD升高水平均优于唑来膦酸组(P < 0.05)，其余时期两组组间比较差异无统计学意义(P > 0.05)。见表2。 Table 2组别 时间 腰椎1~4 BMD 股骨颈BMD 全髋BMD 特立帕肽组 治疗前 0.788 ± 0.038 0.755 ± 0.232 0.780 ± 0.025 治疗后6月 0.822 ± 0.116 * 0.767 ± 0.015 * 0.800 ± 0.043 * 治疗后12月 0.856 ± 0.112 * 0.788 ± 0.015 * 0.835 ± 0.040 * 唑来膦酸组 治疗前 0.818 ± 0.023 0.763 ± 0.029 0.741 ± 0.027 治疗后6月 0.835 ± 0.016 *△ 0.771 ± 0.055 * 0.755 ± 0.020 * 治疗后12月 0.854 ± 0.020 *△ 0.783 ± 0.036 *△ 0.778 ± 0.030 * 表2. 两组患者治疗前后骨密度变化比较( x ¯ ± s ) 注：与治疗前比较， * P < 0.05，同时期与特立帕肽组比较， △ P < 0.05。  与治疗前相比，治疗后3个月、6个月及12个月，特立帕肽组PINP、β-CTX水平较基线均升高(P < 0.05)，唑来膦酸组PINP、β-CTX水平较基线均降低(P < 0.05)，特立帕肽组PINP、β-CTX水平较唑来膦酸组升高明显(P < 0.05)。见表3。 Table 3组别 时间 PINP β-CTX 特立帕肽组 治疗前 29.58 ± 6.01 0.24 ± 0.04 治疗后3月 101.29 ± 21.79 * 0.47 ± 0.07 * 治疗后6月 151.12 ± 30.57 * 0.67 ± 0.08 * 治疗后12月 164.23 ± 33.99 * 0.82 ± 0.06 * 唑来膦酸组 治疗前 28.76 ± 7.14 0.24 ± 0.05 治疗后3月 19.57 ± 6.72 * △ 0.14 ± 0.05 * △ 治疗后6月 18.59 ± 6.70 * △ 0.13 ± 0.04 * △ 治疗后12月 17.51 ± 6.70 * △ 0.12 ± 0.05 * △ 表3. 两组患者治疗前后骨转换标志物变化比较( x ¯ ± s ) 注：与治疗前比较， * P < 0.05，同时期与特立帕肽组比较， △ P < 0.05。  治疗后3个月、6个月及12个月，于相同时间点下观察两组患者VAS评分较基线水平均明显降低(P < 0.05)，特立帕肽组VAS评分低于唑来膦酸组(P < 0.05)。见表4。 Table 4组别 治疗前 治疗后3月 治疗后6月 治疗后12月 特立帕肽组 6.26 ± 0.70 3.32 ± 0.33 * 2.34 ± 0.22 * 1.44 ± 0.44 * 唑来膦酸组 6.10 ± 0.54 4.12 ± 0.64 *△ 2.70 ± 0.63 *△ 2.02 ± 0.76 *△ 表4. 两组患者治疗前后VAS评分变化比较( x ¯ ± s ) 注：与治疗前比较， * P < 0.05，同时期与特立帕肽组比较， △ P < 0.05。  随访观察两组患者用药后不良反应发生情况，特立帕肽组用药后7天内出现恶心呕吐2例，头晕眩晕1例，心慌1例，肢体疼痛1例，上述反应症状较轻，未用药后自行缓解；唑来膦酸组用药后出现发热4例，肌痛、关节痛2例，流感样症状3例，予以对症退热、止疼治疗后症状消失。两组患者均未出现肝肾功能损害、电解质紊乱、恶性心律失常、下颌骨坏死等严重不良反应。"
"绝经后骨质疏松症(ostmenopausal osteoporosis, PMOP)发病机制主要与卵巢功能衰退有关，绝经后体内激素水平紊乱，尤其是雌激素的分泌明显减少，雌激素通过多种机制参与骨代谢活动，维持骨密度，保护骨组织 [ 9 ]。女性处于围绝经期以及绝经后10年内，骨骼代谢情况处于高转换状态，随着年龄增加，破骨和成骨细胞的活性都下降，进入老年期后，骨代谢情况处于低转换状态 [ 10 ]。2018年国家卫生健康委员会指出：中国50岁以上女性骨质疏松症患病率32.1%，且患病率随年龄增加而快速升高。骨质疏松性骨折作为骨质疏松症最严重的并发症，是骨质疏松患者致死和致残的主要原因之一，有调查显示，约20%患者会在发生髋部骨折后1年之内死于各种并发症，50%患者致残导致生活质量明显降低 [ 11 ] [ 12 ]，同时骨质疏松症，尤其是骨质疏松性骨折的治疗、康复也对社会及家庭造成了极大的负担，根据2015年骨质疏松性骨折治疗费用，Si L等 [ 13 ] 预测2035和2050年骨质疏松性骨折(主要腕、髋和椎体部位)的医疗费用将分别高达1320亿元和1630亿元。同时还存在着骨质疏松患者治疗率低的问题，在一项由10个国家，723名临床医师参加的大型前瞻性观察性研究中发现，在60,393名55岁以上的绝经后妇女中，有80%以上的患者未接受抗骨质疏松治疗 [ 14 ]，因此对于绝经后骨质疏松患者高危人群的筛查及早期治疗显得尤为重要。 特立帕肽是重组人甲状旁腺素氨基端1-34活性片段，即保留了与PTH氨基端相同的结合PTH-1受体的促进成骨细胞作用，又消除PTH的C端肽链所引起的促骨细胞凋亡作用 [ 15 ]。对于极高骨折风险的绝经后骨质疏松患者给与特立帕肽治疗，但时间不宜超过24个月，停药后应序贯使用抗骨吸收药物治疗。唑来膦酸作为作用最强的第三代双磷酸盐药物，通过抑制破骨细胞的合成，促进破骨细胞的凋亡，达到抑制骨吸收作用，其特有的二氮咪唑杂环结构与机体骨表面的羟基磷灰石高度结合，可通过降低法尼基焦磷酸合成酶的活性，降低破骨细胞的活性与功能，从而发挥抗骨质疏松作用 [ 16 ]，而且由于其药物脱落率低，并且少量脱落出来的药物可以通过再吸附而重新被骨组织吸收，从而延长了唑来膦酸作用周期，有助于提高患者用药的依从性 [ 17 ]。 现有研究显示，特立帕肽和双磷酸盐药物均可提高患者骨密度，缓解骨痛，降低骨折发生风险。但目前研究结论尚不全面，且缺乏一致性。吴迎春等 [ 18 ] 人研究150例绝经后骨质疏松症患者，通过使用甲状旁腺激素(1-34)、唑来膦酸和雷奈酸锶，发现PTH组在提高骨密度方面明显优于其他两组，在缓解骨痛方面，ZA组效果更佳，据此，该研究考虑其观察结果差异与PTH和ZA促骨形成和抑制骨溶解的不同药物作用机制有关。Harvinder Chhabra等 [ 19 ] 将119例重度骨质疏松患者分别予以特立帕肽，抗骨吸收药物，或两种药物联合应用治疗，结果显示两种药物均可明显改善患者背部疼痛情况，在治疗6个月后，特立帕肽治疗组降低严重背部疼痛的效果更佳，据此结合Harry K. Genant等 [ 20 ] 人研究，认为特立帕肽可以通过降低新发椎体骨折的数量及严重程度，从而达到缓解骨痛的治疗目的。李晓峰等 [ 21 ] 将56例，平均年龄为(68.7 ± 6.1)岁的骨质疏松患者，根据骨转换标志物水平分为高转换组、低转换组，分别采用特立帕肽和唑来膦酸治疗，研究发现26周后低转换组患者中腰椎骨密度、骨痛缓解程度，特立帕肽治疗效果优于唑来膦酸。在一项包含了7个研究的荟萃研究分析中比较了特立帕肽和利塞膦酸盐治疗骨质疏松症的疗效及安全性，研究发现特立帕肽可以更有效增加腰椎，股骨颈以及全髋部的骨密度水平，并可减少临床骨折，如椎骨骨折和非椎骨骨折的发生率 [ 22 ]。 本研究通过对绝经后骨质疏松患者进行筛选，根据研究对象骨转换标志物基线数值水平，纳入患者类型为低转换型骨质疏松症，即成骨细胞和破骨细胞的活性均受到抑制，同时伴有极高骨折风险的患者。本研究选择的药物为特立帕肽与唑来膦酸。本研究分别对特立帕肽组和唑来膦酸组患者的腰椎、股骨颈及全髋部位的BMD进行组内比较，结果显示特立帕肽、唑来膦酸均可以提高绝经后骨质疏松症患者的骨密度，而特立帕肽在提高腰椎1~4骨密度上改变较为显著，这可能是与特立帕肽通过明显促进了皮质骨及网状骨的形成，但对股骨颈和髋部这样的松质骨部位骨量增加不明显所致 [ 23 ]。通过对比两组患者用药前、用药期间骨转换标志物后发现，经特立帕肽经治疗后，患者PINP、β-CTX水平较基线相比均有所提高(P < 0.05)，考虑可能与特立帕肽既能够促进骨形成，又能够抑制骨吸收有关 [ 21 ]。结果反映两种药物均可缓解骨痛，而特立帕肽的效果更佳。就用药安全性方面，本实验表明两组的不良反应小，安全性较好，这与既往研究结果一致 [ 10 ] [ 24 ]。"
"综上所述，本研究证实特立帕肽和唑来膦酸均可以提高老年女性低转换型骨质疏松症患者骨密度，缓解骨痛，降低骨折发生率，且安全性好。而在提高腰椎、股骨颈骨密度及降低VAS评分方面，特立帕肽治疗效果优于唑来膦酸。虽然本研究认为特立帕肽对腰椎骨密度及骨痛改善优于唑来膦酸，但不足之处在于本研究未区分骨痛部位及对应药物治疗的关系，后续可以制定更详细的治疗方案确定相关疗效对比情况，同时本研究存在样本量相对不足、疗效及不良反应观察时间有限的问题，需通过进一步研究精化研究结论。"
