"目的：膀胱癌是最常见的泌尿系统肿瘤，发病率及死亡率始终位于泌尿系统肿瘤首位。本研究通过对膀胱正常黏膜组织和尿路上皮癌组织中磷酸化组蛋白H3 (Phosphorylated Histone H3, PHH3)的表达情况，探讨其在膀胱尿路上皮癌中的表达与临床病理特征及预后的关系。方法：回顾性分析2016年1月至2020年1月期间在青岛市市立医院病理诊断为膀胱尿路上皮癌患者87例以及31例正常膀胱黏膜组织，使用免疫组化的方法分别检测PHH3在癌组织和正常粘膜组织中的表达情况，结合临床资料分析其表达与肿瘤的临床分期、病理分级、有无淋巴结转移之间的统计学关系。结果：PHH3蛋白定位于细胞核，呈棕黄色或棕褐色。在尿路上皮癌组织中PHH3表达阳性率为72%，在正常尿路上皮组织中阳性率为7%，差异有统计学意义(P < 0.05)。在尿路上皮癌患者中，PHH3蛋白的表达与临床分期、病理分级、是否淋巴结转移有明显相关性，差异有统计学意义(P < 0.05)，与患者年龄、性别未见明显关系，无统计学意义(P > 0.05)。PHH3蛋白在一定程度上能判断膀胱癌进展状态和恶性程度，有较高的预后评估价值。"
"膀胱癌是泌尿生殖系统最常见的恶性肿瘤，膀胱癌大多数起源于上皮组织，其中尿路上皮癌占90%以上。在世界范围内，膀胱癌的发病率占全部恶性肿瘤发病率的第十一位，每年约有15万人因膀胱癌而死亡 [ 1 ]。引起膀胱癌的病因很多，但是多数病因尚不明确。现有研究表明苯胺类物质可导致膀胱癌的发生，其他诸如吸烟、慢性感染、饮食、药物、血吸虫病感染、家族史和生活方式等因素也与膀胱癌的发生有关 [ 2 ]。目前膀胱癌治疗方法主要为经尿道膀胱肿瘤电切术(TURBT)和根治性膀胱切除术(RC)。但术后复发率极高，严重影响患者生存时间和生活质量。因此临床上对于膀胱尿路上皮癌预后影响因素的研究也逐渐被人们关注，寻找特异且敏感的预后指标意义重大。磷酸化组蛋白H3 (Phosphorylated Histone H3, PHH3)是真核细胞核心组蛋白，与细胞周期M期密切相关 [ 3 ]，研究指出，组蛋白H3磷酸化主要发生在细胞有丝分裂期，而在细胞凋亡过程中不发生磷酸化，因此，PHH3可以作为细胞分裂的特异性标记，能一定程度上地反映细胞的增殖活性。而且最近的一些研究显示PHH3蛋白具有较高的预后价值 [ 4 ]，是一种新的肿瘤预后预测指标 [ 5 ]。本研究通过免疫组织化学法，检测肿瘤组织和正常组织中PHH3蛋白的表达，并分析其分别在癌组织与正常组织表达的关系、以及临床病理特征的关系，分析PHH3蛋白表达对膀胱尿路上皮癌的增殖活性的意义，进一步分析其对预后的影响。"
"选取青岛市市立医院泌尿外科中心2016年1月至2020年1月期间因膀胱尿路上皮癌行手术的患者87例，经病理学确诊为尿路上皮癌且具有完整的临床资料。另选31例前列腺增生患者的新鲜膀胱组织，且经病理学诊断为正常膀胱组织作为对照。纳入标准：1) 首次诊断膀胱癌患者；2) 病理学检查确诊为膀胱尿路上皮癌；3) 患者的病历资料均详细及完整；4) 术前没有化疗或放疗等治疗；5) 没有家族性恶性肿瘤或其他同步恶性肿瘤的病史。排除标准：1) 转移性膀胱尿路上皮癌患者；2) 有其他恶性肿瘤病史患者；3) 临床资料缺失，失访患者；4) 初诊术前有过治疗患者。在87例膀胱尿路上皮癌患者中，男性65例，女性22例，确诊时的年龄范围42~85岁，平均年龄65岁。所有病例已获得病人的知情同意。  将患者术后组织置于10%的福尔马林溶液中固定24 h后石蜡包埋。连续4 μm厚度切片。采用兔抗人PHH3多克隆抗体按照说明书进行免疫组化染色。PHH3为核表达蛋白，定位于细胞核，光学显微镜下可观察到细胞核中出现棕黄色或黄褐色颗粒则为阳性，无着色则为阴性。所有切片均由2名高年资病理医师采取随机双盲法在高倍视野下(×400)进行判读。  采用SPSS 22.0软件对所得结果进行统计学分析。分类变量分析采取卡方检验。PHH3蛋白表达和复发之间关系通过Kaplan-Meier曲线分析，Log-rank检验。P < 0.05表示差异有统计学意义。"
"应用免疫组化方法检测87例膀胱尿路上皮癌组织和31例正常尿路上皮组织中PHH3蛋白的表达，PHH3免疫组化阳性产物主要见于尿路上皮细胞的细胞核中，表现为或棕褐色或棕黄色，见图1。 在87例尿路上皮癌组织中有63例PHH3表达为阳性，阳性率为72%，其中阴性有24例(28%)，在31例正常尿路上皮组织中有2例PHH3表达为阳性，阳性率为7%，其中阴性有29例(93%)。PHH3在尿路上皮癌组织阳性表达率(72%)与正常尿路上皮组织表达阳性率(7%)相比明显增高，差异有统计学意义(c2 = 40.194, P < 0.05)，见表1，图1、图2。 图1. PHH3在尿路上皮癌中阳性表达 Table 1 PHH3表达 c 2 P值 类型 阴性(−) 阳性(+) 合计 正常尿路上皮组织 29(93%) 2(7%) 31 40.194 <0.001 尿路上皮癌组织 24(28%) 63(72%) 87 表1. PHH3在正常尿路上皮组织和尿路上皮癌组织中的表达 图2. PHH3在正常尿路上皮组织和尿路上皮癌组织中的表达情况  本次研究尿路上皮癌组织中PHH3蛋白表达情况与患者临床病理参数之间的关系。其中PHH3蛋白表达与临床分期、病理分级、有无淋巴结转移有关(P < 0.05)。而与性别、年龄无统计学意义(P > 0.05)。见表2。 Table 2 临床病理参数 例数 PHH3表达 PHH3阳性率 c 2 P值 阴性(−) 阳性(+) 性别 0.001 0.975 男 65 18 47 72% 女 22 6 16 73% 年龄(岁) 0.461 0.497 <65 42 13 29 69% ≥65 45 11 34 76% 临床T分期 12.2 0.000 Ta + T1 39 18 21 54% T2~T4 48 6 42 88% 病理分级 24.526 0.000 I、II 50 24 26 52% III 37 0 37 100% 有无淋巴结转移 有 16 1 15 94% 4.468 0.035 无 71 23 48 68% 表2. PHH3的表达与尿路上皮癌组织的临床病理参数的关系"
"作为泌尿系统最常见的恶性肿瘤，膀胱癌也是因癌症死亡因素中的第七大原因之一 [ 6 ]。我国每年约有八万新诊断的膀胱癌患者，这其中约有75%是非肌层浸润性膀胱癌(NMIBC)，25%为肌层浸润性膀胱癌(MIBC)。NMIBC通常在膀胱镜检查时通过经尿道肿瘤电切术治疗，虽然患者在术后生存率方面预后良好，但有70%左右的复发风险，甚至约有10%~20%的几率进展为MIBC [ 7 ]。相比之下，MIBC尽管进行了积极的治疗，但预后依然很差。因此，膀胱癌患者术后一般都需要定期随访。目前用于膀胱癌监测的生物标记物很少，仍然需要更敏感和特异性的生物标志物来增加对高复发率膀胱癌的检测，并识别那些有进展风险的患者，进一步评估患者预后。 恶性肿瘤通常是细胞分裂和增殖不受限制的结果。目前研究认为，肿瘤的发生是因为细胞周期的调控紊乱，从而导致细胞增殖失控。正常细胞有丝分裂周期是包括G1期、S期、G2期和M期 [ 8 ]。PHH3可作为有丝分裂中具有特异性的标志物反映细胞增值活性。韩换 [ 9 ] 研究结果示PHH3在胰腺神经内分泌肿瘤的表达与Ki67具有高度相关性，与Ki67比具有更多优势，可以协助Ki67对胰腺神经内分泌肿瘤进行病理诊断和分级。Aune等 [ 10 ] 研究发现，PHH3在临床分期为III、IV期的卵巢癌中表达明显高于I、II期卵巢癌组，且伴有腹膜转移组的表达明显高于无转移组。Takahashi等 [ 11 ] 研究表明，在胃癌中，PHH3表达水平明显增高，且和肿瘤血管浸润、淋巴转移等因素关系密切，而且PHH3水平高表达是胃癌患者预后较差的独立因素。而且在多种不同类型的肿瘤预后进行的相关研究中，PHH3被证明是多种肿瘤恶性程度及预后评估的潜在有力标志物 [ 12 ]，能够一定程度的反映癌组织的增殖活性，对多种癌症具有较高的预后价值。 本次研究中，我们通过免疫组化法分别检测正常膀胱黏膜组织和膀胱尿路上皮癌组织中PHH3蛋白的表达，发现PHH3蛋白表达于细胞核。免疫组化结果显示：PHH3蛋白在尿路上皮癌和正常黏膜组织中的阳性率分别为72%和7%，两者差异有统计学意义，这与PHH3蛋白在其他肿瘤的相关研究结果相类似。 在膀胱尿路上皮癌患者中，我们通过免疫组化对不同病理特征患者癌组织中的PHH3蛋白进行定性和定量检测。结果显示PHH3蛋白在Ta + T1、T2~T4分期中阳性率分别为54%、88%，可以看出，随着肿瘤的浸润深度的增加，PHH3蛋白的阳性率也显著提高。PHH3在病理分级为I、II级患者中阳性率为52%，III级患者中阳性率高达为100%，而且III级患者组织中PHH3蛋白表达量明显高于I、II级患者，差异有统计学意义，病理分级越高，PHH3蛋白表达的阳性率也随着升高。在是否有淋巴转移方面，伴有淋巴结转移的患者PHH3阳性表达率(94%)明显高于无淋巴转移的患者(68%)，这也提示PHH3蛋白的高表达预示着患者有较高淋巴转移的倾向。以上实验结果可分析，对于临床分期高、病理分级差的患者来说，其膀胱癌组织中的PHH3蛋白阳性率更高，说明了PHH3蛋白的表达可能对膀胱癌的进展、浸润深度的增加有密切关系。也提示我们可以通过对患者PHH3蛋白的检测，可以评估肿瘤的组织学分级、预测淋巴结转移及其预后，可作为判断膀胱癌进展状态和恶性程度的指标。"
"综上所述，PHH3蛋白在膀胱尿路上皮癌中为高表达，并与膀胱尿路上皮癌的临床分期、病理分级、有无淋巴结转移之间密切相关。其阳性表达提示肿瘤恶性程度高、易复发、预后差，增加PHH3蛋白检测可进一步提高对膀胱癌患者预后情况的预测，指导治疗。"
