"目的：科学预测上海市卫生总费用的支出趋势及筹资结构，并从人口、经济、政策、卫生等角度分析影响上海市卫生总费用的因素，为上海市医疗卫生部门制定医疗卫生政策、发展医疗卫生事业控制医疗卫生费用提出合理意见。方法：数据来源于2010~2017年上海市统计年鉴，采用GM(1,1)灰色预测模型灰色关联模型对上海市卫生总费用进行预测和影响因素关联度分析。结果：2018~2027年十年内，上海市卫生总费用、政府卫生支出、社会卫生支出和个人卫生支出均出现不断上升的趋势；农村居民人均可支配收入、农村居民医疗卫生支出占人均消费支出的比重、城镇居民人均可支配收入的灰色关联度排在前三位，而常住人口数量和政府卫生支出占总支出的比重排在末两位。结论：上海市卫生筹资结构更加合理，人民健康水平不断提升，经济因素和卫生消费因素是影响上海市卫生总费用的主要因素，政策因素、人口因素中的常住人口数量对上海市卫生总费用影响最弱。"
"卫生总费用是指某一地区在一定时期内(通常指1年)，为开展卫生服务活动从全社会筹资的卫生资源的货币总和，是衡量一个国家或地区卫生投入和卫生筹资政策以及卫生资金利用情况的指标 [ 1 ]。卫生总费用是政府卫生支出、社会卫生支出和个人卫生支出的总和。卫生总费用及其构成在很大程度上可以反映出国家、社会及个人对健康的重视程度及对医疗卫生费用的负担水平 [ 2 ]。随着国民经济和卫生事业的不断发展，我国的卫生总费用不断增多，给政府、社会和个人带来了比较大的经济负担，而现如今，“健康中国2030”已成为一项国家战略，如何实现“健康中国”目标成为政府工作和各界关注的焦点，卫生总费用的增长趋势与结构的合理性直接关系到“健康中国2030”战略目标的实现 [ 3 ]。通过对卫生总费用进行有效预测，了解其变化趋势和重要影响指标的变化，对于优化卫生资源配置、制定卫生规划、发展卫生事业具有重要意义。上海市作为经济中心，其医疗卫生水平和经济水平都优于其他地区，同时，上海市为全国医改先行城市，通过不断的对医疗卫生事业进行完善和改革，逐步形成了有自身特色的“上海模式”，而研究卫生总费用对深化医疗体制改革，发展医疗卫生事业具有重要意义，因此本文选择对上海市的卫生总费用进行科学合理的预测，并分析影响卫生总费用的因素，能够对上海市医疗卫生事业的发展提供现实意义，同时为全国其他地区的医疗卫生改革和发展提供借鉴意义。"
"从卫生费用角度来看，2002年~2017年，上海市卫生总费用呈现整体上升趋势，政府卫生支出、社会卫生支出、个人卫生支出也呈现整体上升趋势，卫生总费用从2001年的202.63亿元上升到2017年的2087.09亿元，翻了10倍，其中社会卫生支出上升速度最快，超过了总卫生费用支出，翻了12倍，政府卫生支出增长速度与总费用基本持平，个人卫生支出增长速度低于总费用。上海市人均卫生费用也出现上涨趋势，从2001年的1233元上涨到2017年的8611元，增长幅度较大。 从构成角度来看，社会卫生支出占总费用的一半以上，占比最重，政府卫生支出和个人卫生支出占比较小，且比例接近，总体来看，2001~2017年，社会卫生支出占比呈现上升趋势，从48.8%上升到58.0%。政府卫生支出和个人卫生支出占比呈现下降趋势，政府卫生支出占比从22.6%降低到21.5%，个人卫生支出占比从29.0%下降到20.5%，个人卫生支出占比下降趋势比较明显，且2007年以前，政府卫生支出占比小于个人卫生支出占比，2007年以后，政府卫生支出占比渐渐超过个人卫生支出。 总之，到2017年，上海市卫生总费用支出处于增长状态，并且社会卫生支出占比高于政府卫生支出和个人卫生支出占比，见表1。 Table 1 年份 卫生总费用 其中 比重(%) 人均卫生费用 (亿元) 政府卫生 支出 社会卫生 支出 个人现金 卫生支出 政府卫生 支出 社会卫生 支出 个人卫生 支出 (元) 2001 202.63 45.70 98.01 58.93 22.6 48.4 29.0 1233 2002 220.31 40.65 121.14 58.52 18.5 55.0 26.5 1356 2003 266.19 51.30 151.60 63.29 19.3 56.9 23.8 1556 2004 315.48 59.54 170.14 85.80 18.9 53.9 27.2 1811 2005 362.13 70.30 199.44 92.39 19.4 55.1 25.5 2036 2006 401.46 77.13 226.39 97.94 19.2 56.4 24.4 2212 2007 485.67 99.39 278.50 107.79 20.5 57.3 22.2 2614 2008 559.83 135.82 314.97 109.04 24.2 56.3 19.5 2965 2009 656.66 141.30 366.90 148.45 21.5 55.9 22.6 3418 2010 751.99 177.20 419.82 154.96 23.6 55.8 20.6 3266 2011 931.00 215.70 521.62 193.68 23.2 56.0 20.8 3966 2012 1092.35 232.49 646.51 213.35 21.3 59.2 19.5 4589 2013 1248.68 250.82 740.42 257.44 20.1 59.3 20.6 5170 2014 1347.79 275.29 792.51 279.99 20.4 58.8 20.8 5556 2015 1536.60 319.94 882.39 334.27 20.8 57.4 21.8 6362 2016 1838.00 430.73 1061.74 345.53 23.4 57.8 18.8 7596 2017 2087.09 449.64 1209.53 427.92 21.5 58.0 20.5 8611 表1. 2001~2017年上海市卫生总费用及其构成情况 数据来源：上海市统计年鉴(2019)。"
"本文以2010~2017年上海市卫生总费用及构成状况为参考，预测未来十年的上海市卫生总费用。   X ( 0 ) = ( x ( 0 ) ( 1 ) , x ( 0 ) ( 2 ) , ⋯ , x ( 0 ) ( 8 ) ) = ( 751.99 , 931.00 , 1092.35 , 1248.68 , 1347.79 , 1536.60 , 1838.00 , 2087.09 )  σ ( k ) = x ( 0 ) ( k − 1 ) x ( 0 ) ( k ) σ = ( σ ( 2 ) , σ ( 3 ) , ⋯ , σ ( 8 ) ) = ( 0 .81 , 0 .85 , 0 .87 , 0 .93 , 0 .88 , 0 .84 , 0 .88 )  经过计算，该数列所有的级比数值都属于区间 σ ( k ) ∈ ( e − 2 n + 1 , e 2 n + 1 ) 即属于 σ ( k ) ∈ [ 0 .800737403 , 1 .248848869 ]     ( k = 2 , 3 , ⋯ , 8 ) 内，故可以用 X ( 0 ) 作满意的GM(1,1)建模。  3.2.1. 对原始数据X (0) 作一次累加 X ( 1 ) ( k ) = ∑ m = 1 k X ( 0 ) ( m ) ( k = 1 , 2 , 3 , ⋯ , 8 ) 得： X ( 1 ) = ( x ( 1 ) ( 1 ) , x ( 2 ) ( 2 ) , x ( 1 ) ( 3 ) , ⋯ , x ( 1 ) ( 8 ) ) = ( 751.99 , 1682.99 , 2775.34 , 4024.02 , 5371.81 , 6908.41 , 8746.41 , 10833.50 )  Z = ( Z ( 1 ) ( 2 ) = 1 2 [ x ( 1 ) ( 1 ) + x ( 1 ) ( 2 ) ] = 1217 .49 Z ( 1 ) ( 3 ) = 1 2 [ x ( 1 ) ( 2 ) + x ( 1 ) ( 3 ) ] = 2229 .17 Z ( 1 ) ( 4 ) = 1 2 [ x ( 1 ) ( 3 ) + x ( 1 ) ( 4 ) ] = 3399 .68 Z ( 1 ) ( 5 ) = 1 2 [ x ( 1 ) ( 4 ) + x ( 1 ) ( 5 ) ] = 4697 .92 Z ( 1 ) ( 6 ) = 1 2 [ x ( 1 ) ( 5 ) + x ( 1 ) ( 6 ) ] = 6140 .11 Z ( 1 ) ( 7 ) = 1 2 [ x ( 1 ) ( 6 ) + x ( 1 ) ( 7 ) ] = 7828 .41 Z ( 1 ) ( 8 ) = 1 2 [ x ( 1 ) ( 7 ) + x ( 1 ) ( 8 ) ] = 9789 .96 ) 于是得到： B = ( − Z ( 1 ) ( 2 ) 1 − Z ( 1 ) ( 3 ) 1 − Z ( 1 ) ( 4 ) 1 − Z ( 1 ) ( 5 ) 1 − Z ( 1 ) ( 6 ) 1 − Z ( 1 ) ( 7 ) 1 − Z ( 1 ) ( 8 ) 1 ) = ( − 1217.49 1 − 2229.17 1 − 3399.68 1 − 4697.92 1 − 6140.11 1 − 7827.41 1 − 9789.96 1 ) , Y = ( x ( 0 ) ( 2 ) x ( 0 ) ( 3 ) x ( 0 ) ( 4 ) x ( 0 ) ( 5 ) x ( 0 ) ( 6 ) x ( 0 ) ( 7 ) x ( 0 ) ( 8 ) ) = ( 931.00 1092.35 1248.68 1347.79 1536.60 1838.00 2087.09 ) 3.2.3. 最小二乘法估计求参数列P = (a, b) T 经过计算 B T B ， ( B T B ) − 1 ， ( B T B ) − 1 × B T × Y ，得到 a ^ = − 0.132909927 , b ^ = 769.9371871 。  X ( 0 ) ( k ) − 0.1 32909927 Z ( 1 ) ( k ) = 769 .9371871 解得时间响应序列为： X ^ ( 1 ) ( k + 1 ) = ( x ( 0 ) ( 1 ) − b ^ a ^ ) e − a ^ k + b ^ a ^ = 6544 .914614e 0.132909927 k − 5792 .924614  令 k = 1 , 2 , ⋯ , 7 代入时间响应函数可算得 x ^ ( 1 ) ( 1 ) = x ^ ( 0 ) ( 1 ) = x ( 1 ) ( 1 ) = 751.99 其中取由累减生成 x ^ ( 0 ) ( k ) = x ^ ( 0 ) ( k ) − x ( 0 ) ( k − 1 ) ，得还原值： x ^ ( 0 ) = ( x ^ ( 0 ) ( 1 ) , x ^ ( 0 ) ( 2 ) , ⋯ , x ^ ( 0 ) ( 8 ) ) = ( 751.99 , 930.34 , 1062.59 , 1213.63 , 1386.14 , 1583.18 , 1808.22 , 2065.26 )"
"残差和相对残差 计算得出模型残差和相对残差见表2。 Table 2 序号 年份 原始值 预测值 残差 相对残差 1 2010 751.99 751.99 0 0 2 2011 931.00 930.34 0.66 0.07% 3 2012 1092.35 1062.59 29.7 2.72% 4 2013 1248.68 1213.63 35 2.81% 5 2014 1347.79 1386.14 −38 −2.85% 6 2015 1536.60 1583.18 −46 −3.03% 7 2016 1838.00 1808.22 29 1.62% 8 2017 2087.09 2065.26 21 1.05% 表2. GM(1,1)模型检验表 计算原始序列标准差S 1 及残差标准差S 2 ，后得出后验差比值C值和最小误差概率P值，基于C值与P值进行预测模型的残差检验以及拟合效果分析，其中C值越小且P值越大拟合效果越好 [ 4 ]，模型拟合精度表见表3。 Table 3 模型拟合精度等级 后验差比值C 最小误差概率P a值(预测最佳周期) 好 C ≤ 0.35 0.95 ≤ P −a ≤ 0.3 (适用于短中长期预测) 合格 0.35 < C ≤ 0.5 0.80 ≤ P < 0.95 0.3 < −a ≤ 0.50 (可进行短期预测) 勉强 0.50 < C ≤ 0.65 0.70 ≤ P < 0.80 0.50 < −a ≤ 0.80 (仅适用于短期预测) 不合格 P < 0.70 P < 0.70 0.80 < −a ≤ 1 (不建议进行预测) 表3. GM(1,1)预测模型拟合精度表 平均相对误差： ε ( a v g ) = 1 n − 1 ∑ k = 2 n | ε ( k ) | = 0.003 ， S 1 = 1 n ∑ k − 1 n [ X ( 0 ) k − X ¯ ] = 451 . 34 0 2353 ， S 2 = 1 n − 1 ∑ k − 2 n [ E ( k ) − E ¯ ] 2 = 0.0 22551261 后验差比值 C = S 2 S 1 = 0.0000 5 ，精度 P = P ( | E ( k ) − E ¯ | < 0.6745 S 1 ) = 1 ，经验证，该模型的精度较高，可以进行预测。 运用同样的方法，对政府卫生支出，社会卫生支出和个人卫生支出进行级比检验，三者均通过检验，因此三者都可以建立GM(1,1)模型，经过计算，政府卫生支出、社会卫生支出和个人卫生支出的 a ^ 值分别为：−0.140224438，−0.13159751，−0.129027757， b ^ 分别为：156.7298986，452.9867452，160.0222485。所以三者的GM(1,1)灰色预测模型分别为： 政府卫生支出： X ^ ( 1 ) ( k + 1 ) = ( x ( 0 ) ( 1 ) − b ^ a ^ ) e − a ^ k + b ^ a ^ = 1294 . 9 0 7445e 0.140224438 k − 1117 . 7 0 7445 社会卫生支出： X ^ ( 1 ) ( k + 1 ) = ( x ( 0 ) ( 1 ) − b ^ a ^ ) e − a ^ k + b ^ a ^ = 3862 .0 33643e 0.13159751 k − 3442 . 213643 个人卫生支出： X ^ ( 1 ) ( k + 1 ) = ( x ( 0 ) ( 1 ) − b ^ a ^ ) e − a ^ k + b ^ a ^ = 1395 . 175689e 0.129027757 k − 124 0. 215689 三者的平均相对误差分别为：0.004891689，0.00119006，0.001190304，后验差比值C分别为：0.000653093，0.000126414，0.000364394，均小于0.35，模型精度p都为1，因此都可以进行预测。 基于以上分析，本文对上海市2018~2027年十年的卫生总费用进行预测，预测结果见表4： Table 4 年份 政府卫生支出/亿元 占比/% 社会卫生支出/亿元 占比/% 个人卫生支出/亿元 占比/% 累加总费用/亿元 预测卫生总费用/亿元 2018 520.19 22.05 1364.64 57.85 474.11 20.10 2358.94 2358.83 2019 598.49 22.21 1556.57 57.77 539.41 20.02 2694.47 2694.13 2020 688.58 22.37 1775.50 57.69 613.70 19.94 3077.79 3077.09 2021 792.24 22.53 2025.23 57.61 698.22 19.86 3515.68 3514.49 2022 911.49 22.70 2310.07 57.52 794.38 19.78 4015.95 4014.07 2023 1048.70 22.86 2634.98 57.44 903.78 19.70 4587.47 4584.65 2024 1206.56 23.02 3005.59 57.35 1028.25 19.62 5240.41 5236.35 2025 1388.19 23.19 3428.33 57.27 1169.87 19.54 5986.38 5980.68 2026 1597.16 23.35 3910.52 57.18 1330.98 19.46 6838.66 6830.82 2027 1837.58 23.52 4460.53 57.10 1514.29 19.38 7812.40 7801.80 表4. 2018~2027年上海市卫生总费用及筹资结构预测值 由表4可知，2018~2027十年内，上海市卫生总费用继续呈现上升趋势，从2358.83亿元上涨到7801.80亿元，涨了三倍。在筹资结构上，政府卫生支出、社会卫生支出和个人卫生支出也呈上升趋势，政府卫生支出由520.19亿元上涨到1837.58亿元，社会卫生支出由1364.64亿元上涨到4460.53亿元，个人卫生支出由474.11亿元上涨到1514.29亿元。在各项支出所占总费用的比例上，政府卫生支出占比从22.05%上升到23.52%，呈现上升趋势，社会卫生支出虽然占比仍然最大，超过卫生总费用的一半，但是呈现下降趋势，从57.85%下降到57.10%，个人卫生支出占比也呈现下降趋势，从20.10%下降到19.38%。这说明，政府越来越注重医疗卫生方面的投入，为实现“健康中国”目标不断加大财政支持，个人卫生支出水平的下降，说明人民的健康水平越来越高，“健康中国”的目标渐渐实现，全民健康素养水平不断提升 [ 5 ]。"
"卫生费用的增长受到各种因素的影响，由于其内涵和外延均不确定，因此资料呈现灰色特性 [ 6 ]。而灰色关联分析理论是从多个因素中确定主因素的优势对比的一种理念，它定量描述了系统内部结构之间的联系 [ 7 ]。它的基本思想就是通过分析比较数列指标的变化对参考数列指标的影响来判断关联程度，关联度越大，表示关联程度越强，关联度越小，表示关联程度越弱。因此，本文选择灰色关联模型对上海市卫生总费用的影响因素进行关联分析。  卫生总费用受到包括经济、人口、社会政策、卫生资源等各种因素的影响，通过整合相关学者对卫生总费用影响因素的研究 [ 8 ] [ 9 ] [ 10 ] [ 11 ]，本文从人口变动情况、社会经济状况、卫生资源利用情况、卫生资源提供情况等角度确定了12个影响上海市卫生总费用的因素，见表5。将卫生总费用确定为参考序列X 0 。 Table 5 指标分类 指标名称 指标表达式 人口因素 常住人口数量/万人 X 1 老龄化指数/% X 2 社会经济因素 人均GDP/元 X 3 城镇居民人均可支配收入/元 X 4 农村居民人均可支配收入/元 X 5 卫生消费因素 城镇居民医疗卫生支出占人均消费支出的比重/% X 6 农村居民医疗卫生支出占人均消费支出的比重/% X 7 卫生资源利用因素 门诊人次/万人 X 8 住院人次/万人 X 9 卫生资源提供因素 卫生技术人员数量/万人 X 10 卫生机构床位数/万张 X 11 政策因素 政府卫生支出占总支出的比重/% X 12 表5. 影响上海市卫生总费用的指标分类  如表6所示，上海市卫生总费用影响因素各项指标基本呈上升趋势。其中，参考指标卫生总费用呈现稳步上涨趋势，人口因素中老龄化比重呈现上升趋势，但是常住人口数量在2014年达到峰值，随后呈现不确定性变化，经济因素、卫生资源利用情况、卫生资源提供情况都呈现上升趋势。 Table 6 年份 X 0 X 1 X 2 X 3 X 4 X 5 X 6 X 7 X 8 X 9 X 10 X 11 X 12 2010 751.99 2302.66 23.44 77,275 31,838 13,746 4.3 5.7 21,002.46 285.68 13.54 10.51 5.36 2011 931.00 2347.46 24.50 84,037 36,230 15,644 4.5 8.1 20,205.30 268.28 13.91 10.71 5.51 2012 1092.35 2380.43 25.74 86,969 40,188 17,401 3.9 8.5 21,402.13 298.80 14.61 10.96 5.56 2013 1248.68 2415.15 27.06 92,852 43,851 19,208 4.8 8.8 24,093.28 314.66 15.64 11.43 5.54 2014 1347.79 2425.68 28.77 99,438 47,710 21,192 4.7 8.5 25,834.62 345.08 16.40 11.75 5.31 2015 1536.60 2415.27 30.21 106,009 52,962 23,205 6.4 9.1 26,522.32 362.33 17.02 12.28 5.17 2016 1838.00 2419.70 31.57 116,582 57,692 25,520 7.1 10 26,605.02 394.55 17.82 12.92 6.23 2017 2087.09 2418.33 33.23 126,634 62,596 27,825 6.5 8.1 27,342.32 420.00 18.80 13.46 5.96 表6. 2010~2017年上海市卫生总费用及影响因素原始数据   采用初值法，对参考数列和比较数列的各项指标进行无量纲处理，初值化结果见表7。 Table 7 2010年 2012年 2013年 2014年 2015年 2016年 2017年 X ′ 0 1 1.45261 1.66050 1.79230 2.04338 2.44418 2.77542 X ′ 1 1 1.03377 1.04885 1.05343 1.04890 1.05083 1.05023 X ′ 2 1 1.09812 1.15444 1.22739 1.28882 1.34684 1.41766 X ′ 3 1 1.12545 1.20158 1.28681 1.37184 1.50866 1.63874 X ′ 4 1 1.26227 1.37732 1.49852 1.66348 1.81205 1.96608 X ′ 5 1 1.26590 1.39735 1.54168 1.68813 1.85654 2.02423 X ′ 6 1 0.90698 1.11628 1.09302 1.48837 1.65116 1.51163 X ′ 7 1 1.49123 1.54386 1.49123 1.59649 1.75439 1.42105 X ′ 8 1 1.01903 1.14716 1.23008 1.26282 1.26676 1.30186 X ′ 9 1 1.04593 1.10144 1.20792 1.26831 1.38109 1.47018 X ′ 10 1 1.07903 1.15510 1.21123 1.25702 1.31610 1.38848 X ′ 11 1 1.04282 1.08754 1.11798 1.16841 1.22931 1.28069 X ′ 12 1 1.03731 1.03358 0.99067 0.96455 1.16231 1.11194 表7. 初值化处理结果  对初值化后的参考数列和比较数列求差，找出最大最小值分别为MIN = 0，MAX = 1.72519。求差数列结果见表8。 Table 8 2010年 2011年 2012年 2013年 2014年 2015年 2016年 2017年 | X ′ 1 − X ′ 0 | 0 0.21859 0.41884 0.61165 0.73887 0.99447 1.39335 1.72519 | X ′ 2 − X ′ 0 | 0 0.19283 0.35449 0.50606 0.56491 0.75456 1.09734 1.35776 | X ′ 3 − X ′ 0 | 0 0.15054 0.32716 0.45892 0.50549 0.67154 0.93552 1.13668 | X ′ 4 − X ′ 0 | 0 0.10010 0.19035 0.28318 0.29377 0.37989 0.63213 0.80934 | X ′ 5 − X ′ 0 | 0 0.09997 0.18672 0.26315 0.25061 0.35525 0.58764 0.75120 | X ′ 6 − X ′ 0 | 0 0.19154 0.54564 0.54422 0.69927 0.55501 0.79302 1.26379 | X ′ 7 − X ′ 0 | 0 0.18300 0.03862 0.11664 0.30107 0.44689 0.68980 1.35437 | X ′ 8 − X ′ 0 | 0 0.27600 0.43358 0.51334 0.56222 0.78056 1.17742 1.47356 | X ′ 9 − X ′ 0 | 0 0.29896 0.40669 0.55906 0.58437 0.77507 1.06309 1.30525 | X ′ 10 − X ′ 0 | 0 0.21072 0.37359 0.50540 0.58107 0.78636 1.12808 1.38694 | X ′ 11 − X ′ 0 | 0 0.21902 0.40980 0.57297 0.67431 0.87497 1.21488 1.49474 | X ′ 12 − X ′ 0 | 0 0.21006 0.41530 0.62692 0.80163 1.07883 1.28187 1.66348 表8. 求差数列结果  参考数列 X 0 有十二个比较数列 X 1 , X 2 , ⋯ , X 12 ，各比较数列与参考数列的差值的最小值和最大值分别为0和11.72519，可以用以下公式来计算各点的关联度： ξ i j ( t ) = Δ min + k Δ max Δ i j ( t ) + Δ max ,   t = 1 , 2 , 3 , ⋯ , M (1) (1)式中， ξ i j ( t ) 为因素 X j 对 X i 在t时刻的关联系数， Δ i j ( t ) = | X i ( t ) − X j ( t ) | ， Δ max = max max Δ i j ( t ) ， Δ min = min min Δ i j ( t ) ，k为介于[0, 1]区间上的灰数。 Δ i j ( t ) 的最小值是 Δ min ，当它取最小值0时，关联系数 ξ i j ( t ) 取最大值 max ξ i j ( t ) = 1 。 1 2 ( 1 + Δ min Δ max ) ≤ ξ i j ( t ) ≤ 1 (2) 在实际计算时，取 Δ min = 0 ，这时有 0 .5 ≤ ξ i j ( t ) ≤ 1 。根据这个方式，计算出来各点的关联系数见表9： Table 9 2010年 2011年 2012年 2013年 2014年 2015年 2016年 2017年 X 1 1 0.79782 0.67315 0.58511 0.53863 0.46449 0.38236 0.33333 X 2 1 0.81730 0.70874 0.63025 0.60427 0.53340 0.44011 0.38849 X 3 1 0.85141 0.72502 0.65273 0.63051 0.56227 0.47972 0.43145 X 4 1 0.89602 0.81922 0.75285 0.74595 0.69425 0.57709 0.51592 X 5 1 0.89614 0.82206 0.76624 0.77487 0.70830 0.59480 0.53451 X 6 1 0.81830 0.61254 0.61315 0.55228 0.60849 0.52101 0.40566 X 7 1 0.82498 0.95715 0.88089 0.74127 0.65873 0.55566 0.38909 X 8 1 0.75759 0.66549 0.62692 0.60541 0.52496 0.42284 0.36924 X 9 1 0.74262 0.67959 0.60675 0.59614 0.52672 0.44794 0.39790 X 10 1 0.80367 0.69779 0.63055 0.59750 0.52312 0.43332 0.38345 X 11 1 0.79751 0.67793 0.60088 0.56125 0.49644 0.41521 0.36592 X 12 1 0.80417 0.67501 0.57911 0.51832 0.44431 0.40224 0.34148 表9. 比较数列对参考数列的各点关联系数 由上表的关联系数，用平均值的方式，求出各比较数列的灰色关联度： γ i j ≈ 1 M ∑ I = 1 M ξ i j ( t ) 得到如下结果：r 1 = 0.58686，r 2 = 0.64032，r 3 = 0.66664，r 4 = 0.75016，r 5 = 0.76212，r 6 = 0.64143，r 7 = 0.75097，r 8 = 0.62156，r 9 = 0.62471，r 10 = 0.63368，r 11 = 0.61439，r 12 = 0.59558.排序结果为表10： Table 1 0 r 1 r 2 r 3 r 4 r 5 r 6 r 7 r 8 r 9 r 10 r 11 r 12 排序 11 6 4 3 1 5 2 9 8 7 10 12 表10. 比较数列对参考数列的灰色关联度排序 按照综合关联度大小对各因素的排序，其关联度关系为X 5 > X 7 > X 4 > X 3 > X 6 > X 2 > X 10 > X 9 > X 8 > X 11 > X 1 > X 12 。"
