"免疫性血小板减少症是儿童最常见的获得性免疫介导出血性疾病之一，其异质性明显，在儿童中尤其突出，具体发病机制、自然病程、并发症及治疗方案因人而异。随着免疫性血小板减少症(Immune Thrombocytopenic Purpura, ITP)在治疗的研究进展中，儿童ITP的治疗获得了一定突破，一般认为治疗儿童ITP的常见用药包括肾上腺糖皮质激素类药物、丙种球蛋白以及刺激血小板生成类药物等，新型药物以免疫抑制剂及生物制品等，本文探讨了国内外儿童免疫性血小板减少症的流行特征、发病机制及治疗进展，以此展开综述。"
"免疫性血小板减少症(ITP)是一种相对常见的儿童疾病，儿童发病率为2.0/(10万人·年)~6.4/(10万人·年)，通常出现在年龄1至10岁儿童之间，发病高峰在5岁左右 [ 1 ] [ 2 ]。儿童免疫性血小板减少症是一种自限性疾病，大多数患儿可在确诊12个月后恢复正常，仅约20%左右的患儿病程持续1年以上 [ 3 ]。  ITP传统和新兴疗法的作用机制(见图1)主要通过抑制免疫应答介导的血小板破坏、促进血小板生成以及调节骨髓的微环境。60%~70%的ITP患者可以检测出特异性自身抗体IGG抗体，这些自身抗体(GPIIb/IIIa和GPIb-IX-V等)和血小板膜糖蛋白结合被吞噬破坏(结合方式差异取决于血小板自身抗体的靶点；部分ITP患者没有血小板抗体，可能存在异常的细胞毒性CD8 + T细胞介导的血小板破坏；患儿上调VLA-4和CX3CR1使T细胞在骨髓中富集，抑制骨髓巨核细胞生成血小板，使外周血小板计数减少 [ 4 ]。ITP涉及的免疫机制十分复杂，儿童发病机制与成人ITP不全相同，儿童大多为急性、自限性 [ 5 ]。"
"糖皮质激素、静脉注射免疫球蛋白和抗D免疫球蛋白作为经典的ITP一线治疗方案。成人ITP患者以糖皮质激素为首选治疗，而儿童ITP治疗更倾向于静脉免疫球蛋白治疗方案(见表1)。   Mervat等人纳入20名慢性ITP患儿连续4天接受单剂量24 mg/m 2 地塞米松静脉注射治疗后，在治疗前一天和第五天分别评估血小板计数，90%的患儿出血症状得到有效控制(血小板计数至少增加 ≥ 30 × 10 9 /L)，其中50%的患儿出血症状完全缓解(血小板计数 ≥ 100 × 10 9 /L) [ 6 ]，单疗程HD-DXM可在1~3天内将90%出血症状达到有效控制，证明短期HD-DXM治疗儿童慢性ITP出血失控是一种有效紧急治疗方法，特别是在资源有限的国家。注意地塞米松用药时需同时监测血压、血糖、胃肠道反应等生理指标的变化，预防和治疗感染等副作用。  泼尼松作为一种中效型肾上腺皮质激素，一项临床试验报告了31例ITP患儿接受为期三个月醋酸泼尼松龙治疗后，血小板计数、CD3 + 、CD3 + CD4 + /CD3 + CD8 + 、CD4 + CD25 + CD127细胞计数显著升高，患儿初始缓解率为50%~60%，长期缓解率 < 30% [ 7 ]。根据柳叶刀杂志的一项大剂量地塞米松与泼尼松疗效对比的荟萃分析中证实在长期改善血小板计数反应中，标准剂量泼尼松与大剂量地塞米松无统计学差异(P < 0.05)；而对于需要快速增加血小板计数的临床手术中急性免疫性血小板减少症患者，大剂量地塞米松可能优于泼尼松 [ 8 ]。另一项荟萃分析也证明HD-DXM的不良反应事件更少、长期复发率更低 [ 9 ]。因此对于初诊断的ITP患儿首选大剂量地塞米松。  静脉免疫球蛋白(IVIG)是一种人免疫球蛋白混合的免疫抑制剂，IVIG作用于巨噬细胞表面或树突细胞表面的Fc受体，抑制巨噬细胞的吞噬防止自身血小板被内皮网状系统吞噬，抑制血小板计数水平减少 [ 10 ]，但是不可否认其高昂价格所带来的应用局限 [ 11 ]。Martin等人对34例急性患儿(血小板计数低于20 × 10 9 /L)连续2天以2 g/kg/d和0.6 g/kg/d IVIG剂量予以治疗 [ 12 ]，发现在给药72小时后高剂量组血小板计数增加速度显著高于低剂量组，但大剂量IVIG所带来的副作用也更为明显。在一项303例原发型ITP患儿的随机对照实验中证实单独应用IVIG或IVIG联合激素的疗效均优于单一糖皮质激素疗法 [ 13 ]；参照国际共识，对亟须治疗的出血患儿推荐糖皮质激素联合IVIG。  抗D免疫球蛋白治疗机制与IVIG相似，但抗D免疫球蛋白价格显著低于IVIG。一项就儿童急性ITP临床效果的荟萃分析中 [ 14 ]，静脉注射抗-D在改善急性ITP患儿的血小板计数方面与IVIG相似(抗D组和IVIG组在治疗24、72和7天后血小板计数无显著差异(P > 0.05))。另一项就抗D免疫球蛋白与IVIG疗效对比的随机对照实验中 [ 15 ] 证明在最初治疗的72小时内，IVIG疗法较静脉注射抗D的血小板计数增加速率更快。故IVIG优于注射抗D免疫球蛋白在急性ITP患儿治疗中。 Table 1 一线治疗 使用剂量 起效时间 应用价值 适用人群 不良反应 潜在不足 糖皮质激素 (2~4 mg/kg) × (5~7) d 3~4 d 糖皮质激素联合用药方案对大部分患儿有效，可持续用药。 初诊断患儿均可 免疫抑制、生长缓慢、骨质减少、行为改变、血压升高、食欲增加、胃炎等 [ 16 ] 。 长期用药会产生激素相关性副作用；约20%患儿对糖皮质激素无效。 静脉注射 丙种球蛋白 (IVIg) 400 mg/(kg/d) × (3~5) d； 0.8~1.0 g/(kg/d)静注 24~48 h 单剂量方案；起效指证迅速，早期血小板提升方面优于激素治疗。IVIg治疗后儿童患慢性ITP风险降低。 服药依从性差的患儿(婴幼儿)；重症或伴有严重皮肤黏膜瘀点、瘀斑或伴有活动性出血患者。 已知和未知病原体的潜在感染风险。流感样症状，可伴有恶心、呕吐和发热，急性肾损伤，溶血性贫血；超敏反应，无菌性脑膜炎。 价格昂贵，作用维持时间短；用药风险高可发生严重副反应。 抗D免疫球蛋白 (Anti-D immunoglobulin) 75 μg/(kg·d)静注 24~48 h 患儿须为Rh + ，且未进行脾切除手术。 / 同种免疫溶血、肾功能不全和感染 [ 17 ] ；低血压、关节痛、腹部或背部肌痛、瘙痒、发疹。 类似IVIg 表1. 一线治疗药物总结"
"由于脾切除术具有侵入性、不可逆性、需要终身监测管理的限制不足，故几乎不用于儿童治疗方案中，不予以详细叙述。   艾曲波帕在美国和欧盟获得批准可用于≥ 1岁且其他疗法无效的儿童慢性免疫性血小板减少症(ITP)。在一项为期五年的回顾性分析中 [ 18 ] Eltrombopag治疗的23例小儿ITP患者，在治疗后的第2周、4周、3个月和6个月的血小板中位数(PLT)分别为40(4~170) × 10 9 /L，20(4~130) × 10 9 /L，60(4~110) × 10 9 /L和70(18~160) × 10 9 /L均明显高于治疗前。另一项随机对照研究中同样证明对患有持续性或慢性免疫性血小板减少症的儿童，Eltrombopag可有效减少临床上明显出血症状 [ 19 ]。  罗米司汀(Romiplostim)是美国FDA批准的新药，为Fc融合蛋白(与血小板生成素类药物机制相似)可升高血小板计数，降低ITP患者出血的风险。Vinente等人对三例难治性ITP患儿研究中，观察到在7到28天内患儿可达到缓解，三例患儿有轻微不良反应的发生 [ 20 ]。一项长期研究中，证明接受Romiplostim治疗可增加ITP儿童的血小板计数并维持4年以上，且耐受性良好且无明显毒性 [ 21 ]。过去十多年中罗米司汀一直作为治疗成人ITP的常见疗法，现大量研究表明，其对于慢性难治性儿童ITP患儿也具有一定疗效和安全性，Romiplostim可以被认为是免疫抑制疗法(如Rituximab或脾切除术)的替代治疗方案。  重组血小板生成素是由中国仓鼠卵巢细胞表达，在国内首个应用的促血小板生成类药物。一项入组了30例重症ITP患儿 [ 22 ] 中有17例(56.67%)通过rhTPO治疗获得了缓解。另一项在对经一线治疗失败的58例患儿 [ 23 ] 中随机分为两组：DXM治疗(n = 27)和rhTPO + DXM治疗(n = 31)组，在治疗7、14天、1个月和2个月，分别进行评估总体缓解率，结果表明rhTPO + DXM组的总体缓解率均高于DXM治疗组(P < 0.05)，rhTPO联合大剂量DXM可作为目前治疗难治性ITP患儿的一种安全有效的方法。  低剂量利妥昔单抗是一种嵌合单克隆抗体，其靶向正常和恶性B淋巴细胞表面的CD20抗原 [ 24 ]。Wang等人 [ 25 ] 入组了24名患儿接受每周4次375 mg/m 2 利妥昔单抗治疗，结果显示24名患者中有15名(63%)的CR持续了4到30个月，CR率>50％的儿童平均持续13个月，利妥昔单抗可能是治疗慢性免疫性血小板减少性紫癜的有效方法。由于利妥昔单抗的作用机制几乎只影响B细胞，而没有直接影响免疫系统其他细胞(特别是T细胞和浆细胞)的活性，因此与其他药物联合使用有效率更高。在一项20例ITP患者中给予大剂量地塞米松、低剂量利妥昔单抗和环孢素 [ 26 ]，治疗6个月后缓解率为60%，第12个月的无复发生存率为92%，第24个月的无复发生存率为76%，联合使用疗效及预后良好。 Table 2 二线治疗 使用剂量 长期反应率 应用价值 潜在不足 不良反应 艾曲波帕 12.5~50.0 mg/d 70% 儿童慢性ITP首选治疗。 长期应用易出现鼻咽炎和上呼吸道感染；血液和淋巴系统紊乱。 头痛、肝功能异常、白内障、血栓形成、骨髓纤维化、铁缺乏 [ 27 ] 。 罗米司汀 1 μg/kg~10 μg/kg/w，静注 37%~91% 作为免疫抑制剂类药物的替代疗法治疗慢性难治性ITP患儿。 类似艾曲波帕，也存在非致命性不良反应的发生。 较少不良反应，偶头晕、恶心、肌痛、四肢痛、腹痛、肩痛、食欲不振及感觉异常等，最严重的不良反应是停药后骨髓网硬蛋白沉积 [ 28 ] 。 血小板受体激动剂rhTPO 1.0 μg/kg/d，静注 65%~90% 短期提高血小板计数，安全性好，依从性强。 价格昂贵，可能有增加恶性血液病的风险。 轻微嗜睡、头痛、阵发性视力缺损、过敏等可逆性反应，可随着药物停止而不良反应逐渐消失。 利妥昔单抗 375 mg/m 2 /d 60% 对于难治性ITP起效快，能够显著提高血小板计数 [ 29 ] 。 利妥昔单抗的治疗仍是昂贵的，特别是对于难以获得健康资源的患者。另外，高剂量和多次给药可能增加不良反应的风险；存在较高的复发率。 不良事件通常较轻且易于控制，主要可能引起低血球蛋白血症、以及某些感染风险的增加轻度过敏反应包括瘙痒、荨麻疹、发冷和发烧 [ 30 ] 。 表2. 二线药物治疗总结"
"环孢菌素A是近年来用于治疗各种免疫疾病的新型免疫抑制剂类药物，通过抑制钙神经素及白介素-2来控制T淋巴细胞生长。临床发现小剂量环孢菌素即可治疗难治性复发性ITP。在一项回顾性分析中纳入了30例患儿 [ 31 ]，其中17例患儿(57%)达到完全缓解状态，研究中发现环孢菌素A最常见副反应是多毛症。在另一项回顾性研究中 [ 32 ]，证明口服环孢菌素A可作为一种额外的治疗手段以避免脾切除术和长期使用皮质类固醇激素所带来的不良反应。  达那唑为雄激素17a-乙炔睾丸酮的衍生物，研究表明输注达那唑后抗体IgG的Fc受体与单核细胞结合位点数量减少与临床缓解呈正相关 [ 33 ]，因此降低Fc受体在巨噬细胞表面的表达水平，可降低血小板损伤程度，增加血小板水平。蔡艳 [ 34 ] 对31例ITP患者给予达那唑200 mg/d，疗程3个月，根据前三个月临床检验所得患者治疗前、后的血小板数均有所增加(P < 0.001)，临床总有效率93%，证实达那唑能有效改善临床症状，稳定血小板计数，且无明显副作用，耐受性良好。  霉酚酸酯是一种有机化合物，能够特异性地抑制淋巴细胞嘌呤合成次黄嘌呤核苷酸脱氢酶的活性进而抑制T、B淋巴细胞增殖。一项前瞻性研究报告了9例慢性ITP患儿经霉酚酸酯联合皮质激素治疗后均到达完全缓解的水平 [ 35 ]，霉酚酸酯可作为一种辅助免疫抑制剂联合皮质类固醇激素用于儿童慢性自身免疫性血细胞减少症治疗。  长春新碱(Vincristine)是一种治疗免疫性血小板减少症的新药，作用于Fc受体(FcR)介导抗原呈递和血小板清除，在患儿巨噬细胞中建立了一种带有抗CD41单抗的新型血小板输送系统(CD41-VCR-PLT, CD41-VLP)。虽然在替代脾切除术方面长春新碱相较于其他免疫抑制剂不具备明显优势性，但在既往病例分析中，长春新碱可以提高患儿依从性，且因其较好安全性和低成本被保留在患儿ITP治疗中。  地西他滨是一种特定的DNA甲基化转移酶抑制剂，可逆转DNA甲基化并激活肿瘤抑制基因的沉默和失活，在ITP患儿中证实了低剂量地西他滨显著增加患者体外培养物中成熟多倍体巨核细胞的数量 [ 36 ]，增强肿瘤坏死因子相关的凋亡诱导配体的表达，可以促进健康对照组和ITP组中巨核细胞的成熟和血小板生成。  阿托伐他汀是一种合成的3-羟基-3-甲基戊二酰辅酶A还原酶抑制剂，常用于血脂异常及相关血管异常患者 [ 37 ] [ 38 ]。他汀类药物，如洛伐他汀、阿托伐他汀、普伐他汀和辛伐他汀，经NOS刺激后可以提高NO/O2 − 浓度比值，从而提高NO在内皮细胞中的生物利用度 [ 39 ]。袁孔等人证实阿托伐他汀通过下调p38 MAPK途径和上调Akt途径在数量和功能上改善源自糖皮质激素抵抗性ITP患者的BM EPC [ 40 ]，增强骨髓内皮细胞功能。  近年来对免疫球蛋白疗法有反应的ITP患儿是否会在未经治疗下出现自限性病程，利用生物学参数分析进行预估判断被国际中进行广泛研究。而对于少数转归为慢性难治性ITP的患儿也可以通过将生物遗传免疫参数评分结合临床数据来提高ITP疾病病程判断和免疫球蛋白治疗后续预测的准确性。 Table 3 三线治疗 使用剂量 长期反应率 应用价值 潜在不足 不良反应 环孢菌素A [ 31 ] [ 32 ] [ 41 ] 2.4~7.5 mg/kg/d 57% 强效的、毒性小的，一个较理想的免疫抑制剂。 价格昂贵，不良反应相对其他新型治疗药物较多。 肾毒性反应、肝功能异多毛症、恶心、头痛、胃肠不适等。 霉酚酸酯 [ 35 ] 1.5~2.0 g/d，疗程为2至4个月 80% 可以快速提高血小板计数水平响应率高，与皮质激素联合应用具有良好的前景。 药物安全性尚未明确，还需展开大样本的研究加以验证；长期使用可能增加肿瘤的机会。 不同程度胃肠道反应。 长春新碱 [ 42 ] 1~1.5 mg/m 2 ，每周一次，缓慢静滴，4~6次 10%~75% 脾切除术的替代疗法，价格低廉，耐受性好。 升高血小板速度缓慢，单独应用效果不理想。 易出现周围神经炎、以及消化道反应如食欲下降、恶心、呕吐、腹泻等。 达那唑 [ 33 ] [ 34 ] [ 43 ] 10~15 mg/(kg·d)，分2~3次口服 67% ITP临床疗效满意度高，可有效提高患儿血小板数量，与皮质激素药物联合使用可减少长期使用皮质激素所带来的不良反应。 长期毒性还待大量临床试验研究发现。 肝酶升高，肝酶升高是最常见的副作用以及雄激素效应、下肢水肿、体重增加，症状与用药剂量有关。 低剂量地西他滨 [ 36 ] [ 44 ] 3.5 mg/m 2 每周连续三天静脉注射 66.7% 可以迅速控制临床出血症状；安全、有效的提高ITP患者的血小板水平。 安全性缺乏临床试验证实，价格昂贵。 长期服用引起胃肠负担，如恶心、呕吐、腹泻症状，肝肾功能不全者慎用。 阿托伐他汀 [ 39 ] [ 40 ] 20 mg/d 69% 阿托伐他汀对皮质类固醇抵抗性ITP患者安全有效。 / 仅少量患者会出现严重不良反应，常见肌肉疼痛、消化道反应。 表3. 三线药物治疗总结 图1. 儿童ITP治疗药物机制示意图"
"在ITP治疗新时代下，对于儿童来说理想的药物与剂量应同时具备临床效果好、长期预后缓解率高、不良反应少、价格合理等特点，对于新诊断患儿的初始治疗中，我们首先要采取大剂量类固醇激素进行广泛临床应用；考虑到糖皮质激素所产生的后续预后不佳及长期缓解率低等情况，对于儿童精确的特异性诊断与开发有效的联合治疗同样重要，成功的联合疗法如TPO药剂和具有抑制血小板破坏作用机制的药物；既往大量临床实践表明将艾曲波帕作为治疗慢性难治性ITP患儿(激素耐药型)的首选疗法，利妥昔单抗是治疗慢性免疫性血小板减少性紫癜的有效方法。新型分子靶向药物的治疗选择较多，普遍存在起效快、预后良好但价格昂贵、具有潜在肝肾毒副作用仍需在未来展开大样本量的研究；对于慢性难治性患儿，可将生物参数分层与临床表现相结合进行疾病预后病程判断，临床医师应结合儿童ITP个体异质性、综合考虑获益风险比提供最佳个体方案。"
